title,company,location,site,description,job_url
2026 Ireland Graduate Civil Engineering Career Path: Water Sector,myGwork - LGBTQ+ Business Community,"Dublin, County Dublin, Ireland",linkedin,"**This job is with Mott MacDonald, an inclusive employer and a member of myGwork – the largest global platform for the LGBTQ\+ business community. Please do not contact the recruiter directly.** **We will close for applications on Wednesday 22nd April 2026, however, if this opportunity becomes over\-subscribed, we will close early, therefore we recommend applying as soon as possible.** Before making an application, please browse all graduate opportunities available as we will only accept **one application** per candidate. Once you have made an application you will not be able to make changes to your selection or make a new application. The exception is if we open new vacancies in the new year. **To avoid missing out on your preferred role, we recommend applying as early as possible, as positions will close once filled.** Turn your ambition into action \- apply now and shape your future with us. **Job Description** Designing Resilient Infrastructure for a Sustainable Future. Join a team that's shaping tomorrow's water systems\-today. At Mott MacDonald, our Water Division is a centre of excellence, tackling some of the most pressing challenges of our time: climate change, ageing infrastructure, and population growth. As a Graduate Civil Engineer, you'll play a vital role in designing safe, sustainable water and wastewater systems that serve communities now and for generations to come. This is more than a graduate role\-it's an opportunity to grow, collaborate, and make a meaningful impact. You'll be supported by a caring and inclusive team, empowered to innovate, and inspired to contribute to projects that improve lives and protect the environment. What You'll Be Doing You'll work alongside multidisciplinary teams of engineers, scientists, and consultants, contributing to projects that blend technical excellence with social purpose. **Your Responsibilities May Include** * Designing Infrastructure \- Contribute to the design of pipelines, water and wastewater treatment facilities across feasibility, outline, and detailed design stages. * Collaborative Delivery \- Work with diverse teams to develop integrated, sustainable solutions that reflect the needs of communities and ecosystems. * Project Lifecycle Support \- Be involved from planning and modelling through to construction, commissioning, and handover\-gaining holistic project experience. * Digital Innovation \- Use cutting\-edge digital tools to enhance design quality, efficiency, and collaboration. Why This Role Matters * Empowering Growth \- You'll receive mentoring, structured training, and hands\-on experience to build your technical and project management skills. * Celebrating Impact \- Every project you contribute to helps deliver clean water, protect natural resources, and build resilience against climate change. * Inclusive Culture \- We celebrate diversity and foster a culture where everyone feels valued, heard, and supported. * Integrity \& Trust \- We uphold the highest standards of professionalism and ethics, building trust with clients, communities, and each other. * Wellbeing First \- Your wellbeing is our priority. We offer flexible working, mental health support, and a caring environment where you can thrive. * Purpose\-Driven Work \- Your engineering solutions will have real\-world impact\-enhancing public health, environmental sustainability, and community resilience. **Candidate Specification** We are looking for committed and motivated graduates with a genuine passion and a desire to make a difference in the world. If this describes you, apply today to launch your career at Mott MacDonald. To be eligible for this opportunity, you will have less than 12 months' relevant experience **(excluding placements)** and have a bachelor's degree (obtained no earlier than 2024\) or expected to achieve a degree in **civil engineering** or similar disciplines: In your application, you should aim to demonstrate your genuine interest in both the opportunity and in joining Mott MacDonald. You can do this by highlighting any relevant experience or interests \- such as modules you've studied, previous work experience, or any research you've undertaken about our company, values, and projects. We personally review every completed application form we receive as this part of our selection process is entirely human led \- we do not use AI tools at this stage and kindly expect you not to either. We want you to answer each application question with authenticity so we can get to know the real you. Joining us as a graduate is your opportunity to shape your own story. **We Are Looking For Graduates With The Following Strengths** * Proactively takes initiative to complete tasks efficiently and independently. * Communicates effectively and clearly with clients and colleagues. * Delivers high quality written work with strong attention to detail and clarity. * Demonstrates a structured and analytical approach to problem solving. **About Your Development** A graduate position should be more than just a job. We know this and so do you. That's why with our graduate roles we aim to give you the experience and technical knowledge you need to progress your career. From the moment you join us, you'll receive the training you need. You will be assigned a mentor, who will guide you to meet the objectives of your professional training needs. You will join our three\-year early careers soft skills development programme \- Accelerating your Future, which is designed to give you the skills and tools necessary for a long\-lasting successful career here at Mott MacDonald. You will have the opportunity to make a difference; learn more about Our Purpose and the difference we can make! You're probably wondering what else is on offer. Join us, and you'll get: * Biannual salary reviews: we believe that hard work should be rewarded and recognised. Therefore, for the first three years of your career with us, you'll have biannual salary reviews. * A competitive salary: in addition to biannual reviews, we will ensure that you're given a salary that matches the current industry standard. **Our social side** Being part of Mott MacDonald means more than just work; there's a huge range of fun and exciting things that you can get involved in. From the moment you join us, you'll have the opportunity to expand your social and professional network, whether it's meeting other graduates or joining forces with other members of staff from around the company at our annual sports day. Each of our offices have a sports and social committee which will give you the chance to be part of a variety of sports, social and charity events. We're committed to promoting a strong culture of social responsibility and encourage our staff to play active roles in the local community. It's worth noting that sports and social committees tend to vary from office to office, so as well as getting involved in what's already on offer, don't be afraid to suggest new events or initiatives that you think could be a great addition. It doesn't stop there. As well as events, you'll also have access to discounts on cinema tickets, travel, fashion, utilities and much more as part of our company benefits which you can take advantage of the moment you join. **Equality, diversity and inclusion** We put equality, diversity and inclusion at the heart of our business, seeking to promote fair employment procedures and practices to ensure equal opportunities for all. We encourage individual expression in our workplace and are committed to creating an inclusive environment where everyone feels they have the opportunity to contribute. **Agile working** At Mott MacDonald, we believe it makes business sense for you and your manager to choose how you can work most effectively to meet your client, team and personal commitments. We embrace agility, flexibility and trust. **More About Mott MacDonald** We're a global engineering, management and development consultancy. Our purpose is to improve society by considering social outcomes in everything we do, relentlessly focusing on excellence and digital innovation, transforming our clients' businesses, our communities and employee opportunities. A fundamental part of this is respecting each person's differences and striving to meet their needs. Our values: progress, respect, integrity, drive, excellence ]]\>",https://www.linkedin.com/jobs/view/4399301735
A Fresh Start for Your Career: Become a Recruiter,Access Healthcare,,linkedin,"A Fresh Start for Your Career: Become a Recruiter \- No Experience Required * **Clear career path – be certain of how to progress** * **Fast\-track to leadership – progress your career in your own terms** * **Promotions attached to performance – the more you succeed, the more you advance** At Access Healthcare, the only thing standing between you and success is your own performance, ambition, and drive. If you bring the talent and determination, the opportunities to grow are limitless. Maybe you’re ready to take the next step in your career, eager to prove yourself in a high\-energy, fast\-paced environment. Or maybe you've been looking for that one role where your people skills, ambition, and determination can truly shine and lead to tangible career growth. This is it. **About Recruitment with Access Healthcare** * **Take Ownership of Your Impact** – Manage your own candidate pipeline, match the right professionals to the right roles, and directly influence patient care across Ireland’s healthcare system. Your efforts drive real\-world results—and your success. * **Work with the Best in Healthcare** – Collaborate with leading hospitals, clinics, and healthcare providers by delivering top\-tier talent into critical roles. You’ll become a trusted expert in an industry where quality truly matters. * **Accelerate Your Growth in a High\-Demand Sector** – Gain hands\-on experience in talent acquisition, candidate management, and strategic delivery. With our structured career path, you'll have every opportunity to level up fast—without the pressure of sales. **What We Offer You** * **Career Progression** – We don’t just fill positions; we build careers. You’ll have clear paths to progress into senior and leadership roles as your expertise grows. * **Professional Development** – Gain access to training, mentorship, and the opportunity to specialize in healthcare recruitment. Your career is always evolving. * **Recognition \& Rewards –** Your achievements won’t go unnoticed. Consistent performance is recognised with greater responsibility, new challenges, and fast\-tracked promotions (4 promotions in 2 years? Here it is possible). * **Leadership Academy \-** Fast\-track your path to management with exclusive access to advanced training, leadership certifications, and mentorship. Our academy is designed to equip top performers with the skills and recognition needed to step confidently into leadership roles. **Uncapped Earnings Potential** : Basic salary \+ commission * Year One **Average** Total Compensation: €45K\+ * Year Two **Average** Total Compensation: €65K\+ **What You Bring** * **2\+ years in a fast\-paced or similar role (any industry can be considered!)** * **Unstoppable ambition and drive for success** * Ability to thrive in a target\-driven, high\-energy environment * A track record of exceeding KPIs and going above and beyond **Still wondering if this role is the right move?** Take Rian’s journey as inspiration – within just 24 months at Access Healthcare, he’s advanced from Recruitment Consultant to Associate Manager. Along the way, he’s honed his expertise and developed a unique leadership style. You could follow a similar path, seizing new opportunities and challenges that keep your career exciting and rewarding. For more information, email your CV at francisca.simoes@accesshealthcare.ie",https://www.linkedin.com/jobs/view/4400562389
AWS Cloud Consultant,Korn Ferry,"Dublin, County Dublin, Ireland",linkedin,"**Job Title:** AWS Cloud Consultant **Location:** Dublin (2 days per week on\-site) **Contract Duration:** Initial 6\-month contract **Overview** Our client, a leading organisation based in Dublin, is seeking an experienced AWS Cloud Consultant to support the design, build, and optimisation of their cloud infrastructure. This role will suit a hands\-on consultant with a strong background in AWS environments, including prior experience building cloud platforms from the ground up. **Key Responsibilities** * Design, build, and deploy scalable and secure AWS cloud solutions * Lead the development and implementation of AWS infrastructure from initial setup through to optimisation * Work with existing VM environments, supporting migration and integration into AWS where required * Collaborate with cross\-functional teams to define cloud architecture and best practices * Provide expertise across networking, particularly in IoT\-enabled environments * Ensure high availability, performance, and security of cloud systems * Support ongoing cloud strategy, governance, and cost optimisation initiatives **Key Skills \& Experience** * Proven experience building AWS environments from scratch (essential) * Strong hands\-on AWS expertise across core services (EC2, S3, VPC, Lambda, etc.) * AWS certifications (e.g. Solutions Architect, DevOps Engineer) highly desirable * Experience working with virtualised (VM) environments and cloud migration strategies * Knowledge of IoT network architecture and integration within cloud platforms * Strong understanding of cloud security, networking, and infrastructure as code (e.g. Terraform, CloudFormation) * Experience working in complex enterprise environments * Excellent stakeholder engagement and communication skills **Desirable** * Experience in consulting or client\-facing roles * Familiarity with DevOps practices and CI/CD pipelines * Exposure to hybrid cloud environments **About Korn Ferry** *Korn Ferry unleashes potential in people, teams, and organizations. We work with our clients to design optimal organization structures, roles, and responsibilities. We help them hire the right people and advise them on how to reward and motivate their workforce while developing professionals as they navigate and advance their careers. To learn more, please visit Korn Ferry at www.Kornferry.com*",https://www.linkedin.com/jobs/view/4400580447
Administrative Analyst,RECRUITERS,"South Dublin, Ireland",linkedin,"We are currently seeking a highly organised and proactive **Administrative Support Executive/Analyst** to join a busy State Services team. This is an excellent opportunity for someone with strong administrative and customer service experience who is keen to develop their career within a structured team environment. **Salary:** €35,000\-€36,000 DOE \+ bonus **Location:** Dublin 18 **The Role** This role provides comprehensive administrative support within a team structure and involves daily interaction with internal and external stakeholders via phone and email. You will work closely with established processes and procedures to ensure high service levels, accuracy, and timely delivery across day\-to\-day operations and project\-related activities. You will play a key role in keeping systems up to date, managing scheduled events, supporting fleet\-related activities, and ensuring tasks are completed ahead of deadlines. Over time, there is strong scope to grow, learn, and progress within the wider team. **Key Responsibilities** * Provide day\-to\-day administrative support within the State Services team * Manage phone and email enquiries through shared team inboxes * Proactively manage daily, weekly, and monthly scheduled tasks * Maintain accurate system updates including data entry and reporting * Support fleet\-related administration such as fuel cards, toll tags, vehicle collections, hire cars, fines, road tax, GPS, and pool vehicles * Coordinate CVRT administration with internal teams and external suppliers * Assist with vehicle ordering, deliveries, and logistics planning * Liaise with other departments to resolve queries efficiently * Attend team meetings, recording minutes and tracking actions * Ensure all procedures, timelines, and service standards are adhered to * Contribute to team goals and individual performance targets **About You** * Minimum **1 year’s experience** in an administrative role * Excellent verbal and written communication skills * Strong customer service mindset with a friendly and professional approach * High attention to detail and accuracy * Confident user of **Microsoft Excel, Word, PowerPoint, and Outlook \- especially strong excel skills** * Organised, adaptable, and able to manage fluctuating workloads * A collaborative team player who enjoys contributing to shared success * Calm under pressure with a positive, “can\-do” attitude * Comfortable taking initiative and seeing tasks through to completion *By applying to this job, your CV will be assessed by a consultant from Recruiters.ie for the position described and your CV may be added to our secure applicant tracking system however your details will never be shared to any other third party without your consent.*",https://www.linkedin.com/jobs/view/4399057012
"Analyst, Reference Data Operations (Swedish Language Required - FTC)",ICE,"Dublin 2, County Dublin, Ireland",linkedin,"**Job Description** **Job Purpose** The primary purpose of this position is to research, analyze, interpret, transform, and present reference data for Equity and Funds securities across global markets. This role requires working with documents in English and Swedish. The incumbent must successfully complete a structured two‑month training program to develop subject matter expertise and gain proficiency with the database(s) of record, enabling independent analysis of legal and financial documents associated with Equity and Fund securities. Training includes assessments and accuracy/timeliness benchmarks that must be met. The curriculum provides exposure to market structures, client use cases, and evolving financing techniques, enabling the incumbent to differentiate essential data, interpret complex terminology, and identify relevant information for downstream clients. The work directly supports ICE’s clients and internal stakeholders such as Evaluated Pricing, Index, and Analytics teams who rely on accurate and timely reference data. **Responsibilities** * Analyze, interpret, collate, and transform reference data for simple structures/events in the primary or secondary market by reviewing legal documents, vendor data, and third‑party reports, ensuring accuracy, completeness, and timely delivery. * Apply financial and legal subject matter understanding to make sound, logical decisions regarding data extraction and interpretation. * Gather required documents by conducting advanced research and direct outreach to issuers, trustees, underwriters, and other market participants. * Provide data and product support by responding to inquiries and conducting additional analysis where necessary. * Identify data quality issues, trends, and gaps; maintain awareness of evolving market practices, new financing structures, and emerging terminology. * Apply analytical thinking to drive workflow efficiency, enhance data quality, and support automation or process improvements. * Participate in ad hoc initiatives focused on optimizing processes, improving data completeness, and supporting automation opportunities. * Communicate professionally with external market participants to obtain reference data, resolve discrepancies, and clarify terms or ambiguous content. **Knowledge And Experience** * Bachelor's degree or equivalent experience required * 5\+ years of corporate‑level experience, or 2\+ years of direct experience in reference data, financial operations, market data, or a related domain * Proficiency in Swedish (essential) * Strong command of English * High attention to detail and ability to interpret complex legal/financial documentation * Strong analytical, decision‑making, and problem‑solving abilities * Ability to work effectively in a fast‑paced, dynamic environment * Strong Excel skills, including functions, formulas, and data handling * Data science background preferred * Skills in SQL, Python, and Excel Macros/VBA * Exposure to or experience with AI, automation, or machine learning concepts * Knowledge of Norwegian/ Finish/ or Danish is an additional advantage and considered highly preferable * Ability to convert large datasets into concise, actionable insights * Eagerness to learn, collaborate, and adapt to evolving market requirements",https://www.linkedin.com/jobs/view/4388344963
Animal Care Assistant/Front of House Receptionist,Village Vets,"Stillorgan, D, IE",indeed,"**About us** Our Stillorgan branch joined the Village Vets family in 2013, having previously served the community under a different name with its distinctive circular shape. The clinic is now owned and led by Aislinn Cullen, whose love for veterinary medicine and commitment to supporting her team help shape the caring, welcoming environment clients know and trust. Our state\-of\-the\-art clinic has three consult rooms, a surgical theatre, a dedicated dental room and separate cat and dog wards. We even play relaxing classical music to our patients to help keep them calm and happy while they’re with us! Our facilities and services include: **About the Role** This role will support the nurses and vets at our Stillorgan clinic * Assist the Veterinary Surgeon and Veterinary Nurse with day\-to\-day clinical duties * Support the care of patients and inpatients, maintaining the high standards of care upheld by Village Vets * Carry out general cleaning duties throughout the clinic, including equipment and animal areas, in line with Village Vets hygiene standards * Perform routine laboratory work under the direction of the Veterinary Nurse * Assist with front\-of\-house duties and follow procedures to ensure an efficient, friendly reception experience * Promote Pet Health Plans and Pet Insurance to support clients in accessing the highest standard of veterinary care * Carry out ad hoc clinical and administrative duties as required by the Head Nurse or Area Manager * Complete all tasks and procedures efficiently, accurately, and to a high standard * Contribute to and maintain an outstanding client and patient experience across the team * Greet all visitors and welcome them to the clinic * Answer and direct phone calls * Schedule appointments * Checking in patients * Collecting payments * Maintain records as necessary * Manage the receptionist area and assist with admin tasks as needed **About you** * Ideally, you will have at least two years’ experience working in small animal practice * You have completed a relevant animal care qualification * You are highly motivated, hard\-working, and a strong team player * You have excellent customer care skills and a genuine commitment to delivering the highest standards of animal welfare and patient care * Previous expereince working in a veterinary reception is desirable **What’s in it For You… At a glance** We are proud to support our staff and encourage any interest in further education. In addition to our fabulous teams and supportive environments, we’re proud to offer a benefits package that supports our team’s wellbeing, growth, and families: * Health cash plan * Pension scheme * Gym membership subsidy * Free pet health plan * Funded CPD including, allowances, webinar series, new graduate programme, training platform access, and certificate funding * Statutory sick pay * Length of service holidays * Charity ​paid ​leave You must have legal rights to work in Ireland. Please apply below with updated CV. Pay: From €29,432\.00 per year Benefits: * Bike to work scheme * Company events * Employee discount * Sick pay Work Location: In person",https://ie.indeed.com/viewjob?jk=50c7c5866bb2a686
