title,company,location,site,description,job_url
Mobile QA Architect,Gen,"Dublin, County Dublin, Ireland",linkedin,"**About Us** Gen is a global company dedicated to powering Digital Freedom through its trusted consumer brands including Norton, Avast, LifeLock, MoneyLion and more. Our combined heritage is rooted in financial empowerment and cyber safety for the first digital generations, and today we deliver award\-winning cybersecurity, online privacy, identity protection and financial wellness solutions to nearly 500 million users in more than 150 countries. Together, we share a collective passion and vision to protect consumers and help them grow, manage and secure their digital and financial lives. We’re always looking for smart, fearless and high\-impact talent who see AI as a teammate – leveraging it to move faster and deliver meaningful results. When you’re part of Gen, you’ll have the flexibility, tools and support to do your best work and grow your career – from flexible working options and time off to competitive pay, benefits and well\-being programs. At Gen, we are scrappy and relentlessly customer driven. We create room for healthy debate, experimentation and continuous learning, and we seek out people with different experiences, identities and ideas to join our team. You’ll work with people who back each other, respect each other and understand that our differences are a competitive advantage. If this sounds like you, we’d love you to be part of Gen. **About The Role** We are pioneering an AI\-first development culture. Every aspect of our product development lifecycle is infused with AI adoption—from ideation and design to coding, testing, and deployment. Our mission is to lead the industry in AI\-powered mobile innovation. Quality assurance represents a critical leverage point for AI\-driven productivity in mobile engineering. In this role, you will help transform QA into a strategic, AI\-enabled function that drives both velocity and quality across the mobile engineering organization. **In This Role, You Will** * Build and mentor a world\-class mobile QA engineering team, ensuring high\-impact Android and iOS applications meet the highest quality standards for millions of users worldwide. * Champion AI\-first testing practices, leveraging tools such as GitHub Copilot, Claude Code, Cursor, and generative testing frameworks to automate test creation, optimize test coverage, accelerate bug detection, and elevate product quality. * Partner with engineering, product, and design teams to define and drive a comprehensive quality assurance strategy for mobile products. * Lead the evolution of test automation frameworks and infrastructure, leveraging AI to create intelligent, maintainable, and scalable test suites. * Foster a quality\-first mindset across the mobile engineering organization, positioning QA as a strategic partner rather than a bottleneck. * Remove blockers, set clear priorities, and enable your team to deliver high\-quality outcomes in a fast\-paced, global environment. **About You** * You are an inspiring leader who attracts and develops top talent, leads by example, communicates clearly, and builds trust through authenticity and competence * You have an AI\-native mindset and believe in AI’s transformative potential for quality assurance as a force multiplier, not a replacement * You bring deep technical expertise in mobile QA across Android and/or iOS, including understanding of device fragmentation, OS\-specific challenges, and robust test strategy design * You are a hands\-on manager who stays connected to the work, writes test code, and understands the day\-to\-day realities of your team * You have experience with programming languages such as Java, Kotlin, Swift, or Python * You are curious and continuously learning, especially in AI tooling for QA, mobile testing innovations, and team dynamics * You thrive in cross\-functional collaboration and build strong relationships with product, engineering, design, and DevOps teams * You are a strategic quality builder who shapes team culture, establishes meaningful quality metrics, and drives continuous improvement **What's Next** If you're excited about this opportunity, we’d love to hear from you! The hiring process consists of two technical interview rounds and one managerial interview. Throughout the process, you will have the opportunity to meet the hiring manager and future team members.",https://www.linkedin.com/jobs/view/4405112360
Mobile QA Architect,Gen Digital Inc.,"Dublin, D, IE",indeed,"**About Us:** Gen is a global company dedicated to powering Digital Freedom through its trusted consumer brands including Norton, Avast, LifeLock, MoneyLion and more. Our combined heritage is rooted in financial empowerment and cyber safety for the first digital generations, and today we deliver award\-winning cybersecurity, online privacy, identity protection and financial wellness solutions to nearly 500 million users in more than 150 countries. Together, we share a collective passion and vision to protect consumers and help them grow, manage and secure their digital and financial lives. We’re always looking for smart, fearless and high\-impact talent who see AI as a teammate – leveraging it to move faster and deliver meaningful results. When you’re part of Gen, you’ll have the flexibility, tools and support to do your best work and grow your career – from flexible working options and time off to competitive pay, benefits and well\-being programs. At Gen, we are scrappy and relentlessly customer driven. We create room for healthy debate, experimentation and continuous learning, and we seek out people with different experiences, identities and ideas to join our team. You’ll work with people who back each other, respect each other and understand that our differences are a competitive advantage. If this sounds like you, we’d love you to be part of Gen. **About The Role:** We are pioneering an AI\-first development culture. Every aspect of our product development lifecycle is infused with AI adoption—from ideation and design to coding, testing, and deployment. Our mission is to lead the industry in AI\-powered mobile innovation. Quality assurance represents a critical leverage point for AI\-driven productivity in mobile engineering. In this role, you will help transform QA into a strategic, AI\-enabled function that drives both velocity and quality across the mobile engineering organization. In this role, you will: * Build and mentor a world\-class mobile QA engineering team, ensuring high\-impact Android and iOS applications meet the highest quality standards for millions of users worldwide. * Champion AI\-first testing practices, leveraging tools such as GitHub Copilot, Claude Code, Cursor, and generative testing frameworks to automate test creation, optimize test coverage, accelerate bug detection, and elevate product quality. * Partner with engineering, product, and design teams to define and drive a comprehensive quality assurance strategy for mobile products. * Lead the evolution of test automation frameworks and infrastructure, leveraging AI to create intelligent, maintainable, and scalable test suites. * Foster a quality\-first mindset across the mobile engineering organization, positioning QA as a strategic partner rather than a bottleneck. * Remove blockers, set clear priorities, and enable your team to deliver high\-quality outcomes in a fast\-paced, global environment. **About You:** * You are an inspiring leader who attracts and develops top talent, leads by example, communicates clearly, and builds trust through authenticity and competence * You have an AI\-native mindset and believe in AI’s transformative potential for quality assurance as a force multiplier, not a replacement * You bring deep technical expertise in mobile QA across Android and/or iOS, including understanding of device fragmentation, OS\-specific challenges, and robust test strategy design * You are a hands\-on manager who stays connected to the work, writes test code, and understands the day\-to\-day realities of your team * You have experience with programming languages such as Java, Kotlin, Swift, or Python * You are curious and continuously learning, especially in AI tooling for QA, mobile testing innovations, and team dynamics * You thrive in cross\-functional collaboration and build strong relationships with product, engineering, design, and DevOps teams * You are a strategic quality builder who shapes team culture, establishes meaningful quality metrics, and drives continuous improvement **What's Next:** If you're excited about this opportunity, we’d love to hear from you! The hiring process consists of two technical interview rounds and one managerial interview. Throughout the process, you will have the opportunity to meet the hiring manager and future team members.",https://ie.indeed.com/viewjob?jk=293cbe5d8902fe7f
Nap OS Career Simulator (Un-paid),Napblog Limited,,linkedin,"**Company Description** Napblog Limited, headquartered in Dublin, specializes in product development and go\-to\-market solutions to bridge skills, technology, and employment outcomes. Its flagship product, Nap OS, is a career and recruitment operating system built from over 18 months of global research, enabling institutions and professionals to measure capability based on outcomes rather than credentials. The company also provides AI adoption and go\-to\-market services, designing and deploying AI agents, automation systems, and market launch strategies for clients across Europe. With a focus on real\-world applications, Napblog Limited validates its frameworks and services publicly through extensive research and insights. **Role Description** The Nap OS Career Simulator is a remote role focused on delivering customized career counseling and professional development support. This role involves engaging with users to understand and enhance their career journeys, providing personalized career development plans, and analyzing data to identify areas of improvement. Daily tasks include delivering exceptional customer service, facilitating interactive career simulations, and maintaining effective communication to ensure high levels of user satisfaction and success. The position is execution\-focused and aligned with Napblog's mission to deliver measurable career outcomes. **Qualifications** * Strong Career Counseling and Career Development skills, with the ability to provide actionable insights and personalized guidance * Excellent Communication and Customer Service skills, ensuring positive engagement and user satisfaction * Proficient Analytical Skills for assessing user data and identifying key actionable areas * Experience in tech\-enabled career tools or employment systems is an advantage * Ability to work independently in a remote environment, with strong time management skills * Bachelor's degree or relevant experience in career development, counseling, or human resources is preferred **Napblog Limited** builds **Nap OS** — The Career Accelerator \& Employability Operating System designed to convert ambition into verified career outcomes. Traditional internships often reward attendance, passive learning, and vague experience claims. Modern hiring demands more. Employers increasingly want proof of capability, execution discipline, communication skills, and real\-world outputs. Nap OS was built to solve this gap. Instead of asking people to “gain experience” without structure, Nap OS provides a guided accelerator where participants build measurable employability evidence through execution\-based learning, simulation projects, portfolio creation, and career coaching. This is **not a traditional internship.** This is a **paid career accelerator programme** for serious individuals who want structured progress, accountability, and faster career readiness. **Nap OS Internship Simulator (Career Accelerator Programme)** Remote \| Structured Monthly Programme \| €99 per month The Nap OS Internship Simulator is a guided employability accelerator for students, graduates, immigrants, and career changers who want to become job\-ready through real execution. Participants do not pay for a job. They invest in a structured system that helps them: • build an interview\-ready portfolio • gain role\-based simulated experience • develop practical outputs • improve confidence and clarity • receive guidance and accountability • increase employability signal to recruiters Unlike passive online courses, Nap OS focuses on execution, evidence, and momentum. All selected participants begin with a **14\-Day Execution Sprint** inside Nap OS. This sprint is designed to measure seriousness, consistency, ownership, and ability to follow through. During the sprint, participants may complete tasks such as: • research challenges • market analysis • content creation • workflow building • portfolio improvements • AI productivity tasks • business case exercises • documentation assignments Every completed activity contributes toward a growing portfolio of proof\-of\-work. **Depending on your career direction, outputs may include:** • Marketing campaign plans • SEO audits • Content assets • Business reports • Recruiter\-ready CV improvements • AI workflow automations • Data analysis summaries • Operations dashboards • Case studies • LinkedIn positioning assets **As a Nap OS member (€99/month), participants receive:** • Structured monthly roadmap • Guided internship simulation projects • Portfolio development support • Career accountability system • Proof\-of\-work evidence building • Employability\-focused feedback • Certification upon completion • Priority access to future Napblog opportunities • Potential referrals for strong performers • Entry into the Nap OS talent ecosystem **This programme is best suited for people who are tired of waiting and ready to build.** You may be a: • Student needing experience • Graduate lacking interviews • Immigrant seeking local market readiness • Career changer entering a new field • Ambitious self\-starter wanting momentum Strong candidates demonstrate: • Ownership mindset • Consistency • Curiosity • Professional communication • Coachability • Willingness to execute weekly **This is not employment and not a guaranteed placement.** This is a premium career acceleration service designed to help participants become more employable through structured action. Those seeking passive certificates, guaranteed jobs, or resume\-only validation may not be a fit. Those ready to build real credibility through work will benefit most. **Many talented people stay stuck because they lack:** • structure • proof of skills • accountability • visibility • market direction Nap OS helps solve all five.",https://www.linkedin.com/jobs/view/4404688576
Operations Analyst,Financefair,"Dublin, County Dublin, Ireland",linkedin,"**About Financefair** At Financefair, we're not just another Fintech company. We're a dedicated team of professionals committed to providing innovative financial solutions that propel businesses forward. Specialising in funding the growth of Irish and UK SMEs, we pride ourselves on our ability to foster success through innovative financial solutions. Since our beginning in 2015, we have been obsessed about providing the very best and most innovative solutions, and a best\-in\-class customer experience, to become the finance partner of choice. Over the last 10 years, Financefair has funded over €2\.0 billion for a wide range of clients across all sectors. We are in a period of rapid growth, launching new technology, expanding our team and growing our client base. **The Role** As an Operations Analyst, you will work in a dynamic team gaining an in\-depth exposure to the Financefair Platform, and hands\-on experience of dealing with scaling SMEs and large institutional credit funds. You will be given the opportunity and the autonomy to affect change and growth within a FinTech company who is striving to be the market leader in innovation, technology, credit, risk, and operational excellence within the receivables financing industry. The role will provide you with direct access to the Financefair leadership team and our inhouse Tech team, which will provide a rich learning experience for the successful candidate. The position is based at the company’s head office in Belfield Office Park, Clonskeagh, Dublin with 4 days (Mon to Thu) in the office, with Friday’s working remote. **Key Responsibilities** Operations Responsibilities: * Funder relationship management \- daily funder management, funder allocations and new funder onboarding * Daily cash and asset management * Daily fund reconciliation and allocation management * Drawdown management * Foreign Exchange management * Data analysis and reporting * Process automation and improvement initiatives * Drive change via technology and automation of processes via an agile methodology * Perform ongoing portfolio risk monitoring and identify emerging credit or operational risks **Technology And Risk Innovation Responsibilities** * Automating risk and operational workflows to improve control effectiveness and efficiency * Implementing technology\-driven solutions to enhance risk visibility and decision\-making * Supporting digital transformation initiatives within risk and operations function **The Ideal Candidate** * 3rd level degree in business, finance, or similar. * Experience in operations within the financial services or FinTech sector is highly desirable * Will have strong time management skills and have an ability to be flexible, prioritise their work, work to deadlines and ensure queries resolved in a timely manner * Highly numeric with a razor\-sharp attention to detail is critical * Excellent interpersonal, verbal and written communication and presentational skills with an ability to handle queries in a professional and timely manner * Show a high level of commitment, professional work ethic and is ambitious * Demonstrated ability to collaborate across teams, including Tech, Risk, and Credit, to achieve shared goals * Self\-motivated and able to use own initiative * Foster a culture of operational excellence * An ability to question and improve processes and use software where necessary to do things more efficiently * Proficient in Microsoft Office and experience of working with Microsoft Excel will be a distinct advantage * Relevant certifications (e.g., Lean Six Sigma, CFA, ACCA or similar) are a distinct advantage * Interested in innovation and tech",https://www.linkedin.com/jobs/view/4407423650
PET CT Clinical Specialist,Alliance Medical Ireland,"Dublin, County Dublin, Ireland",linkedin,"Alliance Medical currently have an exciting opportunity with an excellent remuneration package available for a PET\-CT Clinical Specialist to join our centre in Co Dublin! The PET\-CT Clinical Specialist will lead the PET\-CT unit, focusing on service delivery, quality assurance, and staff management. This role involves a combination of expert clinical duties, such as ensuring the correct protocols are followed and manage the day\-to\-day operations of the PET\-CT service, and leadership responsibilities, like training staff and supervising service delivery. **Key Responsibilities:** * In conjunction with the PET\-CT Clinical and Administrative staff, provide a safe \& efficient PET\-CT service, while adhering to all legislative regulations and company policies. * Accountable for the quality of the service provided, including customer service \& technical aspects. * Developing and implementing operational policies, protocols \& guidelines. * Maintain up to date knowledge of clinical, technical and radiographic developments in relation to the PET\-CT department and promote awareness of new developments. * Support the Unit Manager in the implementation of initiatives aimed at on\-going service development and improvement. * Promote \& maintain a safe environment for staff and patients. Assist in the development and implementation of risk management and health and safety strategies in association with the Quality Department. * Participate fully with all internal and external audits and Accreditation. * Quality Assurance: Investigate \& take appropriate action in accordance with Company policy in relation to complaints, accidents and incidents. * Ensure that all Company policies \& relevant up\-to\-date information is understood by staff and complied with. * Ensure all Company policies on infection control, IV policy and health and safety etc. are understood by staff and complied with. * Maintain a quality assurance programme in the PET/CT department. * Assist the Radiation Protection Officer to ensure that all principles and policies of radiation protection, are adhered to. * Be familiar with all legislation and directives regarding the safety standards for the protection of health workers and the general public against the dangers arising from Ionising Radiation. * Follow all Radiation Protection practices as determined by the Radiation Protection Committee, Radiation Protection Advisor and Radiation Protection Officer **Key Requirements:** * BSc (Hons) Diagnostic Radiography or equivalent * Active CORU Registration * IV Cannulation * Post\-Graduate Qualification in PET\-CT (desirable) but not mandatory. **Why choose Alliance Medical?** * Competitive Salary * Relocation Allowance *(t\&c’s)* * Comprehensive Induction \& training programme * Family Friendly Working Arrangements * 27 Annual Leave Days (including 2 discretionary days) * Full paid private Health Insurance * Paid Maternity Leave * Wedding Day Leave * Paid Sick Leave * Fertility Leave * Excellent Pension Scheme * Educational Assistance * Wellbeing Initiatives * Excellent overtime rates",https://www.linkedin.com/jobs/view/4405973493
Parts Assistant,McCoy Motors,"Lucan, D, IE",indeed,"**About Us** Established in 1981, McCoy Motors Ltd is Ireland’s leading SEAT \& CUPRA dealership. Family\-owned and run, we pride ourselves on delivering the highest level of customer service across Sales, Leasing, Finance, and After\-Sales. Our after\-sales services include servicing all makes and models, warranty, crash repairs, and parts \& accessories. **The Role:** We are seeking a **Senior Parts Assistant or Junior Parts Assistant** to join our busy after\-sales team and support a growing workload. The successful candidate will play a key role in delivering excellent customer service while ensuring smooth day\-to\-day parts operations. **Key Responsibilities** * Handle customer queries in person, over the phone, and by email. * Identify, price, and order parts as required. * Process incoming stock and maintain accurate records. * Assist with Vehicle Health Check (VHC) pricing. * Carry out stock analysis and regular stock checks. * Liaise with service and sales departments to ensure smooth workflow. **Requirements** * 1–3 years’ experience in a franchised after\-sales/parts department. * Strong customer service and communication skills. * Computer\-literate, organised, and detail\-oriented. * Experience with a VW Group partner (advantage, but not essential). * Ability to reliably commute to Lucan, Co. Dublin. * Drivers licence **Benefits** * Full\-time, permanent position. * Monday–Friday schedule. * On\-site parking. * Career development opportunities within a leading dealership. **How to Apply** Please send your CV for review. **Benefits:** On site parking, Paid Holidays Job Types: Full\-time, Permanent Benefits: * On\-site parking Application question(s): * Is your commute to our premises in Lucan Dublin (K78Y408\) manageable long term? Work Location: In person",https://ie.indeed.com/viewjob?jk=5bd232d0f30a4e2c
