title,company,location,site,description,job_url
"Data Analyst, Strategic Partnerships( Bangkok based)",Agoda,"Dublin, County Dublin, Ireland",linkedin,"**About Agoda** At Agoda, we bridge the world through travel. Our story began in 2005, when two lifelong friends and entrepreneurs, driven by their passion for travel, launched Agoda to make it easier for everyone to explore the world. Today, we are part of Booking Holdings \[NASDAQ: BKNG], with a diverse team of over 7,000 people from 90 countries, working together in offices around the globe. Every day, we connect people to destinations and experiences, with our great deals across our millions of hotels and holiday properties, flights, and experiences worldwide. No two days are the same at Agoda. Data and technology are at the heart of our culture, fueling our curiosity and innovation. If you’re ready to begin your best journey and help build travel for the world, join us. **Key Areas of Focus:** **In this role, you’ll get to:** **Strategy** : Conduct analyses to identify growth opportunities and prioritize investment areas in APAC for Strategic Partnerships team based on analytical insights, industry trends, and changing competitive landscape. **Analytics** : Leverage data \& tools to analyze SP performance and identify appropriate levers to improve performance. **Cross\-functional projects** : Work with different teams inside SP (B2B, White Label, Affiliates, Financial Institutions, different markets across APAC, etc.) and outside of SP (product, marketing, supply, finance, etc.) to drive initiatives. **Performance management** : Maintain and optimize a performance management system for the department, including a large team of account managers **Data \& tools** : Oversee SP data infrastructure to ensure data accuracy, completeness, and timeliness. Design, manage, and oversee the maintenance of data tools to support decision making. **Performance reporting** : Preparing updates on business performance, proposals, and recommendations to senior management. **Pricing Experiments** : Optimize pricing strategy and make decisions based on A/B experiments. **What you’ll Need to Succeed:** * 4 years and above of experience with Consulting, Data Analytics, Strategy, Business Development, Business Intelligence, or other relevant fields * Proven ability to leverage analytics and quantitative methods to break down ambiguous problems and come up with recommendations * Growth mindset and excited to work on a variety of functional areas * Entrepreneurial and not afraid to be hands\-on on the work * Experience working in a fast\-paced and high growth environment * Excellent communication skills (both verbal and written in English) with ability to work well across multiple stakeholders **It’s Great if you have:** * Ability to write in SQL a plus, or willingness to learn * Ability to use Tableau a plus, or willingness to learn * Bachelor’s degree in Statistics, Computer Science, Economics, Mathematics a plus \#STRA\#ANLS\#MRKT\#3 \#sanfrancisco \#sanjose \#losangeles \#sandiego \#oakland \#denver \#miami \#orlando \#atlanta \#chicago \#boston \#detroit \#newyork \#portland \#philadelphia \#dallas \#houston \#austin \#seattle \#washdc \#tirana \#yerevan \#sydney \#melbourne \#perth \#vienna \#graz \#baku \#minsk \#brussels \#antwerp \#ghent \#charleroi \#saopaolo \#sofia \#toronto \#vancouver \#montreal \#shanghai \#beijing \#shenzhen \#zagreb \#cyprus \#prague \#Brno \#Ostrava \#copenhagen \#cairo \#alexandria \#giza \#estonia \#helsinki \#paris \#nice \#marseille \#rouen \#lyon \#toulouse \#tbilisi \#berlin \#munich \#hamburg \#stuttgart \#cologne \#frankfurt \#dusseldorf \#dortmund \#essen \#Bremen \#leipzig \#dresden \#hanover \#nuremberg \#athens \#hongkong \#budapest \#bangalore \#newdelhi \#jakarta \#bali \#bandung \#dublin \#telaviv \#milan \#rome \#naples \#turin \#palermo \#venice \#bologna \#florence \#tokyo \#osaka \#yokohama \#nagoya \#okinawa \#fukuoka \#sapporo \#amman \#irbid \#riga \#beirut \#tripoli \#vilnius \#luxembourg \#kualalumpur \#malta \#chisinau \#amsterdam \#oslo \#jerusalem \#manila \#warsaw \#krakow \#sintra \#porto \#braga \#cascais \#loures \#amadora \#almada \#doha \#alrayyan \#bucharest \#moscow \#saintpetersburg \#riyadh \#jeddah \#mecca \#medina \#belgrade \#singapore \#bratislava \#capetown \#johannesburg \#seoul \#barcelona \#madrid \#valencia \#seville \#bilbao \#malaga \#oviedo \#alicante \#laspalmas \#zaragozbanga \#stockholm \#zurich \#geneva \#basel \#taipei \#tainan \#taichung \#kaohsiung \#Phuket \#bangkok \#istanbul \#ankara \#izmir \#dubai \#abudhabi \#sharjah \#london \#manchester \#edinburgh \#kiev \#hcmc \#hanoi \#sanaa \#taiz \#aden \#gibraltar \#marrakech \#lodz \#wroclaw \#poznan \#Gdansk \#szczecin \#bydgoszcz \#lublin \#katowice \#rio \#salvador \#fortaleza \#brasilia \#belo \#belem \#manaus \#curitiba \#portoalegre \#saoluis data representation data analysis SQL data analytics analytics python (programming language) data mining data science r (programming language) tableau analytical skills data visualization databases business analysis business intelligence (bi) microsoft sql server machine learning statistics power bi Please review our Hiring Process Guidelines before your interview — click here to learn how interviewing at Agoda works. **Discover More About Working At Agoda** * Agoda Careers https://careersatagoda.com * Facebook https://www.facebook.com/agodacareers/ * LinkedIn https://www.linkedin.com/company/agoda * YouTube https://www.youtube.com/agodalife **Equal Opportunity Employer** At Agoda, we pride ourselves on being a company represented by people of all different backgrounds and orientations. We prioritize attracting diverse talent and cultivating an inclusive environment that encourages collaboration and innovation. Employment at Agoda is based solely on a person’s merit and qualifications. We are committed to providing equal employment opportunity regardless of sex, age, race, color, national origin, religion, marital status, pregnancy, sexual orientation, gender identity, disability, citizenship, veteran or military status, and other legally protected characteristics. We will keep your application on file so that we can consider you for future vacancies and you can always ask to have your details removed from the file. For more details please read our privacy policy. **Disclaimer** We do not accept any terms or conditions, nor do we recognize any agency’s representation of a candidate, from unsolicited third\-party or agency submissions. If we receive unsolicited or speculative CVs, we reserve the right to contact and hire the candidate directly without any obligation to pay a recruitment fee.",https://www.linkedin.com/jobs/view/4410546794
Data Analyst- Customer Experience Group | Bangkok-based,Agoda,"Dublin, County Dublin, Ireland",linkedin,"**About Agoda** At Agoda, we bridge the world through travel. Our story began in 2005, when two lifelong friends and entrepreneurs, driven by their passion for travel, launched Agoda to make it easier for everyone to explore the world. Today, we are part of Booking Holdings \[NASDAQ: BKNG], with a diverse team of over 7,000 people from 90 countries, working together in offices around the globe. Every day, we connect people to destinations and experiences, with our great deals across our millions of hotels and holiday properties, flights, and experiences worldwide. No two days are the same at Agoda. Data and technology are at the heart of our culture, fueling our curiosity and innovation. If you’re ready to begin your best journey and help build travel for the world, join us. **Overview:** We are looking for analysts to join the largest and fastest growing online hotel booking platform in Asia based in Bangkok, Thailand. Agoda is a strongly data driven organization: as a Data Analyst, your insights will impact strategic and tactical decisions driving business growth. **Responsibilities:** You will work in the Data Analytics team to deliver significant and action\-oriented analyses and recommendations to your stakeholders, to help drive decision\-making with insights from customer data analysis. Your work will be project\-oriented, since you will get the opportunity to own analytical projects, starting from understanding stakeholder needs and problem definition, to the analysis and interpretation of results as well as communicating the findings to the Operational teams or other groups in Agoda (Marketing, Product, Partners Services). Typical analysis projects can be: * analyzing impact of higher performance of Customer Experience Specialists on customer satisfaction and loyalty * analyzing processes to improve Customer Experience Specialists productivity * assessing efficiency of recruitment programs for recruiting performant employees Responsibilities are: * Work with stakeholders to understand their business needs and identify opportunities for analysis insight to inform their decision\-making * Understand and report to your team and senior management on business performance * Ensure delivery of regular reports on time and without error * Self\-manage delivery of analytical projects + Defining the business problem + Determining the analytical approach + Efficiently extract relevant data + Appropriately use statistical and data analysis techniques + Sharing your findings using impactful data visualizations and efficient communication + Balance multiple priorities, updating stakeholders on progress and expected delivery * (Encourage and train department members in best practice use of Agoda data, analysis techniques and interpretation) **Qualifications And Experience** * Bachelor’s degree in computer sciences, engineering, mathematics, statistics, data science or a related degree program with outstanding academic results * 0\-3 years work experience (Senior: 4\+ years of relevant experience, preferably working with large datasets and experimentation) * SQL proficiency required: can extract data from large databases using SQL to develop data queries * Excellent problem solving skills including the ability to analyze and resolve complex problems * Expert Excel user: able to understand and build complex spreadsheets * Strong business sense * Excellent communication and comprehension skills: confident communicating with people of differing levels of seniority, analytical understanding and from a wide variety of backgrounds * Organized and structured: can manage multiple, competing priorities and deliver results under tight deadlines and pressure * Fluent in English both spoken and written – additional languages are a plus **Attitude** * Must be curious, proactive, practical and solution\-oriented with “Get it done!” attitude * Must be data savvy and love crunching numbers: love the idea of working in an international and multicultural company, analyzing billions of actions from millions of travelers choosing from thousands of hotels * Must want to tell an impactful story with analysis and smart data visualization, not just number crunch * Able and willing to share your opinion and propose ideas to improve operations based on data and have an impact on the customer experience * Able to work in a highly multi\-cultural team * Attentive to detail and committed to data integrity * Aware of the importance of discretion, confidentiality, and ethics **Good To Have (but Not Required)** * Experience in management consulting * Expert in one data analysis package, such as R, Python or VBA * Experience with dashboarding / visualization software like Tableau **What We Offer** * Be part of a dynamic and exciting data\-driven multinational team in a successful and fast growing tech company * A clearly defined career path will help you to continuously develop your skills. * The chance to propose ideas to improve operations based on data and have an impact on the customer experience * Benefit : + Relocation package for employees joining from abroad + International health insurance + Annual performance bonus + Parking fees reimburse + Discount for Agoda employee booking on Agoda.com \#sydney \#Melbourne \#brussels \#shanghai \#beijing \#prague \#copenhagen \#cairo \#estonia \#helsinki \#paris \#berlin \#munich \#hongkong \#hcmc \#dublin \#telaviv \#tokyo \#kualalumpur \#amsterdam \#oslo \#warsaw \#krakow \#moscow \#singapore \#seoul \#barcelona \#madrid \#stockholm \#taipei \#bangkok \#dubai \#london \#saintpetersburg \#vilnius \#budapest \#newyork \#sanfrancisco \#losangeles ANLS \#IT \#4 Please review our Hiring Process Guidelines before your interview — click here to learn how interviewing at Agoda works. **Discover More About Working At Agoda** * Agoda Careers https://careersatagoda.com * Facebook https://www.facebook.com/agodacareers/ * LinkedIn https://www.linkedin.com/company/agoda * YouTube https://www.youtube.com/agodalife **Equal Opportunity Employer** At Agoda, we pride ourselves on being a company represented by people of all different backgrounds and orientations. We prioritize attracting diverse talent and cultivating an inclusive environment that encourages collaboration and innovation. Employment at Agoda is based solely on a person’s merit and qualifications. We are committed to providing equal employment opportunity regardless of sex, age, race, color, national origin, religion, marital status, pregnancy, sexual orientation, gender identity, disability, citizenship, veteran or military status, and other legally protected characteristics. We will keep your application on file so that we can consider you for future vacancies and you can always ask to have your details removed from the file. For more details please read our privacy policy. **Disclaimer** We do not accept any terms or conditions, nor do we recognize any agency’s representation of a candidate, from unsolicited third\-party or agency submissions. If we receive unsolicited or speculative CVs, we reserve the right to contact and hire the candidate directly without any obligation to pay a recruitment fee.",https://www.linkedin.com/jobs/view/4410538877
Dentist,Veterans Evaluation Services,"Dublin, County Dublin, Ireland",linkedin,"**Introduction** Veterans Evaluation Services is seeking qualified Dentists to join our provider network as an independent contractor to perform dental disability examinations for Veterans for the following location: Paris, France **\*\*Applicants must have their own office within 100 miles of the job location\*\*** **Opportunity Highlights** * **Service** – Provide a meaningful service for the men and women who have worn the cloth of our nation. * **Ease of Use** – User\-friendly software, a dedicated provider support system, up front training, expert report guidance, and automatic payments make it easier than ever to join. * **Diversify Your Income** – Whether you’re looking to grow your practice, pay down student debt or a mortgage, or add variety into your practice schedule, this is an opportunity to earn significant additional income. * **Low Risk –** There is no treatment or prescription of medications **Your Role as a Provider** * As a clinician, you are an expert in the assessment, evaluation, and diagnosis of health conditions for your patients. * As an independent contractor with VES, you apply your expertise in the evaluation and diagnosis of dental conditions to support a Veteran’s disability claim. * As a certified medical disability examiner, you gather and synthesize clinical evidence through medical and military record review, interviews with Veterans, and face\-to\-face examinations which may include panoramic x\-rays. * You develop a medical opinion of likelihood that the Veteran’s condition is related to their military service. * The timely and expert examination assures that a Veteran’s claim is heard and dutifully processed by VBA. Here is a typical workflow for a provider: Exam Request Received \> Testing and Exam Schedule \> Provider Reviews Records \> Veteran Exam Completion \> Report Reviewed and Submitted **Qualifications** * **An active and unrestricted license.** * **Own office within 100 miles of the job location** **Contact Information** Nicolle Guell guelln@veservices.com",https://www.linkedin.com/jobs/view/4410071515
Designer– Women’s Accessories,Primark,"Dublin, County Dublin, Ireland",linkedin,"Because your ideas are our style. Design, our way. As a Designer at Primark, you will plan a critical role in the delivery of the product strategy in Primark. You will drive the success of your department by identifying key seasonal trends, working with suppliers to develop best in class product and alongside B\&M, strategically work to build and deliver well executed and exciting new ranges for our target customers. You will work with teams across design to identify and deliver the newest and latest trends for our Global market. You will deliver colour direction and build seasonally appropriate colour palettes, identify key shapes and graphic newness, and drive fabric innovation. You will be a collaborative and strategic designer, working with B\&M, sourcing and our technical team, to seek out new opportunities of growth, ways to better the product and drive our LFL, in line with Primark’s strategic vision. You will be a well trusted member of the BMD community within Primark. You will be seen as a leader that engages and inspires the junior members of our community. Driving collaboration across the wider Primark teams, to enhance our product offering and position on the high street. **What You’ll Do As a Designer** We want you to feel challenged and inspired. Here, you’ll develop your skills across a range of responsibilities: * Research and shape globally relevant trend direction for women’s accessories, using forecasting tools, data insights and customer analytics to inform commercial ranges. * Lead seasonal colour direction and drive innovation across materials, trims, hardware and construction to deliver differentiated product. * Own the end‑to‑end design and development process across bags, footwear and accessories, from concept through final approval. * Build commercially balanced, customer‑focused ranges aligned to brand DNA, category strategy and clear product architecture. * Lead, manage and mentor a design team, setting high standards for product quality, pace and ways of working. * Collaborate closely with Buying, Merchandising, Technical, Sourcing, suppliers and Brand teams to deliver consistent, high‑quality product execution. **Key Interactions and Engagements as part of this role:** As Designer, you will work closely with Primark’s Buying and Merchandising teams, as well as collaborating with other Design teams across all product categories to ensure alignment and a unified design vision. You will represent your categories and present ranges for sign\-off at leadership meetings. You will also represent your product areas across working groups and forums, contributing to cross\-functional alignment and decision\-making. **What You’ll Get** People are at the heart of what we do here, so it’s essential we provide you with the right environment to perform at your very best. Let’s talk lifestyle. Let’s talk lifestyle: Healthcare, pension, and potential bonus. 27 days of leave, plus bank holidays and if you want, you can buy 5 more. Because Primark is all about tailoring to you, we offer Tax Saver Tickets, fitness centre, and a subsidised cafeteria. **What You’ll Bring** We want every person in our organisation to feel like they’re making a key contribution. Here are some of the experiences and skills you’ll need for the role: * Extensive experience in accessories design, with a minimum of 7 years in design roles and proven people‑management or team‑lead responsibility. * Strong specialist knowledge across accessories, footwear or bags, with deep understanding of materials, construction and end‑to‑end product development. * A track record of delivering commercially successful, high‑volume ranges by translating seasonal trends into customer‑focused product. * Excellent leadership, coaching and mentoring capabilities, with the ability to influence, develop and inspire design teams. * Strong stakeholder and supplier management skills, supported by confident communication, presentation ability and cross‑functional collaboration. * A proactive, well‑organised and accountable approach, thriving in fast‑paced environments while managing multiple priorities with sound judgement and integrity. Excited? Good. Because it’s energising to put your skills to work, in a growing global business committed to encouraging people to express themselves – and feel a sense of belonging. Apply to be part of Primark’s future, today… and enjoy career growth, our way. **About Primark** Primark is an international clothing retailer employing more than 80,000 colleagues across 18 countries in Europe and the US. Founded in Ireland in 1969 under the Penneys brand, Primark aims to create maximum joy at minimum cost – less money and less impact on the planet. Primark continues to expand across new and existing markets with the aim of reaching 530 stores by the end of 2026\. Every person impacts the culture at Primark. Our values: Caring (we always strive to put people first), Dynamic (we bravely push the boundaries to stay ahead) and Together (we learn more, laugh more and achieve more as a team) outline the behaviours we expect of our people as we work with each other, our customers, our suppliers and our partners. Let’s see what impact you can make! **REQ ID:** JR\-8030",https://www.linkedin.com/jobs/view/4410577308
DevOps Engineer,Brightwater Recruitment,"Dublin, County Dublin, Ireland",linkedin,"**Senior Azure DevOps Engineer** Dublin (Hybrid \- 3 days a week) \| Permanent **About the Company** Our client is a **global organisation operating within the insurance and mobility space** , supporting international operations across multiple regions. Following significant recent growth and transformation, they are continuing to invest in their **cloud, data, and engineering capabilities** , with a strong focus on modernisation and scalability. This is an opportunity to join a **high\-impact technology function** working on business\-critical systems in a **cloud\-first environment** . **The Role** We are seeking a **Senior Azure DevOps Engineer** to play a key role in designing, building, and supporting cloud infrastructure and CI/CD capabilities within a modern Azure environment. This is a **senior, hands\-on role** with exposure across infrastructure, application delivery, and data platforms, working closely with engineering and IT teams to ensure scalable and reliable systems. **Key Responsibilities** **Cloud Infrastructure \& Operations** * Manage and optimise Azure infrastructure ensuring **availability, security, and scalability** * Implement Infrastructure\-as\-Code (IaC) using tools such as ARM or equivalent * Support governance, provisioning, and standardisation across environments **CI/CD \& Automation** * Design and maintain CI/CD pipelines using Azure DevOps (Pipelines, Repos, Artifacts) * Automate build, test, and deployment processes across multiple services * Drive adoption of DevOps best practices and continuous improvement **Monitoring, Security \& Performance** * Implement monitoring, logging, and alerting solutions (e.g. Log Analytics) * Perform performance tuning, troubleshooting, and root cause analysis * Apply security best practices including RBAC, secrets management, and pipeline security **Application \& Platform Support** * Collaborate with engineering teams on application lifecycle and deployment architecture * Support and optimise cloud\-hosted applications * Contribute to knowledge sharing and upskilling within the wider team **Data Platform Integration (Desirable)** * Support data pipelines using Azure Data Factory * Work with analytics/data platforms such as Azure Databricks * Implement CI/CD for data engineering workflows **Experience Required** * 5\+ years’ experience in **Azure DevOps / Cloud Engineering roles** * Strong expertise in **Microsoft Azure services and architecture** * Proven experience building and managing **CI/CD pipelines** * Solid scripting skills (PowerShell, Bash, or similar) * Strong understanding of **Git workflows and version control** * Experience with **DevSecOps, cloud security, and cost optimisation (FinOps)** * Excellent troubleshooting and problem\-solving skills * Strong communication skills and ability to work in collaborative environments **Desirable Experience** * Exposure to **Azure Data Factory or Databricks** * Experience in **financial services or regulated environments** * Microsoft certifications (e.g. AZ\-400, AZ\-305\)",https://www.linkedin.com/jobs/view/4410558375
