title,company,location,site,description,job_url
Health And Safety Officer,Global Professional Consultants,,linkedin,"**Health and Safety Officer** **Health and Safety Officer** with 4 years\+ experience required for a top tier main building contractor to work on a the tallest building in Ireland which will be built in Dublin City Centre. The successful Health and Safety Officer will ideally have worked in a similar position in Ireland previously for a Main Building Contractor. **Requirements:** * Hold a relevant Health and Safety Qualification * Construction background * Have a minimum of 4 years’ experience as safety officer on building projects in Ireland or the UK * Hold a full, clean Driving license * Excellent IT skills with proficiency in Microsoft Office including strong excel skills * Exhibit strong interpersonal and communication skills * Highly organised * Strong leader and ability to manage several projects at one time. **Package** * €65k\-€75k * Pension and other benefits * Excellent career prospects * Company vehicle / car allowance If you are a **Health and Safety Officer** considering a career move, please feel to send your **CV or contact Declan Hasson for a confidential discussion.** GPC will not send any applicants CV’s to clients without a full discussion and prior consent. GPC is a specialist construction recruitment consultancy based in Dublin and has more than 28 years’ experience working in the recruitment of construction professionals within Ireland and Internationally.",https://www.linkedin.com/jobs/view/4407792188
"Hiring Now! Teach English Overseas with Full Training, Visa Sponsorship & Career Support",English 1,"South Dublin, Ireland",linkedin,"**Teach English Overseas with Full Training, Visa Sponsorship \& Career Support** Looking for a **stable, full\-time job abroad** where you can **teach English, gain international experience, and receive professional training\-** even if you’ve never taught before? English 1 is recruiting **entry\-level English teachers** to teach English in China. This role is designed specifically for **first\-time teachers, graduates, and professionals transitioning into education** , with **structured training, ready\-made lessons, and continuous support** . **What you'll do** * Teach English to young learners aged 3–16 in a fun, interactive, and immersive classroom setting. * Deliver high\-energy lessons using English 1’s award\-winning curriculum and digital tools. * Provide constructive feedback and help students build confidence in their English skills. * Take part in school events, cultural activities, and student engagement programs. **What you’ll get** * Competitive salary \+ performance bonus after 6 months * 21 days paid leave (10 days paid leave \+ 11 days statutory holidays) * Flight allowance * International health insurance (co\-paid) * Airport pick\-up support * \*\*Sponsored legal Z work visa \+ up to 2 weeks sponsored hotel stay * In\-class coaching and mentoring * Visa sponsorship \& legal work permit * Comprehensive induction training, ongoing support, and fully prepared teaching materials * TEFL certificate \+ skill development \& career advancement * Distance learning courses (Level 6 Trinity College CertPT, DELTM) * English 1\-organized social and cultural activities \+ free Mandarin Chinese lessons *The hotel accommodation for the first two weeks will be deemed as a sponsorship upon successful completion of the first\-year contract. \*\*Sponsored legal Z work visa expenses will be reimbursed.* **Who we’re looking for** * A bachelor’s degree (in any subject) * A valid passport * A genuine interest in education, travel, and cultural exchange. * ESL certification (TEFL, TESOL, CELTA) is a plus\- we can sponsor * Clean background check. **Why work at English 1?** * Teachers are at the core of everything we do at English 1 * Over **30 years** of success in China with **200\+ schools** in **50\+ cities** . * Strong presence in **China** and **Indonesia** . * **Professional development** and career **advancement opportunities** . Whether you're graduating soon, pivoting into a new career, or seeking international experience, this opportunity offers a chance to teach, travel, and grow \#EntryLevel \#Graduates \#EnglishTeacher \#ESL \#TEFL \#TeachingJobs \#GraduateJobs \#hiring \#jobs \#entrylevel \#teachercns \#graduates \#esl \#tefl \#teach \#JobAlert \#NowHiring \#JobOpening \#CareerOpportunities \#JobSearch \#WorkWithUs \#LinkedInJobs \#JobSeeker \#OpenToWork \#CareerGoals \#JobHunt \#NewJob \#CollegeGraduates \#BachelorsDegree \#RecentGrad",https://www.linkedin.com/jobs/view/4410203669
Hiring for 2026! Entry-Level English Teacher (ESL) | No Experience Needed,English 1,"Dublin 12, County Dublin, Ireland",linkedin,"**Launch Your International Career with Purpose and Adventure** Are you searching for a **rewarding, entry\-level job** that lets you **travel the world** , **work abroad** , and gain **real\-world experience** all while making a difference? Whether you're a **recent graduate** , exploring a **career change** , or an **ESL/TEFL\-certified teacher** ready to take your skills overseas, this is the opportunity you’ve been looking for. **English 1** is now hiring **motivated, globally minded individuals** for **full\-time English teaching jobs in China** . No teaching experience? No problem. We provide **full training** , **ready\-made teaching materials** , and **visa sponsorship,** making this the perfect **graduate job** , **first job** , or **international career move** for anyone ready to start something new. **What you'll do** * Teach English to young learners aged 3–16 in a fun, interactive, and immersive classroom setting. * Deliver high\-energy lessons using English 1’s award\-winning curriculum and digital tools. * Provide constructive feedback and help students build confidence in their English skills. * Take part in school events, cultural activities, and student engagement programs. **What you’ll get** * Competitive salary \+ performance bonus after 6 months * 21 days paid leave (10 days paid leave \+ 11 days statutory holidays) * Flight allowance * International health insurance (co\-paid) * Airport pick\-up support * \*\*Sponsored legal Z work visa \+ up to 2 weeks sponsored hotel stay * Comprehensive induction training, ongoing support, and fully prepared teaching materials * TEFL certificate \+ skill development \& career advancement * Distance learning courses (Level 6 Trinity College CertPT, DELTM) * English 1\-organized social and cultural activities \+ free Mandarin Chinese lessons *The hotel accommodation for the first two weeks will be deemed as a sponsorship upon successful completion of the first\-year contract. \*\*Sponsored legal Z work visa expenses will be reimbursed.* **Who we’re looking for** * A bachelor’s degree (in any subject) * A valid passport * A genuine interest in education, travel, and cultural exchange. * ESL certification (TEFL, TESOL, CELTA) is a plus\- we can sponsor * Clean background check. **Why work at English 1?** * Teachers are at the core of everything we do at English 1 * Over **30 years** of success in China with **200\+ schools** in **50\+ cities** . * Strong presence in **China** and **Indonesia** . * **Professional development** and career **advancement opportunities** . Whether you're graduating soon, pivoting into a new career, or seeking international experience, this opportunity offers a chance to teach, travel, and grow \#EntryLevel \#Graduates \#EnglishTeacher \#ESL \#TEFL \#TeachingJobs \#GraduateJobs \#hiring \#jobs \#entrylevel \#teachercns \#graduates \#esl \#tefl \#teach \#JobAlert \#NowHiring \#JobOpening \#CareerOpportunities \#JobSearch \#WorkWithUs \#LinkedInJobs \#JobSeeker \#OpenToWork \#CareerGoals \#JobHunt \#NewJob \#CollegeGraduates \#BachelorsDegree \#RecentGrad \#ClassOf2025 \#JobSearch \#CareerSuccess \#EntryLevelJobs \#HiringNow \#YoungProfessionals \#CareerGrowth \#Networking \#LinkedInNetworking \#FutureLeaders \#UniversityAlumni \#HigherEd \#AlumniNetwork \#CollegeSuccess",https://www.linkedin.com/jobs/view/4410201878
"Hiring for 2026! Teach English Abroad | Full Training, Visa Sponsorship & Career Growth",English 1,"Dublin 4, County Dublin, Ireland",linkedin,"Looking for a **stable, full\-time job abroad** where you can **teach English, gain international experience, and receive professional training\-** even if you’ve never taught before? English 1 is recruiting **entry\-level English teachers** to teach English in China. This role is designed specifically for **first\-time teachers, graduates, and professionals transitioning into education** , with **structured training, ready\-made lessons, and continuous support** . **What you'll do** * Teach English to young learners aged 3–16 in a fun, interactive, and immersive classroom setting. * Deliver high\-energy lessons using English 1’s award\-winning curriculum and digital tools. * Provide constructive feedback and help students build confidence in their English skills. * Take part in school events, cultural activities, and student engagement programs. **What you’ll get** * Competitive salary \+ performance bonus after 6 months * 21 days paid leave (10 days paid leave \+ 11 days statutory holidays) * Flight allowance * International health insurance (co\-paid) * Airport pick\-up support * \*\*Sponsored legal Z work visa \+ up to 2 weeks sponsored hotel stay * In\-class coaching and mentoring * Visa sponsorship \& legal work permit * Comprehensive induction training, ongoing support, and fully prepared teaching materials * TEFL certificate \+ skill development \& career advancement * Distance learning courses (Level 6 Trinity College CertPT, DELTM) * English 1\-organized social and cultural activities \+ free Mandarin Chinese lessons *The hotel accommodation for the first two weeks will be deemed as a sponsorship upon successful completion of the first\-year contract. \*\*Sponsored legal Z work visa expenses will be reimbursed.* **Who we’re looking for** * A bachelor’s degree (in any subject) * A valid passport * A genuine interest in education, travel, and cultural exchange. * ESL certification (TEFL, TESOL, CELTA) is a plus\- we can sponsor * Clean background check. **Why work at English 1?** * Teachers are at the core of everything we do at English 1 * Over **30 years** of success in China with **200\+ schools** in **50\+ cities** . * Strong presence in **China** and **Indonesia** . * **Professional development** and career **advancement opportunities** . Whether you're graduating soon, pivoting into a new career, or seeking international experience, this opportunity offers a chance to teach, travel, and grow \#EntryLevel \#Graduates \#EnglishTeacher \#ESL \#TEFL \#TeachingJobs \#GraduateJobs \#hiring \#jobs \#entrylevel \#teachercns \#graduates \#esl \#tefl \#teach \#JobAlert \#NowHiring \#JobOpening \#CareerOpportunities \#JobSearch \#WorkWithUs \#LinkedInJobs \#JobSeeker \#OpenToWork \#CareerGoals \#JobHunt \#NewJob \#CollegeGraduates \#BachelorsDegree \#RecentGrad",https://www.linkedin.com/jobs/view/4410535075
"Hiring for 2026! Teach English Abroad | Full Training, Visa Sponsorship & Career Growth",English 1,"Drogheda, Ireland",linkedin,"Looking for a **stable, full\-time job abroad** where you can **teach English, gain international experience, and receive professional training\-** even if you’ve never taught before? English 1 is recruiting **entry\-level English teachers** to teach English in China. This role is designed specifically for **first\-time teachers, graduates, and professionals transitioning into education** , with **structured training, ready\-made lessons, and continuous support** . **What you'll do** * Teach English to young learners aged 3–16 in a fun, interactive, and immersive classroom setting. * Deliver high\-energy lessons using English 1’s award\-winning curriculum and digital tools. * Provide constructive feedback and help students build confidence in their English skills. * Take part in school events, cultural activities, and student engagement programs. **What you’ll get** * Competitive salary \+ performance bonus after 6 months * 21 days paid leave (10 days paid leave \+ 11 days statutory holidays) * Flight allowance * International health insurance (co\-paid) * Airport pick\-up support * \*\*Sponsored legal Z work visa \+ up to 2 weeks sponsored hotel stay * In\-class coaching and mentoring * Visa sponsorship \& legal work permit * Comprehensive induction training, ongoing support, and fully prepared teaching materials * TEFL certificate \+ skill development \& career advancement * Distance learning courses (Level 6 Trinity College CertPT, DELTM) * English 1\-organized social and cultural activities \+ free Mandarin Chinese lessons *The hotel accommodation for the first two weeks will be deemed as a sponsorship upon successful completion of the first\-year contract. \*\*Sponsored legal Z work visa expenses will be reimbursed.* **Who we’re looking for** * A bachelor’s degree (in any subject) * A valid passport * A genuine interest in education, travel, and cultural exchange. * ESL certification (TEFL, TESOL, CELTA) is a plus\- we can sponsor * Clean background check. **Why work at English 1?** * Teachers are at the core of everything we do at English 1 * Over **30 years** of success in China with **200\+ schools** in **50\+ cities** . * Strong presence in **China** and **Indonesia** . * **Professional development** and career **advancement opportunities** . Whether you're graduating soon, pivoting into a new career, or seeking international experience, this opportunity offers a chance to teach, travel, and grow \#EntryLevel \#Graduates \#EnglishTeacher \#ESL \#TEFL \#TeachingJobs \#GraduateJobs \#hiring \#jobs \#entrylevel \#teachercns \#graduates \#esl \#tefl \#teach \#JobAlert \#NowHiring \#JobOpening \#CareerOpportunities \#JobSearch \#WorkWithUs \#LinkedInJobs \#JobSeeker \#OpenToWork \#CareerGoals \#JobHunt \#NewJob \#CollegeGraduates \#BachelorsDegree \#RecentGrad",https://www.linkedin.com/jobs/view/4410515445
Hiring now! Entry-Level English Teacher (ESL) | No Experience Needed,English 1,"Dublin, County Dublin, Ireland",linkedin,"**Launch Your International Career with Purpose and Adventure** Are you searching for a **rewarding, entry\-level job** that lets you **travel the world** , **work abroad** , and gain **real\-world experience** all while making a difference? Whether you're a **recent graduate** , exploring a **career change** , or an **ESL/TEFL\-certified teacher** ready to take your skills overseas, this is the opportunity you’ve been looking for. **English 1** is now hiring **motivated, globally minded individuals** for **full\-time English teaching jobs in China** . No teaching experience? No problem. We provide **full training** , **ready\-made teaching materials** , and **visa sponsorship,** making this the perfect **graduate job** , **first job** , or **international career move** for anyone ready to start something new. **What you'll do** * Teach English to young learners aged 3–16 in a fun, interactive, and immersive classroom setting. * Deliver high\-energy lessons using English 1’s award\-winning curriculum and digital tools. * Provide constructive feedback and help students build confidence in their English skills. * Take part in school events, cultural activities, and student engagement programs. **What you’ll get** * Competitive salary \+ performance bonus after 6 months * 21 days paid leave (10 days paid leave \+ 11 days statutory holidays) * Flight allowance * International health insurance (co\-paid) * Airport pick\-up support * \*\*Sponsored legal Z work visa \+ up to 2 weeks sponsored hotel stay * Comprehensive induction training, ongoing support, and fully prepared teaching materials * TEFL certificate \+ skill development \& career advancement * Distance learning courses (Level 6 Trinity College CertPT, DELTM) * English 1\-organized social and cultural activities \+ free Mandarin Chinese lessons *The hotel accommodation for the first two weeks will be deemed as a sponsorship upon successful completion of the first\-year contract. \*\*Sponsored legal Z work visa expenses will be reimbursed.* **Who we’re looking for** * A bachelor’s degree (in any subject) * A valid passport * A genuine interest in education, travel, and cultural exchange. * ESL certification (TEFL, TESOL, CELTA) is a plus\- we can sponsor * Clean background check. **Why work at English 1?** * Teachers are at the core of everything we do at English 1 * Over **30 years** of success in China with **200\+ schools** in **50\+ cities** . * Strong presence in **China** and **Indonesia** . * **Professional development** and career **advancement opportunities** . Whether you're graduating soon, pivoting into a new career, or seeking international experience, this opportunity offers a chance to teach, travel, and grow \#EntryLevel \#Graduates \#EnglishTeacher \#ESL \#TEFL \#TeachingJobs \#GraduateJobs \#hiring \#jobs \#entrylevel \#teachercns \#graduates \#esl \#tefl \#teach \#JobAlert \#NowHiring \#JobOpening \#CareerOpportunities \#JobSearch \#WorkWithUs \#LinkedInJobs \#JobSeeker \#OpenToWork \#CareerGoals \#JobHunt \#NewJob \#CollegeGraduates \#BachelorsDegree \#RecentGrad \#ClassOf2025 \#JobSearch \#CareerSuccess \#EntryLevelJobs \#HiringNow \#YoungProfessionals \#CareerGrowth \#Networking \#LinkedInNetworking \#FutureLeaders \#UniversityAlumni \#HigherEd \#AlumniNetwork \#CollegeSuccess",https://www.linkedin.com/jobs/view/4410524502
"Human Resources Associate, Consulting",Trindent Consulting,"DUBLIN 2, D, IE",indeed,"Trindent Consulting is a global management consulting firm that specializes in technical augmentation in the energy sector, specifically downstream Oil \& Gas. We’ve helped over 100 clients achieve significant financial benefits that yield between 500\-1500% return\-on\-investment within the 1st year – and we’ve done that without capital investments or software changes of any kind. Established in 2008, Trindent Consulting has quickly garnered a reputation as a firm that Makes It Happen™. We are ranked as one of Canada’s Fastest\-Growing Companies by Canadian Business and GROWTH 500 for 7 years in a row and named one of the Fastest\-Growing Consulting Firms by Consulting Magazine in 2015 through 2020\. Our Corporate Services team based in our Toronto Head Office manages our finance, human resources, back office, administration and IT support services for our global employees, customers and stakeholders. This position is based 5 days a week in our Dublin office. **Role Overview** The Human Resources Associate will manage the HR Administrative functions for a growing professional services firm headquartered in downtown Toronto, providing accountability for flawless execution and superior internal client service. **Responsibilities** * Plan, Schedule and Manage the onboarding of new staff members. * Display role\-model business acumen and communicate Company tasks, assignments, policies and procedures with clarity. * Assist in scheduling recruitment interviews and testing. * Prepare recruitment reporting documents and status updates for managerial review. * Management of accurate and fulsome data and documentation in the firm’s HRIS. * Oversight of the company vacation, sick day, flex time and bereavement day tracking. * Prepare business visa and coordinate any work permitting documentation with relevant authorities. * Assist in workplace investigations to ensure compliance with policies, laws and regulations. * Oversee the company drug testing compliance program and ensure that staff are adequately credentialed for the work they perform. * Help to coordinate the bi\-annual performance evaluation process. * Coordination of ‘value excellence’ programs to reward employees for their contributions to the success of the firm. * Perform other duties and ad hoc projects as assigned. **Education, Experience, and Skills Required** * Bachelor’s degree in Human Resources Management * 2\-3\+ years of HR experience and working towards CIPD designation * Experience of Irish \&/or European HR is preferred * Exceptional written and verbal communication skills. * Proficient user of Microsoft Office Suite (Word, Excel, Power Point and Outlook). * Experience using a Bamboo HR HRIS suite is an asset. * Experienced and proficient in using a variety of telecommunication platforms (i.e., conference calls, video conferencing, web meetings, etc.) * Works with a sense of urgency. * Detail\-oriented and disciplined in self\-review. * Ability to manage competing demands and priorities. * Assertive and confident to work with strong personalities. * Embraces problem solving challenges and opportunities. * Proven experience in leading HR initiatives. * Experience working in diverse cultural and geographical settings. * Demonstrated ability to drive best practices and innovation in the HR domain. This role will see you work as part of a Global team for a fast growing consulting practice that offers depth of work and scope as we meet the demands of our expanding customer base and team. Our HR function enables our business and staff so we can deliver impact and results. *Trindent Consulting is committed to providing an accessible, respectful and inclusive environment for all employees and job applicants. We will provide reasonable accommodation if required. If you require any specific accommodation due to a disability or a medical need during the application process, please contact us.*",https://ie.indeed.com/viewjob?jk=9564a18cfeeda2e5
IT Systems Administrator,Click Recruitment,"Dublin, County Dublin, Ireland",linkedin,"We are recruiting for a IT Administrator for a leading IT service provider based in Dublin. This is a Hybrid role with 3 days a week on site. Specialising but not limited to Microsoft technologies, the purpose of this role it the design, build, support and maintenance of complex, high quality infrastructure solutions. This role acts as the primary interface between the Cyber Security Project Team and the IT Operations function, with a strong focus on delivering security\-driven infrastructure projects and architectural change. The position is responsible for the design, planning, analysis, and implementation of strategic security initiatives that enhance the organisation’s security posture while ensuring alignment with existing infrastructure standards and operational requirements. Working closely with internal and external stakeholders, the role shapes and delivers infrastructure and security architectures that meet business objectives, regulatory expectations, and service\-level, security, and availability requirements. * Become technical lead for Cyber Security project delivering Infrastructure related Security Initiatives on our critical 24x7 Operational Environment. * Develop and implement industry standard best practice infrastructure designs to ensure scalability, resilience, and security of infrastructure services to the daa business. * Vulnerability \& Security patch management * Produce high\-quality documentation to support Internal and external audits * Complete daily, weekly and/or quarterly System Administration tasks as and when necessary to ensure that the environment remains in a healthy state. * Using industry and company best practice and information, provide improvement and efficiency suggestions to existing team procedures and processes on an ongoing basis * Using industry \& corporate best practices \& standards, design and build complex Microsoft related infrastructure environments with an emphasis on security hardening * Implement high\-availability and disaster\-recovery strategies for critical applications. * Collaborate with application teams to ensure performance, resilience, and secure traffic flows. * Resolve technical issues upon escalation from first and second level support. * Mentor first and second line staff to assist their development and help them contribute to team deliverables. * Provide Infrastructure and security performance monitoring – to ensure critical components are monitored to meet our SLA’s. * Continuous development of plans for failover and testing of critical operational components and services to ensure resilience is in place. **Experience** * More than 5 years’ Senior experience in Microsoft technologies working in a large enterprise environment * *MCSA, MCP and/or CCNA certified* * Excellent Windows Server 2019/2022/2025 implementation \& administration skills * Expert knowledge of Active Directory and Group Policy * Excellent knowledge of network protocols and concepts * Excellent knowledge of backup solutions and principles, NetBackup experience a bonus * Excellent Windows client OS skills – Windows 11\. * Virtual platform (VMware) and storage technology experience (not essential but desirable) * Linux (RedHat/OEL) experience is desirable (not essential but desirable) * Proven analytical and problem resolution skills and methodologies * Ability to work on own initiative and work well within a team * Good team player with good communication skills at all levels of seniority * Good organizational, administrative \& documentation skills * Proven experience is working under strict process control methodologies, e.g. ITIL * Proficiency with automation tools (Python, Ansible, REST APIs). (not essential but desirable)",https://www.linkedin.com/jobs/view/4408189817
