title,company,location,site,description,job_url
Graduate - AI,Uniphar,"DUBLIN 24, D, IE",indeed,"**Graduate AI** **About the Role** A Graduate AI Agent Developer supports the design and development of intelligent, automated agents that streamline processes and enhance decision making across the organisation. The role focuses on turning real business problems into scalable AI\-driven solutions that deliver measurable efficiency and improved user experiences. Working closely with technical and operational teams, the developer ensures that agents are reliable, compliant, and aligned to organisational goals. This role adds value by accelerating digital transformation and enabling teams to work smarter through safe and effective solutions. **What You Will Learn \& Deliver** * Learns how to gather practical business requirements and understand the day to day responsibilities of different roles throughout the business. * Learns how to design, build, and refine AI agents that address real operational challenges across the organisation. * Develops practical skills in prompt engineering, data handling, and responsible AI practices while working with experienced teams. * Delivers reliable and well tested AI agents that enhance workflow efficiency and support informed decision making. * Contributes to measurable business value by automating manual processes and improving overall service quality. **Required Skills \& Knowledge** * A foundational understanding/interest in artificial intelligence concepts, including large language models, prompt engineering, data handling, and responsible AI principles, with the ability to apply them in practical scenarios. * Knowledge Basic programming or scripting capability, along with the ability to work with APIs, structured data, and workflow automation tools. * Analytical and problem solving skills, with the ability to break down business processes and identify where AI agents can add value. * Good communication and documentation skills, ensuring clear handover of logic, requirements, and agent behaviour to technical and non technical stakeholders. * A willingness to learn modern AI platforms such as Copilot Studio, Azure AI, or equivalent low code and pro code tools, and to stay updated on safe, compliant AI development practices. \[Manager Guidance: Only include essentials. Over\-specification risks excluding candidates.] **Education \& Qualifications** A relevant degree OR equivalent practical experience (placements, internships, project work). For regulated roles, specify accredited programmes as required. Any 3rd level qualification would be suitable if the candidate displayed the desired skills above, however typically you would often see digital development graduates coming from degrees like; Business, Business Information Systems, Computer Science, Data Analytics or Psychology. **Uniphar – Who we are** With a workforce of more than 3000 employees spread across Ireland, United Kingdom, Mainland Europe, MENA, and the USA, Uniphar is a trusted global partner to pharma and MedTech manufacturers, working to improve patient access to medicines around the world. Uniphar provides outsourced and specialized services to its clients, leveraging the strong relationships with 200\+ of the world’s best known pharmaco\-medical manufacturers across multiple geographies, enabled by our cutting\-edge digital technology and our highly expert teams. Uniphar is organised into three key divisions: Supply Chain Retail \& On Demand, Uniphar Med Tech and Uniphar Pharma. **Supply Chain \& Retail** Supply Chain Services provides both pre\-wholesale and wholesale distribution of pharmaceutical, healthcare and animal health products to pharmacies and hospital nationwide. The business supports a diverse customer base through the provision of strong service levels coupled with innovative commercial initiatives. In addition, the business provides services and supports that help independent community pharmacy to compete more effectively in an increasingly difficult environment and runs a network of Uniphar\-owned pharmacies under the Life, Allcare, McCauleys and Hickeys symbol brands. **Pharma – On Demand** The On\-Demand business is a specialist medical supply business that sources and distributes pharmaceuticals, medical equipment, and consumable supplies to healthcare professionals in over 160 countries worldwide. We have offices in Ireland, UK, Europe, USA and New Zealand. The company’s main divisions encompass everything from International Sales through Sales to NGO’s and Charities, Clinical Trials Supply, Imported (Unlicensed Medicines), Sexual Health Supplies, and the storage and distribution of medical products and devices for third parties**.** Click here to find out more: About Us \- Who we are \| Uniphar **Culture at Uniphar** Uniphar is a combination of many businesses each with its own identity, culture, values, and ways of working. Our overarching culture narrative is inclusive of each of these stores. Uniphar lives and breathes four key pillars which unpin and support our culture. We have a people first approach \- we do the right thing. We support entrepreneurial spirit where adaptability, commitment \& resilience is embodied in our way of working. We have a Common Purpose that connects our diversified businesses and people. Finally, Trust is at the heart of how we operate. Everything Uniphar does is enabled by our people and as we continue to grow domestically and internationally, we become more diverse. This diversity fuels our business and culture. **Sustainability** Sustainability is at the core of what we do and is deeply embedded in our business strategy. We want to contribute positively to the people and the world around us. Running our business in a sustainable way ensures that Uniphar will continue to prosper in the long\-term. We are focused on ensuring that each of the five pillars of our sustainability strategy are a fundamental part of our decision\-making process.",https://ie.indeed.com/viewjob?jk=0c042e2a609bf10c
Graduate - HR & Analytics,RECRUITERS,"Dublin, County Dublin, Ireland",linkedin,"We are partnering with a leading financial services organisation to hire an HR Graduate to join their Dublin team. This is an excellent opportunity for a recent graduate or early\-career professional with strong technical and analytical skills, who is interested in building a career in HR, analytics, and systems. **Salary:** €40,000 **Location:** Dublin 4 **About the Role** This role sits within a small, collaborative HR team and offers broad exposure to the full employee life cycle. You’ll support day\-to\-day HR operations while also working with data, systems, and reporting to help improve how HR delivers value to the business. It’s an ideal role for someone who enjoys working with **Excel, data, and technology** , and wants to apply those skills in a people\-focused environment. **What You’ll Do** * Support HR administration across the employee life cycle * Maintain accurate data in HR systems and ensure data quality * Assist with recruitment coordination and onboarding * Support payroll and benefits administration * Prepare reports, dashboards, and presentations (including board materials) * Analyse HR data to identify trends and support decision\-making * Contribute to improving and automating HR processes **What We’re Looking For** * A recent graduate (or 0–2 years’ experience) in HR, Business, Analytics, or a related field * Strong technical skills – particularly **Excel (pivot tables)** ; exposure to Power BI or similar tools is a plus * Interest in HR, people analytics, or HR systems * Strong attention to detail and organisational skills * Confident communication skills, including presentations * Proactive, curious, and eager to learn *By applying to this job, your CV will be assessed by a consultant from Recruiters.ie for the position described and your CV may be added to our secure applicant tracking system however your details will never be shared to any other third party without your consent.*",https://www.linkedin.com/jobs/view/4396472313
Graduate Associate,daa,"Dublin, D, IE",indeed,"Job Description This is a unique opportunity to be a part of something extraordinary. You will work on a variety of interesting, challenging projects and work streams that will see you interact with different areas of our business building your personal brand and engaging with a wide range of stakeholder’s, preparing you for a leadership role. If you are up for the challenge, please submit your application asap. An Extraordinary Opportunity Awaits …. Responsibilities Do You Have What It Takes? * Recently graduated (or expect to graduate) with a minimum 2\.1 bachelor’s or master’s degree in any discipline * Mobile and willing to travel * Strong work ethic with the ambition to succeed * Energetic, passionate and flexible with a resilient and positive, can\-do attitude * A proven track record of achievement * Team player * Committed to daa values * Qualifications What We Can Offer You: * Exciting and Diverse International Career Opportunities * Competitive starting salary with a Performance Related Bonus * 2 year Programme offering Personal Development, Mentoring and Coaching * Cycle To Work and Tax Saver Schemes * Excellent Pension Scheme \- Life Assurance and Income Protection Plan * Discounted Shopping across our retail outlets * On\-Site Sports Facilities \& Health and Wellness initiatives",https://ie.indeed.com/viewjob?jk=2a354c9d7ee7ae8d
"Graduate Digital Trust & Community Analyst – Serbian, Estonian & Norwegian Speakers",Abrivia Recruitment Specialists,"Dublin, County Dublin, Ireland",linkedin,"Graduate Digital Trust \& Community Analyst – Serbian, Estonian \& Norwegian Speakers **Location:** Dublin, Ireland **Contract:** Full\-time, 40 hours/week, 12\-month contract (with potential extension) **Work Hours:** Rotational shifts in a 24/7 operation About the Role Are you a recent graduate or early\-career professional fluent in **Serbian, Estonian, or Norwegian** ? Join a **leading global tech company** as a **Graduate Digital Trust \& Community Analyst** and help create safer, more welcoming online communities. In this role, you’ll gain hands\-on experience reviewing user\-generated content, investigating reports, and contributing to policies that protect millions of users worldwide. You’ll be part of a supportive, international team based in Dublin, with opportunities for mentorship, training, and career growth. Key Responsibilities * Review and assess user\-generated content (text, images, video) to ensure compliance with platform standards * Investigate reports and take action in line with company policies * Respond to user inquiries clearly and professionally * Support research and analysis to improve content moderation strategies * Contribute to team goals for quality, accuracy, and productivity Skills \& Qualifications * Fluency in **Serbian, Estonian, or Norwegian** AND English * Strong attention to detail and good judgment * Curious, proactive, and eager to learn * Comfortable working with digital platforms and online tools * Recent graduates or those with some experience in content moderation, digital operations, or related fields What You’ll Gain * Hands\-on training and ongoing mentorship in online safety and digital operations * Experience in a globally recognized tech company * Exposure to international best practices in content moderation and community management * Clear career progression opportunities * Collaborative, inclusive, and multicultural work environment If you’re motivated, detail\-oriented, and ready to **launch your career in digital safety** , apply now via **Emily Mason** .",https://www.linkedin.com/jobs/view/4394670474
Graduate Electrical Services Engineers 2026,Jones Engineering,"Dublin, County Dublin, Ireland",linkedin,"**Graduate Electrical Services Engineer 2026** **Position** : Electrical Services Graduate Engineers \- 2026 **Location** : Dublin, Kildare, Cork, Limerick, Gavle, Copenhagen, Malmo, Groningen \& Charleroi **Start date:** We operate on a rolling recruitment basis. Please advise your availability to start in your application form. You can discuss this further with your recruiter upon application. **Company Description** We are a leading engineering services company with a proven track record of high quality, customer focused project delivery for over 130 years. Our core divisions include Mechanical Engineering, Electrical Engineering, Sprinkler and Fire Protection. Some of the other services we provide include Waste to Energy (BioEnergy), Specialist Lift, Off Site Fabrication, Technical Support Services, Maintenance, Asset Management, BIM (Building Information Modelling) and Geo\-Surveying. We offer competitive salaries, financial support for further training, Continuous Professional Development (CPD) leading to chartered status, performance incentives and the ability to progress your career with a world class engineering contractor. **Job Description** * Review and understand project documents (specifications, drawings etc). * Supporting with design reviews and analysing supplier information for alignment with project documents. * Develop and manage technical submittals, RFIs, procurement registers, trackers and associated administrative duties. * Working with the BIM team to capture all electrical aspects of the project requirements. * Coordination with other trades and disciplines. * Supporting various project meetings as appropriate. * Supporting weekly project reporting. * Supporting QA/QC on site including system walkdowns and project handover protocols. This role will provide exposure to a wide range of expertise relating to data centre, contracting and other sectors. The successful candidate will be supported in developing their knowledge and skills as their responsibilities grow and evolve. They will also be encouraged and supported to work towards achieving Chartership with Engineers Ireland throughout their career with Jones Engineering. **Requirements** To excel in this role, you should possess the following skills and qualifications: * Degree Qualification in an Electrical Engineering discipline. * Valid Safepass / Manual handling certificates required for successful applicants. * Trade background would be advantageous but not necessary. * Experience/knowledge of data centres or construction sector would be advantageous. * Strong team player with excellent interpersonal skills, able to collaborate effectively with colleagues, clients, and external partners. * Excellent organisational and planning skills. * Proficiency in MS Office systems and other engineering software. * Demonstrated appetite for continuous learning and personal development. **Graduate Development Programme** As part of our commitment to your growth and career development, you will be enrolled in our comprehensive 2\-year Graduate Development Programme. This programme includes experiential learning, mentoring, professional development courses, and in\-house training on key skills such as technical writing, presentation, and time management. You will benefit from peer to peer learning and receive support for obtaining professional certifications. This structured approach ensures you gain the necessary skills and experience to progress in your career. **Benefits** Be part of our Graduate Programme and contribute to meaningful projects that drive innovation and sustainability across multiple industries. We offer a competitive salary package commensurate with experience and qualifications. In addition, you will have the opportunity to work in a dynamic and supportive environment, collaborating with industry leaders and contributing to a sustainable future. Our company values work\-life balance and encourages professional growth through training and development programs. If you are ready to make a difference and be part of a growing industry, please submit your CV, along with a cover letter highlighting your relevant experience and why you are interested in this role. Recognising the contributions and respecting our people is core to our culture and values. We are an equal opportunities employer, and we encourage candidates from all backgrounds to apply for roles. Please note, we are currently not accepting applications from agencies for this role.",https://www.linkedin.com/jobs/view/4303228660
Graduate Engineer - Transport 2026,Tetra Tech Europe,"Dún Laoghaire, Dún Laoghaire-Rathdown, Ireland",linkedin,"Tetra Tech is looking for Graduates to join our **Graduate Transport Engineer Programme 2026** . By joining us, you will be part of a leading global multi\-disciplinary consultancy. We specialise in all areas of the built and natural environment, shaping the future of our environmental, social and economic landscapes. Our projects are all around you. We define, design and manage projects that create shared value to a complex, urbanising and resource\-scarce world. Our people are our success. We need people who share our passion on solving the problems that matter. And where you’ll be supported every step of the way. Here is where you come to build a career. **What You Will Be Doing** You will be working with a strong team of highly knowledgeable consultants giving you the opportunity to develop your skill set and progress your career. You’ll be trained in providing support and assistance across a range of projects and technical areas. You will provide consultancy advice to our clients, contributing towards the success of the team through the effective delivery of project and ensuring development of key client relationships. **Who We Are Looking For** To be considered for our graduate programme you will need to be on course for achieving a relevant degree on one of the following subjects: BEng; MEng in Civil in Engineering. We encourage and value different ideas, perspectives, and styles of thinking. We need a mix of experiences and skills to develop the most innovative ideas to positively shape the impacts of our clients’ projects. We are looking out for people who take opportunities, those who are keen to learn and develop, intelligent risk takers who are not scared to try new things, and who adapt and move quickly. **What’s in it for you?** At Tetra Tech we work as one team to achieve exceptional outcomes and, joining the Graduate Scheme is no different. From early on in your career you will have exposure to sustainable projects. Building the foundations of a consultancy career by growing skills, knowledge, and behaviours; and building experience and achievements into real expertise. We are an accredited training provider – from entry level to master’s degree level professional qualifications in leadership \& management and executive coaching \& mentoring, we support learning and development for everyone. A personal development plan and a transparent career pathway puts you in the driving seat of your career and you’ll be supported as far as you want to go. **Applications** As part of the selection process, it is mandatory to upload a CV and Covering Letter as we will not process your application without one. In your covering letter we want to know why you are interested in RPS and the discipline you are applying against. We would also like to know a little about you as an individual. **What happens next?** If this opportunity suits your career journey, we’d love to hear from you. Our closing date for graduate applications is **Thursday 30th April 2026** . There could be a possibility that we close earlier if we have volume applications. We would recommend for you to get an application in as soon as possible to avoid disappointment. If you are successful, you will be invited to an interview. This will be an opportunity to meet the team who you could be working with. You will be able to showcase your relevant skills and suitability for the role and, ask any questions on how the team works and what to expect in the role day to day. **Recruitment Agencies** We have a Preferred Supplier List of trusted partners to assist us when required and do not acknowledge any speculative CVs or unsolicited candidate introductions from agencies not on this list. Please refer to the careers page on our website if you require any further information.",https://www.linkedin.com/jobs/view/4392864316
Graduate Engineer 2026 - Building Infrastructures - Civil/Structures,Tetra Tech Europe,"Dún Laoghaire, Dún Laoghaire-Rathdown, Ireland",linkedin,"**Tetra Tech** is looking for Graduates to join our **Civil \& Structural Engineer Graduate Programme 2026** . By joining us, you will be part of a leading global multi\-disciplinary consultancy. We specialise in all areas of the built and natural environment, shaping the future of our environmental, social and economic landscapes. Our projects are all around you. We define, design and manage projects that create shared value to a complex, urbanising and resource\-scarce world. Our people are our success. We need people who share our passion on solving the problems that matter. And where you’ll be supported every step of the way. Here is where you come to build a career. **What You Will Be Doing** You will be working with a strong team of highly knowledgeable consultants giving you the opportunity to develop your skill set and progress your career. You’ll be trained in providing support and assistance across a range of projects and technical areas. You will provide consultancy advice to our clients, contributing towards the success of the team through the effective delivery of project and ensuring development of key client relationships. **Who We Are Looking For** To be considered for our graduate programme you will need to be on course for achieving a relevant degree on one of the following subjects: **BEng; MEng in Civil/Structural in Engineering.** We encourage and value different ideas, perspectives, and styles of thinking. We need a mix of experiences and skills to develop the most innovative ideas to positively shape the impacts of our clients’ projects. We are looking out for people who take opportunities, those who are keen to learn and develop, intelligent risk takers who are not scared to try new things, and who adapt and move quickly. **What’s in it for you?** At **Tetra Tech** we work as one team to achieve exceptional outcomes and, joining the Graduate Scheme is no different. From early on in your career you will have exposure to sustainable projects. Building the foundations of a consultancy career by growing skills, knowledge, and behaviours; and building experience and achievements into real expertise. We are an accredited training provider – from entry level to master’s degree level professional qualifications in leadership \& management and executive coaching \& mentoring, we support learning and development for everyone. A personal development plan and a transparent career pathway puts you in the driving seat of your career and you’ll be supported as far as you want to go. **Applications** As part of the selection process, it is mandatory to upload a CV and Covering Letter as we will not process your application without one. In your covering letter we want to know why you are interested in RPS and the discipline you are applying against. We would also like to know a little about you as an individual. **What happens next?** If this opportunity suits your career journey, we’d love to hear from you. We would recommend for you to get an application in as soon as possible to avoid disappointment. If you are successful, you will be invited to an interview. This will be an opportunity to meet the team who you could be working with. You will be able to showcase your relevant skills and suitability for the role and, ask any questions on how the team works and what to expect in the role day to day. **Recruitment Agencies** We have a Preferred Supplier List of trusted partners to assist us when required and do not acknowledge any speculative CVs or unsolicited candidate introductions from agencies not on this list. Please refer to the careers page on our website if you require any further information.",https://www.linkedin.com/jobs/view/4392865353
