title,company,location,site,description,job_url
Software Engineer II - Amplify C.S,Klaviyo,"Dublin, County Dublin, Ireland",linkedin,"*At Klaviyo, we value the unique backgrounds, experiences and perspectives each Klaviyo (we call ourselves Klaviyos) brings to our workplace each and every day. We believe everyone deserves a fair shot at success and appreciate the experiences each person brings beyond the traditional job requirements. If you’re a close but not exact match with the description, we hope you’ll still consider applying. Want to learn more about life at Klaviyo? Visit klaviyo.com/careers to see how we empower creators to own their own destiny.* **Team Overview** The Amplify Engineering team builds internal tools, platforms, and AI\-powered automation that help Klaviyos work more efficiently and at scale as the company grows. We partner across the organisation, including Sales, Marketing, Engineering \& Product, Customer Service \& Success, and Finance, to solve real operational problems with practical, well\-designed software. Our work spans internal applications, 3rd\-party integrations, interactive dashboards, CMS integrations, and robust AI systems and agents that automate repetitive tasks, surface the right information at the right time, and help teams make better decisions. We operate in tight feedback loops with our internal customers, shipping quickly, learning fast, and seeing the impact of our work immediately in how deals move faster, tickets resolve sooner, and launches go more smoothly. This role is for software engineers who enjoy turning real\-world problems into reliable, scalable solutions. The work is highly visible and has a direct impact on how thousands of Klaviyos get their work done every day. **How You’ll Make An Impact** The Amplify team builds the internal platforms, automation, and AI\-driven systems that power how Klaviyos work every day. As a Software Engineer II on Amplify, you will: * Design, build, and maintain internal products and platforms, including internal web applications, APIs, data and event pipelines, and AI\-powered workflows used daily by Sales, Marketing, Customer Service \& Success, R\&D, and Finance teams. You will own features and small\-to\-medium projects end to end, from design through deployment and iteration. * Deliver project work with increasing autonomy and scope. You will break down problems into actionable pieces, refine requirements with your team, and collaborate to ship high\-quality solutions that meet reliability and performance expectations. * Work closely with internal customers to understand their workflows and constraints, and translate operational challenges into pragmatic, maintainable software and AI\-enabled tools that improve productivity and reliability. * Contribute to the technical and architectural evolution of Amplify’s systems by participating in design discussions, proposing improvements, and helping ensure our platforms remain scalable, observable, and reliable as usage grows. * Take responsibility for the quality and operational health of the code you ship, including testing, deployment, monitoring, debugging issues in development and production, and participating in on\-call rotations for the systems your team owns. * Use modern AI tools as part of your day\-to\-day engineering workflow, including for coding, testing, documentation, and experimentation, and share learnings to help the team continuously improve how it works with AI. * Help improve the developer experience and engineering practices on Amplify by contributing to tooling, CI/CD, automation, tests, and shared utilities that support consistent, high\-quality delivery. * Collaborate closely with Product, Design, Data, and operational partners, contributing to discovery, evaluating trade\-offs, and ensuring the work you deliver is tied to clear success criteria and business outcomes. **Who You Are** * You care about building software for the long term, balancing technical quality, delivery pace, and business impact. * You have strong hands\-on experience building and operating full\-stack or backend\-focused software systems, including SaaS products, platforms, or internal tools. * You can take a well\-defined feature or small\-to\-medium project from design through implementation, testing, rollout, and ongoing maintenance, seeking input when needed and moving work forward independently. * You are comfortable questioning and refining requirements, working with product managers and stakeholders to clarify scope, identify edge cases, and propose pragmatic solutions. * You have experience in at least one area of modern web engineering such as backend services, data pipelines, internal tools, integrations, or AI\-enabled workflows, and understand how to build secure, scalable, and maintainable systems. * You are comfortable using AI\-powered tools to support your development workflow and are interested in continuing to grow your AI skills over time. * You care about operational excellence and are comfortable debugging issues, improving tests, adding logging and metrics, and working within reliability goals. * You are a clear communicator and collaborative teammate, contributing thoughtfully to technical discussions, writing clear tickets or lightweight design docs, and keeping others informed on progress and risks. * You enjoy working in small, autonomous, agile teams, shipping iteratively, and partnering closely with product managers and other engineers to deliver meaningful outcomes. * You are motivated to continuously improve how things work, whether that is tooling, workflows, architecture, or team practices. **Nice To Have** * Experience building internal tools, platforms, or automations for developers and/or non\-technical stakeholders, with a track record of improving reliability, productivity, or operational efficiency. * Hands\-on experience in full\-stack environments, including diagnosing and improving application performance, database queries, and complex, multi\-service workflows. * Practical experience building or integrating AI\-powered systems and agents; e.g., workflows using LLM APIs/SDKs, agentic or automated workflows, RAG pipelines, or evaluation/monitoring frameworks. * Familiarity with cloud infrastructure (AWS preferred), infrastructure\-as\-code (Terraform), and containerized environments (Kubernetes), including how to design services that run reliably at scale in those environments. **Technologies We Use** Klaviyo’s platform is primarily built with Python and React and runs on AWS. Engineers join us from a wide range of technical backgrounds and are supported in learning our stack. Core technologies include: * Python / Django / FastAPI * Typescript / React * MySQL / Redis / Memcached * RabbitMQ / Celery / Apache Kafka / Apache Pulsar * AWS / Terraform / Kubernetes **Location \& Work Model:** This role is based in Dublin, Ireland and follows a hybrid working model. Klaviyo supports work authorization and relocation for this position. At Klaviyo, we enjoy tackling meaningful engineering challenges and value people who take ownership, learn continuously, and collaborate openly. We are committed to building inclusive teams and encourage applications from candidates of all backgrounds. Klaviyo is growing fast and we have openings for all skill levels across all of our teams. Learn more about our engineering culture at https://klaviyo.tech We use Covey as part of our hiring and / or promotional process. For jobs or candidates in NYC, certain features may qualify it as an AEDT. As part of the evaluation process we provide Covey with job requirements and candidate submitted applications. We began using Covey Scout for Inbound on April 3, 2025\. Please see the independent bias audit report covering our use of Covey here Our salary range reflects the cost of labour in the country where the job post is advertised. The base salary offered for this position is determined by several factors, including the applicant’s job\-related skills, relevant experience, education or training, and work location. In addition to base salary, our total compensation package may include participation in the company’s annual cash bonus plan, variable compensation (OTE) for sales and customer success roles, equity, sign\-on payments, and a comprehensive range of health, welfare, and wellbeing benefits based on eligibility. Your recruiter can provide more details about the specific salary/OTE range for your preferred location during the hiring process. **Base Pay Range In Local Currency** €76\.000—€114\.000 EUR *This role may require up to 10% travel for purposes such as new hire onboarding, client or partner work if applicable, team meetings, and industry events. Travel is coordinated in advance.* **Get to Know Klaviyo** We’re Klaviyo (pronounced clay\-vee\-oh). We empower creators to own their destiny by making first\-party data accessible and actionable like never before. We see limitless potential for the technology we’re developing to nurture personalized experiences in ecommerce and beyond. To reach our goals, we need our own crew of remarkable creators—ambitious and collaborative teammates who stay focused on our north star: delighting our customers. If you’re ready to do the best work of your career, where you’ll be welcomed as your whole self from day one and supported with generous benefits, we hope you’ll join us. *AI fluency at Klaviyo includes responsible use of AI (including privacy, security, bias awareness, and human\-in\-the\-loop). We provide accommodations as needed.* *By participating in Klaviyo’s interview process, you acknowledge that you have read, understood, and will adhere to our Guidelines for using AI in the Klaviyo interview Process. For more information about how we process your personal data, see our Job Applicant Privacy Notice.* *Klaviyo is committed to a policy of equal opportunity and non\-discrimination. We do not discriminate on the basis of race, ethnicity, citizenship, national origin, color, religion or religious creed, age, sex (including pregnancy), gender identity, sexual orientation, physical or mental disability, veteran or active military status, marital status, criminal record, genetics, retaliation, sexual harassment or any other characteristic protected by applicable law.* *IMPORTANT NOTICE: Our company takes the security and privacy of job applicants very seriously. We will never ask for payment, bank details, or personal financial information as part of the application process. All our legitimate job postings can be found on our official career site. Please be cautious of job offers that come from non\-company email addresses (@klaviyo.com), instant messaging platforms, or unsolicited calls.* **By clicking ""Submit Application"" you consent to Klaviyo processing your Personal Data in accordance with our Job Applicant Privacy Notice. If you do not wish for Klaviyo to process your Personal Data, please do not submit an application.** *You can find our Job Applicant Privacy Notice* *here* *and here (FR).*",https://www.linkedin.com/jobs/view/4363407389
"Specialist, Client Operations II",BNY,"Dublin, County Dublin, Ireland",linkedin,"**Job Description** At BNY, our culture allows us to run our company better and enables employees’ growth and success. As a leading global financial services company at the heart of the global financial system, we influence nearly 20% of the world’s investible assets. Every day, our teams harness cutting\-edge AI and breakthrough technologies to collaborate with clients, driving transformative solutions that redefine industries and uplift communities worldwide. Recognized as a top destination for innovators, BNY is where bold ideas meet advanced technology and exceptional talent. Together, we power the future of finance – and this is what is all about. Join us and be part of something extraordinary. We’re seeking a future team member for the role of Associate, Client Operations II to join our Client Service team. This role is located in Dublin. * Day to day oversight of the assigned Collateralised Loan Obligations (“CLOs”) and /or loan portfolios to ensure high Client Experience Levels * Transaction Management: \- Cash \& Trade (Loans, Bonds etc) Management Oversight – ability to engage with Clients to ensure timely execution, Report Review and preparation on CLO and or loan Portfolio’s Performance, Monitoring of Service Level * Collaboration: Continuous dialogue and open communication with Lead Client Service Manager (CSM) and Group Manager on status of work being completed by supporting teams * Participate in Client Meetings and follow up items are closed out * Develop working relationships with Front Office Relationship Managers * Identify and resolve issues while serving as a high\-level escalation point for complex situations and ensure that they are brought to a successful resolution * Employee Development: Key role in training of support team on Client and deal specific requirements * Partner with Lead CSM to identify and streamline business operations. Support the efforts to enhance controls by standardising relevant business processes and consistently managing/monitoring those activities to ensure quality and accuracy. Support key business programs, including business and process improvements which drive greater operational efficiencies and superior client service * Support Lead CSM as an escalation point and communicate effectively with other internal shared services, external investment managers, brokers, and clients. This role sets the directions and tones for the client service administration elements of our business and therefore drives overall client relationships and risk management * Partner Management: proactively monitor and manage the activities performed within our business partners and hold regular meetings and escalate any concerns To be successful in this role, we’re seeking the following: * Corporate Trust or related financial markets/securities industry experience. * Strong Client Management Experience * Ability to review deal governing documents * Experience in Loans (syndicated, bi\-lateral, real estate) and CLOs very desirable * Solid understanding of the product(s) administered by the group and thorough understanding of risk management and control practices. * Proactively monitor and manage the activities performed within our business partners outside of Ireland * Ability to quickly address issues – strong decision making * Financial Services Technical Skills * Effective interpersonal, oral and written communication skills * Excellent analytical, organisational and time management skills with the ability to meet tight deadlines * Proficiency in using Microsoft packages particularly Excel At BNY, our culture speaks for itself, check out the latest BNY news at: BNY Newsroom BNY LinkedIn **Here’s a Few Of Our Recent Awards** * America’s Most Innovative Companies, Fortune, 2025 * World’s Most Admired Companies, Fortune 2025 * “Most Just Companies”, Just Capital and CNBC, 2025 **Our Benefits And Rewards** BNY offers highly competitive compensation, benefits, and wellbeing programs rooted in a strong culture of excellence and our pay\-for\-performance philosophy. We provide access to flexible global resources and tools for your life’s journey. Focus on your health, foster your personal resilience, and reach your financial goals as a valued member of our team, along with generous paid leaves, including paid volunteer time, that can support you and your family through moments that matter. BNY is an Equal Employment Opportunity/Affirmative Action Employer \- Underrepresented racial and ethnic groups/Females/Individuals with Disabilities/Protected Veterans.",https://www.linkedin.com/jobs/view/4391722309
"Sr. Software Engineer, Cloud (Hybrid, IRE)",CrowdStrike,"Dublin, County Dublin, Ireland",linkedin,"As a global leader in cybersecurity, CrowdStrike protects the people, processes and technologies that drive modern organizations. Since 2011, our mission hasn’t changed — we’re here to stop breaches, and we’ve redefined modern security with the world’s most advanced AI\-native platform. We work on large scale distributed systems, processing almost 3 trillion events per day and this traffic is growing daily. Our customers span all industries, and they count on CrowdStrike to keep their businesses running, their communities safe and their lives moving forward. We’re also a mission\-driven company. We cultivate a culture that gives every CrowdStriker both the flexibility and autonomy to own their careers. We’re always looking to add talented CrowdStrikers to the team who have limitless passion, a relentless focus on innovation and a fanatical commitment to our customers, our community and each other. Ready to join a mission that matters? The future of cybersecurity starts with you. ******About The Role :****** We’re building the next\-generation cloud\-native security platform for CrowdStrike which includes an application and service delivery platform, massively scalable distributed data storage and replication systems, and a cutting\-edge search and distributed graph system. You will play a critical role in innovating and building the CrowdStrike Asset Graph system. Bring your experience in distributed technologies and algorithms, your great API and systems design sensibilities, and your passion for writing code that performs at extreme scale. If you want a job that makes a difference in the world and operates at a high scale, you’ve come to the right place. This is a hybrid position based in Dublin. ******What You'll Do:****** * Lead backend engineering efforts from rapid prototypes to large\-scale applications across CrowdStrike products. * Design, develop, document, test, deploy, maintain, and enhance large scale services. * Take ownership and be accountable for deliverables. * Triage system issues and debug by analyzing the sources of issues and the impact on service operations. * Mentor other engineers on web, backend and data storage technologies and our system. * Constantly re\-evaluate our product to improve architecture, knowledge models, user experience, performance and stability. * Partner with product teams in building their use\-cases and solutions on the Asset Graph platform ******What You'll Use:****** * Go(Golang) * Java8 * Python * GIT * Cassandra * Kafka * ElasticSearch * Kubernetes * Postgres * Redis * AWS Cloud ******What You’ll Need:****** * 7\+ years of production\-level experience in building, delivering, and maintaining distributed services architecture at scale * Degree in Computer Science (or commensurate experience in data structures/algorithms/distributed systems). * The ability to scale backend systems – sharding, partitioning, scaling horizontally are second nature to you. * The desire to ship code and the love of seeing your bits run in production. * Solid understanding of distributed systems and scalability challenges. * Team player skills – we embrace collaborating as a team as much as possible. * A thorough understanding of engineering best practices from appropriate testing paradigms to effective peer code reviews and resilient architecture. * The ability to thrive in a fast paced, test\-driven, collaborative and iterative programming environment. * The skills to meet your commitments on time and produce high quality software that is unit tested, code reviewed, and checked in regularly for continuous integration. ****Bonus Points**** * Experience building Graph Storage or other database systems * Existing exposure to Go,AWS, Kubernetes, Cassandra, Kafka, Elasticsearch. * Experience working on security products. ****Benefits Of Working At CrowdStrike:**** * Market leader in compensation and equity awards * Comprehensive physical and mental wellness programs * Competitive vacation and holidays for recharge * Paid parental and adoption leaves * Professional development opportunities for all employees regardless of level or role * Employee Networks, geographic neighborhood groups, and volunteer opportunities to build connections * Vibrant office culture with world class amenities * Great Place to Work Certified™ across the globe CrowdStrike is proud to be an equal opportunity employer. We are committed to fostering a culture of belonging where everyone is valued for who they are and empowered to succeed. We support veterans and individuals with disabilities through our affirmative action program. CrowdStrike is committed to providing equal employment opportunity for all employees and applicants for employment. The Company does not discriminate in employment opportunities or practices on the basis of race, color, creed, ethnicity, religion, sex (including pregnancy or pregnancy\-related medical conditions), sexual orientation, gender identity, marital or family status, veteran status, age, national origin, ancestry, physical disability (including HIV and AIDS), mental disability, medical condition, genetic information, membership or activity in a local human rights commission, status with regard to public assistance, or any other characteristic protected by law. We base all employment decisions\-\-including recruitment, selection, training, compensation, benefits, discipline, promotions, transfers, lay\-offs, return from lay\-off, terminations and social/recreational programs\-\-on valid job requirements. If you need assistance accessing or reviewing the information on this website or need help submitting an application for employment or requesting an accommodation, please contact us at recruiting@crowdstrike.com for further assistance. , ******What You’ll Need:****** * 7\+ years of production\-level experience in building, delivering, and maintaining distributed services architecture at scale * Degree in Computer Science (or commensurate experience in data structures/algorithms/distributed systems). * The ability to scale backend systems – sharding, partitioning, scaling horizontally are second nature to you. * The desire to ship code and the love of seeing your bits run in production. * Solid understanding of distributed systems and scalability challenges. * Team player skills – we embrace collaborating as a team as much as possible. * A thorough understanding of engineering best practices from appropriate testing paradigms to effective peer code reviews and resilient architecture. * The ability to thrive in a fast paced, test\-driven, collaborative and iterative programming environment. * The skills to meet your commitments on time and produce high quality software that is unit tested, code reviewed, and checked in regularly for continuous integration. ****Bonus Points**** * Experience building Graph Storage or other database systems * Existing exposure to Go,AWS, Kubernetes, Cassandra, Kafka, Elasticsearch. * Experience working on security products.",https://www.linkedin.com/jobs/view/4380808973
