title,company,location,site,description,job_url
L&D System Coordinator - fixed term contract,PwC Ireland,"Dublin, County Dublin, Ireland",linkedin,"**Line of Service** Internal Firm Services **Industry/Sector** Not Applicable **Specialism** IFS \- Internal Firm Services \- Other **Management Level** Associate **Job Description \& Summary** A career in People \& Culture (our combined HR and L\&D teams), will provide you with the opportunity to contribute to the success of our people and continuously improve the PwC experience, by supporting and delivering on our Operational Strategy and the firm’s Digital Strategy, with a particular focus on technology, analytics and reporting, and process improvement through automation. As a part of our People Technology and Insights (PT\&I) Team, you will help deliver PwC initiatives and execute business goals set by leadership. This is a central role in our ongoing transformation objectives. It is essential to the operation of our learning infrastructure and risk compliance. The L\&D System Coordinator serves as the functional owner of the firm’s Learning Management Systems (Cornerstone and Growth Centre), providing direct support to systems administrators and learners across the Irish firm. The role also manages the creation and deployment of eLearning modules, many of which are mandatory under our quality and risk frameworks. You will be supporting the wider PwC People \& Culture team and the business in the use of our people systems, continuously improving our learners’ experience and outcomes. This is a 12 month fixed term contract. As an Associate you’ll work as part of a team of problem solvers, helping to solve complex business issues from strategy to execution. In this role your responsibilities include but are not limited to: **Responsible for:** **Systems:** * Serve as the primary expert and power user of the firm's LMS (Cornerstone Learn ) ; * S upport the firm’s L\&D administrators in LMS operations including training when required ; * Diagnose and resolve technical issues by working closely with LMS administrators, end\-users, and the PwC Global Service Desk. * Perform system administration tasks such as managing user records and data quality * Support of other people related systems where relevant. **Learning Module Development:** * Advise and collaborate with business teams to understand and define their online training module requirements. * Develop and oversee the creation of online learning modules using Articulate Rise. **Data:** * Support technology risk evaluations for relevant tools as required . * System d ata extraction \& transformation as required . * Participate in broader HR and L\&D system projects to contribute toward long\-term strategic objectives in people technology. **Experience and Skills** * Strong hands\-on experience with Cornerstone Learn and L\&D administration is essential. * Minimum 2\-3 years experience in a similar role. * Proficient in system management, troubleshooting, and data handling. * Proficient in Excel (Power BI is a plus) * Competent in delivering training to LMS administrators on system functionalities. * F amiliarity with developing online learning content. * Knowledge of GDPR and handling sensitive data responsibly. * Detail\-oriented with strong decision\-making and problem\-solving skills. * Organised, adaptable, and able to manage shifting priorities. * Strong communicator, both verbally and in writing. * Self\-driven, collaborative, and open to mentoring and growth. * Project management certification is a plus. **Unlock your potential with PwC Ireland** We believe that challenges are better solved together! We’re inspiring and empowering our people to change the world. Powered by the latest technology, you’ll be a part of amazing teams encouraged to collaborate and innovate in a way that creates powerful solutions and makes a positive impact. This purpose\-led work, and our continuous development and encouragement, will help unlock your potential and take your career to the next level. **Enjoy PwC’s perks** We reward your impact, and support your wellbeing, through a competitive compensation package, inclusive employee benefits and flexibility programs that will help you thrive in work and life. Learn more about us at Life@PwC. (https://www.pwc.ie/careers\-ie/life\-at\-pwc.html). **Being appreciated for being you** Our most valuable asset is our people and we grow stronger as we learn from one another. We are an equal opportunity employer and we value diversity. We do not discriminate on the basis of race, religion, color, national origin, sex, gender, gender expression, sexual orientation, age, marital status, veteran status, or disability status. We believe this so much that we have signed up for the Business in the Community Elevate Pledge . ( https://www.bitc.ie/the\-leaders\-group\-on\-sustainability/inclusive\-workplace\-pledge/ ) You can learn more about our culture of belonging and explore our range of inclusive programmes, initiatives, employee resource groups and more at www.pwc.ie . Avoid the confidence gap; you do not have to match all the listed requirements exactly to apply, we’d love to hear from you! We will ensure that individuals with disabilities are provided reasonable accommodation to participate in the job application or interview process, to perform essential job functions, and to receive other benefits and privileges of employment. Please email us for more information. **Required Skills** **Optional Skills** Accepting Feedback, Accepting Feedback, Active Listening, Adult Learning Theories, Career Training, Communication, Content Curation, Content Strategy, Contract Management, Curriculum Development, Data Reporting, Design Thinking, Developing Presentations, Developing Training Materials, E\-Learning Development, Emotional Regulation, Empathy, Event Set Up, Executive Education, Facilitated Discussions, Facilitate Training Sessions, Financial Management, Group Facilitation, Inclusion, Instructional Design (ID) {\+ 26 more} **Desired Languages** *(If blank, desired languages not specified)* **Travel Requirements** Not Specified **Available for Work Visa Sponsorship?** No **Government Clearance Required?** No **Job Posting End Date**",https://www.linkedin.com/jobs/view/4310177146
Lawyer (12 Month Fixed Term Contract),Zurich Insurance,"Dublin, County Dublin, Ireland",linkedin,"**Job Summary** Zurich Insurance Company is looking for a Lawyer for a 12 month fixed term contract. This role will provide professional and independent legal advice to Zurich’s business in Ireland. This role is mainly to support Zurich's Irish Business which is located in Blackrock, Dublin but working from other locations may also be required. This role may be available part\-time or full time. This is because we want the best people for our roles, and we recognise that sometimes those people aren’t available full\-time. Please talk to us at interview about the flexibility you may need. **Your Role** As a Lawyer your main responsibilities will include, but not necessarily be limited to, the following: * Provide general commercial, financial services and/or regulatory advice * Provide legal advice on insurance and investment matters; * Draft, negotiate, review, and advise on a variety of commercial contracts, products and supporting documentation * Ensure that advice accurately reflects applicable laws, regulations and practice. * Mitigate legal risk and assist with commercial risk mitigation and regulatory compliance. **Relationships:** Internal: * Extended Legal Team in Ireland * Relevant business contacts and senior management * “Service provider” relationship with business contacts that call on advice. External: * External lawyers * Zurich Group * Brokers and Customers as deemed necessary by the business **Your Skills And Experience** As a Lawyer your skills and qualifications will include: * Relevant degree \- Legal/Business * Qualified Lawyer – Ideal candidate will have 4\-6 years post qualification experience in commercial or financial services. * Experience of insurance /investment/pensions financial services practice from an Irish legal and regulatory perspective an advantage. **Technical Competencies** * Practical understanding of financial services is an advantage * Strong drafting skills * Ability to research legislation **Non Technical Competencies** * Communication, influencing and negotiation skills with ability to adapt style to suit audience. * Ability to work within a team environment * Ability to take initiative in fast moving environment * Customer centric * Strong problem solving ability **Additional Information** Primary work location is Blackrock. Position is Dublin\-based but occasional travel may be required to other Zurich locations. This is a hybrid position which requires 2\-3 days in the office per week (Blackrock). If you value an exciting and varied working environment and meet the above requirements, then our recruiter is looking forward to receiving your application by clicking on the button “Apply online”. **Who We Are** Zurich is one of Ireland's leading insurance companies providing a wide range of general insurance and life insurance products and services. The company employs over 1,000 people across its locations in Dublin and Wexford. Zurich is a strong brand – with our 53,000 employees worldwide form the basis of our success, helping our customers in 210 countries and territories to understand and protect themselves from risk. In order to deliver our services, we offer our employees flexible working models and interesting opportunities for further training \& development. As a Zurich employee you benefit from a multitude of advantages as well as a strong culture, characterized by acceptance, diversity and team spirit. At Zurich, we foster a culture of diversity and inclusion. Our purpose and values are designed to protect, inspire confidence and help our employees reach their full potential. We value and defend what is right and promote opportunities for equity among our professionals, regardless of gender, disability, LGBTQ \+, race, ethnicity, generations, belief, etc. Join Zurich and be part of this culture. Together we are committed to delivering on our purpose \- Let’s Create a Brighter Future Together!",https://www.linkedin.com/jobs/view/4359223814
Microsoft Business Central Functional Consultant,BearingPoint,"Dublin, County Dublin, Ireland",linkedin,"We are seeking a Microsoft Business Central Functional Consultant to join our dynamic team in Ireland. As a Microsoft Business Central Functional Consultant, you will play a crucial role in analysing business requirements, scoping and effort estimation, configuring aspects of the Microsoft Dynamics Business Central platform, and supporting its successful implementation and optimisation for our clients as part of the delivery team. **About the role:** As a Microsoft Business Central Functional Consultant, you will work closely with our clients to define and implement business solutions using the Microsoft Dynamics Business Central platform. You will provide expert advice, support all project phases, and leverage your knowledge of the broader Microsoft cloud platform. **Key responsibilities will include:** * Advising client organisations on the Microsoft Dynamics Business Central capabilities and functions. * Conducting requirements gathering and analysis with clients using standard methodologies. * Designing optimised business processes for our clients. * Understanding and recommending configurations and customisations in Microsoft Dynamics Business Central, aiming to minimise customisations. * Supporting clients throughout all phases of the project, from requirements analysis to roll out. * Applying strong knowledge of SDLC methodologies, such as Agile and SCRUM as well as experience of writing user stories and developing a backlog in Azure DevOps. * Maintaining up\-to\-date certifications in Microsoft Dynamics Business Central. **About you:** We are looking for a detail\-oriented problem\-solver with a passion for technology and business optimisation. You should have excellent communication skills, an inquisitive nature, and strong technical and analytical abilities. You will be part of a collaborative team that values new ideas and works together to solve complex business problems. * Minimum of 5 years of experience in a functional role. * Preferably, 3\+ full life cycle implementations of Microsoft Dynamics Business Central and or Navision. * Strong experience in developing user stories and functional designs. * Ability to articulate the functional and technical infrastructure of Microsoft Dynamics Business Central. * Working knowledge of other Microsoft products such as Dynamics 365 CRM, Power Platform, SharePoint, Office, Azure, and application architecture. * Experience in data integration and data migration as part of the Microsoft Dynamics Business Central deployments. * Ability to communicate complex technical concepts in non\-technical language. * Strong consulting skills, including influencing abilities, leadership, and facilitation skills. * Masters or Certification in relevant fields. If you have a background in industry, consulting, or business transformation and are looking to make a significant impact, we would love to hear from you. Join us in helping our clients enhance their business operations through innovative solutions and cutting\-edge technology. **Why you will enjoy working at BearingPoint Ireland?** We work in an open and collaborative way, where new ideas are always welcome. BearingPoint is an environment where potential and high performance is recognised and rewarded. **What we offer:** You will receive a competitive salary where you are rewarded for both your individual performance and company performance. You will also receive a best\-in\-class benefits package including holidays, private health insurance, pension contributions, gym/club subscription, wellness programmes, mobile phone and much more. In addition, we offer: **Hybrid working –** where each team has autonomy to determine their in\-person and remote working schedule. **Continuous learning –** we understand that it is imperative to invest in our people’s development and we provide external training at prestigious universities such as Oxford and Yale **Social events –** our people perform best when they have a good work life balance, monthly events for all to attend **Diversity** – we are committed to having a diverse workforce where each individual feels they belong and can thrive in a work environment with a strong sense of community **Mentoring \& coaching –** every employee has a development manager to help them grow their career with feedback via continuous conversations **Giving Back –** you will have an opportunity to join our many giving back initiatives including our commitment to sustainability. Our Emissions Calculator gathers accurate emissions data and enables our clients to understand their footprint and track progress on emission reduction and pave the way for a better future. **Together, we are more than business.** To see more from our people with their experiences of BearingPoint please visit our careers website www.bearingpoint.com **About BearingPoint** BearingPoint is an independent management and technology consultancy with European roots and a global reach. The company operates in four units: Consulting, Solutions, Business Services, and Ventures. Consulting covers the advisory business; Solutions provides the tools for successful digital transformation, advanced analytics and regulatory requirements; Business Services provides managed services beyond SaaS; Ventures drives the financing and development of start\-ups. BearingPoint’s clients include many of the world’s leading companies and organizations. The firm has a global consulting network with more than 10,000 people and supports clients in over 75 countries, engaging with them to achieve measurable and sustainable success. BearingPoint is an equal opportunities employer. Please click here to view our privacy policy. **NO AGENCIES** BearingPoint does not accept unsolicited cvs from 3rd party recruitment agencies without a written agreement in place for placements. BearingPoint is not responsible for any fees related to unsolicited cvs and no fee will be paid should the candidate be hired by BearingPoint.",https://www.linkedin.com/jobs/view/4369797658
"Operations Associate, GTM Accelerate",Stripe,"Dublin, County Dublin, Ireland",linkedin,"**About Stripe** Stripe is a financial infrastructure platform for businesses. Millions of companies—from the world’s largest enterprises to the most ambitious startups—use Stripe to accept payments, grow their revenue, and accelerate new business opportunities. Our mission is to increase the GDP of the internet, and we have a staggering amount of work ahead. **About The Team** The Professional Services team exists to drive the adoption of Stripe’s capabilities across our user base, from Fortune 100s to high\-growth startups. Within this group, the Accelerate team is responsible for the critical ""zero\-to\-one"" phase of the user journey. We partner with developers and technical leaders to ensure they deploy quickly, integrate with high quality, and derive strategic value from Stripe immediately. Accelerate is Stripe’s dedicated onboarding program designed to get users live fast and operationally ready. It is a prescriptive engagement where we guide users through technical integration, fraud prevention setup, and financial reporting. Whether through our foundational (free) tier or our premium high\-touch service, the goal is identical: eliminate friction, reduce implementation risk, and accelerate time\-to\-revenue. **What You’ll Do** Stripe is launching Stripe Delivery Centers \- a brand new global team to design, implement and grow Stripe’s operations for the next decade. We are looking for dynamic and curious people that have a passion for solving global user issues, building operations, driving process improvements and want to play a front\-line role in building this new operational capability for Stripe and accelerating Stripe’s growth. If you like challenging, scaled problems and are an amazing teammate, we want to hear from you! As an Onboarding Specialist, you are the technical guide for users during their first 90 days with Stripe. You will be proactively unblocking deployments and ensuring users are operationally ready to scale. You will manage a portfolio of users, guiding them through best practices for integration, dashboard configuration, and risk management. You will deliver technical workshops and serve as the primary touchpoint to help users navigate the complexity of payments infrastructure. **Responsibilities** * Drive Time\-to\-Value: Manage a portfolio of user implementations, acting as a lightweight project manager to ensure they hit their planned go\-live dates. * Deliver Technical Workshops: Lead pre\-built, interactive workshops covering critical topics such as API integration, Dashboard utilization, Fraud/Radar configuration, and Financial Reporting. * Proactive Unblocking: Anticipate technical challenges before they become blockers. Provide prescriptive guidance on API architecture and best practices to ensure a high\-quality integration. * Operational Readiness: Go beyond code—help users set up their teams for success by advising on dispute management workflows and reconciliation processes. * User Experience: Provide exceptional customer service to ensure a positive onboarding experience, acting as a reliable partner so users feel supported and confident throughout the process. * Continuous Learning: Continuously update your knowledge of Stripe's products, features, and updates to ensure you are providing the most current and strategic advice to your users. * Process Improvement: Contribute to the improvement of onboarding processes and documentation by collaborating with cross\-functional teams to refine our playbooks based on user feedback. **Who You Are** We are looking for dynamic, curious problem\-solvers who love demystifying complex technical concepts. You thrive in a fast\-paced environment and are passionate about helping users build their businesses on Stripe. **Minimum Requirements** * Advanced English proficiency (fluent written and spoken). You can explain complex API architecture to non\-technical stakeholders and discuss business value with developers. * 2\+ years of experience in implementation consulting, technical support, or solutions engineering, preferably in API technologies or SaaS environments. * Technical Aptitude: Strong ability to read and debug code, understand RESTful APIs, and navigate complex technical environments. * Problem Solving: You don't just find the answer; you find the best solution for the user's specific business model. **Preferred Qualifications** * Proficiency in one or more of: French, German, Spanish or Italian. * Experience with financial systems (ERP, Accounting), online payments, or e\-commerce platforms. * Experience delivering live technical training or webinars to external users. * Familiarity with code\-level debugging in languages such as Python, Ruby, or Node.js. This role is based in Dublin, Ireland and requires in\-office attendance. In\-office expectations Office\-assigned Stripes in most of our locations are currently expected to spend at least 50% of the time in a given month in their local office or with users. This expectation may vary depending on role, team and location. For example, Stripes in Stripe Delivery Center roles in Mexico City, Mexico, Bengaluru, India, and Dublin, Ireland work 100% from the office. Also, some teams have greater in\-office attendance requirements, to appropriately support our users and workflows, which the hiring manager will discuss. This approach helps strike a balance between bringing people together for in\-person collaboration and learning from each other, while supporting flexibility when possible. Pay and benefits The annual salary range for this role in the primary location is €36,000 \- €66,000\. This range may change if you are hired in another location. For sales roles, the range provided is the role’s On Target Earnings (“OTE”) range, meaning that the range includes both the sales commissions/sales bonuses target and annual base salary for the role. This salary range may be inclusive of several career levels at Stripe and will be narrowed during the interview process based on a number of factors, including the candidate’s experience, qualifications, and specific location. Applicants interested in this role and who are not located in the primary location may request the annual salary range for their location during the interview process. Specific benefits and details about what compensation is included in the salary range listed above will vary depending on the applicant’s location and can be discussed in more detail during the interview process. Benefits/additional compensation for this role may include: equity, company bonus or sales commissions/bonuses; retirement plans; health benefits; and wellness stipends.",https://www.linkedin.com/jobs/view/4361249577
