title,company,location,site,description,job_url
"Graduate GIS Analyst (Temporary 2 Years) - Corporate Services and Transformation Department, Dublin City Council",Dublin City Council,"Dublin, D, IE",indeed,"**The Role** This role will support the delivery of Dublin City Council’s new Geospatial Strategy. The vision of this strategy is to transform Dublin into a dynamic and sustainable city that is future ready by making high\-quality geographic information central to every decision, service and interaction in the city. Graduates will work with authoritative spatial data, develop reusable geospatial solutions and contribute to improving how the Council collects, manages, analyses and uses data at scale. The role will also support the use of Esri enterprise GIS platforms (ArcGIS Enterprise, ArcGIS Online and ArcGIS Pro) across Dublin City Council. This role is designed to provide graduates with a strong technical foundation, exposure to large\-scale public sector projects, and practical experience applying geospatial technology to real urban challenges. It will also directly support Dublin City Council’s Digital Transformation Strategy, helping to strengthen data capability, improve data quality and governance, and enable more evidence\-based, joined\-up and digitally enabled public services. This programme is designed for graduates who want to work at the intersection of data, technology and citymaking, and who are motivated by contributing to a smarter, more sustainable and digitally enabled Dublin. The role is part of a structured Graduate Programme and will include training and professional development opportunities. **Salary: 39,846 \- 50,447** ============================ We are recruiting for the position of **Graduate GIS Analyst (Temporary 2 Years) \-** **Dublin City Council.** For details of this role please see Candidate Information Booklet on the attachment below. Dublin City Council is committed to a policy of equal opportunity. We recognise the value and importance of attracting and welcoming a diverse workforce that is reflective of the communities we serve. To apply for this role please click on the link **'Apply for Job'** The Closing Date will be at Midnight on Wednesday, 22nd April 2026\. **Candidates are required to complete the application form and assessment questions in full, we do not accept CVs.**",https://ie.indeed.com/viewjob?jk=aea34aea6fd36b42
Graduate Instrument & Electrical Engineer- Immediate Start,NeoDyne,"Dublin, County Dublin, Ireland",linkedin,"*Want to influence the power grid of the future? Tackle climate change? Play your part in the greening of the gas network?* *Launch your career with NeoDyne and open a world of opportunities!* **Overview** NeoDyne is a specialist engineering company with deep expertise in Energy Transmission \& Distribution (T\&D), particularly in supporting molecular energy carriers as a vital component of the green energy transformation. We provide high\-integrity electrical and instrumentation solutions across the gas and electricity sectors, with a strong track record in delivering critical infrastructure projects across Ireland, the UK, and beyond. Our work plays a central role in strengthening energy networks\-enhancing their reliability, availability, and resilience while enabling decarbonisation through a balanced mix of conventional and renewable energy sources. Within our **Transmission \& Distribution** team, we deliver mission\-critical design packages that transform the reliability, availability, and efficiency of the energy network, moving it towards a greener, more sustainable future. Department highlights include: * Delivery of high\-complexity design frameworks: NeoDyne is a gas network design framework supplier, playing a significant role in providing electrical and instrumentation engineering services for the on\-shore Natural Gas Industry and Regulated gas utility sector in Ireland and the UK. Our expertise include Compressor Station, AGI Electrical \& Instrumentation design, Fiscal and non\-Fiscal metering, and Cathodic Protection. * Driving complex design delivery: We design AIS/GIS substations from 20kV to 220kV and contestable build and non\-contestable stations in the range of 40 to 550MVA CCGT. Connections include conventional and renewable Power Generation, Peaking, Battery Storage, DS3 and Solar PV plants and large demand loads such as data centres and process plants. With a team of 220\+ skilled engineers, our expertise spans the entire project lifecycle, from design and implementation to commissioning and operations. From our offices in Ireland, the UK, Romania, and the US, we operate on a global scale, combining technical expertise with local delivery. We support customers across Europe, North America, and Asia, delivering tailored engineering services that drive long\-term success. **Position Summary** NeoDyne are recruiting a **Graduate Instrument \& Electrical Engineer** to join our expanding Gas Transmission \& Distribution team. Our graduate programme is all about learning new and developing your existing skills. Over a two\-year period, you will be placed in projects where you get to do meaningful work and contribute to the business. This Graduate opportunity is offered as a full\-time permanent contract, based at our **Dublin Office** , with an excellent salary and benefits package. If successful, you will enjoy NeoDyne's ""People First"" company culture, built on mutual respect, trust, and honesty, where each individual actively contributes as a valued team member. **What will I be doing?** * Projects could include preparation of coordinated drawings covering all aspects of installations, including mechanical, electrical, instrumentation and structural elements. More specifically, you will be producing Gas Transmission AGI Design including, Electrical Layouts, LV Distribution Design, Control \& Instrumentation Design, Earth Grid Design and General Services Design. * Carrying out Power Systems Electrical Studies: Load Estimates, Protection Coordination, Cable Sizing Calcs. You will have the opportunity to use state\-of\-the\-art engineering software for control and protection design and substation layouts. You will also get to use leading\-edge power system modelling software to run steady state and transient electrical studies, including short circuit studies, protection coordination and grid compliance studies for proposed renewable generation * Generating technical documentation and dealing with customers will also be key parts of our graduate programme to help develop your soft skills. You will be producing specifications for various electrical equipment and assemblies: transformers, RTUs, Gas Analysis equipment, instrumentation etc. * You will also have the opportunity to travel to customer sites to get involved in installation, testing, and commissioning, by participating in design \& commissioning of SCADA and control systems in the field: I/O and instrumentation testing, full testing and commissioning. **What about training?** *Our induction programme revolves around a 70\-20\-10 model for learning and development.* * 70% On\-the\-job Learning: You'll get stuck in from Day 1, working on real projects, delivering real business value to our customers both on\- and off\-site. * 20% Learning from others: You'll be part of a team, working with subject matter experts and interacting with our customers daily. You'll receive support and guidance, and an invaluable opportunity to learn from former graduates who've seen it and done it. * 10% Formal Education:We'll help you become an expert in your chosen field, backed up by formal e\-learning and classroom training. This extends to attaining professional certifications where relevant to our business specialisations. **Required** **Experience \& skills** * Level 8 Degree in Instrumentation/Electrical/ Energy Engineering, or equivalent. * Experience in developing Electrical Schematics using AutoCAD, EPLAN or similar. * Experience in developing equipment layouts using AutoCAD, or similar. * Full Drivers Licence and own transport for site survey works. Desired * 0\-3 years' experience in a similar instrument/electrical design role or Work Placement. * Experience in LV Systems Study software such as Amtech, or similar. **Characteristics** *We look for candidates who* * Work well as part of a team. * Have excellent problem solving and diagnostic skills. * Can complete tasks independently, capable of self\-learning. * Can prioritise and coordinate work. * Have excellent customer service, interpersonal, communication and organisational skills. * Can multitask and work well under pressure. * Are a strategic business thinker. **What's on offer?** * Competitive starting salary with year\-on\-year bonuses and salary increases * Paid Overtime * Paid Graduation Day * Health Insurance * Income Protection * Life Assurance * PRSA pension with employer contribution * Flexible Working * Personalised Career Development Plan * Professional Certifications, pathways to become a Chartered Engineer * Cycle to work scheme **Apply today!** With our diverse range of business specialisations, customers, and industries that we serve, we offer an unrivalled programme designed to accelerate your personal and professional development. Don't miss this opportunity to join a company at the forefront of industrial automation projects in Ireland, the UK, mainland Europe and the US. So why wait? Apply Today! NeoDyne Ltd. is an equal opportunity employer, and all applications will be treated in strictest confidence.",https://www.linkedin.com/jobs/view/4374795954
Graduate Program,English 1,"Dublin 6, County Dublin, Ireland",linkedin,"**Launch Your Global Career After Graduation** **Teach English in China \| Full\-Time \| Entry\-Level Friendly** Just graduated (or graduating soon) and not ready for a desk job? Want to travel, gain international work experience, and build transferable skills while earning a competitive salary? **English 1** is hiring **recent graduates and early\-career professionals** to teach English in China. No prior teaching experience required. Full training, visa sponsorship, and structured career development are included. This is an ideal **first job** , **graduate program alternative** , or **gap\-year career launch** for ambitious, globally minded graduates. **What you'll do** * Teach English to young learners aged 3–16 in a fun, interactive, and immersive classroom setting. * Deliver high\-energy lessons using English 1’s award\-winning curriculum and digital tools. * Provide constructive feedback and help students build confidence in their English skills. * Take part in school events, cultural activities, and student engagement programs. **What you’ll get** * Competitive salary \+ performance bonus after 6 months * 21 days paid leave (10 days paid leave \+ 11 days statutory holidays) * Flight allowance * International health insurance (co\-paid) * Airport pick\-up support * \*\*Sponsored legal Z work visa \+ up to 2 weeks sponsored hotel stay * Comprehensive induction training, ongoing support, and fully prepared teaching materials * TEFL certificate \+ skill development \& career advancement * Distance learning courses (Level 6 Trinity College CertPT, DELTM) * English 1\-organized social and cultural activities \+ free Mandarin Chinese lessons *The hotel accommodation for the first two weeks will be deemed as a sponsorship upon successful completion of the first\-year contract. \*\*Sponsored legal Z work visa expenses will be reimbursed.* **Who we’re looking for** * A bachelor’s degree (in any subject) * A valid passport * A genuine interest in education, travel, and cultural exchange. * ESL certification (TEFL, TESOL, CELTA) is a plus\- we can sponsor * Clean background check. **Why work at English 1?** * Teachers are at the core of everything we do at English 1 * Over **30 years** of success in China with **200\+ schools** in **50\+ cities** . * Strong presence in **China** and **Indonesia** . * **Professional development** and career **advancement opportunities** . Whether you’re a recent graduate, or exploring your first international role, this is your chance to **earn, travel, and grow professionally and personally** . **Apply now and start your international career with English 1\.** \#EntryLevel \#Graduates \#EnglishTeacher \#ESL \#TEFL \#TeachingJobs \#GraduateJobs \#hiring \#jobs \#entrylevel \#teachercns \#graduates \#esl \#tefl \#teach \#JobAlert \#NowHiring \#JobOpening \#CareerOpportunities \#JobSearch \#WorkWithUs \#LinkedInJobs \#JobSeeker \#OpenToWork \#CareerGoals \#JobHunt \#NewJob \#CollegeGraduates \#BachelorsDegree \#RecentGrad \#ClassOf2026 \#JobSearch \#CareerSuccess \#EntryLevelJobs \#HiringNow \#YoungProfessionals \#CareerGrowth \#Networking \#LinkedInNetworking \#FutureLeaders \#UniversityAlumni \#HigherEd \#AlumniNetwork \#CollegeSuccess",https://www.linkedin.com/jobs/view/4394607682
Graduate Sales Executive (Hungarian Market),Revolut,,linkedin,"**About Revolut** People deserve more from their money. More visibility, more control, and more freedom. Since 2015, Revolut has been on a mission to deliver just that. Our powerhouse of products — including spending, saving, investing, exchanging, travelling, and more — help our 70\+ million customers get more from their money every day. As we continue our lightning\-fast growth,‌ 2 things are essential to our success: our people and our culture. In recognition of our outstanding employee experience, we've been certified as a Great Place to Work™. So far, we have 13,000\+ people working around the world, from our offices and remotely, to help us achieve our mission. And we're looking for more brilliant people. People who love building great products, redefining success, and turning the complexity of a chaotic world into the simplicity of a beautiful solution. **About The Role** Our Sales team powers customer growth around the world. From prospecting to acquisition and activation, they own their market segments, solve complex problems, and help more customers discover the value of Revolut with a sharp, solution\-oriented approach. We're looking for a Sales Executive to join our Graduate Sales Programme, which offers an unparalleled opportunity for ambitious graduates, regardless of prior experience, to join a high\-performing, international team. You'll be at the forefront of delivering cutting\-edge financial solutions to customers while building key relationships. You’ll kick things off with a focused bootcamp, complete with workshops, lectures, and hands\-on training to sharpen your commercial and communication skills. Once you're up to speed, you'll dive straight into the on\-the\-job experience by working with real clients. Watch this video from our team members about what goes into being an Account Executive at Revolut. Up to shape what's next in finance? Let's get in touch. **What You'll Be Doing** * Outreaching prospects across multiple touch points and channels, with an emphasis on cold\-calling * Developing and executing a robust lead\-sourcing strategy by identifying key verticals, diversifying your prospects base, and maintaining consistent activity levels * Building and managing your own pipeline, from prospecting to closing and account management, maximising adoption and upsell/cross\-sell opportunities * Liaising customer relationships with internal stakeholders to ensure a smooth experience, from getting started to daily usage * Being autonomous to effectively balance your time (prospect vs. close vs. upsell), activate internal resources, and engage your team * Using solution\-based selling to understand customer needs and communicate the value proposition * Becoming a product expert on Revolut Business, its market positioning, and the solutions it offers, backed by relevant, compelling case studies **What You'll Need** * Fluency in English and Hungarian * To have graduated from university in 2024 or 2025 * Excellent communication skills and articulation over the phone * Impeccable literacy skills (email, LinkedIn outreach) * A drive to launch a career in a high\-performing sales culture * An interest in the financial industry **Nice to have** * Previous internship or experience in a high\-performance, fast\-paced environment, with exposure to strategic thinking, analytical tasks, or client\-facing work Building a global financial super app isn’t enough. Our Revoluters are a priority, and that’s why in 2021 we launched our inaugural D\&I Framework, designed to help us thrive and grow everyday. We're not just doing this because it's the right thing to do. We’re doing it because we know that seeking out diverse talent and creating an inclusive workplace is the way to create exceptional, innovative products and services for our customers. That’s why we encourage applications from people with diverse backgrounds and experiences to join this multicultural, hard\-working team. **Important notice for candidates:** Job scams are on the rise. Please keep these guidelines in mind when applying for any open roles. * Only apply through official Revolut channels. We don’t use any third\-party services or platforms for our recruitment. * Always double\-check the emails you receive. Make sure all communications are being done through official Revolut emails, with an @revolut.com domain. **We won't ask for payment or personal financial information during the hiring process.** If anyone does ask you for this, it’s a scam. Report it immediately. By submitting this application, I confirm that all the information given by me in this application for employment and any additional documents attached hereto are true to the best of my knowledge and that I have not wilfully suppressed any material fact. I confirm I have disclosed if applicable any previous employment with Revolut. I accept that if any of the information given by me in this application is in any way false or incorrect, my application may be rejected, any offer of employment may be withdrawn or my employment with Revolut may be terminated summarily or I may be dismissed. By submitting this application, I agree that my personal data will be processed in accordance with Revolut's Candidate Privacy Notice",https://www.linkedin.com/jobs/view/4393022656
Graduate Sales Executive (Hungarian Market),Revolut,"Dublin, D, IE",indeed,"**About Revolut** People deserve more from their money. More visibility, more control, and more freedom. Since 2015, Revolut has been on a mission to deliver just that. Our powerhouse of products — including spending, saving, investing, exchanging, travelling, and more — help our 70\+ million customers get more from their money every day. As we continue our lightning\-fast growth,‌ 2 things are essential to our success: our people and our culture. In recognition of our outstanding employee experience, we've been certified as a Great Place to Work™. So far, we have 13,000\+ people working around the world, from our offices and remotely, to help us achieve our mission. And we're looking for more brilliant people. People who love building great products, redefining success, and turning the complexity of a chaotic world into the simplicity of a beautiful solution. **About the role** Our Sales team powers customer growth around the world. From prospecting to acquisition and activation, they own their market segments, solve complex problems, and help more customers discover the value of Revolut with a sharp, solution\-oriented approach. We're looking for a Sales Executive to join our Graduate Sales Programme, which offers an unparalleled opportunity for ambitious graduates, regardless of prior experience, to join a high\-performing, international team. You'll be at the forefront of delivering cutting\-edge financial solutions to customers while building key relationships. You’ll kick things off with a focused bootcamp, complete with workshops, lectures, and hands\-on training to sharpen your commercial and communication skills. Once you're up to speed, you'll dive straight into the on\-the\-job experience by working with real clients. Watch this video from our team members about what goes into being an Account Executive at Revolut. Up to shape what's next in finance? Let's get in touch. **What you'll be doing*** Outreaching prospects across multiple touch points and channels, with an emphasis on cold\-calling * Developing and executing a robust lead\-sourcing strategy by identifying key verticals, diversifying your prospects base, and maintaining consistent activity levels * Building and managing your own pipeline, from prospecting to closing and account management, maximising adoption and upsell/cross\-sell opportunities * Liaising customer relationships with internal stakeholders to ensure a smooth experience, from getting started to daily usage * Being autonomous to effectively balance your time (prospect vs. close vs. upsell), activate internal resources, and engage your team * Using solution\-based selling to understand customer needs and communicate the value proposition * Becoming a product expert on Revolut Business, its market positioning, and the solutions it offers, backed by relevant, compelling case studies **What you'll need*** Fluency in English and Hungarian * To have graduated from university in 2024 or 2025 * Excellent communication skills and articulation over the phone * Impeccable literacy skills (email, LinkedIn outreach) * A drive to launch a career in a high\-performing sales culture * An interest in the financial industry **Nice to have*** Previous internship or experience in a high\-performance, fast\-paced environment, with exposure to strategic thinking, analytical tasks, or client\-facing work **Compensation range*** Krakow: PLN7,100 \- PLN8,300 gross monthly\* * Poland: PLN7,500 \- PLN7,500 gross monthly\* * Other locations: Compensation will be discussed during the interview process * Final compensation will be determined based on the candidate's qualifications, skills, and previous experience *Building a global financial super app isn’t enough. Our Revoluters are a priority, and that’s why in 2021 we launched our inaugural D\&I Framework, designed to help us thrive and grow everyday. We're not just doing this because it's the right thing to do. We’re doing it because we know that seeking out diverse talent and creating an inclusive workplace is the way to create exceptional, innovative products and services for our customers. That’s why we encourage applications from people with diverse backgrounds and experiences to join this multicultural, hard\-working team.* ***Important notice for candidates:*** *Job scams are on the rise. Please keep these guidelines in mind when applying for any open roles.* * ***Only apply through official Revolut channels.*** *We don’t use any third\-party services or platforms for our recruitment.* * ***Always double\-check the emails you receive.*** *Make sure all communications are being done through official Revolut emails, with an @revolut.com domain.* ***We won't ask for payment or personal financial information during the hiring process.*** *If anyone does ask you for this, it’s a scam. Report it immediately.* *By submitting this application, I confirm that all the information given by me in this application for employment and any additional documents attached hereto are true to the best of my knowledge and that I have not wilfully suppressed any material fact. I confirm I have disclosed if applicable any previous employment with Revolut. I accept that if any of the information given by me in this application is in any way false or incorrect, my application may be rejected, any offer of employment may be withdrawn or my employment with Revolut may be terminated summarily or I may be dismissed. By submitting this application, I agree that my personal data will be processed in accordance with Revolut's* *Candidate Privacy Notice*",https://ie.indeed.com/viewjob?jk=52e42517df859b73
