title,company,location,site,description,job_url
Data Scientist,F5,"Dublin, County Dublin, Ireland",linkedin,"At F5, we strive to bring a better digital world to life. Our teams empower organizations across the globe to create, secure, and run applications that enhance how we experience our evolving digital world. We are passionate about cybersecurity, from protecting consumers from fraud to enabling companies to focus on innovation. Everything we do centers around people. That means we obsess over how to make the lives of our customers, and their customers, better. And it means we prioritize a diverse F5 community where each individual can thrive. F5 is looking for an experienced Data Scientist, specialising in Artificial Intelligence and Large Language Models (LLMs), to build and deploy intelligent tools within our pioneering security platform. This role will focus on implementing cutting\-edge AI/LLM solutions as practical features for AI red\-teaming, defense, and securing agentic systems. You'll work hands\-on to operationalise AI models, contributing directly to our platform's core intelligence. Key Responsibilities: * Design, develop, fine\-tune, and evaluate LLMs, agents and other deep learning models for AI security tasks (e.g., automated red\-teaming operations, vulnerability detection, adversarial attack simulation and intelligent defense mechanisms). * Implement and deploy these AI/LLM\-powered tools as robust, scalable features within CalypsoAI's security platform. * Develop and implement novel methods and tools for detecting and mitigating vulnerabilities, feeding directly into the AI Security platform. * Build and maintain end\-to\-end pipelines optimised for AI/LLM workflows, including data processing, training/fine\-tuning, validation, deployment, and monitoring (MLOps for AI). * Collaborate closely with AI Researchers to productionize novel AI/LLM algorithms and security techniques. * Work with Software Engineers to integrate complex AI/LLM components seamlessly into our products * Optimise AI/LLM models for inference speed, cost, and resource utilisation. * Monitor model performance and behavior in production, particularly focusing on safety, alignment, and security vulnerabilities. * Apply software engineering best practices to AI/LLM development and deployment. Required Qualifications: * BS or MS in Computer Science, Artificial Intelligence, Machine Learning, or a related quantitative field. * 1\-3 years of relevant professional experience, including hands\-on experience developing, training, or fine tuning AI models, especially LLMs. * Experience with AI/LLM libraries (e.g. LangGraph, CrewAI, OpenAI SDK, Pytorch or TensorFlow, Hugging Face Transformers) * Understanding of LLM security vulnerabilities (e.g., prompt injection, data poisoning) and mitigation techniques. * Proven experience deploying AI/ML models into production environments. * Strong analytical and problem\-solving skills applied to complex AI systems. Preferred Qualifications: * Experience specifically fine tuning or training large scale language models. * Experience deploying LLMs or generative AI models using frameworks like vLLM, TGI, or cloud provider services. * Familiarity with techniques like Reinforcement Learning from Human Feedback (RLHF). The Job Description is intended to be a general representation of the responsibilities and requirements of the job. However, the description may not be all\-inclusive, and responsibilities and requirements are subject to change. **Please note that F5 only contacts candidates through F5 email address (ending with @f5\.com) or auto email notification from Workday (ending with f5\.com or** **@myworkday.com)** **.** **Equal Employment Opportunity** It is the policy of F5 to provide equal employment opportunities to all employees and employment applicants without regard to unlawful considerations of race, religion, color, national origin, sex, sexual orientation, gender identity or expression, age, sensory, physical, or mental disability, marital status, veteran or military status, genetic information, or any other classification protected by applicable local, state, or federal laws. This policy applies to all aspects of employment, including, but not limited to, hiring, job assignment, compensation, promotion, benefits, training, discipline, and termination. F5 offers a variety of reasonable accommodations for candidates. Requesting an accommodation is completely voluntary. F5 will assess the need for accommodations in the application process separately from those that may be needed to perform the job. Request by contacting accommodations@f5\.com.",https://www.linkedin.com/jobs/view/4364470725
Devops Engineer | Experienced Hire| DDT,Susquehanna International Group,"Dublin, County Dublin, Ireland",linkedin,"**Overview** Susquehanna is a global quantitative trading firm powered by scientific rigor, curiosity, and innovation. Our culture is intellectually driven and highly collaborative, bringing together researchers, engineers, and traders to design and deploy impactful strategies in our systematic trading environment. To meet the unique challenges of global markets, Susquehanna applies machine learning and advanced quantitative research to vast datasets in order to uncover actionable insights and build effective strategies. By uniting deep market expertise with cutting\-edge technology, we excel in solving complex problems and pushing boundaries together. As a DevOps Engineer you serve as a seasoned member of an agile team to design and deliver trusted market\-leading technology products in a secure, stable, and scalable way. You are responsible for carrying out critical technology solutions across multiple technical areas within various business functions in support of the firm’s business objectives. **Job Responsibilities** * Build and release both infrastructure and product solution across multiple geo regions scale through automation * Ensuring infrastructure and product solutions are deployed with scalability and reliability as key design requirements * Work with System Engineers, Developers, Architects to design and implement automated solutions with CD Pipelines for infrastructure and software build, deployment, and configuration * Implementing monitoring solutions using Grafana, GrayLog, Prometheus etc * Build and maintain tools, scripts, and processes that make our developers and testers more efficient * Maintaining and securing the infrastructure which supports production systems along with internal testing platforms. * Provide support and troubleshooting on production systems including diagnosing and resolving post deployment issues, patching servers, implementing automated server hardening policies, investing / resolving and downtime incidents. **What We're Looking For** * 4\+ years’ experience in a DevOps or technical role in an agile fast paced environment. * Experience delivering Infrastructure as Code using tools such as terraform, chef, puppet, ansible * Experience in deploying and managing container based services using Docker and Kubernetes * Proficient in a scripting language Python, Bash PowerShell, YAML etc, Microsoft Azure Cloud * Monitoring (Grafana, InfluxDB, Prometheus, New Relic, Pingdom), Databases (MSSQL Server) * CI (Jenkins), Automated QC (SonarQube), Logging (ElasticSearch, GrayLog) If you're a recruiting agency and want to partner with us, please reach out to recruiting@sig.com. Any resume or referral submitted in the absence of a signed agreement will not be eligible for an agency fee.",https://www.linkedin.com/jobs/view/4327257677
Fixed Income Sales Trader - Vice President,BNY,"Dublin, County Dublin, Ireland",linkedin,"**Job Description** At BNY, our culture allows us to run our company better and enables employees’ growth and success. As a leading global financial services company at the heart of the global financial system, we influence nearly 20% of the world’s investible assets. Every day, our teams harness cutting\-edge AI and breakthrough technologies to collaborate with clients, driving transformative solutions that redefine industries and uplift communities worldwide. Recognized as a top destination for innovators, BNY is where bold ideas meet advanced technology and exceptional talent. Together, we power the future of finance – and this is what is all about. Join us and be part of something extraordinary. The BNY Markets business helps our clients formulate, implement and operationalise their investment strategies. It provides clients with financing, execution, liquidity and collateral solutions that are integrated with BNY’s asset servicing ecosystem. Within the Markets division we have Global Markets Trading unit, which is comprised of the Foreign Exchange, Fixed Income, and Equities businesses. We are seeking a future team member for the role of VP, Fixed Income Sales Trading, to join our Global Markets Trading Fixed Income \& Equities Team. This role is located in Dublin, Ireland. In this role, you’ll make an impact and support the team in the following ways: * Fixed Income trade execution and client coverage * Support Equities execution and client coverage * Create, gather and distribute market commentary and strategic content * Internal brand development and proactive stakeholder relationship building * Monitor client requests and liaise with appropriate teams for resolution/responses * Work with Tech and Product teams globally to enhance FIEQ product offering * Support Best Execution/TCA development * Support strategic initiatives * Enhance market structure awareness To be successful in this role, we’re seeking the following: * Execution experience across Riskless Principal \& Agency FI products and markets * Bachelor’s degree or the equivalent combination of education and experience is required. * Advanced/graduate degree preferred. * Some cross asset exposure to FI, Equities \& FX. * Ability to multi\-task under pressure while maintaining a heavy focus on accuracy. * Highly numerate both in a theoretical and practical basis At BNY, our culture speaks for itself, check out the latest BNY news at: BNY Newsroom BNY LinkedIn **Here’s a Few Of Our Recent Awards** * America’s Most Innovative Companies, Fortune, 2025 * World’s Most Admired Companies, Fortune 2025 * “Most Just Companies”, Just Capital and CNBC, 2025 **Our Benefits And Rewards** BNY offers highly competitive compensation, benefits, and wellbeing programs rooted in a strong culture of excellence and our pay\-for\-performance philosophy. We provide access to flexible global resources and tools for your life’s journey. Focus on your health, foster your personal resilience, and reach your financial goals as a valued member of our team, along with generous paid leaves, including paid volunteer time, that can support you and your family through moments that matter. BNY is an Equal Employment Opportunity/Affirmative Action Employer \- Underrepresented racial and ethnic groups/Females/Individuals with Disabilities/Protected Veterans",https://www.linkedin.com/jobs/view/4391300185
Forward Deployed Software Engineer - Dublin,OpenAI,"Dublin, County Dublin, Ireland",linkedin,"**About The Team** OpenAI’s Forward Deployed Engineering team partners with customers to turn research breakthroughs into production systems. We operate at the intersection of customer delivery and core platform development. **About The Role** We are looking for customer\-focused software engineers to build effective custom software that leverages OpenAI’s APIs to solve real customer problems. As an FDSWE, you will work with our customers and OpenAI Forward Deployed Engineers to design and implement scalable solutions that solve their most difficult problems. You will design abstractions to solve customer problems, and then use them to scale our speed and quality of delivery across all Forward Deployed engagements. You will collaborate closely with Sales, Solutions Engineering, Solutions Architects, and Customer Success Managers who work on the same account. You will also work with our Research and Applied Product and Engineering teams to provide insightful customer feedback. This role is based in Dublin. We use a hybrid work model of 3 days in the office per week. We offer relocation assistance. Travel up to 50% is required. **In This Role, You Will** * Embed deeply with strategic customers to understand their business challenges and technical requirements in detail. * Design, architect, and develop full\-stack solutions using an experiment\-driven, iterative approach. * Prepare detailed scopes of work and project plans for both proof\-of\-concept prototypes and full production deployments. * Work hands\-on with customers' technical teams as a technical expert and trusted advisor, coding side\-by\-side to drive projects to completion on their infrastructure. * Collaborate with Product, Research and Applied teams to ensure seamless customer experiences, project success and actionable product feedback * Contribute to internal knowledge bases, codifying best practices and sharing insights gained from customer engagements to scale the Forward Deployed Engineering function. **You’ll Thrive In This Role If You** * 7\+ years of professional full stack engineering experience (excluding internships) in relevant roles at tech and product\-driven companies \- customer\-facing experience is highly desirable * Former founder, or early engineer at a startup who has built a product from scratch is a plus * Experience with relational databases like Postgres/MySQL * Have a bias for action and willingness to work iteratively with your customers to deliver the right solution that solves their problem. **About OpenAI** OpenAI is an AI research and deployment company dedicated to ensuring that general\-purpose artificial intelligence benefits all of humanity. We push the boundaries of the capabilities of AI systems and seek to safely deploy them to the world through our products. AI is an extremely powerful tool that must be created with safety and human needs at its core, and to achieve our mission, we must encompass and value the many different perspectives, voices, and experiences that form the full spectrum of humanity. We are an equal opportunity employer, and we do not discriminate on the basis of race, religion, color, national origin, sex, sexual orientation, age, veteran status, disability, genetic information, or other applicable legally protected characteristic. For additional information, please see OpenAI’s Affirmative Action and Equal Employment Opportunity Policy Statement. Background checks for applicants will be administered in accordance with applicable law, and qualified applicants with arrest or conviction records will be considered for employment consistent with those laws, including the San Francisco Fair Chance Ordinance, the Los Angeles County Fair Chance Ordinance for Employers, and the California Fair Chance Act, for US\-based candidates. For unincorporated Los Angeles County workers: we reasonably believe that criminal history may have a direct, adverse and negative relationship with the following job duties, potentially resulting in the withdrawal of a conditional offer of employment: protect computer hardware entrusted to you from theft, loss or damage; return all computer hardware in your possession (including the data contained therein) upon termination of employment or end of assignment; and maintain the confidentiality of proprietary, confidential, and non\-public information. In addition, job duties require access to secure and protected information technology systems and related data security obligations. To notify OpenAI that you believe this job posting is non\-compliant, please submit a report through this form. No response will be provided to inquiries unrelated to job posting compliance. We are committed to providing reasonable accommodations to applicants with disabilities, and requests can be made via this link. OpenAI Global Applicant Privacy Policy At OpenAI, we believe artificial intelligence has the potential to help people solve immense global challenges, and we want the upside of AI to be widely shared. Join us in shaping the future of technology.",https://www.linkedin.com/jobs/view/4347004926
Graduate Analyst,EPAM Systems,"Dublin, County Dublin, Ireland",linkedin,"First Derivative is driven by people, data, and technology, unlocking the value of insight, hindsight, and foresight to drive organizations forward. Counting many of the world's leading investment banks as clients, we help our clients navigate the data\-driven, digital revolution that is transforming the financial services sector. Our global teams span across 15 offices serving clients across EMEA, North America and APAC. As an EPAM Systems, Inc. (NYSE: EPAM) company, a leading global provider of digital platform engineering and development services, we deliver advanced financial services solutions by empowering operational insights, driving innovation, and enabling more effective risk management in an increasingly data\-centric world. Together with EPAM, we combine deep industry expertise with cutting\-edge technology to help clients stay ahead in a rapidly evolving financial landscape, offering comprehensive solutions that drive business transformation and sustainable growth. We are looking for **Graduate Analysts** with a passion for problem\-solving and collaboration to join our dynamic team. This is a unique opportunity to develop your skills while working on diverse projects across different business areas. As a Graduate Analyst, you'll play a pivotal role in helping our clients tackle complex challenges while gaining invaluable experience. **We sincerely thank all applicants for their interest. Please note that, due to the volume of applications received, only those shortlisted for further consideration will be contacted.** **Responsibilities** * Collaborate with clients and team members to gather and analyze business requirements * Support various projects in areas such as Banking Operations, Business Analysis, and Project Management Office * Provide insights and recommendations to improve processes and develop effective solutions * Assist in system integration and testing of new software applications * Offer operational and technical support for systems and applications in diverse environments * Help ensure compliance with financial regulations and maintain adherence to client lifecycle management standards * Contribute to the implementation of solutions that address specific client needs and objectives * Work alongside cross\-functional teams to drive project success and deliver measurable outcomes * Foster teamwork and strong relationships with internal and external stakeholders **Requirements** * Proficiency in Communication, Teamwork and Collaboration, and Adaptability * 0\-2 years of experience in relevant roles or academic projects * Background in Banking Operations, Business Analysis, or Project Management * Competency in working with Systems and Application Support, System Integration, or Software Testing * Understanding of Financial Regulations, Client Lifecycle Management, or Compliance practices **Nice to have** * Knowledge of Microsoft Excel * Skills in database management or query optimization **We offer** * Private Healthcare Package * Pension * Employee Assistance Programme * Enhanced Maternity policy * Group Life Protection Benefit * Give as You Earn * Cycle to Work Scheme * Employee Referral Bonus Scheme * Diversity Networks * Access to a range of skills and certifications",https://www.linkedin.com/jobs/view/4345601199
Graduate Electrical Engineer,Mercury,"Dublin, County Dublin, Ireland",linkedin,"Graduate Electrical Engineer, Dublin, Ireland Apply Now **Mercury is the European leader in construction solutions.** We build and manage complex engineering \& construction projects for the world’s leading corporations. Our solutions help deliver technologies and life changing advancements that connect people, communities and businesses, giving them the power to achieve incredible things. Our people have the courage to be innovative. Their determination and sharp focus enable us to deliver with certainty, time and time again. We deliver our clients’ visions through leading edge construction solutions across multiple sectors, including Enterprise Data Centres, Advanced Technology \& Life Sciences, Hyperscale Data Centres and Fire Protection. At Mercury, it is our duty to encourage and back our people to realise their vision of themselves. We place them at the heart of what we do, providing challenging opportunities to develop within a great team in a supportive environment that allows them to reach their full potential. **Our Graduate Programme** We’re seeking the leaders of tomorrow to join us on our Graduate Programme \- those who are willing to share our values, live our culture and deliver beyond expectations. At Mercury we know that to achieve incredible things you must invest in your people. Our dedication to shaping the leaders of tomorrow shines through our highly regarded graduate programme and ensures we stay ahead in a competitive market. From day one you will be on a stellar career trajectory with no limits to what you can achieve, and the programme empowers you to develop the essential skills needed to excel in the fast\-paced construction industry. Since launching in 2009, we have successfully trained 360\+ graduates, many of whom have forged long\-lasting careers with us. Our comprehensive eighteen\-month programme is tailored to meet real\-world demands, featuring courses led by both external and internal subject matter experts in a focused learning environment. Graduates on our programme can anticipate working alongside a diverse and supportive team, accessing state\-of\-the\-art training and masterclasses, and gaining international experience at the leading edge of industry. An important aspect of the development programme is the completion of a group research project. Graduates are split into small groups of four or five and assigned a strategic business project to research and present their findings to Senior Management. All topics are chosen by Senior Management and are relevant to Mercury's business. **Roles\& Responnsibilities** * Complete technical submittals and operate a submittal System * Submit technical enquiries on request for Information System * Operate Document Control system for drawings * Develop material Schedules and take\-off’s from drawings * Track Construction progress and update project schedule * Verify circuit identification on drawings and develop distribution board schedules * Develop construction details to issue to site * Carry out Builders work drawings * Co\-ordinate installation of electrical services with other trades * Survey Installation for preparation of record drawings * Collate Test Packs and Track Testing Installation * Co\-ordinate and liaise with each department as required * Ensure Mercury Policies and procedures are followed closely * Maintain a weekly project photographic diary * All other duties associated with this role **Essential** **Selection Criteria / Person Specification:** * Ideally 2:1 Honours Degree / Expected 2:1 * Level 8 or relevant bachelor’s degree * Good communication skills * Strong interpersonal and organisational skills * Adaptable and solutions driven * Able to work in a team environment * Pride in the quality and presentation of work * Good organization \& coordination skills * Flexible to travel * Enthusiastic and energetic **Desirable** * Experience in the Construction Industry or Trade Background ***Mercury is an equal opportunities employer.*** Apply Now",https://www.linkedin.com/jobs/view/4326652772
