title,company,location,site,description,job_url
1st Year Electrical Apprentice,Grade Electrical Services,"Dublin, D, IE",indeed,"**About Us:** We’re a fast\-growing electrical company working on a mix of domestic and commercial projects. With plenty of new work coming up this year, we’re looking to bring someone new on board who’s keen to get stuck in and grow with us. I strive to provide a healthy work environment for my staff, with that being said, I have high standards and I expect the same from my employees. **The Role:** We’re looking for a 1st Year Electrical Apprentice to join the team. This is a great opportunity for someone who’s genuinely interested in learning the trade and getting hands\-on experience across different types of jobs. **What You’ll Be Doing:** * Working alongside qualified electricians on\-site * Helping out with installs, repairs, and general electrical work * Getting experience on both domestic and commercial jobs * Learning how to read drawings and understand the job * Keeping tools and work areas organised * Following safety procedures at all times **What We’re Looking For:** * A real interest in becoming an electrician * Good attitude and willingness to learn * Reliable and shows up on time * Able to work well with others * Safe Pass and Manual Handling are a bonus (or willing to get them) **What You’ll Get:** * On\-the\-job training and support from experienced electricians * A chance to work on a variety of projects * Opportunity to grow within a company that’s expanding * A solid start to your career in the electrical trade **The Ideal Person:** Someone who’s eager to learn, not afraid of hard work, and serious about building a career as an electrician. Job Types: Full\-time, Permanent, Apprenticeship Pay: €9\.18\-€9\.19 per hour Expected hours: 39 per week Work Location: Hybrid remote in Dublin, County Dublin",https://ie.indeed.com/viewjob?jk=00d83c51af9ae41e
2 LOD Regulatory Compliance Associate,Delta Capita,"Dublin, D, IE",indeed,"Gap analysis in advance of business integration to understand Regulatory Compliance requirements against current business processes. **Key Responsibilities:** * Support implementation across all areas of the business to ensure smooth transition while remaining within regulatory guidelines and maintaining status quo of local business authorities and codes. * Post implementation review of activities, conduct control design and effectiveness testing, updates. * Any applicable and upcoming regulatory legislation, guidelines, best practice incl. local codes of conduct to be implemented and embedded * Engagement with the regulators and other authorities incl. notifications/ approvals required prior to the transaction, reports/notifications to home/host regulators and other authorities incl. data requirements and systems access, * Updates to compliance framework, policies, procedures, monitoring, controls, regulatory change management, horizon scanning. * Training required and audience adaption and compliance mandatory * Confirm roles and responsibilities, ownership of activities, data requirements, system access/migration. **Job requirements** * Degree (e.g. business administration, economics, business law, law or comparable). * Expertise in the field of regulation of financial services companies * Communication and influencing skills, and assertiveness. * Analytical, commercial and results driven. * Experience working in a demanding environment is essential. * The ability to work across all areas of the business a strong business acumen is necessary. * Experience of 2LOD Regulatory Compliance with Financial Institute governed under CBI Regulation **How We Work:** Delta Capita is an equal opportunity employer. We positively encourage applications from suitably qualified and eligible candidates regardless of age, colour, disability, national origin, ancestry, race, religion, gender, sexual orientation, gender identity and/or expression, veteran status, genetic information, or any other status protected by applicable law. We will ensure that individuals with disabilities are provided reasonable accommodation to participate in the job application or interview process, to perform essential job functions, and to receive other benefits and privileges of employment. If you require any reasonable adjustments through your interview process, please use the designated space within the application questionnaire. This is a fixed\-term contract position located in Dublin. As the selection and interview process is ongoing, please submit your application in English as soon as possible, if your profile is selected, a member of our team will contact you within 4 weeks. For this role a valid working permit for the Dublin is mandatory. **Expectations regarding hybrid working:** As we are a Service Provider and Consulting firm servicing clients, our policy for physically working from the office (which may be the clients' offices or our own offices depending on the client) aligns to what our clients' policies and expectations are and these vary. Most of our clients now require a minimum of 3 days per week in the office, 2 days from home, and accordingly this is also the minimum expectation that Delta Capita require. However, some of our clients have now moved up to 4 days and even 5 days in the office and we require candidates to be flexible to meet our client demands. **Who We Are:** Delta Capita Group is a global managed services, consulting, and solutions provider with a unique combination of experience in Financial Services and technology innovation capability. Our mission is to reinvent the financial services value chain providing technology based mutualised services for financial institutions for non\-differentiating services. **Our 3 offerings are:** * Managed Services * Consulting \& Solutions * Technology To know more about Delta Capita and our culture click here: Working at DC \- Delta Capita",https://ie.indeed.com/viewjob?jk=5b9ff99f080e292e
2026 Software Dev Engineer Intern - Ireland,myGwork - LGBTQ+ Business Community,"Dublin, County Dublin, Ireland",linkedin,"**This job is with Amazon, an inclusive employer and a member of myGwork – the largest global platform for the LGBTQ\+ business community. Please do not contact the recruiter directly.** **Description** Do you want to solve real customer problems through innovative technology? Do you enjoy working on scalable services in a collaborative team environment? Do you want to see your code directly impact millions of customers worldwide? At Amazon, we hire the best minds in technology to innovate and build on behalf of our customers. Customer obsession is part of our company DNA, which has made us one of the world's most beloved brands. Our Software Development Engineer (SDE) interns use modern technology to solve complex problems while seeing their work's impact first\-hand. The challenges SDE interns solve at Amazon are meaningful and influence millions of customers, sellers, and products globally. We seek individuals passionate about creating new products, features, and services while managing ambiguity in an environment where development cycles are measured in weeks, not years. At Amazon, we believe in ownership at every level. As an SDE intern, you'll own the entire lifecycle of your code \- from design through deployment and ongoing operations. This ownership mindset, combined with our commitment to operational excellence, ensures we deliver the highest quality solutions for our customers. We're looking for curious minds who think big and want to define tomorrow's technology. At Amazon, you'll grow into the high impact engineer you know you can be, supported by a culture of learning and mentorship. Every day brings exciting new challenges and opportunities for personal growth. Amazon internships across all seasons are full\-time positions, and interns should expect to work in office, Monday\-Friday, up to 40 hours per week typically between 8am\-5pm. Specific team norms around working hours will be communicated by your manager. Interns should not have conflicts such as classes or other employment during the Amazon workday. Key job responsibilities * Collaborate and communicate effectively with experienced cross\-disciplinary Amazonians to design, build, and operate innovative products and services that delight our customers, while participating in technical discussions to drive solutions forward. * Design and develop scalable solutions using cloud\-native architectures and microservices in a large distributed computing environment. * Participate in code reviews and contribute to technical documentation. * Build and maintain resilient distributed systems that are scalable, fault\-tolerant, and cost\-effective. * Leverage and contribute to the development of GenAI and AI\-powered tools to enhance development productivity while staying current with emerging technologies. * Write clean, maintainable code following best practices and design patterns. * Demonstrate operational excellence through monitoring, troubleshooting, and resolving production issues. A day in the life As an intern, you will be matched to a manager and a mentor and will have the opportunity to influence the evolution of Amazon technology and lead critical projects early in your career. In addition to working on an impactful project, you will have the opportunity to engage with Amazonians for both personal and professional development, expand your network, and participate in activities with other interns throughout your internship. No matter the location of your internship, we give you the tools to own your project and learn in a real\-world setting. **About The Team** Intern Community: As an Amazon Intern, you'll be part of a vibrant, supportive community that empowers your growth and development. You'll collaborate with interns from around the world, networking and participating in social events to broaden your perspectives. You can also join specialized groups focused on areas like sustainability to explore your diverse interests. **Support** The internship program provides a robust support system, including weekly intern office hours, dedicated IT and HR support, and a program team committed to your success. This ensures you have the guidance and assistance needed to thrive. **Learning Sessions** Exclusive learning sessions will further enhance your skills, granting you access to Amazon's cutting\-edge learning platforms and the expertise of industry leaders. These structured development opportunities will prepare you for the next step in your career. **Opportunities** Upon successful completion of the internship, you may be considered for a graduate role or a second internship, allowing you to continue your journey with Amazon. Additionally, you'll enjoy a competitive monthly salary, relocation support, and access to a range of employee benefits. **Basic Qualifications** * Are enrolled in a Bachelor's degree or above in Computer Science, Computer Engineering, or related fields at time of application * Knowledge of programming languages such as C/C\+\+, Python, Java or Perl * Knowledge of computer science fundamentals such as object\-oriented design, operating systems, algorithms, data structures, and complexity analysis **Preferred Qualifications** * Experience from a technical internship * Experience with distributed, multi\-tiered systems, algorithms, and relational databases * Experience in optimization mathematics such as linear programming and nonlinear optimization * Ability to effectively articulate technical challenges and solutions * Adept at handling ambiguous or undefined problems as well as ability to think abstractly Amazon is an equal opportunities employer. We believe passionately that employing a diverse workforce is central to our success. We make recruiting decisions based on your experience and skills. We value your passion to discover, invent, simplify and build. Protecting your privacy and the security of your data is a longstanding top priority for Amazon. Please consult our Privacy Notice (https://www.amazon.jobs/en/privacy\_page) to know more about how we collect, use and transfer the personal data of our candidates. Amazon is an equal opportunity employer and does not discriminate on the basis of protected veteran status, disability, or other legally protected status. Our inclusive culture empowers Amazonians to deliver the best results for our customers. If you have a disability and need a workplace accommodation or adjustment during the application and hiring process, including support for the interview or onboarding process, please visit https://amazon.jobs/content/en/how\-we\-hire/accommodations for more information. If the country/region you're applying in isn't listed, please contact your Recruiting Partner.]]\>",https://www.linkedin.com/jobs/view/4396270015
2135GSN425,HSE Workplace Health & Wellbeing,"Louth, County Louth, Ireland",linkedin,"Before you apply This job opportunity is open to both HSE and non\-HSE applicants. Reference 2135GSN425 Category Nursing and Midwifery Grade Staff Nurse \- General 2135 Advertisement source HSE Advertisement Type External Important Information This job is in the HSE. Health region HSE Dublin and North East County * Louth Location Our Lady of Lourdes Hospital Drogheda \& Louth County Hospital Recruiter HSE Dublin and North East: North Dublin, Meath, Louth, Cavan, and Monaghan Contract type * Permanent Wholetime Post specific related information The Staff Nurse will assess, plan, implement and evaluate care to the highest professional and ethical standards within the model of nursing care practiced in the relevant care setting. The staff nurse will provide holistic, person centred care, promoting optimum independence and enhancing the quality of life for service users.Please note: This campaign is only for Graduate Staff Nurses who have successfully completed the clinical and academic requirements of their BSc (Honours) Degree in General Nursing in September 2026 and who will be eligible for registration thereafter with the Nursing and Midwifery Board of Ireland (NMBI). Closing date 15/04/2026 17:00:00 Informal enquiries Darren Behan, darren.behan@hse.ie, CNM3 Practice Development External link https://careers\-hsedne.icims.com/jobs/4688/job",https://www.linkedin.com/jobs/view/4393013395
2nd/3rd Year Apprentice Electrician,P&N O'Connor Ltd,"Portarlington, LS, IE",indeed,"ADL Electrical is seeking a 2nd/3rd Year Apprentice Electrician to join our team for an exciting opportunity. The role involves a mix of electrical and mechanical work, focusing on the installation and maintenance/crane wiring projects. Key Responsibilities: * Wiring cranes and associated electrical systems * Installation of containment (trunking, conduit, cable tray, etc.) * Cable installation and termination * Assisting with mechanical work as required * Ensuring all work is carried out to a high standard and in compliance with safety regulations * Working effectively as part of a team and independently when needed Requirements: * Previous experience in a similar role or currently a 2nd/3rd Year Apprentice Electrician * Strong work ethic with a keen interest in career progression * Good problem\-solving skills and attention to detail * Full driving license (preferred but not essential) What We Offer: * Competitive salary (dependent on experience) * Immediate start with steady work * Opportunity to develop skills in electrical and mechanical work * Support for career progression within the company If you are a motivated individual looking to gain hands\-on experience in a dynamic and growing company, we want to hear from you! You can call Noel on 086 308 8472 Job Type: Full\-time Pay: €24,502\.40\-€30,000\.00 per year Benefits: * On\-site parking Work Location: In person",https://ie.indeed.com/viewjob?jk=e3f7189b1fb9f3a7
AI/ML Associate Engineer,JPMorganChase,"Dublin, County Dublin, Ireland",linkedin,"**Job Description** The AI/ML Associate Engineer is a hands‑on software engineer who applies strong programming fundamentals to build, integrate, and support AI/ML solutions. The role focuses on writing production‑quality code while contributing to AI‑powered features, including (where applicable) solutions that leverage Microsoft 365 Copilot and Copilot Agents. This role is ideal for engineers early in their AI/ML career who are solid coders and eager to work at the intersection of software engineering, applied ML, and enterprise AI platforms. **Key Responsibilities** * Design, develop, test, and maintain production‑quality software supporting AI/ML solutions. * Implement and support AI‑enabled features using modern ML/LLM techniques, APIs, and services. * Contribute to Copilot‑enabled workflows (e.g., Teams, Outlook, Word, Excel) where applicable, including prompt refinement and agent‑based task automation. * Build and maintain backend services, APIs, and integrations that support AI/ML use cases. * Apply GenAI/LLM patterns: Build RAG pipelines, prompt management, evaluation harnesses, and safety mitigations. Integrate embeddings, vector stores, and caching strategies for latency/cost targets. * Participate in model integration and lifecycle activities: experimentation, evaluation, deployment, monitoring, and iteration. Instrument solutions for monitoring (quality, drift, bias, performance, cost). * Write unit tests, integration tests, and documentation to ensure reliability, security, and maintainability. * Collaborate closely with product managers, designers, and senior engineers to translate requirements into working solutions. * Follow enterprise standards for security, data handling, and governance when working with AI systems. **Required Qualifications** * Bachelor’s degree in Computer Science, Engineering, or equivalent practical experience. * Strong programming background, especially in Python and/or at least one of Java, C\#, or similar. * Solid understanding of software engineering fundamentals: data structures, APIs, version control, testing, and CI/CD. * Working knowledge of AI/ML fundamentals (machine learning concepts, LLMs, embeddings, evaluation basics) and tooling (scikit\-learn, XGBoost, PyTorch/TensorFlow, Pandas/Spark). * Experience building APIs/services (REST/gRPC), containerization (Docker), and orchestration (Kubernetes). * Exposure to MLOps practices: CI/CD, MLflow/Kubeflow, model registries, automated testing. **Preferred Qualifications** * Experience using or integrating Microsoft 365 Copilot, Copilot Agents, or similar enterprise GenAI tools. * Exposure to prompt engineering, agent‑based workflows, or AI‑assisted productivity tools. * Familiarity with cloud platforms (Azure preferred), Power Platform, or Microsoft Graph integrations. * Experience supporting AI features in production systems. **About Us** J.P. Morgan is a global leader in financial services, providing strategic advice and products to the world’s most prominent corporations, governments, wealthy individuals and institutional investors. Our first\-class business in a first\-class way approach to serving clients drives everything we do. We strive to build trusted, long\-term partnerships to help our clients achieve their business objectives. We recognize that our people are our strength and the diverse talents they bring to our global workforce are directly linked to our success. We are an equal opportunity employer and place a high value on diversity and inclusion at our company. We do not discriminate on the basis of any protected attribute, including race, religion, color, national origin, gender, sexual orientation, gender identity, gender expression, age, marital or veteran status, pregnancy or disability, or any other basis protected under applicable law. We also make reasonable accommodations for applicants’ and employees’ religious practices and beliefs, as well as mental health or physical disability needs. Visit our FAQs for more information about requesting an accommodation. **About The Team** Our professionals in our Corporate Functions cover a diverse range of areas from finance and risk to human resources and marketing. Our corporate teams are an essential part of our company, ensuring that we’re setting our businesses, clients, customers and employees up for success.",https://www.linkedin.com/jobs/view/4394368688
AI/ML Associate Engineer,JPMorganChase,"DUBLIN 2, D, IE",indeed,"**JOB DESCRIPTION** The AI/ML Associate Engineer is a hands‑on software engineer who applies strong programming fundamentals to build, integrate, and support AI/ML solutions. The role focuses on writing production‑quality code while contributing to AI‑powered features, including (where applicable) solutions that leverage Microsoft 365 Copilot and Copilot Agents. This role is ideal for engineers early in their AI/ML career who are solid coders and eager to work at the intersection of software engineering, applied ML, and enterprise AI platforms. **Key Responsibilities** * Design, develop, test, and maintain production‑quality software supporting AI/ML solutions. * Implement and support AI‑enabled features using modern ML/LLM techniques, APIs, and services. * Contribute to Copilot‑enabled workflows (e.g., Teams, Outlook, Word, Excel) where applicable, including prompt refinement and agent‑based task automation. * Build and maintain backend services, APIs, and integrations that support AI/ML use cases. * Apply GenAI/LLM patterns: Build RAG pipelines, prompt management, evaluation harnesses, and safety mitigations. Integrate embeddings, vector stores, and caching strategies for latency/cost targets. * Participate in model integration and lifecycle activities: experimentation, evaluation, deployment, monitoring, and iteration. Instrument solutions for monitoring (quality, drift, bias, performance, cost). * Write unit tests, integration tests, and documentation to ensure reliability, security, and maintainability. * Collaborate closely with product managers, designers, and senior engineers to translate requirements into working solutions. * Follow enterprise standards for security, data handling, and governance when working with AI systems. **Required Qualifications** * Bachelor’s degree in Computer Science, Engineering, or equivalent practical experience. * Strong programming background, especially in Python and/or at least one of Java, C\#, or similar. * Solid understanding of software engineering fundamentals: data structures, APIs, version control, testing, and CI/CD. * Working knowledge of AI/ML fundamentals (machine learning concepts, LLMs, embeddings, evaluation basics) and tooling (scikit\-learn, XGBoost, PyTorch/TensorFlow, Pandas/Spark). * Experience building APIs/services (REST/gRPC), containerization (Docker), and orchestration (Kubernetes). * Exposure to MLOps practices: CI/CD, MLflow/Kubeflow, model registries, automated testing. **Preferred Qualifications** * Experience using or integrating Microsoft 365 Copilot, Copilot Agents, or similar enterprise GenAI tools. * Exposure to prompt engineering, agent‑based workflows, or AI‑assisted productivity tools. * Familiarity with cloud platforms (Azure preferred), Power Platform, or Microsoft Graph integrations. * Experience supporting AI features in production systems. **ABOUT US** J.P. Morgan is a global leader in financial services, providing strategic advice and products to the world’s most prominent corporations, governments, wealthy individuals and institutional investors. Our first\-class business in a first\-class way approach to serving clients drives everything we do. We strive to build trusted, long\-term partnerships to help our clients achieve their business objectives. We recognize that our people are our strength and the diverse talents they bring to our global workforce are directly linked to our success. We are an equal opportunity employer and place a high value on diversity and inclusion at our company. We do not discriminate on the basis of any protected attribute, including race, religion, color, national origin, gender, sexual orientation, gender identity, gender expression, age, marital or veteran status, pregnancy or disability, or any other basis protected under applicable law. We also make reasonable accommodations for applicants’ and employees’ religious practices and beliefs, as well as mental health or physical disability needs. Visit our FAQs for more information about requesting an accommodation. **ABOUT THE TEAM** Our professionals in our Corporate Functions cover a diverse range of areas from finance and risk to human resources and marketing. Our corporate teams are an essential part of our company, ensuring that we’re setting our businesses, clients, customers and employees up for success.",https://ie.indeed.com/viewjob?jk=2c97605a2f0a630c
