title,company,location,site,description,job_url
Operational Risk Associate,Pantheon,"Dublin, County Dublin, Ireland",linkedin,"Pantheon has been at the forefront of private markets investing for more than 40 years, earning a reputation for an innovative approach to investing in secondaries, co\-investments, and primary fund investments, as well as capital formation across commingled funds, evergreen vehicles and customized solutions. Our specialist investment capabilities span multiple strategies across private equity, infrastructure and real assets, and private credit. Through our collaborative and committed culture, we find new ways to solve complex problems together and deliver innovative investment opportunities across private markets. Pantheon currently manages approximately $82\.3 billion in AUM across all its strategies, serving more than 750 institutional and 638 private wealth clients worldwide For further details please visit www.pantheon.com **Purpose of Role** The Operational Risk Associate will be part of the wider Enterprise Risk / Operational Risk function and support the team in further developing and managing operational risks across all business functions. The position will report to the Head of Enterprise/Operational Risk. **Key Responsibilities** * Support the development and implementation of Pantheon’s global operational risk frameworks and policies and procedures for adoption by Pantheon Group entities * Support the ISAE 3402/SSAE 16 annual processes including completion of the document, drafting of controls wording and providing external auditor with supporting information. * Support process and control reviews to identify risks and issues in Pantheon’s control environment. Reviews will include identified areas of risk, monitoring programme and new business processes. * Manage Error/Incident reporting process including reporting to management and resolution of any issues. Ensure monitoring procedures are in line with Pantheon’s risk policies. Direct investigation of serious error or breaches and make recommendations for change to management * Co\-ordinate and assist in providing risk oversight and governance across third party supplier relationships of all Pantheon Group entities * Support business continuity process including BCP and testing programme. * Support to manage various risk\-related frameworks such as the data privacy / data protection, vendor risk, Insurance risk, and assist with any client / business related queries * Support and further develop a centralised library of processes, risks and controls in a strategic risk system **Skills And Experience Required** * Degree level education * Experience of working in a risk function ideally in an investment banking, asset management, private equity environment * Understanding of investment management and products * Ability to work on own initiative and in team * Ability to identify when issues should be escalated for further discussion * Controls awareness * Keen problem\-solving skills, ability to offer solutions to issues **This job description is not to be construed as an exhaustive statement of duties, responsibilities, or requirements. You may be required to perform other job\-related duties as reasonably requested by your manager.** **Pantheon is an Equal Opportunities employer, we are committed to building a diverse and inclusive workforce so if you're excited about this role but your past experience doesn't perfectly align we'd still encourage you to apply.**",https://www.linkedin.com/jobs/view/4393016312
Operational Risk Associate,Pantheon Ventures,"Dublin, D, IE",indeed,"Pantheon has been at the forefront of private markets investing for more than 40 years, earning a reputation for an innovative approach to investing in secondaries, co\-investments, and primary fund investments, as well as capital formation across commingled funds, evergreen vehicles and customized solutions. Our specialist investment capabilities span multiple strategies across private equity, infrastructure and real assets, and private credit. Through our collaborative and committed culture, we find new ways to solve complex problems together and deliver innovative investment opportunities across private markets. Pantheon currently manages approximately $82\.3 billion in AUM across all its strategies, serving more than 750 institutional and 638 private wealth clients worldwide For further details please visit www.pantheon.com **Purpose of Role** The Operational Risk Associate will be part of the wider Enterprise Risk / Operational Risk function and support the team in further developing and managing operational risks across all business functions. The position will report to the Head of Enterprise/Operational Risk. **Key Responsibilities** * Support the development and implementation of Pantheon's global operational risk frameworks and policies and procedures for adoption by Pantheon Group entities * Support the ISAE 3402/SSAE 16 annual processes including completion of the document, drafting of controls wording and providing external auditor with supporting information. * Support process and control reviews to identify risks and issues in Pantheon's control environment. Reviews will include identified areas of risk, monitoring programme and new business processes. * Manage Error/Incident reporting process including reporting to management and resolution of any issues. Ensure monitoring procedures are in line with Pantheon's risk policies. Direct investigation of serious error or breaches and make recommendations for change to management * Co\-ordinate and assist in providing risk oversight and governance across third party supplier relationships of all Pantheon Group entities * Support business continuity process including BCP and testing programme. * Support to manage various risk\-related frameworks such as the data privacy / data protection, vendor risk, Insurance risk, and assist with any client / business related queries * Support and further develop a centralised library of processes, risks and controls in a strategic risk system **Skills** **and Experience Required** * Degree level education * Experience of working in a risk function ideally in an investment banking, asset management, private equity environment * Understanding of investment management and products * Ability to work on own initiative and in team * Ability to identify when issues should be escalated for further discussion * Controls awareness * Keen problem\-solving skills, ability to offer solutions to issues \#LI\-SB1 **This job description is not to be construed as an exhaustive statement of duties, responsibilities, or requirements. You may be required to perform other job\-related duties as reasonably requested by your manager.** **Pantheon is an Equal Opportunities employer, we are committed to building a diverse and inclusive workforce so if you're excited about this role but your past experience doesn't perfectly align we'd still encourage you to apply.**",https://ie.indeed.com/viewjob?jk=a4975a2c80c35583
Operations Assistant,Royal College of Surgeons in Ireland (RCSI),"Dublin, County Dublin, Ireland",linkedin,"**Title:** Operations Assistant **Department:** Faculty of Radiologists and Radiation Oncologists **Tenure:** Permanent \- Full\-time **Location:** RCSI, St Stephen’s Green, Dublin 2 **Reporting to:** Dean of the Faculty or nominee **About the post** This post is designed to provide a comprehensive administrative support service to the Dean, Honorary Secretary and Officers of the Board of the Faculty of Radiologists and Radiation Oncologists with specific emphasis on the Faculty training programmes. This role is an integral part of the Faculty ideally suited for an ambitious individual to support trainees on their journey from application to graduation along with ad\-hoc events and projects within the Faculty. **Duties include:** * Act as the key point of contact for trainees, fellows, training coordinators, clients and stakeholders * Support trainee recruitment to the programmes through response to enquiries, liaising with prospective trainees, follow up with applicants and management of the online training programme systems * Assisting with the organisation and operation of scientific meetings, functions, conferring ceremonies, board and committee meetings and other events associated with the Faculty. * Assisting with organising and running of training courses, modules, interviews and assessments * Work collaboratively with the National Training Coordinators, lecturers, trainees and other Operations Assistants to ensure effective running of courses and delivery of a highly flexible, responsive and effective service to all * Assist with preparing documentation for accreditation and site visits for both radiation oncology and diagnostic radiology training programmes * Maintain training passports for trainees and ensure these are up to date for all individuals, ensuring all mandatory courses completed for CSCST purposes * Maintain the educational calendar for all Faculty courses throughout the year and updating MedHub with training courses, modules, lectures and recordings * Attend all operational educational meetings and discuss any changes on the calendar and manage and coordinate ongoing requirements for courses as they arise * Preparing training programme specialty rotations, lecture schedules, recordings as required. * Provision of assistance to tutors in the set up of zoom and uploading of tutors presentations for lecture purposes in the lecture theatre/tutorial room * Updating Hospital Buddy with dates for lectures and circulation details for lectures to both tutors and SpRs * Updating MedHub with tutors slides for revision purposes for SpRs * Support the delivery of online modules, courses, webinars and conferences in line with faculty requirements as they arise * Collating programme outcomes into documented reports in support of programmatic review and continuous quality improvement * Preparation and collation of the Faculty Annual Report * Providing assistance to the Executive Officer * Reviewing and updating the Faculty website with relevant information, reports, publications, news etc * Collation and circulation of all information and documentation for meetings. Preparing and taking minutes as required and keeping Sharepoint updated * Assist with the preparation and completion of circulars for Fellows and trainees * Assist with processing of expense claims for board and committee members, lecturers, visiting speakers, trainee discretionary fund in line with Faculty, RCSI and NDTP policies * Coordinate the ordering and supply of stationery and materials for the faculty within the budget limits * Undergo programmes of training and development as may be required from time to time * Completion of the annual mandatory staff courses and training in technology * Complying with statutory legislation and department rules and requirements in furtherance of own and general staff welfare and safety * Representing the best interests of the Faculty of Radiologists and Radiation Oncologists and RCSI at all times * Performing such other duties appropriate to the post as may arise from time to time **Person specification** * Strong communication and interpersonal skills appropriate to audience and situation * Have strong customer service skills and communicate with high level of diplomacy and confidentiality * Ability and sensitivity to operate and liaise with busy and highly skilled professionals with differing priorities, geographic bases etc. * Team player – ability to work collaboratively alongside others to maximise individuals and team effectiveness in order to achieve required service outputs * Highly organised with an acute attention to detail and follow through, giving full consideration to all aspects of the task / project including potential issues and wider impact on Faculty activities and functions * Excellent computerised administration skills * Excellent time and management skills * Ability to make decisions, identify, prioritise workload and meet deadlines and escalate problems when necessary * Ability to work on own initiative * Can operate flexibly within a busy and changing environment; can shift focus when required, act decisively and prioritise several tasks to meet deadlines * Flexibility with working hours when required **Knowledge and experience (essential):** * Understanding of accounting and budgets * Proficient in administrative and educational programmes and platforms such as Microsoft Office Suite, Panopto, Quercus, Zoom, social medial platform X etc **Knowledge and experience (desirable):** * Understanding of medical working environment and legal parameters * Proven track record in a similar role would be advantageous ***We are all too aware that imposter syndrome and the confidence gap can sometimes stop fantastic candidates putting themselves forward, so please do submit an application — we’d love to hear from you.***",https://www.linkedin.com/jobs/view/4394622231
Operations Risk & Resilience Placement - 2026 Work Placement,Arup,"Dublin, County Dublin, Ireland",linkedin,"**Shape a future with purpose at Arup in Dublin and Cork.** Arup’s purpose, shared values and collaborative approach has set us apart for over 75 years, guiding how we shape a better world. The Operations Consulting Team Supports Clients Across The Full Asset Lifecycle—from Acquisition And Planning Through To Operation And Disposal—by Addressing The Interdependencies Between People, Processes, Systems, And Assets. The Discipline Delivers a Broad And Integrated Set Of Services, Including * Operational Strategy \& Transformation: Helping clients align operational execution with strategic goals, including digital transformation initiatives and process improvement * Governance, Risk \& Compliance (GRC): Support the delivery of effective compliance and risk management programmes to identify, manage and mitigate business and digital related risk * Operational Readiness \& Performance Improvement: Ensuring systems, teams, and processes are prepared for launch or transition, and continuously optimised for performance * Digital Enablement: Leveraging tools like BIM, Digital Twins, and analytics platforms to improve operational visibility and decision\-making **The Opportunity** Arup Ireland are seeking talented students to join our Cork or Dublin team. We look for students who are ready to jump into the professional world; diverse individuals with inquisitive minds and a desire to challenge. You will work alongside skilled professionals and contribute to the success of real projects. You will also enjoy learning sessions with technical experts within your team, working on local projects and all kinds of social events. You will be working with a team of Operations Consulting Services professionals from various offices. The Operations Consulting team embodies Arup’s Total Design philosophy by integrating people, processes, technology, and physical assets into cohesive operational strategies that are embedded from concept through to implementation. The team works with a variety of public sector organisations, including Transport Infrastructure Ireland. With reference to our Risk \& Resilience service within Operations Consulting, it exemplifies Arup’s Total Design by embedding resilient governance frameworks, proactive risk intelligence, and compliance assurance into the operational phase of projects—ensuring that systems, processes, and people are holistically integrated. This is an office\-based role, with successful candidates expected to work 5 days per week in the Arup office in Cork or Dublin. **As a work placement student in the Operations team at Arup, you will:** * Support turning technical recommendations into operational plans and project deliverables with defined sustainability outcomes for our clients * Practice creative applications of technology to develop design solutions * Develop communication skills, including report writing and visual representations * Attend and participate in meetings – listen, ask questions * Be involved in discussions with team members to gain knowledge \& experience * Undertake analytical research to develop, document, present concepts and design ideas * Review project documentation, applicable codes and standards to assist with preparation of reports, presentations, drawings and/or sketches * Give structure to ideas – lots of “taking a first pass” at spreadsheets, reports and analyses for discussion later rather than instruction **Does this role inspire you?** We're Looking For Students Who Are Currently Studying For a Relevant Bachelor’s Degree Level Or Be Currently Undertaking a Post\-graduate Level Qualification In a Relevant Discipline, Including, But Not Limited To * Governance \& Compliance Management * Business in Operations Management * Management (Operations \& Supply Chain) * Supply Chain Operations * Business Information Systems * Computer Systems Engineering * Cybersecurity **We Also Value** * Experience of producing technical presentations and reports, knowledge sharing with peers * History of academic research, technical presentations, and technical report writing * Experience with any of the following: GRC software solutions, Cybersecurity solutions, Microsoft Visio, PowerPoint, or Project, or analysis packages * Knowledge of ISO Assurance Frameworks such as 27001 or 55001 and Data Privacy regulations * Evidence of teamwork and leadership in academic or extracurricular field * The ability to prioritise effectively, balance assigned work and deliver to deadlines **Why Arup?** At Arup, we believe in investing in our people and supporting their growth from day one. As a trust\-owned company, we're driven by our purpose and values, creating a collaborative and rewarding environment for our employees. **Benefits That Work For You** * Professional Growth \& Development: Kickstart your career with our structured program, benefit from continuous learning opportunities, and receive guidance from experienced mentors. * Wellbeing and Culture: At Arup we are committed to fostering a healthy working culture by offering a range of health and wellbeing benefits, including health insurance, flexible working schemes, wellness programmes and an Employee Assistance Programme. * Equality, Diversity and Inclusion: We strive to embed inclusion in our way of working, our interactions with one another and the projects we deliver. We are committed to creating an inclusive working environment for talented people of any background, based on merit, fairness and respect. At Arup, you belong to an extraordinary collective where individuality is encouraged. Our strength comes from how we respect, share, and connect our diverse experiences, perspectives, and ideas. You'll have the opportunity to do socially useful work that has meaning – to Arup, to your career, and to the clients and communities we serve. We welcome applications from talented individuals of all backgrounds, regardless of age (within legal limits), gender identity or expression, disability, ethnicity, religion, sexual orientation, or any other protected characteristic. We are committed to making our recruitment process and workplaces accessible. If you need any assistance or adjustments, please visit our Candidate Support page for contact information and assistance. We're happy to help. **Please note this role is only suitable for those who are in full time education and are looking for a placement for the summer months or for those who are required to complete a placement as part of their course requirements.** **If you have recently graduated, please apply to one of our '2026 Graduate Programme' roles.** \#IREIntern **Do you want to join us in shaping a better world?**",https://www.linkedin.com/jobs/view/4392898086
PARK RANGER,Local Government Jobs Ireland,"Dublin, D, IE",indeed,"Professional and Technical PARK RANGER €764\.92 \- €805\.40 Advertised Date: 19 Mar 2026 Weekly Rate Dublin Permanent Wholetime Closing Date: 09 Apr 2026, 12:00 PM **Job Summary** --------------- EDUCATION, TRAINING, EXPERIENCE, ETC. Each candidate must, on the latest date for receipt of completed application form: Have a reasonable standard of education sufficient to enable them to perform the job efficiently and effectively – not less than junior certificate / intermediate certificate or equivalent. AND Hold a full unendorsed driving licence (Category B or equivalent) that permits permanent driving in Ireland AND Hold a valid work permit if required\* * All non\-EU/EEA citizens must hold a valid work permit prior to and for the duration of their contract. The work permit must allow you to work full time for Dún Laoghaire Rathdown County Council. It is the responsibility of individual employees to ensure that you have a valid work permit. If at any stage during your contract you cease to hold a valid work permit you must immediately advise Dún Laoghaire\-Rathdown County Council and your employment will cease with immediate effect. It is desirable for candidates to: * have a qualification in horticulture, landscaping, ecology or a related discipline and practical horticulture and practical arboriculture; * Hold a current Safe Pass Card; * Have an awareness of the Council’s Biodiversity and Climate Action Plans and Tree Policy **Contact Details** ------------------- hr@dlrcoco.ie",https://ie.indeed.com/viewjob?jk=1c31ab35becdf455
