title,company,location,site,description,job_url
"Counter Associate - The Ordinary - Brown Thomas, Dublin - PT",DECIEM | THE ABNORMAL BEAUTY COMPANY,"Dublin, County Dublin, Ireland",linkedin,"**WHAT ON EARTH IS DECIEM?** We are a collective of disrupters and doers, of creatives and scientists, with a mission to reimagine the world of beauty. Since inception, our vertically integrated structure, including our own laboratories, manufacturing, retail stores, and brand infrastructure, have enabled us to rapidly identify opportunities and deliver quality. Home to The Ordinary, NIOD, AVESTAN, and other emerging brands, our goal is to create with purpose. We were founded on the principle of doing everything that others don’t. Because normal gets you nowhere. We are DECIEM, The Abnormal Beauty Company. We are growing rapidly and we’re looking for someone who shares this vision and wants to grow with us! **WHAT WE'RE LOOKING FOR** We are looking for a flexible customer service\-oriented Sales Assistant known at DECIEM as Counter Associate, to join our "" **extraOrdinary""** team in **Brown Thomas, Dublin** to deliver memorable experiences to our customers \<3 Experience in the Retail, Department Stores, and luxury industry is highly desirable and ideally, within the Fragrance, Beauty, Fashion, and Luxury Goods sectors. * This is a 16\-hour\-a\-week position on a part\-time basis **WHAT YOU'D BE DOING IN THIS ROLE** * Greet all customers who enter the store with enthusiasm and professionalism, reflecting DECIEM’s vision through excellent service * Determine the customer’s needs and suggest relevant products by listening to the customer and sharing the product knowledge acquired during brand training * Ensure standards for quality, customer service, and health and safety are met * Adhere to the DECIEM experience and deliver unparalleled customer service. Educate customers about the world of Beauty and Skin Care, DECIEM brands, and products * Manage customer feedback and queries * Assist in maintaining counter standards of cleanliness and organization * Be aware of and assist in maintaining DECIEM’s merchandising concepts * Ensure tidiness standards are always respected and maintained * Conduct product refunds and address customer issues in a positive manner * Responsible for building meaningful relationships with department managers and clients. High standard communication. **SKILLS AND QUALIFICATIONS NEEDED TO GET THE JOB DONE** - Comfortable in engaging customers and applying products to the customer while providing consultations - Ability to multi\-task, while providing professional and outstanding customer service Desire to spread brand awareness - Effective time management and communication skills. **WHAT YOU'LL BE GAINING BY JOINING OUR TEAM** There’s a lot of good stuff that comes along with being a DECIEM team member. Here’s a few of our favourite perks and benefits, in no particular order… Generous Vacation \& Personal Days, plus additional time off for volunteering in your community, voting, peaceful protesting, celebrating your birthday, and more. 6 months of paid time off for new parents (inclusive of all genders). Unlimited access to an Employee Assistance Program that includes mental health care, mindfulness programs, and more. Access to Development Grants \& a LinkedIn Learning membership to help you keep growing and learning. First dibs on new products. A generous discount on DECIEM products for you, your family, and your friends. **BUILDING GROWTH TO POWER GOOD** We are a people\-first company that lives by our core values to… * ✨ Defy Convention. * ✨ Make it real. * ✨ Play in the grey. * ✨ Build Bridges. * ✨ Be the rabbit. These values continue to guide us in all that we do. Along the way, we’ve been honoured to win some pretty incredible awards, including a CEW Achiever Award, Best Skincare Brand at Sunday Times Style Beauty Awards, and Most Popular Sustainable Brand by The Cosmetify Index Global. We’re still blushing! **SUSTAINABILITY AND SOCIAL IMPACT** DECIEM’s objective is to build growth and do good things while prioritizing people, animals, and the Earth. Our Sustainability strategy is focused on fighting climate change, improved waste management, responsible packaging, responsible sourcing and product lifecycle, and water conservation. In 2020, DECIEM established the Good Fund to support both large and grassroots charities in response to global events. **CREATING A HUMAN WORLD OF BEAUTY** DECIEM is committed to diversity, equity, and inclusion (DEI) by creating meaningful, measurable change in the lives of our team members and in the communities where we operate. Achieving equality is critical to DECIEM and our future. You can learn more about our DEI commitment in our open letter, "" DECIEM is an equal opportunity employer. We prohibit discrimination based on age, colour, disability, national origin, race, religion, sex, gender, sexual orientation, and any other legally protected class in accordance with applicable federal, provincial and local laws. We are also committed to creating and maintaining an inclusive and accessible workplace. If you are contacted to be part of our recruitment process and require accommodation, please let us know. **WANT TO JOIN US?** Thank you for reading the whole thing! If you liked what you heard, kindly send us your resume. We really appreciate your effort in applying for this position. However, only those who have been shortlisted for interviews will be contacted. \<3 \#SP",https://www.linkedin.com/jobs/view/4396742363
Customer Service Agent - Payments | Transition Into Recruitment,Archer Recruitment,"Dublin, County Dublin, Ireland",linkedin,"**Customer Service Agent \- Payments \| Transition Into Recruitment** * **Fast\-Track Career Change** – Move from payments/customer support into recruitment * **Full Recruitment Lifecycle Exposure** – From sourcing to offer stage * **High\-Impact, People\-Focused Role** – Relationship\-driven, consultative recruitment At Archer, we connect organisations across pharma, medical devices, and financial services with high\-calibre IT and technology professionals across Europe. If you’re currently working in payments or customer service and want to pivot into a commercial, people\-focused career, recruitment offers the chance to leverage your communication skills, stakeholder management experience, and results\-driven mindset in a fast\-paced, high\-reward environment. **Why Join Archer as a Recruitment Consultant** * **Accelerate Your Career Change** – Structured pathway from Trainee Consultant to Senior \& Leadership roles * **World\-Class Training** – Intensive onboarding, real\-time performance coaching, and ongoing mentorship * **Clear Progression** – 13\-level promotion structure up to Equity Partner, based on performance and ownership **What You Will Do** * **Build Relationships** – Partner with candidates and clients, becoming a trusted advisor * **Own the Process** – Manage roles end\-to\-end: sourcing, interviewing, coordinating, and closing * **Deliver Results** – Match high\-quality talent to business\-critical roles in a competitive market **Why Your Payments Background Works** * **Client Communication** – You’re already skilled at handling queries, resolving issues, and managing expectations * **Attention to Detail** – Critical when qualifying candidates and managing hiring processes * **Resilience \& Pace** – High\-volume, deadline\-driven environments translate directly to recruitment success **Additional Benefits** * **Limitless Commission \+ Bonus** – Paid monthly, directly tied to performance * **Incentives \& Rewards** – Ski trips, international travel, team events, and celebrations * **High\-Performance Culture** – Work alongside ambitious, driven consultants in Dublin city centre **What You Will Have** * **Customer Service or Payments Experience** – Call centre, fintech, banking, or operations backgrounds welcomed (ideally 3\+ years of experience post\-education) * **Commercial Mindset** – Motivated by targets, progression, and financial reward * **In\-Office Commitment** – Dublin city centre\-based, ready to build a long\-term career **Base Salary DOE (Early\-Mid Thirties) \+ Commission Uncapped \+ Bonus** **Average Total Compensation:** Year 1 €47,000\+ \| Year 2 €65,000\+ For more information, contact **Saoirse.lawton@archer.ie** or call **\+353 (0\)1 649 8517**",https://www.linkedin.com/jobs/view/4405815253
Cyber Security Analyst,Fruition Group Ireland,"Dublin, County Dublin, Ireland",linkedin,"My Dublin based client is recruiting for a Cyber Security Risk Analyst to join a growing team on a permanent basis. This role requires 1 day per week onsite. The Cyber Security Risk Analyst will be responsible for establishing and maintaining a strong security posture across the organisation. The team defines security strategies, frameworks, and controls, and ensures their effective implementation to protect information assets and manage security risks. **Responsibilities** * Act as a primary point of contact for information security matters related to service delivery and operational activities. * Promote awareness and understanding of information security principles, policies, and processes across the organisation. * Identify, assess, and monitor information security risks in collaboration with risk owners, ensuring appropriate controls are applied throughout the service and system lifecycle. * Evaluate the effectiveness of information security controls and ensure alignment with organisational policies, regulatory obligations, and recognised industry standards. * Develop, maintain, and improve information security policies, standards, and procedures. * Support third\-party risk management activities, including defining and assessing security requirements for suppliers and outsourced services. * Lead or contribute to security initiatives and improvement projects, working with cross\-functional teams to enhance security processes and increase automation where appropriate. **Skills / Experience Required** * A degree in computer science, information technology, or a related discipline, or equivalent professional experience. * 5\+ years of experience in information security or related IT roles, with strong exposure to risk management, security frameworks, and control design. * Broad knowledge of information security technologies, architectures, and operational processes, including information security management systems and industry standards (e.g. ISO 27001, COBIT, DORA, NIS2\). * Experience working with data, reporting, automation, or AI\-enabled tools to support security processes. * Experience managing or assessing security risks associated with third\-party suppliers, cloud services, and outsourced environments. * Proven ability to manage projects and influence stakeholders in complex organisational environments. * Strong communication skills, with the ability to produce clear, professional documentation and communicate effectively with technical and non\-technical audiences. **Benefits** Hybrid Working \- Only 1 Day per week required on site Healthcare Bonus Childcare Allowance Pension Sub Canteen",https://www.linkedin.com/jobs/view/4405009134
Data Center Design Engineer,Crusoe,"Dublin, County Dublin, Ireland",linkedin,"Crusoe is on a mission *to accelerate the abundance of energy and intelligence* . As the only vertically integrated AI infrastructure company built from the ground up, we own and operate each layer of the stack — from electrons to tokens — to power the world's most ambitious AI workloads. When you join Crusoe, you join a team that is building the future, faster. We're in the midst of the greatest industrial revolution of our time. The demand for AI compute is boundless, and power is a bottleneck. We're solving that — with an energy\-first approach that makes AI infrastructure better for the world and faster for the people innovating with AI. We're looking for problem\-solving, opportunity\-finding teammates with a sense of urgency, who believe in the scale of our ambition and thrive on a path not fully paved — people who want to grow their careers alongside a team of experts across energy, manufacturing, data center construction, and cloud services. If you want to do the most meaningful work of your career, help our customers and partners advance their AI strategies, and be part of a high\-performing team that believes in each other, come build with us at Crusoe. **About This Role:** As the Data Center Deployment Engineer, you will be the primary architect of Crusoe’s operational computing environments. You will bridge the gap between heavy infrastructure and high\-performance computing by designing the ""whitespace""\- the critical area where our servers, storage, and network equipment live. Your work is fundamental to Crusoe’s mission of aligning the future of computing with the future of the climate; by optimizing power distribution, cooling, and equipment density, you directly enable the scalability and energy efficiency of our sustainable cloud platform. You will join a bold, collaborative team where you will lead the planning and implementation of high\-density layouts and modular infrastructure. The ideal candidate is a technical problem\-solver who thrives in the intersection of mechanical, electrical, and network engineering. This is a full\-time position designed for an innovative engineer who wants to build the physical foundation of an ethical and sustainable digital world. **What You’ll Be Working On:** * Whitespace Design \& Planning: Architect comprehensive whitespace layouts, including rack placement and aisle configurations, to maximize equipment density while maintaining optimal airflow and accessibility. * Infrastructure Integration: Partner with Electrical and Mechanical teams to seamlessly integrate power delivery and cooling systems into the whitespace, ensuring robust support for high\-performance cloud workloads. * Capacity \& Growth Modeling: Develop sophisticated 3D models and capacity planning tools to project future utilization, ensuring our data centers remain scalable and redundant (N\+1, 2N). * Connectivity Strategy: Coordinate with Network and Cloud teams to design and implement structured cabling and fiber management systems that meet rigorous performance and low\-latency requirements. * Cross\-Functional Leadership: Participate in design reviews and risk assessments, providing technical guidance to internal stakeholders and external contractors during construction and commissioning phases. * Compliance \& Excellence: Enforce industry standards (TIA\-942, ASHRAE) and local building codes to ensure every design is safe, compliant, and performs to the highest reliability standards. * Technical Documentation: Produce and maintain high\-fidelity CAD/BIM drawings and schematics that serve as the definitive source for operations, maintenance, and auditing. * Continuous Innovation: Evaluate emerging modular technologies and design methodologies to relentlessly improve energy efficiency and site performance. **What You’ll Bring to the Team:** * Engineering Foundation: A Bachelor’s degree in Electrical, Mechanical, Facilities, or Data Center Engineering. * Industry Expertise: At least 5\+ years of experience in data center design, with a proven track record in cloud\-scale or hyperscale environments. * Technical Proficiency: Advanced skills in CAD/BIM software (AutoCAD, Revit, Visio, or equivalent) to create precise architectural and engineering schematics. * Infrastructure Mastery: Deep technical knowledge of data center power distribution, UPS systems, HVAC/cooling systems, and structured cabling. * Standards Knowledge: A firm grasp of industry\-standard frameworks, specifically TIA\-942, Uptime Institute, ASHRAE, and ANSI/BICSI. * Collaborative Mindset: Exceptional communication skills and the ability to drive results within cross\-functional teams while managing multiple complex projects simultaneously. * Field Readiness: A willingness and ability to travel to data center sites to oversee implementation and conduct site inspections. **Bonus Points:** * Advanced Hyperscale Experience: Prior experience specifically designing for ultra\-high\-density liquid cooling or modular data center deployments. * Professional Certifications: Possession of a Registered Communications Distribution Designer (RCDD) or Certified Data Center Design Professional (CDCP) credential. * Sustainability Focus: Experience implementing LEED\-certified or carbon\-neutral data center cooling and power strategies. * Advanced Modeling Skills: Experience with Computational Fluid Dynamics (CFD) modeling to analyze and optimize airflow within the whitespace. * Leadership Tenure: Experience mentoring junior engineers or leading external vendor teams through complex infrastructure build\-outs. **Benefits:** Crusoe also offers a competitive benefits package designed to support financial security, health, and overall well\-being, including pension contributions, private health and dental insurance, income protection, life assurance and more. **Compensation:** Compensation will be paid as salary or hourly. Compensation to be determined by the applicant’s education, experience, knowledge, skills, and abilities, as well as internal equity and alignment with market data. Crusoe is an Equal Opportunity Employer. Employment decisions are made without regard to race, color, religion, disability, genetic information, pregnancy, citizenship, marital status, sex/gender, sexual preference/ orientation, gender identity, age, veteran status, national origin, or any other status protected by law or regulation.",https://www.linkedin.com/jobs/view/4358163984
Data Innovation Graduate Programme,daa,"Dublin, D, IE",indeed,"Job Description Step into the heart of innovation with daa’s Data Innovation Graduate Programme. Over two years, you’ll rotate across our Data Analytics teams \- solving real\-world challenges that keep Ireland’s airports running smoothly. Whether you're building digital systems or turning data into insights, you’ll deliver impact across operations, retail \& commercial, digital, finance, and more. You will work with business teams to design data\-driven tools that interpret, model and predict across transactional, geographical, system event and other data to create models, apps and dashboards, that power smarter decisions. Ideal for inquisitive, analytical thinkers with strong communication skills and backgrounds in Computational Thinking , Maths / Stats, Economics, Physics, Engineering, or Product Design. This is a structured 2\-year graduate programme. As a Data Innovation Graduate, you’ll work at the intersection of data, insight, and business decision ‑ making. Across your rotations, you’ll help transform complex data into clear, actionable insights that support smarter choices across daa . Depending on your placement, you could be: * Analysing large and diverse datasets to identify trends, patterns, and opportunities across airport operations, commercial and digital areas * Working with AI \& ML tools across cloud and on\-premise systems to accelerate \& transform how we use our data to solve business problems * Designing and delivering dashboards and reports that communicate insights clearly to business stakeholders * Working with teams to understand business questions, translating them into meaningful data analysis and measures * Supporting data ‑ driven decision ‑ making by evaluating performance, customer behaviour, and operational outcomes * Collaborating across multidisciplinary teams to ensure insights are understood, trusted, and used * Contributing to data products and analytical solutions that are scalable, well ‑ governed, and impactful At daa Labs, every day brings a new challenge—whether it's delivering cutting\-edge technology and data driven solutions to keep the airport running. The diversity of applications and data spans from airport operations, back\-office systems to commercial, digital and retail solutions, which makes this an uniquely dynamic and rewarding graduate opportunity. * **Not your average grad job** — it’s a launchpad for future tech leaders * **Hands\-on from day one** — build cloud infrastructure, apps, integrations and digital tools * **Real impact** — drive smarter decisions with data and innovation * **Data\-driven rotations** — design dashboards, build models, uncover insights * **Cross\-functional exposure** — work across cloud, cyber, BI, and more * **Innovation\-first culture** — your ideas matter and get implemented * **Build your portfolio** — solve real business problems, not just case studies As a **Data Innovation Graduate** , you’ll work at the intersection of data, insight, and business decision ‑ making. Across your rotations, you’ll help transform complex data into clear, actionable insights that support smarter choices across daa . Depending on your placement, you could be: * **Analysing large and diverse datasets** to identify trends, patterns, and opportunities across airport operations, commercial and digital areas * **Working with AI \& ML tools** across cloud and on\-premise systems to accelerate \& transform how we use our data to solve business problems * **Designing and delivering dashboards and reports** that communicate insights clearly to business stakeholders * **Working with teams to understand business questions** , translating them into meaningful data analysis and measures * **Supporting data** ‑ **driven decision** ‑ **making** by evaluating performance, customer behaviour, and operational outcomes * **Collaborating across multidisciplinary teams** to ensure insights are understood, trusted, and used * **Contributing to data products and analytical solutions** that are scalable, well ‑ governed, and impactful After submitting your application, you’ll be invited to complete an online assessment. This must be completed within 5 days of receiving the invitation—applications without a completed assessment within this timeframe will not be considered Responsibilities **Do you have what it takes?** We’re looking for curious minds and bold thinkers ready to shape the future of airport technology. To thrive in this programme, you should: * **Hold (or be expecting) a 2\.1 degree or higher** in a relevant field such as Computer Science, Engineering, Mathematics, Product Design, or related disciplines. * **Bring strong teamwork, communication, and interpersonal skills** — collaboration is at the heart of everything we do. * **Show ambition, integrity, and a growth mindset** — we want people who are eager to learn, adapt, and lead. * **Be resilient** — ready to take on challenges in a fast\-paced, ever\-evolving environment. * Qualifications **What We Are Offering You?** As a daa Data Innovation Graduate, you’ll enjoy a comprehensive package of benefits designed to support your growth, reward your performance, and set you up for long\-term success — both personally and professionally. From competitive compensation to world\-class development opportunities, you’ll be empowered to thrive in a collaborative, inclusive environment. **Programme benefits include:** * **Competitive salary** with a **performance\-related bonus** to reward your impact * **Flight subsidies and access to Fast Track** to help you stay connected and explore new destinations * **Support to earn Industry\-recognised certifications,** boosting your cloud skills and boosting your credibility in tech\-driven roles ( *Microsoft Azure Fundamentals, ITIL Foundation, Agile/SCRUM Master)* * **Structured learning and development** through tailored training, interactive workshops, hands\-on experience with Scrum and Project Management, technology platforms and engineering tools. * **Personalised coaching and mentoring** to guide your career journey * **Projects across** **daa’s** **business units** —including Airfield Operations, Airport Operations, Retail, and Commercial ecommerce often with direct placement in specialist teams * Exposure to **cutting\-edge technologies** in cloud and on\-premise tech including: MS Azure, Databricks, DevOps, GitHub, JIRA, Advanced ML, Oracle \& SQL Databases, Container applications and Enterprise systems * **A collaborative, inclusive culture** that values diversity, teamwork, and your unique contributions * **On\-site gym and pool** , plus social activities and volunteering opportunities to support your wellbeing and community engagement",https://ie.indeed.com/viewjob?jk=97f77ec15ef914c0
