title,company,location,site,description,job_url
Cloud Solutions Architect (Daily Rate),Fruition Group Ireland,"Dublin, County Dublin, Ireland",linkedin,"**Cloud Solutions Architect** **Daily Rate Contract (1 day onsite, Dublin City Centre) Ireland or UK** My Dublin based client is seeking an experienced Cloud Solutions Architect for a daily rate contract. The Cloud Architect will support a large\-scale digital and cloud transformation programme. This is a daily rate contract role focused on designing, delivering, and optimising secure, scalable cloud infrastructure solutions across AWS and/or Azure environments. You will operate within a Cloud Centre of Excellence style function, contributing hands\-on architecture expertise, establishing best practice patterns, and accelerating cloud adoption across enterprise platforms. **Key Responsibilities** * Design and deliver secure, scalable, and cost\-efficient cloud architecture solutions aligned to enterprise and regulatory requirements * Refine and translate business requirements into robust technical designs * Provide strategic guidance on cloud adoption, platform optimisation, and architectural best practice * Drive innovation and cost optimisation across public cloud environments * Present architectural solutions to both technical and non\-technical stakeholders * Ensure security\-by\-design principles are embedded across all solutions * Develop reusable, repeatable cloud patterns to accelerate delivery and reduce platform overhead * Collaborate with engineering teams to implement, deploy, and enhance cloud capabilities * Ensure solutions meet performance, reliability, and governance standards **Required Experience** * 5\+ years’ experience designing and implementing scalable cloud solutions * Strong background in modern cloud\-native architecture (microservices, serverless, containerisation) * Hands\-on Infrastructure as Code expertise (Terraform, CloudFormation) * Deep experience with at least one major cloud platform (AWS or Azure) * Experience designing or implementing Kubernetes solutions (preferably EKS or equivalent) * Proven ability to manage and optimise public cloud infrastructure environments * Strong stakeholder engagement and communication skills * Experience producing clear, structured architecture and design documentation **Desirable Experience** * Exposure to regulated or complex enterprise environments * Experience across both AWS and Azure * CI/CD and DevOps implementation using IaC tooling * Experience supporting cloud migration or transformation programmes **Certifications (Advantageous)** * AWS Certified Solutions Architect (or equivalent cloud certification)",https://www.linkedin.com/jobs/view/4404679372
Cloud Support Consultant,Codec,"Dublin, County Dublin, Ireland",linkedin,"We are seeking a highly skilled and solutions\-oriented Cloud Support Consultant with a strong focus on Microsoft Azure and Microsoft Cloud Infrastructure to join our growing technical support team. This role is a remote escalation position, responsible for resolving complex cloud related incidents, infrastructure issues, and technical challenges escalated from the Level 1 and Level 2 Team. The Cloud Support Consultant will be instrumental in ensuring the stability, security, and performance of customer environments hosted in Azure, while also assisting in the design and improvement of cloud systems and automation processes. **Key Responsibilites:** • Act as the primary escalation point for complex incidents that cannot be resolved by the Service Desk team. • Troubleshoot and resolve issues across Azure infrastructure, including Virtual Machines, Networking, Entra ID, and related PaaS/IaaS services. • Manage and maintain Azure subscriptions, resource groups, and policies across customer tenants. • Monitor system health and proactively identify areas for performance tuning or cost optimization. • Implement and support Conditional Access, Entra ID configurations, and Intune management for secure endpoint and identity control. • Deploy and maintain core Azure services such as: o Azure Virtual Networks, VPN Gateways, and NSGs o Azure Storage and Backup solutions • Provide advanced support for Microsoft 365, Exchange, Intune and Defender for Cloud, including integration and security posture recommendations. • Create and maintain PowerShell automation scripts for routine administrative and remediation tasks. • Configure and maintain monitoring policies for Windows, iOS and Android devices using third\-party tools (DattoRMM, NinjaRMM, etc.) or native Microsoft tools such as Intune • Collaborate with project engineers on new cloud implementations or migrations. • Document troubleshooting steps and solutions to enhance the Service Desk knowledge base. • Support continuous improvement by identifying recurring problems and proposing permanent technical fixes. **Skills, Knowledge \& Expertise:** Essential: • 5\+ years’ experience in a technical support or cloud engineering role, preferably within a managed services or enterprise environment. • Strong hands\-on experience with Microsoft Azure (IaaS, PaaS, and security components). • Solid understanding of Entra ID, Conditional Access, Identity Protection, and Security/Defender solutions. • Proven troubleshooting skills across Azure Networking, VM connectivity, and security baselines. • Strong understanding of Azure Virtual Desktop technologies. • Strong PowerShell scripting ability for automation and configuration. • Working knowledge of Intune, Exchange, Defender for Endpoint/Identity, and Microsoft 365 administration. • Understanding of patching and monitoring policies in live customer environments • Familiarity with ARM templates, Azure Policy, and Resource Locks. • Excellent communication skills, both written and verbal, with an emphasis on customer experience and clarity. • Ability to work independently, manage priorities, and maintain accurate case documentation. Desirable: • Microsoft Certified: Azure Administrator Associate (AZ\-104\) or higher (Solutions Architect, etc.). • Certifications in Microsoft Security such as SC\-200, SC\-300, SC\-400, SC900, SC\-100, AZ\-500 • Experience integrating Azure with on\-premises environments (Entra ID Connect, hybrid networking, etc.). • Exposure to Terraform, Bicep, or Azure DevOps pipelines. • Understanding of ITIL processes and service delivery frameworks. • Familiarity with ISO Standards or other compliance frameworks. Skills/Behavioural Competencies: • Analytical thinker with strong problem\-solving abilities. • Calm and methodical under pressure, capable of managing critical incidents effectively. • Self\-driven and proactive in identifying and resolving systemic issues. • Strong collaborator who communicates well with both technical and nontechnical stakeholders. • Passionate about continuous learning and staying up\-to\-date with the evolving Microsoft cloud ecosystem.",https://www.linkedin.com/jobs/view/4407190638
Cloud Support Consultant,Codec,"Dublin, D, IE",indeed,"### **Description** We are seeking a highly skilled and solutions\-oriented Cloud Support Consultant with a strong focus on Microsoft Azure and Microsoft Cloud Infrastructure to join our growing technical support team. This role is a remote escalation position, responsible for resolving complex cloud related incidents, infrastructure issues, and technical challenges escalated from the Level 1 and Level 2 Team. The Cloud Support Consultant will be instrumental in ensuring the stability, security, and performance of customer environments hosted in Azure, while also assisting in the design and improvement of cloud systems and automation processes. ### **Key Responsibilities** * Act as the primary escalation point for complex incidents that cannot be resolved by the Service Desk team. * Troubleshoot and resolve issues across Azure infrastructure, including Virtual Machines, Networking, Entra ID, and related PaaS/IaaS services. * Manage and maintain Azure subscriptions, resource groups, and policies across customer tenants. * Monitor system health and proactively identify areas for performance tuning or cost optimization. * Implement and support Conditional Access, Entra ID configurations, and Intune management for secure endpoint and identity control. * Deploy and maintain core Azure services such as: o Azure Virtual Networks, VPN Gateways, and NSGs o Azure Storage and Backup solutions * Provide advanced support for Microsoft 365, Exchange, Intune and Defender for Cloud, including integration and security posture recommendations. * Create and maintain PowerShell automation scripts for routine administrative and remediation tasks. * Configure and maintain monitoring policies for Windows, iOS and Android devices using third\-party tools (DattoRMM, NinjaRMM, etc.) or native Microsoft tools such as Intune * Collaborate with project engineers on new cloud implementations or migrations. * Document troubleshooting steps and solutions to enhance the Service Desk knowledge base. * Support continuous improvement by identifying recurring problems and proposing permanent technical fixes. ### **Skills, Knowledge and Expertise** Essential: * 5\+ years’ experience in a technical support or cloud engineering role, preferably within a managed services or enterprise environment. * Strong hands\-on experience with Microsoft Azure (IaaS, PaaS, and security components). * Solid understanding of Entra ID, Conditional Access, Identity Protection, and Security/Defender solutions. * Proven troubleshooting skills across Azure Networking, VM connectivity, and security baselines. * Strong understanding of Azure Virtual Desktop technologies. * Strong PowerShell scripting ability for automation and configuration. * Working knowledge of Intune, Exchange, Defender for Endpoint/Identity, and Microsoft 365 administration. * Understanding of patching and monitoring policies in live customer environments * Familiarity with ARM templates, Azure Policy, and Resource Locks. * Excellent communication skills, both written and verbal, with an emphasis on customer experience and clarity. * Ability to work independently, manage priorities, and maintain accurate case documentation. Desirable: * Microsoft Certified: Azure Administrator Associate (AZ\-104\) or higher (Solutions Architect, etc.). * Certifications in Microsoft Security such as SC\-200, SC\-300, SC\-400, SC900, SC\-100, AZ\-500 * Experience integrating Azure with on\-premises environments (Entra ID Connect, hybrid networking, etc.). * Exposure to Terraform, Bicep, or Azure DevOps pipelines. * Understanding of ITIL processes and service delivery frameworks. * Familiarity with ISO Standards or other compliance frameworks. Skills/Behavioural Competencies: * Analytical thinker with strong problem\-solving abilities. * Calm and methodical under pressure, capable of managing critical incidents effectively. * Self\-driven and proactive in identifying and resolving systemic issues. * Strong collaborator who communicates well with both technical and nontechnical stakeholders. * Passionate about continuous learning and staying up\-to\-date with the evolving Microsoft cloud ecosystem. ### **About Codec** Established over 40 years ago, Codec is a multi\-award\-winning Microsoft Solutions Partner, trusted by public and private sector organisations to deliver impactful digital transformation. With offices in **Dublin**, **Belfast**, **Cologne**, and across **Germany**, our team of over **300 experts** specialises in harnessing the full potential of Microsoft technologies—including **Dynamics 365**, **Power Platform**, **Azure**, and **Copilot**—to drive innovation, automation, and operational excellence. Codec combines deep industry expertise with a proven track record to help organisations unlock the power of AI and modern cloud solutions Though originally best known as a hardware reseller, since 2010 Codec has focused on building an outstanding software consulting business with a team of experts implementing enterprise solutions using products from Microsoft and Oracle. Our customer base, revenues and average contract values have grown steadily year on year and we continue to invest in the provision of new product and service offerings. Our team is a careful mix of recent graduates and experienced professionals from a variety of diverse cultural backgrounds. We are a melting pot of seasoned consultants supported by the best talent from the local universities. We have a thriving placement student academy and graduate recruitment programme which grows year on year. This company is an equal opportunities employer",https://ie.indeed.com/viewjob?jk=3e4a7d62c77f93ae
Corporate Tax Consultant,RSM Ireland,"Dublin, County Dublin, Ireland",linkedin,"**About RSM** As one of the world’s largest networks of audit, tax, and consulting firms, RSM is committed to delivering big ideas and premium service to help middle\-market businesses thrive. We are a fast\-growing firm with big ambitions – we have a clear goal to become the premium adviser to the middle market, globally. This vision touches everything we do, motivating and inspiring us to become better every day. If you are looking for a firm where you can build a future and make an impact, then RSM is the place for you. RSM Ireland is one of the country’s fastest growing advisory firms, specialising in the provision of audit, tax and consulting services to leading domestic and international mid\-market clients. We are a key member of the RSM International network and work closely with over 64,000 colleagues in 820 offices, spanning over 120 countries. RSM International is the world’s most rapidly growing accountancy network and currently ranked number six globally. When you join RSM you’ll have a world of opportunity to build the career you want. It’s your future. Own it at RSM. Our clients range from growth\-focused entrepreneurial businesses through to multi\-national organisations across many sectors and operating nationally and across borders. **The Opportunity** RSM have a new and exciting opportunities for a qualified tax professional to join our team in a hybrid, work\-from\-home environment. At RSM Ireland, our Tax team offer a full spectrum of tax services led by subject matter experts. Our tax professionals have the opportunity to work across industry sectors while at the same time working to develop a core tax specialism. The successful candidate will join our Corporate tax team, working with FDI businesses, predominantly clients in the technology, life sciences and manufacturing sectors. The role will involve an equal balance of compliance and advisory assignments for a portfolio of clients and will entail close collaboration with cross\-border RSM teams in delivering client projects. We are a fast\-growing tax team and are keen to develop our future tax leaders, and you will be given the opportunity to expand your experience and develop your career in a professional, innovative and supportive environment. **Responsibilities Will Include, But Are Not Limited To** * Assisting in the management of a portfolio of corporate tax clients. * Working with Partners and senior management in the delivery of tax consultancy projects. * Collaborating with RSM international colleagues on cross\-border client projects. * Coaching and mentoring Tax Associates, including presenting in\-house tax training courses. * Full commercial management for a portfolio of client work. * Contributing to business development initiatives. **The successful candidate should have the following:** * ITI and/or ACA or ACCA qualified. * Strong technical competence in domestic and international corporate tax matters. * Experience in coaching and mentoring junior staff. * Very strong communication and organisational skills. *\#RSM is an equal opportunity employer.*",https://www.linkedin.com/jobs/view/4207936292
Customer Service Representative II,Stericycle,"Dublin, D, IE",indeed,"**About Us:** ------------- Stericycle is a U.S. based business\-to\-business services company and leading provider of compliance\-based solutions that protects people and brands, promotes health and well\-being, and safeguards the environment. Since our founding over 30 years ago, we have grown from a small start\-up in medical waste management into a leader across a range of increasingly complex and highly regulated arenas, serving healthcare organizations and commercial businesses of every size. Every day, we help our customers solve complex challenges by safely managing materials that could otherwise spread disease, contaminate the environment, or compromise one’s identity. Join us on our mission to protect health and well\-being in a safe, responsible, and sustainable way. **Position Purpose:** --------------------- As part of a busy transport team, our Customer Service Representatives (Class C drivers) are responsible for the collection, destruction, movement and unloading of confidential waste paper and electronic storage devices on behalf of various customers within the professional, financial and retail industries. **Key Job Activities:** ----------------------- Working a 40\-hour week over 4 days and acting as a key point of customer contact, you will also be expected to reconcile/complete all relevant documentation and issue a certificate of destruction via a hand\-held terminal. Remove the console bags from each console and tie them tightly so no paper escapes while transferring to the truck. Ensure that no material is left in the console. Replace the console bag with an empty bag and lock the console. Take material directly to the shredder truck and proceed to shred. Make sure the truck gates are secure so that none of the contents escape from the truck during the shred. Immediately upon completion of the shredding locate the client's for signature. Give and explain certificate of destruction to client. Record time shred was completed. **Education:** -------------- Junior and Leaving Certificates. **Experience (EMEAA):** ----------------------- Relevant driving experience and a Class C licence, along with a full driver CPC card. The ability to undertake heavy lifting and physically demanding work, involving the safe movement of large wheeled trolleys on and off vehicles. Excellent customer service skills and plenty of flexibility around working hours. Ability to read and understand client information sheets. Ability to write clear messages on daily reporting sheets. **Certifications and/or Licenses:** ----------------------------------- **Benefits:** ------------- Stericycle offers you: * Contributory Pension Scheme * Life Insurance * Access to SteriCares, our employee support fund * Stericycle University – Our online library of self\-development \& learning * Annual performance related pay review. * Referral Scheme (Earn by introducing people in your network to the Stericycle family) * Flu voucher * Eye Test voucher And more… ***Disclaimer:*** ----------------- The above description is meant to provide a summary of the nature and level of work being performed; it should not be construed as an exhaustive list of all responsibilities, duties and requirements of the job. This document does not create an employment contract, implied or otherwise, and it does not constitute any right or guarantee of employment condition. This position is open to people with disabilities. Stericycle will consider requests for workplace accommodations for protected physical or mental limitations in accordance with its human resources and risks prevention policies and local laws. To the extent permissible under local law, and consistent with business necessity, Stericycle reserves the right to modify the content formally or informally, either verbally or in writing, at any time with or without advance notice.",https://ie.indeed.com/viewjob?jk=fd9e822d20293499
Customer Success Associate - Dublin,Datadog,"Dublin, County Dublin, Ireland",linkedin,"As a Customer Success Associate, you will focus on the long term strategic relationship with our customers, drive adoption, and identify growth opportunities across a high volume of Datadog customers to ensure successful product use and retention. You’ll be an advocate for the customer internally and focus on providing a positive experience for a high volume of accounts. Associates follow a well\-defined methodology to identify the customer’s unique needs and clearly convey the value of the Datadog product. As we scale our Customer Success team, furthering personal development and team success is a top priority. *At Datadog, we place value in our office culture \- the relationships and collaboration it builds and the creativity it brings to the table. We operate as a hybrid workplace to ensure our Datadogs can create a work\-life harmony that best fits them* **What You’ll Do:** * Identify target opportunities, manage the full sales cycle and proactively build strategic relationships with customers and focus on retention. * Manage requests from your book of business such as but not limited to technical support escalations, billing questions, documentation/enablement requests to ensure a positive customer experience * Pivot account management strategy based on different customer requirements and needs seamlessly and efficiently * Act as an advisor to customers to ensure they’re leveraging the solution effectively * Monitor and identify usage trends to uncover renewal risks and support greater adoption rates * Collaborate cross\-functionally with internal Datadog teams (support, product, finance, and legal) **Who You Are:** * Customer\-minded, always trying to provide the most value possible * Driven and motivated by a career in sales with a strong desire to grow a career in Customer Success. * A strong communicator (written and verbal) with excellent attention to detail * Experienced in independently negotiating contract terms and overcoming pricing objections for up\-sell/cross sell activities * 0\-2 years of experience in a customer account facing role and desire to grow a career in Customer Success * Passionate about building long term and lasting relationships *Datadog values people from all walks of life. We understand not everyone will meet all the above qualifications on day one. That's okay. If you’re passionate about technology and want to grow your skills, we encourage you to apply.* **Benefits and Growth:** * Best\-in\-breed onboarding * Sales training in MEDDIC and Command of the Message * An inclusive company culture, opportunity to join our Community Guilds * Intra\-departmental mentor and buddy program for in\-house networking * Continuous professional development, product training, and career pathing * New hire stock equity (RSU) and employee stock purchase plan (ESPP) * Generous global benefits *Benefits and Growth listed above may vary based on the country of your employment and the nature of your employment with Datadog.* **About Datadog:** Datadog (NASDAQ: DDOG) is a global SaaS business, delivering a rare combination of growth and profitability. We are on a mission to break down silos and solve complexity in the cloud age by enabling digital transformation, cloud migration, and infrastructure monitoring of our customers’ entire technology stacks. Built by engineers, for engineers, Datadog is used by organizations of all sizes across a wide range of industries. Together, we champion professional development, diversity of thought, innovation, and work excellence to empower continuous growth. Join the pack and become part of a collaborative, pragmatic, and thoughtful people\-first community where we solve tough problems, take smart risks, and celebrate one another. Learn more about \#DatadogLife on Instagram, LinkedIn, and Datadog Learning Center. **Equal Opportunity at Datadog:** Datadog is proud to offer equal employment opportunity to everyone regardless of race, color, ancestry, religion, sex, national origin, sexual orientation, age, citizenship, marital status, disability, gender identity, veteran status, and other characteristics protected by law. We also consider qualified applicants regardless of criminal histories, consistent with legal requirements. Here are our Candidate Legal Notices for your reference. Datadog endeavors to make our Careers Page accessible to all users. If you would like to contact us regarding the accessibility of our website or need assistance completing the application process, please complete this form. This form is for accommodation requests only and cannot be used to inquire about the status of applications. **Privacy and AI Guidelines:** Any information you submit to Datadog as part of your application will be processed in accordance with Datadog’s Applicant and Candidate Privacy Notice. For information on our AI policy, please visit Interviewing at Datadog AI Guidelines.",https://www.linkedin.com/jobs/view/4407192623
