title,company,location,site,description,job_url
Managing Consultant,Delta Capita,"Dublin, County Dublin, Ireland",linkedin,"**Job Description** **MANAGING CONSULTANT** **Dublin** **Fixed Term Contract / Permanent** **Role Summary** This is a fantastic opportunity to join our fast\-growing Consulting Business working with some of the world’s leading financial institutions. As a **Managing Consultant** , the successful candidate will work directly with our clients to ensure they receive the quality consulting services that Delta Capita (DC) offers. The ideal candidate will have a deep understanding of financial services, exceptional problem\-solving skills, project management and business analysis experience, the ability to manage, motivate and inspire others, and a proven track record of delivering successful client engagements. You will have deep change management experience and prior success as a management consultant or within a change role in a financial services institution. To know more about our Consulting services, click here Consulting \- Delta Capita. **Job Requirements** **The Role and Responsibilities** This role is ideal for someone with the right mix of consulting and client management experience as well as having an entrepreneurial spirit. You will combine project delivery know\-how, a can\-do attitude, and a strong knowledge of Financial Services. **Project responsibilities include;** * Coordinate delivery of project tasks from initiation to closure, including definition of project scope and objectives, budgetary considerations, resource allocation \& training, formal documentation, delivery, monitoring and control, reporting and delivery assurance. * Day to day management and central point of contact for the project * Manage changes to the project scope, project schedule and project costs using appropriate verification techniques * Create and maintain all project documentation e.g., Terms of reference/ project charters, project plans, status reports. * Establish and maintain governance processes including stakeholder mapping, governance forums (e.g. Operating \& Steering Committees) and all supporting documentation * Design \& deliver documentation to support the successful operational implementation * Identify opportunities to streamline operational process relevant to the project * Manage and oversee project plan and RAID log (Risks, Assumptions, Issues, Dependencies) * Actively manage risks and issues, escalating to senior management and client stakeholders where required to ensure they are appropriately and quickly addressed, documenting as ‘lessons learnt’ once resolved * Build and manage relationships with project stakeholders, ensuring appropriate level and frequency of communication * Ensure decisions and outcomes are formally documented via minutes, sign\-offs, project documentation or any other client specific tools * Define, gather and collate meaningful KPIs and dashboards for management reporting * Undertake other Transformation \& Change lifecycle roles/responsibilities as required **As An Experienced Managing Consultant, You Will Have** * Proven Consulting experience or alternatively in Project Management or Business Analysis within Financial Services. * Change management experience: Strategy, Design, Analysis, Project Management, Build Testing, Go\-Live. * Understanding of Financial Services products and lifecycle events – Trade Finance experience is desired * Risk and control awareness in a banking environment * Experience managing projects and team members supporting successful project/programme deliveries. * Good knowledge of the capital markets and retail banking eco\-system and participants * You will come from a management consultant background or within a change role in a financial services institution. You must have a blend of both Financial Services knowledge and soft skills across influence, listening, presentation and team management. * As an experienced Consultant, you will be expected to be comfortable working on an independent basis and managing your own workload with minimal supervision. * You will also be responsible for helping to grow our business by supporting ongoing operations, RFPs and helping to manage junior consultants. **How We Work** Delta Capita is an equal opportunity employer. We positively encourage applications from suitably qualified and eligible candidates regardless of age, colour, disability, national origin, ancestry, race, religion, gender, sexual orientation, gender identity and/or expression, veteran status, genetic information, or any other status protected by applicable law. We will ensure that individuals with disabilities are provided reasonable accommodation to participate in the job application or interview process, to perform essential job functions, and to receive other benefits and privileges of employment. If you require any reasonable adjustments through your interview process, please use the designated space within the application questionnaire. This is fixed term contract position located in Dublin, Ireland. As the selection and interview process is ongoing, please submit your application as soon as possible. If your profile is selected, a member of our team will contact you within 4 weeks. For this role, a valid working permit for Ireland is mandatory. **Who We Are** Delta Capita Group (a member of the Prytek Group) is a global managed services, consulting, and solutions provider with a unique combination of experience in Financial Services and technology innovation capability. Our mission is to reinvent the financial services value chain providing technology based mutualized services for financial institutions for non\-differentiating services. **Our 3 Offerings Are** * Managed Services * Consulting \& Solutions * Technology To know more about Delta Capita and our culture click here: Working at DC \- Delta Capita.",https://www.linkedin.com/jobs/view/4396465146
Managing Consultant,Delta Capita,"Dublin, D, IE",indeed,"**MANAGING CONSULTANT** **Dublin** **Fixed Term Contract / Permanent** **Role Summary** This is a fantastic opportunity to join our fast\-growing Consulting Business working with some of the world’s leading financial institutions. As a **Managing Consultant**, the successful candidate will work directly with our clients to ensure they receive the quality consulting services that Delta Capita (DC) offers. The ideal candidate will have a deep understanding of financial services, exceptional problem\-solving skills, project management and business analysis experience, the ability to manage, motivate and inspire others, and a proven track record of delivering successful client engagements. You will have deep change management experience and prior success as a management consultant or within a change role in a financial services institution. To know more about our Consulting services, click here Consulting \- Delta Capita. **The Role and Responsibilities** This role is ideal for someone with the right mix of consulting and client management experience as well as having an entrepreneurial spirit. You will combine project delivery know\-how, a can\-do attitude, and a strong knowledge of Financial Services. **Project responsibilities include;** * Coordinate delivery of project tasks from initiation to closure, including definition of project scope and objectives, budgetary considerations, resource allocation \& training, formal documentation, delivery, monitoring and control, reporting and delivery assurance. * Day to day management and central point of contact for the project * Manage changes to the project scope, project schedule and project costs using appropriate verification techniques * Create and maintain all project documentation e.g., Terms of reference/ project charters, project plans, status reports. * Establish and maintain governance processes including stakeholder mapping, governance forums (e.g. Operating \& Steering Committees) and all supporting documentation * Design \& deliver documentation to support the successful operational implementation * Identify opportunities to streamline operational process relevant to the project * Manage and oversee project plan and RAID log (Risks, Assumptions, Issues, Dependencies) * Actively manage risks and issues, escalating to senior management and client stakeholders where required to ensure they are appropriately and quickly addressed, documenting as ‘lessons learnt’ once resolved * Build and manage relationships with project stakeholders, ensuring appropriate level and frequency of communication * Ensure decisions and outcomes are formally documented via minutes, sign\-offs, project documentation or any other client specific tools * Define, gather and collate meaningful KPIs and dashboards for management reporting * Undertake other Transformation \& Change lifecycle roles/responsibilities as required **As an experienced Managing Consultant, you will have:** * Proven Consulting experience or alternatively in Project Management or Business Analysis within Financial Services. * Change management experience: Strategy, Design, Analysis, Project Management, Build Testing, Go\-Live. * Understanding of Financial Services products and lifecycle events – Trade Finance experience is desired * Risk and control awareness in a banking environment * Experience managing projects and team members supporting successful project/programme deliveries. * Good knowledge of the capital markets and retail banking eco\-system and participants * You will come from a management consultant background or within a change role in a financial services institution. You must have a blend of both Financial Services knowledge and soft skills across influence, listening, presentation and team management. * As an experienced Consultant, you will be expected to be comfortable working on an independent basis and managing your own workload with minimal supervision. * You will also be responsible for helping to grow our business by supporting ongoing operations, RFPs and helping to manage junior consultants. **How We Work:** Delta Capita is an equal opportunity employer. We positively encourage applications from suitably qualified and eligible candidates regardless of age, colour, disability, national origin, ancestry, race, religion, gender, sexual orientation, gender identity and/or expression, veteran status, genetic information, or any other status protected by applicable law. We will ensure that individuals with disabilities are provided reasonable accommodation to participate in the job application or interview process, to perform essential job functions, and to receive other benefits and privileges of employment. If you require any reasonable adjustments through your interview process, please use the designated space within the application questionnaire. This is fixed term contract position located in Dublin, Ireland. As the selection and interview process is ongoing, please submit your application as soon as possible. If your profile is selected, a member of our team will contact you within 4 weeks. For this role, a valid working permit for Ireland is mandatory. **Who We Are:** Delta Capita Group (a member of the Prytek Group) is a global managed services, consulting, and solutions provider with a unique combination of experience in Financial Services and technology innovation capability. Our mission is to reinvent the financial services value chain providing technology based mutualized services for financial institutions for non\-differentiating services. **Our 3 offerings are:** * Managed Services * Consulting \& Solutions * Technology To know more about Delta Capita and our culture click here: Working at DC \- Delta Capita.",https://ie.indeed.com/viewjob?jk=f512d8d3e7958ca0
Microsoft SharePoint Architect,Codec,"Dublin, D, IE",indeed,"### **Description** As we continue to experience rapid growth, we are seeking a highly skilled SharePoint Architect to join our team. The successful candidate will provide expert\-level support, administration, and consultancy across Microsoft SharePoint environments both on\-premises (SharePoint Server 2013/2016/2019 \& Subscription Edition) and SharePoint Online. The role combines advanced troubleshooting and incident resolution with the delivery of enhancements and change for our customers. Working closely with business stakeholders and technical teams, the consultant will ensure SharePoint solutions are optimised, secure, and aligned with business requirements. ### **Key Responsibilities** * Troubleshoot complex technical issues across SharePoint, Microsoft 365, Teams, and integrated systems; perform root cause analysis for recurring issues and implement permanent fixes. * Manage and maintain (SharePoint Server 2013/2016/2019 \& Subscription Edition), including site collections, permissions, content databases, and service applications. * Configure, monitor, and optimise performance, security, and availability. * Support migration projects (on\-premises to SharePoint Online, tenant\-to\-tenant, or version upgrades). * Develop and support custom solutions using SharePoint Framework (SPFx), TypeScript, React, and modern web technologies. * Build and maintain solutions using Power Platform (Power Automate, Power Apps, Power BI). ### **Skills, Knowledge and Expertise** **Required skills \& experience** * Minimum 5\-8 years' hands\-on experience with Microsoft SharePoint, including architecture, service applications, and administration. * SP data migrations (experience of Sharegate \- who also has good experience of PP/CE) * Proficiency across the Microsoft 365 ecosystem (Teams, OneDrive, Exchange Online). * Experience with PowerShell scripting for automation and troubleshooting. * Experience working within ticketing systems and SLA\-driven environments. **Desirable skills \& experience** * 5\+ years' experience with Power Platform technologies (Power Automate, Power Apps, Power BI). * Experience with migration tooling such as Sharegate, AvePoint Fly, or LinkFixer Advanced. * Experience with Teams Phone (Voice). ### **About Codec** Established over 40 years ago, Codec is a multi\-award\-winning Microsoft Solutions Partner, trusted by public and private sector organisations to deliver impactful digital transformation. With offices in **Dublin**, **Belfast**, **Cologne**, and across **Germany**, our team of over **300 experts** specialises in harnessing the full potential of Microsoft technologies—including **Dynamics 365**, **Power Platform**, **Azure**, and **Copilot**—to drive innovation, automation, and operational excellence. Codec combines deep industry expertise with a proven track record to help organisations unlock the power of AI and modern cloud solutions Though originally best known as a hardware reseller, since 2010 Codec has focused on building an outstanding software consulting business with a team of experts implementing enterprise solutions using products from Microsoft and Oracle. Our customer base, revenues and average contract values have grown steadily year on year and we continue to invest in the provision of new product and service offerings. Our team is a careful mix of recent graduates and experienced professionals from a variety of diverse cultural backgrounds. We are a melting pot of seasoned consultants supported by the best talent from the local universities. We have a thriving placement student academy and graduate recruitment programme which grows year on year. This company is an equal opportunities employer",https://ie.indeed.com/viewjob?jk=b6f870afd6763bc5
Operational Risk Associate,Pantheon Ventures,"Dublin, D, IE",indeed,"Pantheon has been at the forefront of private markets investing for more than 40 years, earning a reputation for an innovative approach to investing in secondaries, co\-investments, and primary fund investments, as well as capital formation across commingled funds, evergreen vehicles and customized solutions. Our specialist investment capabilities span multiple strategies across private equity, infrastructure and real assets, and private credit. Through our collaborative and committed culture, we find new ways to solve complex problems together and deliver innovative investment opportunities across private markets. Pantheon currently manages approximately $82\.3 billion in AUM across all its strategies, serving more than 750 institutional and 638 private wealth clients worldwide For further details please visit www.pantheon.com **Purpose of Role** The Operational Risk Associate will be part of the wider Enterprise Risk / Operational Risk function and support the team in further developing and managing operational risks across all business functions. The position will report to the Head of Enterprise/Operational Risk. **Key Responsibilities** * Support the development and implementation of Pantheon's global operational risk frameworks and policies and procedures for adoption by Pantheon Group entities * Support the ISAE 3402/SSAE 16 annual processes including completion of the document, drafting of controls wording and providing external auditor with supporting information. * Support process and control reviews to identify risks and issues in Pantheon's control environment. Reviews will include identified areas of risk, monitoring programme and new business processes. * Manage Error/Incident reporting process including reporting to management and resolution of any issues. Ensure monitoring procedures are in line with Pantheon's risk policies. Direct investigation of serious error or breaches and make recommendations for change to management * Co\-ordinate and assist in providing risk oversight and governance across third party supplier relationships of all Pantheon Group entities * Support business continuity process including BCP and testing programme. * Support to manage various risk\-related frameworks such as the data privacy / data protection, vendor risk, Insurance risk, and assist with any client / business related queries * Support and further develop a centralised library of processes, risks and controls in a strategic risk system **Skills** **and Experience Required** * Degree level education * Experience of working in a risk function ideally in an investment banking, asset management, private equity environment * Understanding of investment management and products * Ability to work on own initiative and in team * Ability to identify when issues should be escalated for further discussion * Controls awareness * Keen problem\-solving skills, ability to offer solutions to issues \#LI\-SB1 **This job description is not to be construed as an exhaustive statement of duties, responsibilities, or requirements. You may be required to perform other job\-related duties as reasonably requested by your manager.** **Pantheon is an Equal Opportunities employer, we are committed to building a diverse and inclusive workforce so if you're excited about this role but your past experience doesn't perfectly align we'd still encourage you to apply.**",https://ie.indeed.com/viewjob?jk=a4975a2c80c35583
Operations Assistant,Royal College of Surgeons in Ireland (RCSI),"Dublin, County Dublin, Ireland",linkedin,"**Title:** Operations Assistant **Department:** Faculty of Radiologists and Radiation Oncologists **Tenure:** Permanent \- Full\-time **Location:** RCSI, St Stephen’s Green, Dublin 2 **Reporting to:** Dean of the Faculty or nominee **About the post** This post is designed to provide a comprehensive administrative support service to the Dean, Honorary Secretary and Officers of the Board of the Faculty of Radiologists and Radiation Oncologists with specific emphasis on the Faculty training programmes. This role is an integral part of the Faculty ideally suited for an ambitious individual to support trainees on their journey from application to graduation along with ad\-hoc events and projects within the Faculty. **Duties include:** * Act as the key point of contact for trainees, fellows, training coordinators, clients and stakeholders * Support trainee recruitment to the programmes through response to enquiries, liaising with prospective trainees, follow up with applicants and management of the online training programme systems * Assisting with the organisation and operation of scientific meetings, functions, conferring ceremonies, board and committee meetings and other events associated with the Faculty. * Assisting with organising and running of training courses, modules, interviews and assessments * Work collaboratively with the National Training Coordinators, lecturers, trainees and other Operations Assistants to ensure effective running of courses and delivery of a highly flexible, responsive and effective service to all * Assist with preparing documentation for accreditation and site visits for both radiation oncology and diagnostic radiology training programmes * Maintain training passports for trainees and ensure these are up to date for all individuals, ensuring all mandatory courses completed for CSCST purposes * Maintain the educational calendar for all Faculty courses throughout the year and updating MedHub with training courses, modules, lectures and recordings * Attend all operational educational meetings and discuss any changes on the calendar and manage and coordinate ongoing requirements for courses as they arise * Preparing training programme specialty rotations, lecture schedules, recordings as required. * Provision of assistance to tutors in the set up of zoom and uploading of tutors presentations for lecture purposes in the lecture theatre/tutorial room * Updating Hospital Buddy with dates for lectures and circulation details for lectures to both tutors and SpRs * Updating MedHub with tutors slides for revision purposes for SpRs * Support the delivery of online modules, courses, webinars and conferences in line with faculty requirements as they arise * Collating programme outcomes into documented reports in support of programmatic review and continuous quality improvement * Preparation and collation of the Faculty Annual Report * Providing assistance to the Executive Officer * Reviewing and updating the Faculty website with relevant information, reports, publications, news etc * Collation and circulation of all information and documentation for meetings. Preparing and taking minutes as required and keeping Sharepoint updated * Assist with the preparation and completion of circulars for Fellows and trainees * Assist with processing of expense claims for board and committee members, lecturers, visiting speakers, trainee discretionary fund in line with Faculty, RCSI and NDTP policies * Coordinate the ordering and supply of stationery and materials for the faculty within the budget limits * Undergo programmes of training and development as may be required from time to time * Completion of the annual mandatory staff courses and training in technology * Complying with statutory legislation and department rules and requirements in furtherance of own and general staff welfare and safety * Representing the best interests of the Faculty of Radiologists and Radiation Oncologists and RCSI at all times * Performing such other duties appropriate to the post as may arise from time to time **Person specification** * Strong communication and interpersonal skills appropriate to audience and situation * Have strong customer service skills and communicate with high level of diplomacy and confidentiality * Ability and sensitivity to operate and liaise with busy and highly skilled professionals with differing priorities, geographic bases etc. * Team player – ability to work collaboratively alongside others to maximise individuals and team effectiveness in order to achieve required service outputs * Highly organised with an acute attention to detail and follow through, giving full consideration to all aspects of the task / project including potential issues and wider impact on Faculty activities and functions * Excellent computerised administration skills * Excellent time and management skills * Ability to make decisions, identify, prioritise workload and meet deadlines and escalate problems when necessary * Ability to work on own initiative * Can operate flexibly within a busy and changing environment; can shift focus when required, act decisively and prioritise several tasks to meet deadlines * Flexibility with working hours when required **Knowledge and experience (essential):** * Understanding of accounting and budgets * Proficient in administrative and educational programmes and platforms such as Microsoft Office Suite, Panopto, Quercus, Zoom, social medial platform X etc **Knowledge and experience (desirable):** * Understanding of medical working environment and legal parameters * Proven track record in a similar role would be advantageous ***We are all too aware that imposter syndrome and the confidence gap can sometimes stop fantastic candidates putting themselves forward, so please do submit an application — we’d love to hear from you.***",https://www.linkedin.com/jobs/view/4394622231
