title,company,location,site,description,job_url
Entry-Level English Teacher (ESL) | No Experience Needed,English 1,"Dublin, County Dublin, Ireland",linkedin,"**Launch Your International Career with Purpose and Adventure** Are you searching for a **rewarding, entry\-level job** that lets you **travel the world** , **work abroad** , and gain **real\-world experience** all while making a difference? Whether you're a **recent graduate** , exploring a **career change** , or an **ESL/TEFL\-certified teacher** ready to take your skills overseas, this is the opportunity you’ve been looking for. **English 1** is now hiring **motivated, globally minded individuals** for **full\-time English teaching jobs in China** . No teaching experience? No problem. We provide **full training** , **ready\-made teaching materials** , and **visa sponsorship,** making this the perfect **graduate job** , **first job** , or **international career move** for anyone ready to start something new. **What you'll do** * Teach English to young learners aged 3–16 in a fun, interactive, and immersive classroom setting. * Deliver high\-energy lessons using English 1’s award\-winning curriculum and digital tools. * Provide constructive feedback and help students build confidence in their English skills. * Take part in school events, cultural activities, and student engagement programs. **What you’ll get** * Competitive salary \+ performance bonus after 6 months * 21 days paid leave (10 days paid leave \+ 11 days statutory holidays) * Flight allowance * International health insurance (co\-paid) * Airport pick\-up support * \*\*Sponsored legal Z work visa \+ up to 2 weeks sponsored hotel stay * Comprehensive induction training, ongoing support, and fully prepared teaching materials * TEFL certificate \+ skill development \& career advancement * Distance learning courses (Level 6 Trinity College CertPT, DELTM) * English 1\-organized social and cultural activities \+ free Mandarin Chinese lessons *The hotel accommodation for the first two weeks will be deemed as a sponsorship upon successful completion of the first\-year contract. \*\*Sponsored legal Z work visa expenses will be reimbursed.* **Who we’re looking for** * A bachelor’s degree (in any subject) * A valid passport from the UK, US, Canada, Ireland, Australia, New Zealand, or South Africa. * A genuine interest in education, travel, and cultural exchange. * ESL certification (TEFL, TESOL, CELTA) is a plus\- we can sponsor * Clean background check. **Why work at English 1?** * Teachers are at the core of everything we do at English 1 * Over **30 years** of success in China with **200\+ schools** in **50\+ cities** . * Strong presence in **China** and **Indonesia** . * **Professional development** and career **advancement opportunities** . Whether you're graduating soon, pivoting into a new career, or seeking international experience, this opportunity offers a chance to teach, travel, and grow \#EntryLevel \#Graduates \#EnglishTeacher \#ESL \#TEFL \#TeachingJobs \#GraduateJobs \#hiring \#jobs \#entrylevel \#teachercns \#graduates \#esl \#tefl \#teach \#JobAlert \#NowHiring \#JobOpening \#CareerOpportunities \#JobSearch \#WorkWithUs \#LinkedInJobs \#JobSeeker \#OpenToWork \#CareerGoals \#JobHunt \#NewJob \#CollegeGraduates \#BachelorsDegree \#RecentGrad \#ClassOf2025 \#JobSearch \#CareerSuccess \#EntryLevelJobs \#HiringNow \#YoungProfessionals \#CareerGrowth \#Networking \#LinkedInNetworking \#FutureLeaders \#UniversityAlumni \#HigherEd \#AlumniNetwork \#CollegeSuccess",https://www.linkedin.com/jobs/view/4400567007
Equipment Engineer,Cpl,"Kildare, County Kildare, Ireland",linkedin,"JO\-2604\-564357 Field Service Engineers job spec Cpl are once again retained as the exclusive recruitment partner with our client who are a legacy service partner to the Semi\-Conductor Manufacturing industry in North Kildare. To support the continued expansion of the site in Leixlip, they are currently recruiting for a number of Field Service / Customer Service Engineers, and all of these positions are full time permanent employment contracts. As an Engineer, you will be based on\-site in North Co. Kildare on the largest Semi\-Conductor manufacturing site in Europe. These are full time employment contracts with an exciting and dynamic operation, and you will be joining a team of Degree and master’s qualified electronic, automation and electrical engineering professionals. The roles are all based in the client site in North Kildare but can also require travel to the USA or the Taiwan for initial training. A full driving licence (it can be Irish, UK, EU or International) is also necessary as when you are away on training, you will be provided with a company vehicle to travel form your accommodation to the training facility. As a Field Service / Customer Engineer, your role will include the following \- You will be required to supply, maintain, repair, and install various kinds of Electronic Assembly Equipment across the site’s facility. You will also be responsible for providing engineering support and activities across the facility wherein you will have to troubleshoot more complicated products and problems. Key Responsibilities • Install, commission, and qualify semiconductor manufacturing equipment on customer sites, ensuring adherence to OEM specifications and cleanroom protocols. • Perform scheduled preventative maintenance (PM) and calibration activities to maximise tool uptime and performance. • Diagnose and troubleshoot complex mechanical, electrical, and process\-related issues on semiconductor capital equipment, driving rapid resolution to minimise downtime. • Execute corrective maintenance and implement sustainable fixes following root cause analysis (RCA). • Support equipment upgrades, retrofits, and process improvements in line with customer and business requirements. • Work collaboratively with process engineers, equipment engineers, and production teams to optimise tool performance and yield. • Maintain accurate service records, documentation, and reports in line with quality and compliance standards. • Ensure strict adherence to EHS, cleanroom, and contamination control procedures at all times. • Provide technical support and training to customer personnel on equipment operation and basic maintenance. • Participate in on\-call rota and respond to urgent breakdowns or escalations as required. • Liaise with global technical support teams and engineering groups to resolve escalated issues. • Manage spare parts inventory and ensure availability of critical components to support service activities. • Continuously identify opportunities for improving equipment reliability, service efficiency, and customer satisfaction. • Support audits and ensure compliance with industry standards such as ISO, GMP, and semiconductor\-specific protocols. \_\_\_\_\_\_\_\_\_\_\_\_\_\_\_\_\_\_\_\_\_\_\_\_\_\_\_\_\_\_\_\_\_\_\_\_\_\_\_\_ Skills and Requirements: • You must be degree qualified in Electrical or Electronic Engineering, Robotics, Automation, Mechanical Engineering etc... • You should have previous work experience in a similar position or if you are at graduate level then a keen interest in a career in electronics is essential. • Strong technical product knowledge and customer service experience would be advantageous. • Strong Time Management and Decision\-Making skills. • Exceptional listening \& understanding to solve problems effectively and efficiently. Tools, Equipment, Work Environment. • Use of extremely high precision equipment, electronic diagnostic equipment, test fixtures equipment will be part of your daily routine. · You will be a part of a team of high performing engineers who will be installing and pre\-qualifying and validating an array of extremely complex and high spec vision and equipment inspection systems for semi\-conductor manufacturing • Software includes the use of Windows operating system \& MS Office. If you are interested in this excellent full\-time permanent job opportunity and you want to join a team of high performing Engineers, if you want a challenging and rewarding career then please send your CV to shane.gleeson@cpl.ie We will review and reply back to you within 24 hours. Please note that to be considered for these positions, you must hold either a Stamp 4 work permit or else you need to be an EU passport holder (this is essential for travel for training purposes) \#LI\-SG2",https://www.linkedin.com/jobs/view/4400588354
Events Executive,Imma,"Kilmainham, D, IE",indeed,"**Open Competition for the role of** **Events Executive** **Permanent Full Time** **Contract of Employment** **\_\_\_\_\_\_\_\_\_\_\_\_\_\_\_\_\_\_\_\_\_\_\_\_\_\_\_\_\_\_\_\_\_\_\_\_\_\_\_\_\_\_\_\_\_\_\_\_\_\_\_\_\_\_\_\_\_\_\_\_\_\_\_\_\_\_\_\_\_\_\_\_\_** **About IMMA** The Irish Museum of Modern Art, based in what was the Royal Hospital Kilmainham, an extraordinary 17th century building, set upon a hilltop of 48 acres overlooking the river Liffey, is a witness to at least a millennium of change. All of which feeds into our contemporary thinking and commitment to celebrate this remarkable site. At IMMA we have begun to create a space unique with contemporary culture. This is a space where local and global connect, a space where contemporary art and contemporary life meet, challenge and inspire one another. **\_\_\_\_\_\_\_\_\_\_\_\_\_\_\_\_\_\_\_\_\_\_\_\_\_\_\_\_\_\_\_\_\_\_\_\_\_\_\_\_\_\_\_\_\_\_\_\_\_\_\_\_\_\_\_\_\_\_\_\_\_\_\_\_\_\_\_\_\_\_\_\_\_** **Role** **Overview** The Events Executive will manage and oversee all aspects of event planning within the museum’s spaces in collaboration with colleagues, external clients and stakeholders. These activities are critical to achieving the goals of IMMA and overseeing a portfolio of State, Cultural, and Commercial events. The Event Executive ensures details are in place in advance of an event to run smoothly and ultimately enhances the visitor experience engaging in events at IMMA. **\_\_\_\_\_\_\_\_\_\_\_\_\_\_\_\_\_\_\_\_\_\_\_\_\_\_\_\_\_\_\_\_\_\_\_\_\_\_\_\_\_\_\_\_\_\_\_\_\_\_\_\_\_\_\_\_\_\_\_\_\_\_\_\_\_\_\_\_\_\_\_\_\_** **Key Responsibilities** **1\. Client Relationship Support:** * Conduct preliminary research on potential clients or event opportunities. * Handle client inquiries and provide high\-level customer service to ensure client satisfaction (both internal and external). * Prepare and present proposals and contracts. Use a suitable software system to demonstrate layout of event with the client. **2\. Event Planning and Design** * Work closely with clients, external event companies, internal stakeholders to plan event details from concept to the execution. * Manage bookings and scheduling for museum event spaces. * Understand the event’s objectives and design it accordingly. This includes style of event, setting timelines, number of guests, F\&B requirements, entertainment, speeches, planning the layout etc. * Provide clear and effective communication with OPW and external contractors to ensure IMMA’s needs are met within a safe environment. * The Event Executive may have duties which include the transportation of furniture, such as tables, seating, stages, dancefloor, audio systems, barriers, dancefloors, uplighters, coat rails, signage stands and heaters. **3\. Vendor Management** * In conjunction with Senior Commercial Manager, identify and select external event companies that align with the state’s and IMMA’s needs through rigorous vetting and competitive procurement processes. * Oversee vendor performance to ensure compliance with museum standards and event objectives. * Maintain strong relationships with all external partners and vendors. **4\. Stakeholder Communication:** * Engage with stakeholders at all levels, including state officials, museum staff, and external partners, to support events. * Ensure that all internal stakeholders are informed about event developments and that their input is incorporated into the planning process. * Address and resolve any issues that arise before, during, or after events. **5\. Budget Management:** * Develop and manage comprehensive budgets for state, cultural and commercial events, integrating costs from external entities and ensuring transparent financial reporting. * Monitor expenses and provide regular financial reports to museum management. **6\. Post Event Analysis** * Conduct thorough post\-event evaluations to assess the performance against objectives and identify improvement opportunities. * Prepare detailed reports for state officials and relevant stakeholders, outlining event outcomes, budget adherence, and public engagement. * Gather feedback from attendees, vendors, and museum staff to enhance future events. **\_\_\_\_\_\_\_\_\_\_\_\_\_\_\_\_\_\_\_\_\_\_\_\_\_\_\_\_\_\_\_\_\_\_\_\_\_\_\_\_\_\_\_\_\_\_\_\_\_\_\_\_\_\_\_\_\_\_\_\_\_\_\_\_\_\_\_\_\_\_\_\_\_** **Key Performance Indicators** **Stakeholder Satisfaction:** Metric: Measured through post\-event surveys or feedback forms distributed to both attendees, internal museum staff and high\-level stakeholders (e.g., state officials, sponsors). Objective: To continuously assess IMMA’s event organisation and execution delivery. **Budget Adherence:** Metric: Measures how effectively the event stays within the financial parameters set during the planning stages. Objective: Assess financial management skills and cost efficiency. **Vendor Performance Metrics:** Metric: Assesses the performance of external event companies and other vendors based on criteria like adherence to contract terms, quality of service, and punctuality. Objective: Ensures that vendors meet or exceed IMMA’s expectations. **Event Setup and Breakdown Efficiency:** Metric: Time how quickly and effectively event setups and breakdowns are completed. Objective: To minimise disruption to IMMA’s operations and visitor experience. **Repeat Partnership Rate:** Metric: Track the rate at which external companies and attendees choose to work with IMMA on multiple events. Objective: Get an indication of the overall success and appeal of IMMA’s events. **Incidence Reports:** Metric: Monitor the number and severity of any incidents or disruptions during events. Objective: Fewer incidents suggest better planning and risk management. **Return on Investment on Events:** Metric: For events intended to generate revenue or other tangible benefits, analyse the profitability of events by considering all costs versus gains from things like ticket sales, sponsorships, book shop, sales, increased museum memberships, or donations. **Innovation and Improvement** Metric: Measure the introduction of new and innovative event elements and the adoption of suggestions or improvements from previous event feedback. Objective: Continuously improve the event delivery standard delivered at IMMA. **\_\_\_\_\_\_\_\_\_\_\_\_\_\_\_\_\_\_\_\_\_\_\_\_\_\_\_\_\_\_\_\_\_\_\_\_\_\_\_\_\_\_\_\_\_\_\_\_\_\_\_\_\_\_\_\_\_\_\_\_\_\_\_\_\_\_\_\_\_\_\_\_\_** **What We Are Looking For** **The successful candidate will have:** **Education and Experience** * A third level degree and/or 5 years relevant administration. * Proven track record of successfully working within a busy office, dealing with a high volume of enquiries. **Skills** * Strong negotiation skills aligned to a flexible approach in the working environment. * Demonstrated ability to work collaboratively with colleagues, external partners, and vendors. * Excellent organisational, communication, and attention to detail skills, with the capacity to manage multiple projects simultaneously. * Proficiency in the use of IT technology and event software. **Desirable Attributes:** * Passion for the event industry, with an understanding of the museum’s strategy. * Experience in handling high\-profile events and VIP guests. * Ability to work flexible hours, including evenings and weekends, as required by the nature of events. **\_\_\_\_\_\_\_\_\_\_\_\_\_\_\_\_\_\_\_\_\_\_\_\_\_\_\_\_\_\_\_\_\_\_\_\_\_\_\_\_\_\_\_\_\_\_\_\_\_\_\_\_\_\_\_\_\_\_\_\_\_\_\_\_\_\_\_\_\_\_\_\_\_** **Why Work with IMMA?** **At IMMA, we are proud to offer:** * Opportunity to get involved in IMMA’s 2024\-2028 Strategy, development of key themes in response to current global cultural concerns which will shape our programming over the next five years. * Progressive, hybrid working model. * The opportunity to work in a beautiful serene historic 17th Century Building surrounded by 48 acres of Meadows and Gardens – an oasis in Dublin City. * Free Parking / Secure Bike Sheds. * Career development opportunities through mentoring, coaching, and training. * Erasmus \+ Staff Mobility Scheme funding by European Union. * Government Pension Scheme * Employee Wellbeing Committee. * Employee Assistance Programme. * Generous Public Sector leave benefits. * Strong values\-based and inclusive culture. * Strong commitment to diversity, equity, and inclusion. * Great team environment working to our Core Tenets: Contemporary, Inclusion, Innovation, Collaboration and Globally Connected. * Valuable experience at a leading cultural institution. * Opportunities to attend special museum events and exhibitions. * Networking opportunities with professionals in the museum and cultural sectors. **\_\_\_\_\_\_\_\_\_\_\_\_\_\_\_\_\_\_\_\_\_\_\_\_\_\_\_\_\_\_\_\_\_\_\_\_\_\_\_\_\_\_\_\_\_\_\_\_\_\_\_\_\_\_\_\_\_\_\_\_\_\_\_\_\_\_\_\_\_\_\_\_\_** **Salary** The salary for this role is in line with public sector pay scales, starting at **€38,419**, Point 1 of the Grade Executive Officer (PPC) scale, as of 1st February 2026\. The Full Time Salary Scale: €38,419, €40,360, €41,456, €43,594, €45,510, €47,364, €49,211, €51,024, €52,890, €54,749, €56,722, €58,044, LSI 1 €59,928, LSI 2 €62,601 Candidates should note the Irish Museum of Modern Art complies with Department of Public Expenditure and Reform and guidelines on Public Sector pay and conditions of employment and pension provisions. Entry level will be at Point 1 of this Grade. **\_\_\_\_\_\_\_\_\_\_\_\_\_\_\_\_\_\_\_\_\_\_\_\_\_\_\_\_\_\_\_\_\_\_\_\_\_\_\_\_\_\_\_\_\_\_\_\_\_\_\_\_\_\_\_\_\_\_\_\_\_\_\_\_\_\_\_\_\_\_\_\_\_** **Contract Details** * **Contract Type:** Full Time * **Contract Duration:** Permanent * **Hours:** Monday to Friday**,** 35 hours per week, net of breaks * **Location:** IMMA, Military Road, The Royal Hospital Kilmainham, Kilmainham, Dublin 8 **\_\_\_\_\_\_\_\_\_\_\_\_\_\_\_\_\_\_\_\_\_\_\_\_\_\_\_\_\_\_\_\_\_\_\_\_\_\_\_\_\_\_\_\_\_\_\_\_\_\_\_\_\_\_\_\_\_\_\_\_\_\_\_\_\_\_\_\_\_\_\_\_\_** **How to Apply** To apply for this exciting opportunity, please submit the following: * A tailored cover letter explaining your suitability for the role. * A current curriculum vitae. Applications should be submitted via https://imma.bamboohr.com/careers/73 **Closing date for receipt of applications: 23 April 2026** For further assistance or reasonable accommodations during the application process, please email tetiana.shchukina@imma.ie. **\_\_\_\_\_\_\_\_\_\_\_\_\_\_\_\_\_\_\_\_\_\_\_\_\_\_\_\_\_\_\_\_\_\_\_\_\_\_\_\_\_\_\_\_\_\_\_\_\_\_\_\_\_\_\_\_\_\_\_\_\_\_\_\_\_\_\_\_\_\_\_\_\_** **Join Our Team** IMMA is an equal\-opportunity employer, deeply committed to promoting equality, diversity, and inclusion. We actively encourage applications from individuals of all backgrounds and experiences. We value the richness that a diverse team brings to our work, enhancing both staff and visitor experiences.",https://ie.indeed.com/viewjob?jk=08e2178c314459b9
FP&A Analyst,Darwin Hawkins,"Dublin, County Dublin, Ireland",linkedin,"**Job Title:** FP\&A Analyst **Sector:** Energy / Utilities **Location:** Dublin 2 (Hybrid) **Salary:** €70,000 plus benefits **Our Client** Our client is a large and well\-regarded organisation playing a central role in Ireland’s transition to a low\-carbon energy future. With significant ongoing investment in infrastructure, renewable generation and system resilience, the organisation continues to expand its finance capability to support strategic decision\-making across the business. **Why should you apply?** This is an excellent opportunity to join a high\-performing Financial Planning \& Analysis team operating at the heart of a business undergoing significant transformation. You will gain strong exposure to budgeting, forecasting and performance analysis in a complex and commercially relevant environment while partnering with stakeholders across multiple business units. The role offers a highly collaborative culture, strong mentoring and clear long\-term career progression within a values\-driven organisation committed to flexibility, sustainability and employee development. **Who should apply?** This role will suit qualified accountants or finance professionals currently working in FP\&A, commercial finance or financial analysis roles who are looking to further develop their career in a large organisation with meaningful strategic impact. * Qualified accountant (ACA / ACCA / CIMA or equivalent) with 2\+ years PQE * Experience in budgeting, forecasting, financial modelling or performance analysis * Strong analytical mindset with advanced Excel and data analysis capability * Excellent communication skills and ability to engage non\-finance stakeholders * Ability to manage deadlines, prioritise workload and deliver high\-quality outputs **Role and Reporting Lines** Reporting to the FP\&A Manager, you will play a key role supporting financial planning and performance management activities across the organisation: * Lead elements of the budgeting, forecasting and long\-term planning processes ensuring timely and accurate submissions * Work closely with budget holders and business units to understand financial drivers and support decision\-making * Deliver monthly variance analysis, insights and commentary for senior stakeholders * Develop and maintain models, dashboards and analytical tools to enhance visibility and forecasting accuracy * Identify opportunities to improve efficiency, automation and reporting capability within FP\&A * Ensure compliance with internal controls, audit requirements and governance standards * Communicate financial insights clearly to both finance and non\-finance audiences **Interested in this position?** To apply please submit your CV to **Aonghus** who is managing this assignment via the link below or to inquire further please contact us directly on 01 529 4200\.",https://www.linkedin.com/jobs/view/4400558451
Field Service Engineer,Manning Global AG,"Dublin, County Dublin, Ireland",linkedin,"Our client, a leading global ICT service provider,is recruiting for a **Field Service Engineer** to join their business in **Ireland.** **Position Title:** **Field Service Engineer** **Position Type:** One\-year rolling contract **Start Date:** ASAP **Location:** Dublin office and Client site **Contact:** Zuni Vallejo / t \+49 (0\) 89 23 88 98 456 **Responsibilities:** * Lead field technical operations to ensure compliance with Service Level Agreements (SLAs) for PV, Battery Energy Storage Systems (BESS), Data Center (DC), and EV Charging products, while fostering the development of a localized service ecosystem. * Client Satisfaction: Take responsibility for resolving live network issues within SLA parameters for PV, BESS, DC, and Charging products. This includes managing spare parts effectively to ensure quick problem resolution and implementing preventive measures to avoid future occurrences. * Delivery Quality: Conduct field audits for installation partners to ensure adherence to Clients's technical standards. Carry out random site checks and issue quality deficiency reports as needed. * Proactive Maintenance: Implement contractual preventive maintenance to ensure the seamless operation of products on the live network. * Installer Enablement: Provide quarterly technical training to installers and oversee the resolution of local hotline Key Performance Indicators (KPIs). **Requirements:** * Candidates should have at least 1 year of experience in PV, BESS, DC, or EV Charge. A strong understanding of high\-voltage fields is preferred. Alternatively, entry\-level candidates with a strong willingness to learn and grow in the role will also be considered. * Bachelor degree or above * Fluency in English is required, with the ability to explain technical protocols to installers. Strong verbal and written communication skills are essential. * Communication Skills: Excellent verbal and written communication skills are essential for effectively engaging with local installers, partners, and team members. * Time Management and Adaptability: The ability to work under pressure, meet deadlines, and manage targets while adapting to continuously changing situations is crucial. On\-call readiness for emergency dispatch is also required. * Planning and Organizational Skills: Candidates should be able to work according to outlined processes, manage multiple tasks, prioritize effectively, and maintain organized work processes to meet deadlines. * Proactive and Detail\-Oriented: A self\-motivated individual with a strong initiative, accurate execution, and the ability to collaborate effectively within a team is preferred.",https://www.linkedin.com/jobs/view/4400552590
