title,company,location,site,description,job_url
1st Year Electrical Apprentice (Midlands Area),Walden Electrical Contracting,"Carlow, CW, IE",indeed,"1st Year Apprentice's required in the Midlands Area. Must be willing to travel to various sites. Work is based mainly in the commercial / retail sector. If you are interested in training to become and Electrician send us your C.V. Pay: From €19,000\.00 per year Work Location: In person",https://ie.indeed.com/viewjob?jk=07d4815db45d4f31
2026 Ireland Graduate Electrical Engineer: Energy Sector,Mott MacDonald,"Dublin, County Dublin, Ireland",linkedin,"**To avoid missing out on your preferred role, we recommend applying as early as possible, as positions will close once filled.** Turn your ambition into action—apply now and shape your future with us. **Job Description:** Please note that for these graduate opportunities we are happy for you to simply apply with a CV and the option to include a cover letter. At Mott MacDonald, we believe engineering is more than solving problems — it’s about shaping a better world. As a Graduate Overhead Engineer, you’ll be part of a collaborative, inclusive, and forward\-thinking team that designs and delivers sustainable solutions across sectors including energy, aviation, buildings, ports, rail \& metros, and water. **Candidate Specification:** We are looking for committed and motivated graduates with a genuine passion and a desire to make a difference in the world. If this describes you, apply today to launch your career at Mott MacDonald. To be eligible for this opportunity, you will have less than 12 months relevant experience and have a degree or are expected to achieve one of the following degree disciplines: * Electrical Engineering * Civil Engineering In your application you should be able to demonstrate your interest in the role and working at Mott MacDonald through relevant experience, such as studying relevant modules, or previous work experience. We are looking for graduates with the following characteristics: * Methodical approach to problem solving. * Ability to use your initiative to undertake tasks efficiently and independently. * Excellent verbal communication skills, which allow you to confidently liaise with clients and team members. * Excellent written communication and attention to detail and be able to demonstrate accurate technical drawings and good report writing. * As we want the best people for the role, we support flexible working. Please ask us at interview stage about any flexibility you may need. As we want the best people for the role, we support flexible working. Please ask us at interview stage about any flexibility you may need. Mott MacDonald Ltd. are not currently offering sponsorship to candidates under the Skilled Worker visa route in the UK. This decision is as a consequence of the changes made to the Skilled Worker route by the UK Government in April 2024\. Our ethos is to develop, train and retain our graduates and therefore we are looking for a long\-term relationship with our graduates. For this reason, we cannot accept applications from candidates who would be working under the Graduate visa route or other time\-limited visas, (irrespective of visa duration), due to their temporary nature and the requirement for sponsorship under the Skilled Worker route in future. We continue to welcome applications from candidates who are eligible for alternative immigration routes in the UK, that do not require sponsorship as a Skilled Worker now or in future. **About Your Development** A graduate position should be more than just a job. We know this and so do you. That’s why with our graduate roles we aim to give you the experience and technical knowledge you need to progress your career. From the moment you join us, you’ll receive the training you need. You will be assigned a mentor, who will guide you to meet the objectives of your professional training needs. You will join our three\-year early careers soft skills development programme – Accelerating your Future, which is designed to give you the skills and tools necessary for a long\-lasting successful career here at Mott MacDonald. You will have the opportunity to make a difference; learn more about Our Purpose and the difference we can make! You’re probably wondering what else is on offer. Join us, and you’ll get: * Biannual salary reviews: we believe that hard work should be rewarded and recognised. Therefore, for the first three years of your career with us, you’ll have biannual salary reviews. * A competitive salary: in addition to biannual reviews, we will ensure that you’re given a salary that matches the current industry standard. * Contributory pension up to 7% of your salary: we have the best people on our team, and we like to look out for them. With our support, you’ll have all the advice and options you need to be able to invest in your future. * A flexible benefits scheme: our company is made up of a range of different people and we understand that different people want different things. That’s why with our flexible plan, you’ll have the ability to manage the range of benefits we have on offer, to suit your specific needs. * **Our social side** Being part of Mott MacDonald means more than just work; there’s a huge range of fun and exciting things that you can get involved in. From the moment you join us, you’ll have the opportunity to expand your social and professional network, whether it’s meeting other graduates or joining forces with other members of staff from around the company at our annual sports day. Each of our offices have a sports and social committee which will give you the chance to be part of a variety of sports, social and charity events. We’re committed to promoting a strong culture of social responsibility and encourage our staff to play active roles in the local community. It's worth noting that sports and social committees tend to vary from office to office, so as well as getting involved in what’s already on offer, don’t be afraid to suggest new events or initiatives that you think could be a great addition. It doesn’t stop there. As well as events, you’ll also have access to discounts on cinema tickets, travel, fashion, utilities and much more as part of our company benefits which you can take advantage of the moment you join. **Equality, diversity and inclusion** We put equality, diversity and inclusion at the heart of our business, seeking to promote fair employment procedures and practices to ensure equal opportunities for all. We encourage individual expression in our workplace and are committed to creating an inclusive environment where everyone feels they have the opportunity to contribute. **Agile working** At Mott MacDonald, we believe it makes business sense for you and your manager to choose how you can work most effectively to meet your client, team and personal commitments. We embrace agility, flexibility and trust. **More About Mott MacDonald** We’re a global engineering, management and development consultancy. Our purpose is to improve society by considering social outcomes in everything we do, relentlessly focusing on excellence and digital innovation, transforming our clients’ businesses, our communities and employee opportunities. A fundamental part of this is respecting each person’s differences and striving to meet their needs. Our values: progress, respect, integrity, drive, excellence Location(s): Dublin, IE Contract Type: Permanent Work Pattern: Full Time Market: Energy Discipline: Electrical Job Ref: 11653 Recruiter Contact: earlycareers.recruitment@mottmac.com",https://www.linkedin.com/jobs/view/4405111022
AWS Platform Engineer,Fruition Group Ireland,"Dublin, County Dublin, Ireland",linkedin,"**AWS Platform Engineer (CloudFormation)** **Daily Rate Contract (1 day onsite, Dublin City Centre) Ireland or UK** My Dublin based client is seeking an experienced AWS Platform Engineer with strong CloudFormation expertise to join its Cloud Centre of Excellence (CCoE) on a daily rate contract. This role supports a large, highly regulated organisation undergoing significant enterprise cloud transformation. You will play a key role in shaping, building and evolving a modern AWS\-native platform supporting business\-critical workloads at scale. Key Responsibilities * Platform engineering role focused on roadmap delivery and long\-term cloud capability uplift * Work across multiple strategic AWS platform initiatives * Drive cloud\-native innovation, including AI\-native and serverless capabilities * Apply deep AWS expertise within a structured, risk\-aware enterprise environment * Design, build and manage secure, scalable AWS infrastructure using CloudFormation (Infrastructure as Code) * Engineer and enhance a modern AWS cloud platform aligned to enterprise standards * Contribute to platform roadmap initiatives and continuous improvement * Design and deploy serverless and event\-driven architectures * Build AI\-native platform components using AWS managed services * Develop and optimise CI/CD pipelines (CodeBuild, CodePipeline, Step Functions) * Implement monitoring, logging and performance optimisation solutions * Embed DevOps and automation best practices * Drive cost optimisation and operational efficiency * Ensure alignment with security, regulatory and governance requirements * Promote reusable platform patterns and shared services Experience Required * Strong hands\-on AWS experience with deep knowledge of native services * Proven track record delivering resilient, highly available enterprise\-scale cloud platforms * Strong Infrastructure as Code expertise (CloudFormation essential) * Experience writing automation and tooling scripts (Python, Bash or similar) * Solid understanding of AWS networking, IAM, security and governance * Experience building and maintaining AWS\-native CI/CD pipelines * Experience operating in regulated or risk\-aware environments * Comfortable working in Agile teams within a Cloud Centre of Excellence Desirable * AWS Certifications (Solutions Architect, DevOps Engineer, Developer) * Experience building AI/ML\-enabled AWS platforms * Exposure to platform engineering concepts (self\-service infrastructure, reusable modules, internal developer platforms)",https://www.linkedin.com/jobs/view/4404697195
Accountant,GPC Finance,"Dublin, County Dublin, Ireland",linkedin,"Our client is looking for an Accounts Senior to join their medium\-sized accounting practice in Dublin. The ideal Accounts Senior will be meticulous and analytical, with deep knowledge of accounts practices. You will work as part of a team and help to mentor junior colleagues. **Responsibilities** * Prepare and present reports for clients and partners upon request. * Prepare and finalise audit and audit\-exempt financial statements. * Address various enquiries from clients, banks, Revenue, and assist with Revenue audits. * The Accounts Senior will mentor Trainees **Requirements** * The Accounts Senior will be ACCA/ACA Qualified. * Minimum 2 years of experience in an Irish accounting practice. * Strong understanding of Accounting and Auditing Standards. * Experience in operational supervision of assignments and managing client relationships. * Basic knowledge of tax is preferred. * Integrity and reliability. **Benefits** * Salary €55,000 \- €65,000 DOE * Hybrid working model with flexible hours * 25 days of annual leave * Onsite parking * Company events \& social committee * Wellbeing initiatives * Performance based bonus If you are an Accounts Senior looking for a new opportunity, please contact Andrew Hendrickx for more information. We do not send out your cv without your permission.",https://www.linkedin.com/jobs/view/4404688161
Administrative Analyst,RECRUITERS,"South Dublin, Ireland",linkedin,"We are currently seeking a highly organised and proactive **Administrative Support Executive/Analyst** to join a busy State Services team. This is an excellent opportunity for someone with strong administrative and customer service experience who is keen to develop their career within a structured team environment. **Salary:** €32,000\-€36,000 DOE \+ bonus **Location:** Dublin 18 **The Role** This role provides comprehensive administrative support within a team structure and involves daily interaction with internal and external stakeholders via phone and email. You will work closely with established processes and procedures to ensure high service levels, accuracy, and timely delivery across day\-to\-day operations and project\-related activities. You will play a key role in keeping systems up to date, managing scheduled events, supporting fleet\-related activities, and ensuring tasks are completed ahead of deadlines. Over time, there is strong scope to grow, learn, and progress within the wider team. **Key Responsibilities** * Provide day\-to\-day administrative support within the State Services team * Manage phone and email enquiries through shared team inboxes * Proactively manage daily, weekly, and monthly scheduled tasks * Maintain accurate system updates including data entry and reporting * Support fleet\-related administration such as fuel cards, toll tags, vehicle collections, hire cars, fines, road tax, GPS, and pool vehicles * Coordinate CVRT administration with internal teams and external suppliers * Assist with vehicle ordering, deliveries, and logistics planning * Liaise with other departments to resolve queries efficiently * Attend team meetings, recording minutes and tracking actions * Ensure all procedures, timelines, and service standards are adhered to * Contribute to team goals and individual performance targets **About You** * Minimum **1 year’s experience** in an administrative role * Excellent verbal and written communication skills * Strong customer service mindset with a friendly and professional approach * High attention to detail and accuracy * Confident user of **Microsoft Excel, Word, PowerPoint, and Outlook \- especially strong excel skills** * Organised, adaptable, and able to manage fluctuating workloads * A collaborative team player who enjoys contributing to shared success * Calm under pressure with a positive, “can\-do” attitude * Comfortable taking initiative and seeing tasks through to completion *By applying to this job, your CV will be assessed by a consultant from Recruiters.ie for the position described and your CV may be added to our secure applicant tracking system however your details will never be shared to any other third party without your consent.*",https://www.linkedin.com/jobs/view/4404690460
Asset Backed Finance Portfolio Monitoring Associate,KKR,"Dublin, County Dublin, Ireland",linkedin,"**Company Overview** KKR is a leading global investment firm that offers alternative asset management as well as capital markets and insurance solutions. KKR aims to generate attractive investment returns by following a patient and disciplined investment approach, employing world\-class people, and supporting growth in its portfolio companies and communities. KKR sponsors investment funds that invest in private equity, credit and real assets and has strategic partners that manage hedge funds. KKR’s insurance subsidiaries offer retirement, life and reinsurance products under the management of Global Atlantic Financial Group. References to KKR’s investments may include the activities of its sponsored funds and insurance subsidiaries. KKR is seeking an Associate to join its expanding Private Asset\-Backed Finance (ABF) business, based in Dublin. KKR is one of the world’s leading investment firms, with a 50\-year track record of delivering strong investment performance. Today, the firm manages over $700 billion in assets across public and private markets globally. The Portfolio Monitoring Unit (PMU) plays a central role in the ongoing management and oversight of KKR’s ABF investments. The team is responsible for performance analytics, transaction modelling, valuation, and strategic optimisation across a growing portfolio of 200\+ deals. Operating across a wide range of asset types and industries, the PMU team supports both institutional and insurance\-related mandates. Headquartered in Dublin, with team members in London and Gurugram, the ABF PMU team has grown to 13 investment professionals. As part of the business’s strategic expansion, KKR has launched a rapidly growing High Grade ABF platform. This business focuses on public and private ABF investments primarily in the investment grade or near\-investment grade space. We are now hiring an Associate to help manage this portfolio, with an exciting opportunity to contribute to the development of a key strategic initiative at KKR. **Key Responsibilities** * Proactive monitoring of the performance of public and private ABF transactions, including regular engagement with servicers and originators. * Preparation of quarterly portfolio reviews and participation in Investment Committee presentations. * Financial modelling, conducting scenario and sensitivity analyses. * Maintaining performance data and risk metrics within KKR’s internal portfolio management systems. * Collaborating cross\-functionally with Investor Relations, Risk, ESG, and other teams on reporting, investor materials, and ad hoc portfolio requests. * Coordinating with third\-party valuation agents to support valuations of private transactions. * Identifying underperforming or high\-risk assets and supporting trade or repositioning recommendations. **Candidate Profile** * 3\+ years of relevant experience in credit risk, structured finance, ABF/securitisation, transaction services, leasing, restructuring, or a rating agency. * A proven ability to quickly absorb new information and a commitment to learning new asset classes and analytical tools. * Direct experience with ABF, structured credit, or secured lending is highly advantageous. * Familiarity with tools such as Excel, Intex, Bloomberg, Tableau/PowerBI, and FactSet is beneficial. * A strong academic background, ideally in a quantitative or finance\-related discipline. * Excellent quantitative and analytical skills, attention to detail, and the ability to communicate complex ideas clearly. * A self\-starter mindset, with the ability to thrive in a dynamic, fast\-paced environment. * Solid understanding of financial statements, cash flow modelling, and deal structuring. * Strong written communication and presentation skills. KKR is an equal opportunity employer. Individuals seeking employment are considered without regard to race, color, religion, national origin, age, sex, marital status, ancestry, physical or mental disability, veteran status, sexual orientation, or any other category protected by applicable law. KKR will provide reasonable accommodations as required by applicable federal, state, and/or local laws. Individuals seeking an accommodation for the application or interview process should email Benefits@kkr.com. Emails sent for unrelated issues, such as following up on an application, will not receive a response. If you are a qualified individual with a disability or a disabled veteran, you may request a reasonable accommodation if you are unable or limited in your ability to use or access https://www.kkr.com/careers because of your disability. You can request reasonable accommodations by sending an email to Benefits@kkr.com. Only emails left for this purpose will be returned. **Massachusetts Applicants:** It is unlawful in Massachusetts to require or administer a lie detector test as a condition of employment or continued employment. An employer who violates this law shall be subject to criminal penalties and civil liability. This notice applies only to applicants and employees who work or will work in Massachusetts, in accordance with applicable state law.",https://www.linkedin.com/jobs/view/4404667000
Asset Backed Finance Portfolio Monitoring Associate New,Kohlberg Kravis Roberts & Co.,"Dublin, D, IE",indeed,"**COMPANY OVERVIEW** KKR is a leading global investment firm that offers alternative asset management as well as capital markets and insurance solutions. KKR aims to generate attractive investment returns by following a patient and disciplined investment approach, employing world\-class people, and supporting growth in its portfolio companies and communities. KKR sponsors investment funds that invest in private equity, credit and real assets and has strategic partners that manage hedge funds. KKR’s insurance subsidiaries offer retirement, life and reinsurance products under the management of Global Atlantic Financial Group. References to KKR’s investments may include the activities of its sponsored funds and insurance subsidiaries. KKR is seeking an Associate to join its expanding Private Asset\-Backed Finance (ABF) business, based in Dublin. KKR is one of the world’s leading investment firms, with a 50\-year track record of delivering strong investment performance. Today, the firm manages over $700 billion in assets across public and private markets globally. The Portfolio Monitoring Unit (PMU) plays a central role in the ongoing management and oversight of KKR’s ABF investments. The team is responsible for performance analytics, transaction modelling, valuation, and strategic optimisation across a growing portfolio of 200\+ deals. Operating across a wide range of asset types and industries, the PMU team supports both institutional and insurance\-related mandates. Headquartered in Dublin, with team members in London and Gurugram, the ABF PMU team has grown to 13 investment professionals. As part of the business’s strategic expansion, KKR has launched a rapidly growing High Grade ABF platform. This business focuses on public and private ABF investments primarily in the investment grade or near\-investment grade space. We are now hiring an Associate to help manage this portfolio, with an exciting opportunity to contribute to the development of a key strategic initiative at KKR. **Key Responsibilities:** * Proactive monitoring of the performance of public and private ABF transactions, including regular engagement with servicers and originators. * Preparation of quarterly portfolio reviews and participation in Investment Committee presentations. * Financial modelling, conducting scenario and sensitivity analyses. * Maintaining performance data and risk metrics within KKR’s internal portfolio management systems. * Collaborating cross\-functionally with Investor Relations, Risk, ESG, and other teams on reporting, investor materials, and ad hoc portfolio requests. * Coordinating with third\-party valuation agents to support valuations of private transactions. * Identifying underperforming or high\-risk assets and supporting trade or repositioning recommendations. **Candidate Profile:** * 3\+ years of relevant experience in credit risk, structured finance, ABF/securitisation, transaction services, leasing, restructuring, or a rating agency. * A proven ability to quickly absorb new information and a commitment to learning new asset classes and analytical tools. * Direct experience with ABF, structured credit, or secured lending is highly advantageous. * Familiarity with tools such as Excel, Intex, Bloomberg, Tableau/PowerBI, and FactSet is beneficial. * A strong academic background, ideally in a quantitative or finance\-related discipline. * Excellent quantitative and analytical skills, attention to detail, and the ability to communicate complex ideas clearly. * A self\-starter mindset, with the ability to thrive in a dynamic, fast\-paced environment. * Solid understanding of financial statements, cash flow modelling, and deal structuring. * Strong written communication and presentation skills. \#LI\-ONSITE KKR is an equal opportunity employer. Individuals seeking employment are considered without regard to race, color, religion, national origin, age, sex, marital status, ancestry, physical or mental disability, veteran status, sexual orientation, or any other category protected by applicable law. KKR will provide reasonable accommodations as required by applicable federal, state, and/or local laws. Individuals seeking an accommodation for the application or interview process should email Benefits@kkr.com. Emails sent for unrelated issues, such as following up on an application, will not receive a response. If you are a qualified individual with a disability or a disabled veteran, you may request a reasonable accommodation if you are unable or limited in your ability to use or access https://www.kkr.com/careers because of your disability. You can request reasonable accommodations by sending an email to Benefits@kkr.com. Only emails left for this purpose will be returned. **Massachusetts Applicants:** It is unlawful in Massachusetts to require or administer a lie detector test as a condition of employment or continued employment. An employer who violates this law shall be subject to criminal penalties and civil liability. This notice applies only to applicants and employees who work or will work in Massachusetts, in accordance with applicable state law.",https://ie.indeed.com/viewjob?jk=b855e76c2e5bf471
