title,company,location,site,description,job_url
Junior Executive Assistant,Eden Recruitment,"Dublin, County Dublin, Ireland",linkedin,"On behalf of our client we are hiring a **Junior Executive Assistant** to join them on a 3 month contract. In this role, you will provide vital administrative and scheduling support to the CEO, helping to ensure daily operations run smoothly and efficiently. This is an excellent opportunity for someone looking to build a career in executive support within a fast\-paced, professional environment. **Key Responsibilities:** **Executive Support** * Manage complex calendars, schedule meetings, and coordinate travel arrangements for the CEO and Executive/Management team. * Prepare briefing materials, presentations, and reports. * Coordinate communications with internal and external stakeholders. * Prepare agendas, take minutes, and follow up on action items from executive meetings. * Handle confidential correspondence and documents with discretion and professionalism. * Act as a gatekeeper and liaison between the CEO, internal stakeholders, and external partners. **Operational Coordination** * Support the planning and execution of strategic initiatives and projects led by the CEO or Executive team. * Assist in the preparation of presentations, reports, and briefing materials. * Coordinate logistics for board meetings, leadership offsites, and corporate events. * Track and support strategic projects and follow\-ups. **Qualifications** * Proven experience as an Executive Assistant or in a similar role supporting senior leadership. * Exceptional organizational and time\-management skills. * Strong written and verbal communication abilities. * High level of discretion and professionalism in handling confidential information. * Proficiency in Microsoft Office Suite and collaboration tools. * Ability to manage multiple priorities in a fast\-paced environment",https://www.linkedin.com/jobs/view/4402874343
Junior Health & Safety Officer,Quinn Downes Group,"Dublin, D, IE",indeed,"Quinn Downes Group are a leading National provider of Mechanical Service Installations to high\-profile clients across Ireland. We have an exciting opportunity for a **Junior** **Health \& Safety Officer** to join our expanding team. The successful candidate will join the Quinn Downes Group QEHS Department reporting to the QEHS Manager. **Main Duties and Responsibilities** * Work with and report to the QEHS Manager to identify and mitigate site\-specific hazards. * Liaise with the Contracts Manager \& Site Manager onsite to ensure compliance with current Health and Safety statutory requirements and Company procedures. * Attend regular Health \& Safety meetings between staff, subcontractors and senior management. * Conduct site inspections, risk assessments and audits. * Delivering on continual improvement on existing ISO 9001, 14001 and 45001 standards. * Participation in yearly NSAI surveillance and recertification audits. * Reviewing and assisting with the development of Risk Assessments and Method Statements (RAMS) for employee's and subcontractors. * Continual review of Health and Safety Documents, Processes and Procedures. * Detailed reporting and investigation of incidents, accidents, near misses and dangerous occurrences and updating associated databases. * Reporting, recommending, and implementing corrective actions for Health and Safety nonconformities. * Communicating good practice and good catches to relevant parties. * Trend Analysis across incidents, non\-conformances and good catches. * Conducting, organising training including Toolbox Talks. * Travel to sites within Ireland will be required **Desired Criteria** * Holds or working towards NEBOSH General Certificate or equivalent * Knowledge of Health \& Safety Legislation, Codes of Practice and Guidelines. * 1\+ years previous experience in a Health and Safety role. * Experience in the construction industry is preferred but not essential. * Full Driving license essential for travel to sites. * Must be IT Proficient with Microsoft Outlook, Excel, and Word. * Confident, proactive and have strong interpersonal and communication skills. * Willingness to uphold health and safety values above all others.",https://ie.indeed.com/viewjob?jk=7e27124eb92c1c80
Junior Health & Safety Officer,Quinn Downes Group,"Dublin, County Dublin, Ireland",linkedin,"Quinn Downes Group are a leading National provider of Mechanical Service Installations to high\-profile clients across Ireland. We have an exciting opportunity for a **Junior** **Health \& Safety Officer** to join our expanding team. The successful candidate will join the Quinn Downes Group QEHS Department reporting to the QEHS Manager. **Main Duties And Responsibilities** * Work with and report to the QEHS Manager to identify and mitigate site\-specific hazards. * Liaise with the Contracts Manager \& Site Manager onsite to ensure compliance with current Health and Safety statutory requirements and Company procedures. * Attend regular Health \& Safety meetings between staff, subcontractors and senior management. * Conduct site inspections, risk assessments and audits. * Delivering on continual improvement on existing ISO 9001, 14001 and 45001 standards. * Participation in yearly NSAI surveillance and recertification audits. * Reviewing and assisting with the development of Risk Assessments and Method Statements (RAMS) for employee's and subcontractors. * Continual review of Health and Safety Documents, Processes and Procedures. * Detailed reporting and investigation of incidents, accidents, near misses and dangerous occurrences and updating associated databases. * Reporting, recommending, and implementing corrective actions for Health and Safety nonconformities. * Communicating good practice and good catches to relevant parties. * Trend Analysis across incidents, non\-conformances and good catches. * Conducting, organising training including Toolbox Talks. * Travel to sites within Ireland will be required **Desired Criteria** * Holds or working towards NEBOSH General Certificate or equivalent * Knowledge of Health \& Safety Legislation, Codes of Practice and Guidelines. * 1\+ years previous experience in a Health and Safety role. * Experience in the construction industry is preferred but not essential. * Full Driving license essential for travel to sites. * Must be IT Proficient with Microsoft Outlook, Excel, and Word. * Confident, proactive and have strong interpersonal and communication skills. * Willingness to uphold health and safety values above all others.",https://www.linkedin.com/jobs/view/4405002133
Junior Platform Engineer,Fexco,"Dublin, D, IE",indeed,"**Location** Ireland, Ireland \- Dublin, Ireland \- Kerry **Contract Type** Permanent Full Time **Closing Date**07/05/2026 **The Role** ------------ Fexco's Platform \& Infrastructure Engineering teams build and run the shared services the wider engineering organisation depends on, the paved roads that let engineering teams ship product without infrastructure becoming a bottleneck. We work primarily in Azure, write Terraform, operate Kubernetes, and build the self\-service tooling that ties our service catalog together. Fexco's principle is, you build it, you own it. Platform provides the paved roads; application teams own their applications. Fexco thinks IaC first. If your instinct is to click through a console to fix something, this is not the role for you. This is a Junior Platform Engineer position. You will work alongside mid and senior Platform Engineers on the inner workings of these services, including Kubernetes clusters, Terraform modules, identity and networking, GitOps delivery with GitLab and ArgoCD, observability on Grafana Cloud, and the platform tooling that makes all of it self\-service. We are also building an Internal Developer Platform (IDP), which you will help contribute to as you grow. **This is a Platform Engineering role, not DevOps** --------------------------------------------------- Application teams own their own pipelines and deployments. Your focus is the shared services, tooling, and infrastructure they run on. **Core Responsibilities** ------------------------- * Contribute to well\-scoped components of our multi\-tenant Kubernetes platform on AKS under the guidance of senior Platform Engineers. * Deploy, observe, and help operate workloads on Azure Kubernetes Service (AKS). * Read, extend, and contribute to Terraform configurations using established module patterns. * Write basic Bash and Python automation to reduce manual work and eliminate toil. * Implement pre\-designed network and security controls: network policies, RBAC, identity and access. * Help build and maintain services in the catalog that application teams consume. * Contribute to GitOps delivery using ArgoCD, Helm, and Kustomize. * Write clear documentation and runbooks so platform knowledge stays in the team, not in individuals. * Share on\-call duties with the wider team as you build operational experience. **Essential Skills** -------------------- ### **Cloud** * Some production or near\-production exposure to a major public cloud. Azure is preferred; AWS or GCP experience is also fine. * Familiarity with cloud networking fundamentals: VPCs or VNets, subnets, peering, VPNs. ### **Kubernetes** * Hands\-on experience deploying workloads on Kubernetes (AKS, GKE, EKS, or self\-managed). * Understands core concepts: pods, deployments, services, RBAC, namespaces. ### **Infrastructure as Code** * Comfortable reading and modifying Terraform; understands module composition. * Comfortable writing basic Bash scripts for everyday automation; willing to learn more as needed. * Some Python for tasks beyond simple shell scripts. ### **Version Control and CI/CD** * Git fluency beyond basic commits. * Exposure to CI/CD pipelines (GitLab, GitHub Actions, or similar). ### **Networking and Security** * TCP/IP, DNS, and L2 to L7 fundamentals. * Basic understanding of identity and access control (SAML, OIDC). ### **Mindset** * Infrastructure as Code first. * Learning mindset, takes feedback and runs with it. * Comfortable working in a remote\-first, written communication environment. **Nice to Have** ---------------- * Kubernetes KCNA (Kubernetes and Cloud Native Associate) or equivalent foundational certification. * Experience with Grafana and Prometheus. * Exposure to ArgoCD or other GitOps tooling. * Experience in regulated environments (financial services, healthcare, public sector). * Contributions to open\-source infrastructure or platform tooling. **What Good Looks Like in Year One** ------------------------------------ * Paired effectively with senior engineers and picked up core platform patterns. * Shipped scoped pieces of the platform independently by the end of year one. * Contributed to platform documentation, runbooks, and self\-service tooling. * Built operational confidence through shared on\-call and incident participation. **Note on Travel** ------------------ This role requires occasional travel to our Kerry office for team meetings and collaboration. While day\-to\-day work can be hybrid, you need to be willing to travel to Kerry when needed. **Fexco is an equal opportunities employer and is proud to foster a work environment where our people are supported and encouraged to be themselves. We welcome applicants of all backgrounds and sections of society and each application is given fair consideration.**",https://ie.indeed.com/viewjob?jk=7b17fa3409cafb0b
Junior Purchasing Assistant,Doyles Veg Prep Ltd,"Dublin, D, IE",indeed,"**Company Overview** Founded in 1998, Doyles Veg Prep is one of Ireland's leading suppliers of fresh fruit and vegetables. Operating a sixday delivery schedule with a fully refrigerated fleet, we supply a diverse customer base including hotels, catering companies, and many of Ireland's bestknown bars and restaurants. Quality, consistency, and reliability are at the core of everything we do. Due to continued growth, we are seeking to recruit a Junior Purchasing Assistant to support our Purchasing Team. **Role Purpose** The Junior Purchasing Assistant will support the buying team with daytoday purchasing activities, supplier coordination, and stock management. This is an entrylevel role suited to someone with strong organisational skills, attention to detail, and a keen interest in the food or fresh produce supply chain, with clear development opportunities into a Buyer role. ***Key Responsibilities*** **Purchasing \& Supply Support** * Assist Buyers with daily purchasing of fresh produce * Raise and amend purchase orders in line with demand forecast and sales requirements * Communicate with suppliers regarding orders, deliveries, shortages, and substitutions * Track supplier confirmations and follow up on late or incomplete deliveries * Support price checks and ensure accurate pricing on ordering systems **Stock \& Inventory Support** * Monitor stock levels and flag low stock, overstocking, or potential waste * Assist with inventory accuracy and stock rotation processes * Support stock reconciliation and investigate variances as required **Quality \& Compliance** * Support quality checks on incoming goods in line with company food safety and quality standards * Report quality issues to Buyers and suppliers and assist with followup actions * Ensure all purchasing processes comply with food safety and internal procedures **Systems \& Administration** * Maintain accurate purchasing records and supplier information * Update internal systems with pricing, product, and supplier data * Support reporting on purchasing activity, pricing, and supplier performance **Team Collaboration** * Work closely with Warehouse, Operations, and Quality teams to ensure alignment between purchasing and delivery requirements * Escalate supply risks, shortages, or issues promptly Contribute to continuous improvement within the purchasing function * ***Key Requirements*** * Strong interest in food, fresh produce, or supply chain operations * Excellent organisational and timemanagement skills * Ability to work effectively in a fastpaced environment * Strong attention to detail, particularly with orders, pricing, and quality * Good numerical skills and confidence working with data * Strong communication and teamwork skills * Proficiency in Excel or similar systems * Proactive, flexible, and eager to learn ***Desirable*** * Experience in retail, wholesale, food production, or FMCG * Knowledge of seasonal produce or food supply chains * Qualification or ongoing study in Business, Supply Chain, Food, or related field ***What We Offer*** * Entry point into a commercial buying and supply chain career * Exposure to fresh produce markets and supplier networks * Support, training, and development opportunities * A dynamic, handson working environment * Potential progression into a Buyer role",https://ie.indeed.com/viewjob?jk=1142ed4172d99cad
Junior Quantity Surveyor,Maplegrange Construction Ltd,"Navan, MH, IE",indeed,"**Junior Quantity Surveyor – Maplegrange (Navan \& Dublin)** **About Us** Maplegrange is a well\-established plastering and construction company, backed by over 30 years of expertise across both commercial and residential projects. With offices in Navan and Dublin, we have built a strong reputation for delivering high\-quality workmanship and reliable service to our clients. Due to our continued growth, we are seeking a **Junior Quantity Surveyor** to join our expanding team. **The Role** This is an excellent opportunity for a motivated individual looking to develop their career in quantity surveying. Working alongside our Senior Quantity Surveyor, you will gain hands\-on experience across a range of commercial and residential projects, supporting the successful delivery of works from start to finish. **Key Responsibilities** * Assist in the preparation of project budgets, cost plans, and forecasts * Support cost analysis and value engineering exercises * Assist with procurement processes, including obtaining quotations and liaising with subcontractors * Monitor project costs and progress under the guidance of senior team members * Help prepare interim valuations, variations, and final accounts * Maintain accurate records and documentation * Liaise with internal teams, clients, and suppliers as required **Requirements** * Degree (or working towards) in Quantity Surveying or related discipline * Strong attention to detail and good organisational skills * Fluent in English (written and spoken) * Willingness to learn and develop professionally * Flexible and adaptable approach to work * Ability to work both independently and as part of a team environment * Full, clean driving licence **What We Offer** * Competitive salary starting from €45,000 (depending on experience) * Ongoing training and mentorship from experienced professionals * Opportunity to grow and progress within a dynamic and expanding company **Why Join Maplegrange?** This is a very exciting opportunity for the right candidate to begin or further their career with a respected and growing company. Maplegrange offers a supportive environment with excellent opportunities to learn, develop, and progress long\-term. If you are eager to build a career in quantity surveying, we would love to hear from you. Please send your CV to nicola@maplegrange.ie Job Type: Full\-time Pay: €45,000\.00\-€50,000\.00 per year Benefits: * Bike to work scheme * On\-site parking * Sick pay Work Location: In person Application deadline: 08/05/2026 Expected start date: 25/05/2026",https://ie.indeed.com/viewjob?jk=d3ef92ce8434cd83
Junior Quantity Surveyor,Mercury,"Dublin, County Dublin, Ireland",linkedin,"Junior Quantity Surveyor, Dublin, Ireland Apply Now Mercury is the European leader in construction solutions. We build and manage complex engineering \& construction projects for the world’s leading corporations. Our solutions help deliver technologies and life changing advancements that connect people, communities and businesses, giving them the power to achieve incredible things. Our people have the courage to be innovative. Their determination and sharp focus enable us to deliver with certainty, time and time again. We deliver our clients’ visions through leading edge construction solutions across multiple sectors, including: Enterprise Data Centres, Advanced Technology \& Life Sciences, Hyperscale Data Centres, Fire Protection. At Mercury, it is our duty to encourage and back our people to realise their vision of themselves. We place them at the heart of what we do, providing challenging opportunities to develop within a great team in a supportive environment that allows them to reach their full potential. **Key Responsibilities Of The Role** * Review and understanding project contract documentation. * Preparing and analysing supplier and sub\-contractor enquiries. * Preparation and issuing of contract documents to our supply chain. * Monitoring change in our scope of work and pricing of variations. * Preparing and agreeing Monthly progress applications. * Financial and contractual control of sub\-contractor accounts. * Issuing of contractual notices and evaluate loss and expense/acceleration claims. * Providing fast, accurate, competitive and profitable estimates. * Preparation of monthly commercial project reports. * Provide Data and analysis of issues \& risks as required by Management. * Managing and forecasting of project Cash flows. * Liaising with the client, main contractor and other departments. * All other duties associated with this role. **Essential Criteria For The Role** * Knowledge of COMM’s and ICT scope of Work and Systems * Academically (Degree) qualified and or relevant experience in the industry * 5\+ years’ experience in a QS role or engineering role with good commercial exposure * A wide understanding of subcontracts * We are looking for candidates from CSA and MEP discipline areas. * Able to negotiate with clients and subcontractors on a professional level * Experience in use of Excel a requirement (SAP experience an advantage) * Excellent Analytical and problem\-solving skills * High level of accuracy and attention to detail * Must have fluency in written and spoken English for this QS Job in the UK ***Mercury is an equal opportunities employer*** **.** Määrälaskija (ICT), Suomi Mercury on Euroopan johtava rakennusratkaisujen toimittaja. Rakennamme ja hallinnoimme monimutkaisia suunnittelu\- ja rakennusprojekteja maailman johtaville yrityksille. Ratkaisumme auttavat tarjoamaan teknologioita ja elämää mullistavia edistysaskeleita, jotka yhdistävät ihmisiä, yhteisöjä ja yrityksiä ja antavat heille mahdollisuuden saavuttaa uskomattomia asioita. Ihmisillämme olla rohkeutta olla innovatiivisia. Heidän päättäväisyytensä ja tarkka keskittymisensä antavat meille mahdollisuuden toimittaa varmuudella, aika aika jälkeen. Toteutamme asiakkaidemme visioita huippuluokan rakennusratkaisuilla useilla eri aloilla, mukaan lukien: yritysten datakeskukset, edistynyt teknologia ja biotieteet, hyperskaalatut datakeskukset ja palontorjunta. Mercurylla velvollisuutemme on kannustaa ja tukea ihmisiä toteuttamaan visionsa itsestään. paikka heidät toimintamme keskiöön ja tarjoamme haastavia kehitysmahdollisuuksia loistavassa tiimissä tukevassa ympäristössä, joka antaa heille mahdollisuuden saavuttaa täyden potentiaalinsa. **Roolin Keskeiset Vastuut** * Tarkista ja ymmärrä projektisopimusdokumentaatio. * Toimittajien ja alihankkijoiden tiedustelujen valmistelu ja analysointi. * Sopimusasiakirjojen valmistelu ja toimittaminen toimitusketjullemme. * Työn laajuuden ja variaatioiden hinnoittelun muutosten seuranta. * Kuukausittaisten edistymishakemusten valmistelu ja hyväksyminen. * Alihankkijoiden tilien taloudellinen ja sopimusvalvonta. * Sopimusilmoitusten antaminen sekä tappio\- ja kulu\-/kiihtyneiden maksujen korvausvaatimusten arviointi. * Tarjoamme nopeita, tarkkoja, kilpailukykyisiä ja kannattavia kustannusarvioita. * Kuukausittaisten kaupallisten projektiraporttien laatiminen. * Tarjoa johdon edellyttämiä tietoja ja analyysejä ongelmista ja riskeistä. * Projektin kassavirtojen hallinta ja ennustaminen. * Yhteydenpito asiakkaan, pääurakoitsijan ja muiden osastojen kanssa. * Kaikki muut tähän rooliin liittyvät tehtävät. **Rooliin Liittyvät Keskeiset Kriteerit** * Tietoa viestinnän ja ICT:n työtehtävien ja järjestelmien laajuudesta * Akateeminen (tutkinto) pätevyys ja/tai asiaankuuluva kokemus teollisuus * Vähintään 5 vuoden kokemus laadunvalvonnan tai insinöörin tehtävissä ja hyvä kaupallinen kokemus * Laaja ymmärrys alihankinnoista * Etsimme ehdokkaita CSA\- ja MEP\-tieteenaloilta. * Kykyä neuvotella ammattimaisesti asiakkaiden ja alihankkijoiden kanssa * Kokemus Excelin käytöstä on välttämätöntä (SAP\-kokemus katsotaan eduksi) * Erinomaiset analyyttiset ja ongelmanratkaisutaidot * Korkea tarkkuus ja yksityiskohta huomioiminen * Tässä QS\-työpaikassa Isossa\-Britanniassa sinulla olla sujuva englanti sekä kirjallisesti että suullisesti. ***Mercury on tasa\-arvoinen työnantaja*** **.** Apply Now",https://www.linkedin.com/jobs/view/4373019852
