title,company,location,site,description,job_url
Commercial Analyst,CarTrawler,"Dublin, County Dublin, Ireland",linkedin,"**Tech that takes you places** We’re CarTrawler, the global travel tech company behind seamless connections between people, places and possibilities. From powering car rental to creating smarter ways to move, we make travel smoother for millions worldwide. Our culture is built on curiosity, collaboration and craic where every idea counts and every journey matters. Ready to make an impact? Let’s go places together. The Commercial Analyst plays a critical role in supporting the Head of P\&L, Commercial Manager and Trading Squad in making informed business decisions. Working within a cross\-functional, self\-organised Trading Squad, the Commercial Analyst will drive insights, analyse performance, and communicate key trends to stakeholders. The role requires strong commercial acumen and the ability to identify, prioritise, and act upon opportunities for growth, focusing on driving profitable outcomes across multiple partners and markets. The Commercial Analyst will also collaborate across the wider Trading Analyst Group, ensuring that learnings are captured, shared, and implemented across the organisation. Additionally, the role will involve project work and providing analytical support for various initiatives, ensuring that data\-driven strategies are consistently aligned with the organisation's broader goals. **Your Journey starts here!** **What you’ll do as a Commercial Analyst;** **Performance Analysis \& Communication:** * Analyse trading performance and identify the key drivers influencing outcomes. * Communicate findings to stakeholders in a clear, tailored way to ensure insights are easily understood and actionable. **Project Leadership \& Co\-management:** * Support ad\-hoc and long\-term projects, such as partner performance optimisation and strategic initiatives, by providing data insights and recommendations. **P\&L Deep Dives:** * Conduct regular financial P\&L deep dives on selected partner groups, providing actionable insights for performance improvement. **Reporting Framework Development:** * Develop scalable, automated reporting that allow channel and P\&L owners to analyse performance and identify trends effectively. **P\&L Performance Communication:** * Ensure that performance trends related to pricing, digital merchandising, content, and conversion are well communicated, contextualised, and prioritised to drive business growth. **Collaboration and Action:** * Work closely with the Trading Squad to identify growth opportunities and ensure these are developed and executed across the business. * Collaborate with other teams (e.g., business, product, finance) to ensure commercial strategies are aligned and backed by robust analytical insights. **Project Support:** * Provide analytical support for cross\-functional projects, offering insights from performance data to shape strategy and ensure alignment with business goals. * Contribute to special initiatives, such as pricing forums, new product launches, or partner onboarding, by supporting the data analysis and performance tracking. **What You’ll Bring To The Team** * At least 3\+ years in a similar role, with a proven track record in data analysis, identifying commercial opportunities, and driving business results. * A third\-level degree in IT, Mathematics, Statistics, Economics, or a related field. * Strong experience working with large datasets and practical experience with SQL. * Expertise in data visualisation, including creating interactive dashboards with tools such as Tableau or ThoughtSpot. * A passion for data and the ability to use it to identify commercial opportunities and product improvements. * A strong understanding of Excel and PowerPoint are essential. * Ability to clearly and succinctly communicate complex findings to a non\-specialist audience. * Strong collaboration and communication skills, working effectively across teams and with external partners **Nice to Have:** * Statistical Programming: * Experience with statistical programming languages like R or Python is a plus, though not essential. **Go on, give it a go!** We know that looking for a new job can feel a bit daunting but don’t let a touch of imposter syndrome hold you back. Even if you don’t tick every box, we’d still love to hear from you! Apply today to stay connected. At CarTrawler, we’re proud to be an equal opportunities employer. We celebrate diversity and are committed to creating an inclusive environment for everyone. No matter your background, identity, or life experience, if you’re passionate about what you do, you’ll be welcomed here. **Perks for the journey** * Competitive pay and benefits, including a performance\-based annual bonus, fully subsidised VHI health insurance and pension matching up to 4% * Generous time off and flexible working, including 25 days’ annual leave, extra company days, monthly Friday Unplugged afternoons and the option to work abroad for up to 20 days a year * Comprehensive wellbeing support, including access to health and mental health programmes (HeadsUp and EAP) and paid leave for marriage, volunteering and personal wellbeing including menstrual, menopause, and fertility leave * Growth and recognition culture with development opportunities through training, coaching and study support plus programmes that celebrate individual and team achievements * Everyday perks that make a difference \- subsidised canteen (KC Peaches), on\-site car parking, Bike to Work and TaxSaver schemes plus an active Sports \& Social Club We may use artificial intelligence (AI) tools to support parts of the hiring process, such as reviewing applications, analyzing resumes, or assessing responses. These tools assist our recruitment team but do not replace human judgment. Final hiring decisions are ultimately made by humans. If you would like more information about how your data is processed, please contact us.",https://www.linkedin.com/jobs/view/4394644909
Commercial Growth Account Executive,MongoDB,"Dublin, D, IE",indeed,"We are searching for an ambitious Commercial Growth Account Executive. Your role will primarily be identifying new workloads to expand MongoDB's usage into accounts that are already leveraging our Database as a Service (DBaaS), Atlas, in a self\-serve manner. You'll focus on helping customers understand the continuous evolution of our developer data platform and its additional features that could be leveraged for their specific use cases. You will support customers at any stage of their journey, fostering greater adoption, retention, and overall satisfaction. This role provides an excellent opportunity for growth in a highly dynamic sales team. We are looking to speak to candidates who are based in Dublin for our hybrid working model. ### **Day to Day:** * Identify new workloads and potential use cases within existing accounts to drive increased Atlas consumption via your own pipeline generation and outbound activities * Articulate the value of MongoDB's expanded feature set and evolving developer data platform * Support customers throughout their journey, addressing any queries and ensuring optimal product usage * Develop relationships within customer accounts to promote greater visibility and deepen the partnership between MongoDB and your account's decision\-makers * Strategically navigate diverse industries with a data\-driven discovery and sales process to help land and expand customer workloads ### **What you bring to the table:** * At least 1 years of Sales experience, with a preference for database or software * Consistent record of meeting or exceeding targets in a highly competitive environment (top 10% performer) * Dynamic, enthusiastic, tenacious, team\-oriented mindset * Excellent verbal and written communication skills * Experience working within a quota and commission structure * College degree or equivalent work experience * High EQ, coachability, intellectual curiosity, and motivation to build a career at MongoDB * Native Spanish speaker ### **Things we love:** * Familiarity with database, developer personas, and open\-source technology * Experience with sales tech stack tools like Salesforce.com, Outreach, and Chorus.ai ### **Why You Should Apply:** * We offer an industry\-leading onboarding process for Associate Commercial Growth AE's that prioritizes professional development * High earning potential and a welcoming, inclusive workplace Meet MongoDB's Employee Affinity Groups! * Continuous career development, sales training in MEDDPIC, and Command of the Message * Benefits include: * + Sales Bootcamp + Cross\-departmental mentor and buddy programs * Join us at MongoDB, where your work matters, your individuality is embraced, and you have the freedom to create. You'll be a part of a culture that values your wellbeing and supports your professional and personal journey. We're committed to making a real\-world impact, and we can't wait to see what kind of difference you can make. Learn more about working at MongoDB and help us transform the world! ### **About MongoDB** MongoDB is built for change, empowering our customers and our people to innovate at the speed of the market. We have redefined the database for the AI era, enabling innovators to create, transform, and disrupt industries with software. MongoDB's unified database platform, the most widely available, globally distributed database on the market, helps organizations modernize legacy workloads, embrace innovation, and unleash AI. Our cloud\-native platform, MongoDB Atlas, is the only globally distributed, multi\-cloud database and is available across AWS, Google Cloud, and Microsoft Azure. With offices worldwide and over 60,000 customers, including 75% of the Fortune 100 and AI\-native startups, relying on MongoDB for their most important applications, we're powering the next era of software. Our compass at MongoDB is our Leadership Commitment, guiding how and why we make decisions, show up for each other, and win. It's what makes us MongoDB. To drive the personal growth and business impact of our employees, we're committed to developing a supportive and enriching culture for everyone. From employee affinity groups, to fertility assistance and a generous parental leave policy, we value our employees' wellbeing and want to support them along every step of their professional and personal journeys. Learn more about what it's like to work at MongoDB, and help us make an impact on the world! MongoDB is committed to providing any necessary accommodations for individuals with disabilities within our application and interview process. To request an accommodation due to a disability, please inform your recruiter. MongoDB is an equal opportunities employer. *Req ID: 426217*",https://ie.indeed.com/viewjob?jk=9e9cb990ccd81c84
"Counter Associate - The Ordinary - Brown Thomas, Dublin - PT",DECIEM | THE ABNORMAL BEAUTY COMPANY,"Dublin, County Dublin, Ireland",linkedin,"**WHAT ON EARTH IS DECIEM?** We are a collective of disrupters and doers, of creatives and scientists, with a mission to reimagine the world of beauty. Since inception, our vertically integrated structure, including our own laboratories, manufacturing, retail stores, and brand infrastructure, have enabled us to rapidly identify opportunities and deliver quality. Home to The Ordinary, NIOD, AVESTAN, and other emerging brands, our goal is to create with purpose. We were founded on the principle of doing everything that others don’t. Because normal gets you nowhere. We are DECIEM, The Abnormal Beauty Company. We are growing rapidly and we’re looking for someone who shares this vision and wants to grow with us! **WHAT WE'RE LOOKING FOR** We are looking for a flexible customer service\-oriented Sales Assistant known at DECIEM as Counter Associate, to join our "" **extraOrdinary""** team in **Brown Thomas, Dublin** to deliver memorable experiences to our customers \<3 Experience in the Retail, Department Stores, and luxury industry is highly desirable and ideally, within the Fragrance, Beauty, Fashion, and Luxury Goods sectors. * This is a 16\-hour\-a\-week position on a part\-time basis **WHAT YOU'D BE DOING IN THIS ROLE** * Greet all customers who enter the store with enthusiasm and professionalism, reflecting DECIEM’s vision through excellent service * Determine the customer’s needs and suggest relevant products by listening to the customer and sharing the product knowledge acquired during brand training * Ensure standards for quality, customer service, and health and safety are met * Adhere to the DECIEM experience and deliver unparalleled customer service. Educate customers about the world of Beauty and Skin Care, DECIEM brands, and products * Manage customer feedback and queries * Assist in maintaining counter standards of cleanliness and organization * Be aware of and assist in maintaining DECIEM’s merchandising concepts * Ensure tidiness standards are always respected and maintained * Conduct product refunds and address customer issues in a positive manner * Responsible for building meaningful relationships with department managers and clients. High standard communication. **SKILLS AND QUALIFICATIONS NEEDED TO GET THE JOB DONE** - Comfortable in engaging customers and applying products to the customer while providing consultations - Ability to multi\-task, while providing professional and outstanding customer service Desire to spread brand awareness - Effective time management and communication skills. **WHAT YOU'LL BE GAINING BY JOINING OUR TEAM** There’s a lot of good stuff that comes along with being a DECIEM team member. Here’s a few of our favourite perks and benefits, in no particular order… Generous Vacation \& Personal Days, plus additional time off for volunteering in your community, voting, peaceful protesting, celebrating your birthday, and more. 6 months of paid time off for new parents (inclusive of all genders). Unlimited access to an Employee Assistance Program that includes mental health care, mindfulness programs, and more. Access to Development Grants \& a LinkedIn Learning membership to help you keep growing and learning. First dibs on new products. A generous discount on DECIEM products for you, your family, and your friends. **BUILDING GROWTH TO POWER GOOD** We are a people\-first company that lives by our core values to… * ✨ Defy Convention. * ✨ Make it real. * ✨ Play in the grey. * ✨ Build Bridges. * ✨ Be the rabbit. These values continue to guide us in all that we do. Along the way, we’ve been honoured to win some pretty incredible awards, including a CEW Achiever Award, Best Skincare Brand at Sunday Times Style Beauty Awards, and Most Popular Sustainable Brand by The Cosmetify Index Global. We’re still blushing! **SUSTAINABILITY AND SOCIAL IMPACT** DECIEM’s objective is to build growth and do good things while prioritizing people, animals, and the Earth. Our Sustainability strategy is focused on fighting climate change, improved waste management, responsible packaging, responsible sourcing and product lifecycle, and water conservation. In 2020, DECIEM established the Good Fund to support both large and grassroots charities in response to global events. **CREATING A HUMAN WORLD OF BEAUTY** DECIEM is committed to diversity, equity, and inclusion (DEI) by creating meaningful, measurable change in the lives of our team members and in the communities where we operate. Achieving equality is critical to DECIEM and our future. You can learn more about our DEI commitment in our open letter, "" DECIEM is an equal opportunity employer. We prohibit discrimination based on age, colour, disability, national origin, race, religion, sex, gender, sexual orientation, and any other legally protected class in accordance with applicable federal, provincial and local laws. We are also committed to creating and maintaining an inclusive and accessible workplace. If you are contacted to be part of our recruitment process and require accommodation, please let us know. **WANT TO JOIN US?** Thank you for reading the whole thing! If you liked what you heard, kindly send us your resume. We really appreciate your effort in applying for this position. However, only those who have been shortlisted for interviews will be contacted. \<3 \#SP",https://www.linkedin.com/jobs/view/4396742363
Credit Analyst,Hays,"Dublin, County Dublin, Ireland",linkedin,"We're currently supporting the recruitment for a position within a **Retail Valuations Centre of Specialisation** , based in either **Cork or Dublin.** The role offers a pay rate of **€18\.19–€20\.79** per hour, operates on a **hybrid model** with three days onsite, and is initially a **6‑month contract** with potential to extend. There are two potential team pathways depending on your experience: 1\. \*\*Operations Team\*\* – focused on managing the full Internal Monitoring Test (IMT) operational cycle, maintaining key valuation tools and databases, supporting governance requirements, and ensuring smooth workflow coordination. This suits someone who is detail‑oriented, organised, comfortable with high‑volume processes, and experienced in operations, compliance, risk, or data management. 2\. \*\*Valuations Team\*\* – responsible for preparing and reviewing valuation reports, applying valuation methodologies aligned to RICS/EVS standards, and collaborating with internal and external stakeholders. This is ideal for someone with a background in property valuation, credit, commercial real estate, or financial analysis. Both roles play a key part in ensuring robust, consistent, and well‑governed valuations that support wider lending decisions. If this aligns with your experience, could you please share an updated CV? I would also appreciate a quick 10‑minute call to discuss the role in more detail. Please let me know a suitable time. Looking forward to hearing from you.",https://www.linkedin.com/jobs/view/4394613592
Data Analyst,Irish College of GPs,"Dublin, County Dublin, Ireland",linkedin,"**Job Title:** Data Analyst – Research **Reporting to:** Head of Research, Policy Information (RPI) **Base:** 15 Hogan Place, Dublin 2/ Hybrid working **Contract type:** Fixed term contract for 2 Years (with potential to become permanent) **Application closing Date : 20th April 2026 12pm** **About The Irish College Of GPs** The Irish College of GPs is the professional body for general practice in Ireland. Please visit our website for more information: Irish College of GPs **About The Research, Policy Information (RPI) Department** The Irish College of GPs views data and its analysis as essential for our health system to modernise and meet the needs of our patients and growing population. RPI activities can help these goals to be realised, and the College’s “Shaping the Future” discussion paper on the Workforce and Workload crisis in General Practice in Ireland (launched Oct 2022\), holds that the Research, Policy Information department is important to mainstreaming research in general practice and thus should be “continued and potentially expanded to maximise this benefit”. **Job Purpose** The Data Analyst will primarily support the Research, GP Training and IMG Rural departments as well as other departments across the College by providing high\-quality data analysis, reporting, and insight. The role will contribute to GP Trainings selection process, workforce planning, research, continuous improvement of education and training programmes, and evidence\-based decision\-making across the College. The Data Analyst will work as part of a small team contributing to general practice workforce planning and training programme delivery in Ireland. The role will involve close collaboration with colleagues across education, policy, and research functions, with particular focus on supporting GP Training's selection and assessment processes. While the day\-to\-day work centres on data processing, analysis, and reporting, this work directly supports the College's mission to strengthen general practice and inform evidence\-based workforce planning. The postholder will use appropriate statistical and technological tools while ensuring full compliance with GDPR and relevant regulatory requirements, gaining broad exposure to healthcare research, medical education, and workforce data. **Key Result Areas** * Oversee data processing aspect of GP Training selection processes, designing and improving these processes to support the administration of assessments and offers. * Develop analytical tools and provide mapping and modelling outputs for RPI, GP Training, IMG Rural and other approved projects. * Combine and manage complex data sources to generate metrics and support data analysis to provide analysis across the College to meet its advocacy and information needs. * Interpret complex information, presenting it clearly and concisely to non\-analytical audiences. * Analyse and interpret data and provide guidance as required to support key decision making. * Offer expert knowledge and support appropriate projects that contribute to the overall College strategic goals. * Provide support for data issues across the College as prioritized and allocated by the Head of RPI (Research, Policy and Information). * Produce reports for stakeholders and document statistical approaches used in analyses. * Present data through accessible charts and dashboards to highlight trends, patterns, and insights that supports tjhe RPI, GP Training and IMG Rural departments objectives. * Enhance data quality, consistency, and governance by aligning with other data quality and privacy initiatives across the College, including workforce planning, education, and research. * Proactively participate in the Performance Management (Job Chats) process which seek to nurture high performing, cohesive teams. **Person Specification** **Essential** * Third level qualification in a relevant subject such as data analytics, informatics, statistics, mathematics, social sciences, economics, or computer science. * Minimum of 2 years experience in data analytics or in related field (areas such as statistical modelling, spatial analysis, survey analysis, policy research with quantitative components, dashboard design). * Experience with data analysis tools. Strong preference for demonstrated experience with R, MS SQL, and Power BI specifically, as these form our core analytical infrastructure. * Ability to analyse data and communicate findings clearly and accurately, including highlighting gaps. * Strong attention to detail and commitment to high quality analysis and report writing. * Good organisational skills and ability to manage competing priorities. * Ability to work with key stakeholders at all levels within collaborating organisations. * Understanding of the confidentiality requirements when handling personal or sensitive organisational data. **Desirable** * Interest in assessment, medical education, healthcare and research. * Experience supporting research projects or evaluations. * Familiarity with healthcare, education, or workforce datasets. * Good understanding of research methods and/or statistics. * Familiarity with assessment data handling, and use of statistics in exam design and delivery. * Good awareness of data protection, research ethics, and information governance principles. * Experience creating dashboards or visualisations. **Key benefits of working at the Irish College of GPs include:** * Contributing to the evolution of general practice in Ireland * An inclusive working environment where wellbeing, diversity and equity are actively promoted. We have been awarded the Silver accreditation from the Irish Centre for Diversity and working towards our Gold Award * Flexible hybrid working * Competitive salary and generous annual leave * Learning and development opportunities * Access to Employee Assistance Programme including for close family members",https://www.linkedin.com/jobs/view/4396711434
