title,company,location,site,description,job_url
Sexual Health Clinical Nurse Specialist - Sandyford Services,NHS Ayrshire & Arran,"Sandyford, Dún Laoghaire-Rathdown, Ireland",linkedin,"**NHS Greater Glasgow and Clyde (NHSGGC)** is one of the largest healthcare systems in the United Kingdom, employing approximately 40,000 staff across a wide range of clinical and non\-clinical professions and roles. We deliver acute hospital, primary, community and mental health services to a population of over 1\.15 million people, and to a wider population of 2\.2 million when regional and national services are included. **The Role** As a clinical expert, the post holder will deliver a range of skilled sexual \& reproductive health care interventions, including long\-acting contraception (intra\-uterine contraceptive devices), testing and treatment of sexual infections and blood\-borne viruses, sexual health advising, including partner notification and supporting case management to a defined population. The post holder will provide accessible, appropriate, high\-quality, culturally sensitive, safe and effective care to Sandyford service users, working in partnership with the Team Leader, the multi\-professional team, service users, care providers and other agencies. **You need to have a live NMC UK pin to be considered for this post.** **Duration, Location, and Working Pattern:** * Sandyford Initiative * There are two full\-time positions (36 hours per week), and one part\-time position (21\.6 hours per week) * Please outline your preference in your application * The shift pattern for these posts is Monday to Friday, from 08:30 \- 20:00 **Key Responsibilities** * Function as an independent practitioner by virtue of in\-depth knowledge, expertise, proficiency and experience providing sexual and reproductive health care to patients based on a social model of health care and manage individual patient consultations within a legal and ethical framework, in line with clinical protocols/guidance, clinical governance and professional accountability. * Undertake risk assessments in relation to STI and carry out screening for symptomatic individuals, demonstrating the ability to plan or coordinate care following clearly defined protocols, guidelines and policies, ensuring understanding and consent of the patient. * Demonstrates the ability to make or confirm a differential diagnosis predominantly using written guidelines or protocols. * Interpret clinical results within the scope of their knowledge and experience and make referrals as appropriate. * Be responsible for disclosing and explaining the diagnosis and implications of bacterial sexually transmitted infections to a patient or partner. * Provide appropriate treatment and ensure effective partner notification, for those diagnosed with a range of STIs being accountable for their care management. **Knowledge, training, qualifications and/or experience required to do the job:** **Essential** * Registered nurse, Adult or Mental Health, currently registered with the Nursing \& Midwifery Council * Evidence of contraceptive and sexual infection knowledge, including public health/partner notification, obtained from modular learning or post\-registration course. * Evidence of continuing professional development relevant to sexual health * Significant experience of working in sexual health, gynaecology or a related area of practice, enabling effective fulfilment of the responsibilities of the role. * Ability to work on own initiative and within a team * Ability to work to challenging deadlines * Excellent communication skills, verbal/written **Essential Or Working Towards** * Minimum of a graduate certificate (honours degree level) qualification specific to sexual and reproductive health with a core educational focus on the development of clinical competence. * Development of a NES TURAS Professional Portfolio containing evidence of their qualifications, clinical competence and continued professional development. Competence in Subdermal Contraceptive Implant Device Fitting \& Removal * Competence in Intra\-uterine contraceptive device fitting * Non\-medical prescriber V300 qualification **Desirable** * Full driving licence **What We Offer** We offer a wide range of supportive policies designed to enhance your employee journey, including a comprehensive Employee Assistance Programme, Cycle to Work Scheme, bursary scheme and extensive learning and development opportunities. As an NHS Scotland employee, you will be entitled to: * A minimum of 27 days annual leave, increasing with length of service, plus public holidays * Membership of the NHS Pension Scheme, including life insurance benefits * Salary Sacrifice Car Benefit Scheme * Development opportunities including study bursaries, e\-learning and classroom\-based courses * Enhanced pay for working public holidays * NHS discounts on a wide range of goods and services * Confidential employee support and assistance, including counselling and psychological therapies **Interested?** If you would like to find out more, we would love to hear from you. **For An Informal Discussion, Please Contact** **Amy Heggie, Nurse Team Lead, amy.heggie@nhs.scot** Details on how to contact the Recruitment Service and the Recruitment Process: **Information for candidates** This post may close early to the volume of response. Please submit your application form as soon as possible. Due to the volume of applications that we receive, we will not be able to provide shortlisting feedback. **From 1 April 2026, the Agenda for Change full\-time working week will reduce from 37 hours to 36 hours. Part\-time working hours will be reduced on a pro\-rata basis. A corresponding increase in the hourly rate will apply, ensuring that overall pay remains unchanged.** NHS Greater Glasgow and Clyde (NHSGGC) recognises the importance of **work\-life balance** and is committed to offering a range of flexible working options where service needs allow. For roles where less than full\-time hours can be accommodated, and where the tenure is listed as *“various”* , we encourage applications from individuals seeking flexible working arrangements. Flexible working will be included as a topic for discussion during the recruitment process. **NHS Greater Glasgow and Clyde encourages applications from all sections of the community** . We are committed to promoting equality, diversity and inclusion and are proud of the diverse workforce we employ. By signing the **Armed Forces Covenant,** NHSGGC has pledged its commitment to being a Forces Friendly Employer. We welcome applications from across the Armed Forces Community and recognise military skills, experience and qualifications throughout the recruitment and selection process. Candidates must provide original and authentic responses to all questions within the application form. The use of **artificial intelligence (AI)** , automated tools or other third\-party assistance to generate, draft or significantly modify responses is strongly discouraged. By submitting your application, you confirm that all answers are your own work, reflect your personal knowledge, skills and experience, and have not been solely produced or altered by AI or similar technologies. Failure to comply with this requirement may result in your application being withdrawn from the recruitment process. For application portal or log\-in issues, please contact the Jobtrain Support Hub in the first instance.",https://www.linkedin.com/jobs/view/4403708415
Site Engineer - Civils,Sisk,"Blanchardstown, D, IE",indeed,"Overview: At Sisk, we create places and infrastructure that shape how people live, work and connect – now and for future generations. As a family‑owned, international construction and engineering group, we offer meaningful careers across building, infrastructure, rail, energy and off‑site manufacturing throughout Ireland, the UK and Europe, where people are supported to grow, make an impact and be part of positive change. The Engineer is responsible for setting\-out the site and dimensional controls in accordance with the relevant contract Drawings, Specification and Site Surveys. Ensures that all relevant tolerances have been catered for without compromising quality or loss of floor space. Is tasked with reviewing construction outputs and planning the most efficient sequence of operations with an emphasis on control of the works, quality and technical advice. The Engineer will carry out their work in accordance with company standard procedures and discharge their duties as listed in the Sisk Safety Statement/Policy. John Sisk \& Son have been building excellence as a family\-owned international construction company by offering trust, certainty and value to our clients whilst being at the heart of change. Responsibilities: * Set out works in line with drawings, specifications and site surveys * Liaise with planners to align programmes and supplier outputs * Check materials and works in progress for compliance with specifications and quality standards * Contribute to Inspection and Test Plans and ensure supply chain provides required test data * Raise and resolve RFIs with client representatives, suppliers, subcontractors and statutory bodies * Maintain quality control and records in line with method statements, quality plans and inspection procedures * Review subcontractor drawings and ensure correct use of contract records and specifications * Ensure purchase orders define technical requirements accurately * Conduct regular audits of DPD compliance and performance across projects. * Ensure integration of digital tools into construction, design and planning processes, promoting efficiency and innovation. * Supervise and mentor junior or trainee engineers * Provide input into measurement and valuation with the project quantity surveyor * Maintain site diaries and prepare reports * Carry out pre\-start condition surveys * Manage and record delivered materials including concrete, reinforcement and structural products * Assist with installation of site facilities such as hoardings and accommodation * Carry out snagging and de\-snagging before handover * Support safe working practices including reviewing subcontractor safety plans and preparing method statements * Actively develop own skills and mentor others through knowledge sharing Experience: **Essential*** Minimum three years post\-qualification experience within the sector or project\-based environment * Strong knowledge of engineering principles and technical coordination * Skilled in setting out and proficient in using total stations, EDMs, lasers and dumpy levels * Ability to check packages such as drainage and reinforcement installations * Articulate and numerate with ability to produce objective and persuasive reports * Demonstrates initiative, resilience and problem\-solving ability * Experience across a range of trades including piling, geotechnical, substructures, superstructures and facades **Desirable*** Strong interpersonal and communication skills with ability to influence and work with senior management * Ability to analyse, evaluate and adapt approach to project needs * Knowledge of Control of Temporary Works with ability to act as TWC desirable * Competence in BIM and ability to work with 3D scanning or point cloud data an advantage Qualifications: **Essential*** Degree or Diploma in Engineering * SMSTS or MSIC certification * First Aid training * Lifting Supervisor certification * Temporary Works Coordinator training * Chartered or working towards professional membership with Engineers Ireland or the Institution of Civil Engineers **Desirable*** Project Management qualification * Training in planning software * Additional Information: * **What We Offer** At Sisk, your rewards package goes far beyond your salary. Our most valued benefits include: + Competitive salary + 26 days annual leave + Pension scheme + Comprehensive health, wellbeing and lifestyle supports + Career development opportunities + And much more as part of our Total Rewards programme * **Our People \& Recruitment Commitment** At Sisk, our people are at the heart of everything we do. We offer the opportunity to work with purpose, grow a career without limits and be part of a supportive, collaborative team. All vacancies are managed directly by our Internal Recruitment Team. Unsolicited CVs or speculative contact from unapproved agencies are not accepted, and no fees will be payable. **Equity, Inclusion \& Accessibility** We are an equal opportunities employer. We welcome applications from all qualified candidates regardless of gender, race, ethnicity, disability, age, sexual orientation, religion, family status or any other protected characteristic. We are committed to providing reasonable adjustments throughout the recruitment process to support all candidates. **Encouraging All Talent to Apply** We understand that the confidence gap or imposter syndrome can discourage great people from applying. Even if you don’t meet every requirement, we encourage you to express your interest — your skills, experience and potential are what matter. **Compliance \& Transparency** All recruitment materials are designed to meet or exceed legal and regulatory requirements, including the Irish and UK Equality Acts and the EU Pay Transparency Directive, ensuring fairness, transparency and equal access for every applicant. \#LI\-RB1 \#LI\-AG1",https://ie.indeed.com/viewjob?jk=1ad054c3eef6b6d7
Site Engineer - Civils,John Sisk & Son Ltd,"Blanchardstown, Fingal, Ireland",linkedin,"****Overview**** At Sisk, we create places and infrastructure that shape how people live, work and connect – now and for future generations. As a family‑owned, international construction and engineering group, we offer meaningful careers across building, infrastructure, rail, energy and off‑site manufacturing throughout Ireland, the UK and Europe, where people are supported to grow, make an impact and be part of positive change. The Engineer is responsible for setting\-out the site and dimensional controls in accordance with the relevant contract Drawings, Specification and Site Surveys. Ensures that all relevant tolerances have been catered for without compromising quality or loss of floor space. Is tasked with reviewing construction outputs and planning the most efficient sequence of operations with an emphasis on control of the works, quality and technical advice. The Engineer will carry out their work in accordance with company standard procedures and discharge their duties as listed in the Sisk Safety Statement/Policy. John Sisk \& Son have been building excellence as a family\-owned international construction company by offering trust, certainty and value to our clients whilst being at the heart of change. ****Responsibilities**** * Set out works in line with drawings, specifications and site surveys * Liaise with planners to align programmes and supplier outputs * Check materials and works in progress for compliance with specifications and quality standards * Contribute to Inspection and Test Plans and ensure supply chain provides required test data * Raise and resolve RFIs with client representatives, suppliers, subcontractors and statutory bodies * Maintain quality control and records in line with method statements, quality plans and inspection procedures * Review subcontractor drawings and ensure correct use of contract records and specifications * Ensure purchase orders define technical requirements accurately * Conduct regular audits of DPD compliance and performance across projects. * Ensure integration of digital tools into construction, design and planning processes, promoting efficiency and innovation. * Supervise and mentor junior or trainee engineers * Provide input into measurement and valuation with the project quantity surveyor * Maintain site diaries and prepare reports * Carry out pre\-start condition surveys * Manage and record delivered materials including concrete, reinforcement and structural products * Assist with installation of site facilities such as hoardings and accommodation * Carry out snagging and de\-snagging before handover * Support safe working practices including reviewing subcontractor safety plans and preparing method statements * Actively develop own skills and mentor others through knowledge sharing ****Essential**** **Experience** * Minimum three years post\-qualification experience within the sector or project\-based environment * Strong knowledge of engineering principles and technical coordination * Skilled in setting out and proficient in using total stations, EDMs, lasers and dumpy levels * Ability to check packages such as drainage and reinforcement installations * Articulate and numerate with ability to produce objective and persuasive reports * Demonstrates initiative, resilience and problem\-solving ability * Experience across a range of trades including piling, geotechnical, substructures, superstructures and facades **Desirable** * Strong interpersonal and communication skills with ability to influence and work with senior management * Ability to analyse, evaluate and adapt approach to project needs * Knowledge of Control of Temporary Works with ability to act as TWC desirable * Competence in BIM and ability to work with 3D scanning or point cloud data an advantage ****Essential**** **Qualifications** * Degree or Diploma in Engineering * SMSTS or MSIC certification * First Aid training * Lifting Supervisor certification * Temporary Works Coordinator training * Chartered or working towards professional membership with Engineers Ireland or the Institution of Civil Engineers **Desirable** * Project Management qualification * Training in planning software ****Additional Information**** * What We Offer At Sisk, your rewards package goes far beyond your salary. Our most valued benefits include: + Competitive salary + 26 days annual leave + Pension scheme + Comprehensive health, wellbeing and lifestyle supports + Career development opportunities + And much more as part of our Total Rewards programme * Our People \& Recruitment Commitment At Sisk, our people are at the heart of everything we do. We offer the opportunity to work with purpose, grow a career without limits and be part of a supportive, collaborative team. All vacancies are managed directly by our Internal Recruitment Team. Unsolicited CVs or speculative contact from unapproved agencies are not accepted, and no fees will be payable. **Equity, Inclusion \& Accessibility** We are an equal opportunities employer. We welcome applications from all qualified candidates regardless of gender, race, ethnicity, disability, age, sexual orientation, religion, family status or any other protected characteristic. We are committed to providing reasonable adjustments throughout the recruitment process to support all candidates. **Encouraging All Talent to Apply** We understand that the confidence gap or imposter syndrome can discourage great people from applying. Even if you don’t meet every requirement, we encourage you to express your interest — your skills, experience and potential are what matter. **Compliance \& Transparency** All recruitment materials are designed to meet or exceed legal and regulatory requirements, including the Irish and UK Equality Acts and the EU Pay Transparency Directive, ensuring fairness, transparency and equal access for every applicant.",https://www.linkedin.com/jobs/view/4402894334
Site Engineer - Civils,SISK Group,"Blanchardstown, Fingal, Ireland",linkedin,"At Sisk, we create places and infrastructure that shape how people live, work and connect \- now and for future generations. As a family‑owned, international construction and engineering group, we offer meaningful careers across building, infrastructure, rail, energy and off‑site manufacturing throughout Ireland, the UK and Europe, where people are supported to grow, make an impact and be part of positive change. The Engineer is responsible for setting\-out the site and dimensional controls in accordance with the relevant contract Drawings, Specification and Site Surveys. Ensures that all relevant tolerances have been catered for without compromising quality or loss of floor space. Is tasked with reviewing construction outputs and planning the most efficient sequence of operations with an emphasis on control of the works, quality and technical advice. The Engineer will carry out their work in accordance with company standard procedures and discharge their duties as listed in the Sisk Safety Statement/Policy. John Sisk \& Son have been building excellence as a family\-owned international construction company by offering trust, certainty and value to our clients whilst being at the heart of change. * Set out works in line with drawings, specifications and site surveys * Liaise with planners to align programmes and supplier outputs * Check materials and works in progress for compliance with specifications and quality standards * Contribute to Inspection and Test Plans and ensure supply chain provides required test data * Raise and resolve RFIs with client representatives, suppliers, subcontractors and statutory bodies * Maintain quality control and records in line with method statements, quality plans and inspection procedures * Review subcontractor drawings and ensure correct use of contract records and specifications * Ensure purchase orders define technical requirements accurately * Conduct regular audits of DPD compliance and performance across projects. * Ensure integration of digital tools into construction, design and planning processes, promoting efficiency and innovation. * Supervise and mentor junior or trainee engineers * Provide input into measurement and valuation with the project quantity surveyor * Maintain site diaries and prepare reports * Carry out pre\-start condition surveys * Manage and record delivered materials including concrete, reinforcement and structural products * Assist with installation of site facilities such as hoardings and accommodation * Carry out snagging and de\-snagging before handover * Support safe working practices including reviewing subcontractor safety plans and preparing method statements * Actively develop own skills and mentor others through knowledge sharing ****Essential**** * Minimum three years post\-qualification experience within the sector or project\-based environment * Strong knowledge of engineering principles and technical coordination * Skilled in setting out and proficient in using total stations, EDMs, lasers and dumpy levels * Ability to check packages such as drainage and reinforcement installations * Articulate and numerate with ability to produce objective and persuasive reports * Demonstrates initiative, resilience and problem\-solving ability * Experience across a range of trades including piling, geotechnical, substructures, superstructures and facades **Desirable** * Strong interpersonal and communication skills with ability to influence and work with senior management * Ability to analyse, evaluate and adapt approach to project needs * Knowledge of Control of Temporary Works with ability to act as TWC desirable * Competence in BIM and ability to work with 3D scanning or point cloud data an advantage ****Essential**** * Degree or Diploma in Engineering * SMSTS or MSIC certification * First Aid training * Lifting Supervisor certification * Temporary Works Coordinator training * Chartered or working towards professional membership with Engineers Ireland or the Institution of Civil Engineers **Desirable** * Project Management qualification * Training in planning software * What We Offer At Sisk, your rewards package goes far beyond your salary. Our most valued benefits include + Competitive salary + 26 days annual leave + Pension scheme + Comprehensive health, wellbeing and lifestyle supports + Career development opportunities + And much more as part of our Total Rewards programme * Our People \& Recruitment Commitment At Sisk, our people are at the heart of everything we do. We offer the opportunity to work with purpose, grow a career without limits and be part of a supportive, collaborative team. All vacancies are managed directly by our Internal Recruitment Team. Unsolicited CVs or speculative contact from unapproved agencies are not accepted, and no fees will be payable. **Equity, Inclusion \& Accessibility** We are an equal opportunities employer. We welcome applications from all qualified candidates regardless of gender, race, ethnicity, disability, age, sexual orientation, religion, family status or any other protected characteristic. We are committed to providing reasonable adjustments throughout the recruitment process to support all candidates. **Encouraging All Talent to Apply** We understand that the confidence gap or imposter syndrome can discourage great people from applying. Even if you don’t meet every requirement, we encourage you to express your interest — your skills, experience and potential are what matter. **Compliance \& Transparency** All recruitment materials are designed to meet or exceed legal and regulatory requirements, including the Irish and UK Equality Acts and the EU Pay Transparency Directive, ensuring fairness, transparency and equal access for every applicant.",https://www.linkedin.com/jobs/view/4404797894
