title,company,location,site,description,job_url
Quality Specialist – Trading Partner,GSK,"Dublin, County Dublin, Ireland",linkedin,"**Site Name:** Ireland \- Dublin **Posted Date:** Apr 10 2026 We are looking for a Quality Specialist – Trading Partner to join our team on a 12\-month fixed term contract basis. The successful candidate will support the Responsible Person in the fulfilment of responsibilities associated with licences, authorisations and registrations in the global wholesale distribution operations. You will be involved in the maintenance and management of Quality Assurance Agreements supporting the Trading Partner business operations globally. You will also, maintain and develop the Trading Partner Quality function to comply with the GSK Quality Management System. We value people who are curious, dependable, and clear communicators. This role offers strong learning and growth opportunities and a chance to make a meaningful impact by helping ensure safe and effective products reach patients. Join us to unite science, technology and talent to get ahead of disease together. This role is offered on a hybrid basis. You will work from the Dublin, Ireland site and from home as agreed with your manager. We create a place where people can grow, be their best, be safe, and feel welcome, valued and included. We offer a competitive salary, an annual bonus based on company performance, healthcare and wellbeing programmes, pension plan membership, and shares and savings programme. We embrace modern work practises; our Performance with Choice programme offers a hybrid working model, empowering you to find the optimal balance between remote and in\-office work. Discover more about our company wide benefits and life at GSK on our webpage *Life at GSK \| GSK* **In this role you will** * Maintain and operate the Quality System in Trading Partner Quality / Supply Chain Finance including key processes such as deviation, CAPA, incident management, change control, risk management and self\-inspection. * Maintain Quality Assurance Agreements that support the operations of the Trading Partner Companies. * Ensure that the training programme is maintained. * Maintain the Customer, Supplier and Active Ingredient qualification processes. * Maintain registrations, authorisation and licences as required. * Support the preparation of internal and external audits or inspections at all levels. * Support the Quality Council process ensuring that risks and issues are escalated to a leadership team level and that appropriate actions are taken. * Support and maintain the document management system in Trading Partner Quality including review of QMS documents and updates to Trading Partner Quality SOPs. ***Why you?*** **Basic Qualifications \& Skills:** **We are looking for professionals with these required skills to achieve our goals:** * Minimum education requirement of Leaving Certificate (Higher Level) or equivalent, including QQI Levels 3–5 or Junior Certificate. A degree in a relevant scientific discipline is desirable. * Experience working in a regulated pharmaceuticals environment. * Experience in a Quality Assurance role in a complex regulated pharmaceutical environmental including experience in the application and improvement of Quality Management System (QMS). * Experience in wholesaling in a pharmaceutical environment. * Experience working with and managing quality systems. * Knowledge of the management of WDA (H) and API licences for the UK and EU. * Strong computer literacy and proficient in Microsoft Word, Excel, PowerPoint, Outlook. **Preferred Qualifications \& Skills:** **Please note the following skills are not necessary, just preferred, if you do not have them, please still apply:** * Degree in Pharmacy, Chemistry, Biology or equivalent experience. * Experience in a regulated pharmaceuticals environment with an emphasis on the regulatory requirements for distribution of medicinal products in accordance with the EU GDP Guidelines. We manufacture and supply reliable, high\-quality medicines and vaccines to meet patients’ needs and drive our performance. Our network of 37 medicines and vaccines manufacturing sites delivered 1\.7 billion packs of medicines and 409 million vaccine doses in 2024 to help make a positive impact on the health of millions of people. Our supply chain is not just core to our operations; it’s vital to bringing our innovations to patients as quickly, efficiently and effectively as possible. Technology is transforming how we manufacture medicines and vaccines, enabling us to increase the speed, quality and scale of product supply. We need the very best minds and capability to help us on our journey to make more complex products, harnessing the power of smart manufacturing technologies including robotics, digital solutions and artificial intelligence to deliver for patients. **Closing Date for Applications – 24th April 2026 (COB)** Please take a copy of the Job Description, as this will not be available post closure of the advert. When applying for this role, please use the ‘cover letter’ of the online application or your CV to describe how you meet the competencies for this role, as outlined in the job requirements above. The information that you have provided in your cover letter and CV will be used to assess your application. **Why GSK?** **Uniting science, technology and talent to get ahead of disease together.** GSK is a global biopharma company with a purpose to unite science, technology and talent to get ahead of disease together. We aim to positively impact the health of 2\.5 billion people by the end of the decade, as a successful, growing company where people can thrive. We get ahead of disease by preventing and treating it with innovation in specialty medicines and vaccines. We focus on four therapeutic areas: respiratory, immunology and inflammation; oncology; HIV; and infectious diseases – to impact health at scale. People and patients around the world count on the medicines and vaccines we make, so we’re committed to creating an environment where our people can thrive and focus on what matters most. Our culture of being ambitious for patients, accountable for impact and doing the right thing is the foundation for how, together, we deliver for patients, shareholders and our people. GSK is an Equal Opportunity Employer. This ensures that all qualified applicants will receive equal consideration for employment without regard to race, color, religion, sex (including pregnancy, gender identity, and sexual orientation), parental status, national origin, age, disability, genetic information (including family medical history), military service or any basis prohibited under federal, state or local law. We believe in an agile working culture for all our roles. If flexibility is important to you, we encourage you to explore with our hiring team what the opportunities are. Should you require any adjustments to our process to assist you in demonstrating your strengths and capabilities contact us at UKRecruitment.Adjustments@gsk.com where you can also request a call. Please note should your enquiry not relate to adjustments, we will not be able to support you through these channels. However, we have created a Recruitment FAQ guide. Click the link where you will find answers to multiple questions we receive **Important notice to Employment businesses/ Agencies** GSK does not accept referrals from employment businesses and/or employment agencies in respect of the vacancies posted on this site. All employment businesses/agencies are required to contact GSK's commercial and general procurement/human resources department to obtain prior written authorization before referring any candidates to GSK. The obtaining of prior written authorization is a condition precedent to any agreement (verbal or written) between the employment business/ agency and GSK. In the absence of such written authorization being obtained any actions undertaken by the employment business/agency shall be deemed to have been performed without the consent or contractual agreement of GSK. GSK shall therefore not be liable for any fees arising from such actions or any fees arising from any referrals by employment businesses/agencies in respect of the vacancies posted on this site. Please note that if you are a US Licensed Healthcare Professional or Healthcare Professional as defined by the laws of the state issuing your license, GSK may be required to capture and report expenses GSK incurs, on your behalf, in the event you are afforded an interview for employment. This capture of applicable transfers of value is necessary to ensure GSK’s compliance to all federal and state US Transparency requirements. For more information, please visit the Centers for Medicare and Medicaid Services (CMS) website at https://openpaymentsdata.cms.gov/",https://www.linkedin.com/jobs/view/4400605321
Quality Specialist – Trading Partner,GSK,"Dublin, D, IE",indeed,"**Site Name:** Ireland \- Dublin **Posted Date:** Apr 10 2026 We are looking for a Quality Specialist – Trading Partner to join our team on a 12\-month fixed term contract basis. The successful candidate will support the Responsible Person in the fulfilment of responsibilities associated with licences, authorisations and registrations in the global wholesale distribution operations. You will be involved in the maintenance and management of Quality Assurance Agreements supporting the Trading Partner business operations globally. You will also, maintain and develop the Trading Partner Quality function to comply with the GSK Quality Management System. We value people who are curious, dependable, and clear communicators. This role offers strong learning and growth opportunities and a chance to make a meaningful impact by helping ensure safe and effective products reach patients. Join us to unite science, technology and talent to get ahead of disease together. This role is offered on a hybrid basis. You will work from the Dublin, Ireland site and from home as agreed with your manager. We create a place where people can grow, be their best, be safe, and feel welcome, valued and included. We offer a competitive salary, an annual bonus based on company performance, healthcare and wellbeing programmes, pension plan membership, and shares and savings programme. We embrace modern work practises; our Performance with Choice programme offers a hybrid working model, empowering you to find the optimal balance between remote and in\-office work. Discover more about our company wide benefits and life at GSK on our webpage *Life at GSK \| GSK* **In this role you will** * Maintain and operate the Quality System in Trading Partner Quality / Supply Chain Finance including key processes such as deviation, CAPA, incident management, change control, risk management and self\-inspection. * Maintain Quality Assurance Agreements that support the operations of the Trading Partner Companies. * Ensure that the training programme is maintained. * Maintain the Customer, Supplier and Active Ingredient qualification processes. * Maintain registrations, authorisation and licences as required. * Support the preparation of internal and external audits or inspections at all levels. * Support the Quality Council process ensuring that risks and issues are escalated to a leadership team level and that appropriate actions are taken. * Support and maintain the document management system in Trading Partner Quality including review of QMS documents and updates to Trading Partner Quality SOPs. ***Why you?*** **Basic Qualifications \& Skills:** **We are looking for professionals with these required skills to achieve our goals:** * Minimum education requirement of Leaving Certificate (Higher Level) or equivalent, including QQI Levels 3–5 or Junior Certificate. A degree in a relevant scientific discipline is desirable. * Experience working in a regulated pharmaceuticals environment. * Experience in a Quality Assurance role in a complex regulated pharmaceutical environmental including experience in the application and improvement of Quality Management System (QMS). * Experience in wholesaling in a pharmaceutical environment. * Experience working with and managing quality systems. * Knowledge of the management of WDA (H) and API licences for the UK and EU. * Strong computer literacy and proficient in Microsoft Word, Excel, PowerPoint, Outlook. **Preferred Qualifications \& Skills:** **Please note the following skills are not necessary, just preferred, if you do not have them, please still apply:** * Degree in Pharmacy, Chemistry, Biology or equivalent experience. * Experience in a regulated pharmaceuticals environment with an emphasis on the regulatory requirements for distribution of medicinal products in accordance with the EU GDP Guidelines. We manufacture and supply reliable, high\-quality medicines and vaccines to meet patients’ needs and drive our performance. Our network of 37 medicines and vaccines manufacturing sites delivered 1\.7 billion packs of medicines and 409 million vaccine doses in 2024 to help make a positive impact on the health of millions of people. Our supply chain is not just core to our operations; it’s vital to bringing our innovations to patients as quickly, efficiently and effectively as possible. Technology is transforming how we manufacture medicines and vaccines, enabling us to increase the speed, quality and scale of product supply. We need the very best minds and capability to help us on our journey to make more complex products, harnessing the power of smart manufacturing technologies including robotics, digital solutions and artificial intelligence to deliver for patients. **Closing Date for Applications – 24th April 2026 (COB)** Please take a copy of the Job Description, as this will not be available post closure of the advert. When applying for this role, please use the ‘cover letter’ of the online application or your CV to describe how you meet the competencies for this role, as outlined in the job requirements above. The information that you have provided in your cover letter and CV will be used to assess your application. **Why GSK?** **Uniting science, technology and talent to get ahead of disease together.** GSK is a global biopharma company with a purpose to unite science, technology and talent to get ahead of disease together. We aim to positively impact the health of 2\.5 billion people by the end of the decade, as a successful, growing company where people can thrive. We get ahead of disease by preventing and treating it with innovation in specialty medicines and vaccines. We focus on four therapeutic areas: respiratory, immunology and inflammation; oncology; HIV; and infectious diseases – to impact health at scale. People and patients around the world count on the medicines and vaccines we make, so we’re committed to creating an environment where our people can thrive and focus on what matters most. Our culture of being ambitious for patients, accountable for impact and doing the right thing is the foundation for how, together, we deliver for patients, shareholders and our people. GSK is an Equal Opportunity Employer. This ensures that all qualified applicants will receive equal consideration for employment without regard to race, color, religion, sex (including pregnancy, gender identity, and sexual orientation), parental status, national origin, age, disability, genetic information (including family medical history), military service or any basis prohibited under federal, state or local law. We believe in an agile working culture for all our roles. If flexibility is important to you, we encourage you to explore with our hiring team what the opportunities are. Should you require any adjustments to our process to assist you in demonstrating your strengths and capabilities contact us at UKRecruitment.Adjustments@gsk.com where you can also request a call. Please note should your enquiry not relate to adjustments, we will not be able to support you through these channels. However, we have created a Recruitment FAQ guide. Click the link where you will find answers to multiple questions we receive **Important notice to Employment businesses/ Agencies** GSK does not accept referrals from employment businesses and/or employment agencies in respect of the vacancies posted on this site. All employment businesses/agencies are required to contact GSK's commercial and general procurement/human resources department to obtain prior written authorization before referring any candidates to GSK. The obtaining of prior written authorization is a condition precedent to any agreement (verbal or written) between the employment business/ agency and GSK. In the absence of such written authorization being obtained any actions undertaken by the employment business/agency shall be deemed to have been performed without the consent or contractual agreement of GSK. GSK shall therefore not be liable for any fees arising from such actions or any fees arising from any referrals by employment businesses/agencies in respect of the vacancies posted on this site. Please note that if you are a US Licensed Healthcare Professional or Healthcare Professional as defined by the laws of the state issuing your license, GSK may be required to capture and report expenses GSK incurs, on your behalf, in the event you are afforded an interview for employment. This capture of applicable transfers of value is necessary to ensure GSK’s compliance to all federal and state US Transparency requirements. For more information, please visit the Centers for Medicare and Medicaid Services (CMS) website at https://openpaymentsdata.cms.gov/",https://ie.indeed.com/viewjob?jk=507e5e3cd049c43a
Quantitative Data DevOps,Susquehanna International Group,"Dublin, County Dublin, Ireland",linkedin,"**Overview** The Quantitative Engineering and Data group in Dublin is a new group focused on developing tools, processes and datasets to enable revenue generation using data at Susquehanna. We partner with Quantitative Researchers, Traders and other engineering teams in Dublin and across the globe. The QED Dublin group is on an exciting strategic mission that will transform the speed of innovation of the business. **Job Summary** You will work closely with the global engineering and DevOps resources to develop and operate the data processing systems that are a critical dependency for trading and quantitative research. The primary focus of the role is to improve the reliability and operational effectiveness of the data processing systems. You will also be critical in the productionisation of new datasets that unlock revenue for the business. The QED Dublin group is part of a global QED team that operates a follow\-the\-sun model for operations. * Member of the Quantitative Engineering and Data group * Responsible for the operations of critical QED data processing systems. * Driving change that improves the uptime and reliability of systems, including configuration and development work where appropriate. * Act as an ambassador for excellence by ensuring change into the system is of a high quality, and fits into the QED global operating model. * Member of global follow\-the\-sun team, acting during EMEA hours. * Develop expertise in Susquehanna’s systems and business. **What We're Looking For** **What we’re looking for:** * Professional operations mindset coupled with practical development experience to improve systems. * Degree in a numerate subject. * Evidence of taking accountability for system delivery. * 2\+ years professional experience using Python as a scripting language for orchestrating processes and systems. * Experience with Airflow and other industry standard tooling for orchestration would be beneficial. * Experience working in a Linux environment. * The ability to self\-manage, self\-motivate, and seek process improvement opportunities. * Strong interpersonal and communication skills that enable you to collaborate effectively in a complex domain. * Attention to detail and ability to react to changing priorities. * A general interest in quantitative trading.",https://www.linkedin.com/jobs/view/4398164892
Receptionist,The Johnstown Estate,"Enfield, County Meath, Ireland",linkedin,"At The Johnstown Estate, we do warm, authentic welcomes particularly well, and constantly strive to deliver a polished service, guest comfort and excellence in everything we do. Our values of Passion, Customer Focus, Teamwork and Integrity are always forefront in our minds as we passionately care about our guest experience and are committed to being the best in all we do. We are also committed to training and developing our team members and ensuring their journey with us inspires them each day. Duties and Responsibilities of the Role: * The receptionist warmly welcomes and assists visitors, clients, and vendors as they enter the premises. They ensure that visitors feel comfortable and direct them to the appropriate person or department. * The receptionist manages incoming phone calls, forwarding them to the appropriate individuals or taking accurate messages. They also respond to general inquiries about the organization and its services. * The receptionist maintains the appearance of the front desk area and ensures it is well\-organized and tidy. They may also handle tasks like receiving and distributing mail, arranging courier services, and managing deliveries. * Receptionists often handle scheduling duties. They need to be well\-organized to manage various calendars efficiently. * Act as a bridge between various departments, relaying messages, and information as necessary to maintain effective communication within the organization. * The receptionist plays a crucial role in providing exceptional customer service. They must possess strong interpersonal skills and be able to handle inquiries or complaints in a professional and courteous manner. * Technological proficient, receptionists often work with various office software and communication tools such as email, phone systems, and possibly other specialized software specific to the organization's needs. * Perform various administrative tasks, such as data entry, filing, and document management. * To ensure complete guest satisfaction through the prompt handling of guest queries in a friendly and efficient manner. * To anticipate guest's needs and ensure that service is provided to the level they require and beyond their expectations. * To have thorough knowledge and understanding of all standards of performance and delivery within all front office departments. * To develop a strong working relationship with colleagues in your department and related departments. * To ensure all guests receive a genuine, warm, friendly, courteous welcome on arrival and during their stay and departure, be always pro\-active. * To anticipate guests' needs whenever possible and to enhance quality service and guest satisfaction. * Be open to new ideas and make changes in the job and routine as required; work in line with business requirements and maintain a culture of respect. * Assist guests and escort them to locations within the hotel at their request, when possible, priority to be given for all check\-in guest that they are oriented till the elevator's minimum. * Strive for constant improvement and take responsibility for your own performance and development * Ensure daily handle is sent out via email each shift and attend briefings, communication meeting and contribute during these meetings. Requirements for the role: * Excellent communication and interpersonal skills, with a friendly and welcoming attitude. * Strong organizational skills, with the ability to multitask and prioritize effectively. * Proficiency in using office software, such as word processing and spreadsheet programs. * Professional appearance and demeanour. * Ability to remain calm under pressure and handle challenging situations with diplomacy. * Previous experience in customer service, administrative roles, or receptionist positions is beneficial but not always required.",https://www.linkedin.com/jobs/view/4398171668
