title,company,location,site,description,job_url
QA Associate,Bimeda,,linkedin,"Purpose of the Position/ Role Summary Reporting to the Site Director of Quality, the QA Analyst ensures that products manufactured, tested, released and distributed via Contract Manufacturing Organisations (CMOs) and contract laboratories comply with cGMP/GDP, Marketing Authorisations and Bimeda standards. The role leads QA oversight of external partners (CMOs/3PLs/contract labs), approves key quality documentation (e.g., deviations, change controls, CAPAs, validation), manages complaints and product quality reviews, and supports artwork control, stability, EM and recall readiness. The role also provides training and coaching on documentation and cGMP expectations and supports audits/inspections. Key Role Specific Requirements CMO \& Contract Partner Quality Oversight * Coordinate recurring CMO meetings and quality business reviews covering performance metrics, complaints, deviations, CAPAs, change controls and commitments. * Review/approve CMO Validation Protocols/Reports and Sampling Plans; ensure statistically justified approaches (e.g., ANSI/ASQ). * Lead/participate in CMO audits and Contract Lab Qualification; track and verify completion of CMO CAPAs and follow‑up actions. * Maintain Supply Chain Maps for CMOs and ensure GDP compliance across logistics partners; support qualification/oversight of 3PL and Contract Lab Testing. * Coordinate and approve QC Method Transfers to CMOs; ensure data integrity, comparability protocols, acceptance criteria and transfer reports. Quality Management System (QMS) Ownership * Maintain and update the Quality Manual/SMF; ensure alignment with licences and BAHL procedures. * Administer/approve Change Controls, Deviation/LIR, CAPA, Documentation Approvals, Documentation Reconciliation, and Archiving for CMO batches and records. * Plan and execute Internal Audits; collate outcomes into Management Review; track QMS KPIs and continuous improvement initiatives. * Oversee Calibration Programme from a QA standpoint and support QC Equipment Transfers lifecycle controls. * Issue, reconcile and archive Logbooks in accordance with data integrity expectations. Product Lifecycle \& Technical Activities * QA review/approval of CMO Validation Protocol Approvals / Validation Report Approvals; ensure protocol‑to‑report traceability. * Establish and oversee Stability Programme Testing (protocols, pulls, investigations, reporting, commitments). * Administer EM Programme (Environmental Monitoring) data review/trending (as applicable for retained BAHL facilities or lab partners). * Coordinate Finished Product Testing and Raw Material Testing via contract labs/CMOs in line with specifications and release requirements. * Maintain BAHL Artwork process and CMO Artwork approval, ensuring change control integration. Complaints, Deviations \& Investigations * Lead Customer and Supplier Complaints investigations, including root cause analysis, risk assessment and CAPA effectiveness checks. * Oversee CMO Deviations and internal Deviation records; ensure timely closure and product impact assessment. * Manage RM/FP Rejections (Raw Material/Finished Product) and ensure appropriate disposition and escalation. * Compile and present BAHL CMO Summary PQR, CMO PQR and BAHL PQR; ensure annual product quality review completion and action tracking. Regulatory Interface \& Recall Readiness * Support the BAHL Responsible Person (GDP) and Regulatory Affairs on HPRA and other HA notifications (e.g., quality defect/recall, significant changes, licence variations, CMO/3PL changes). * Maintain Recall readiness (mock recalls, distribution traceability, retained samples) and coordinate with partners to execute when required. * Coordinate Licence Variations quality inputs (validation impacts, stability commitments, artwork updates, SMF updates). * Inform HPRA (how/when): collaborate with RA to determine the correct notification/variation route and timing; notify when we are closing it down (e.g., site testing/distribution cessation) per regulatory guidance and BAHL procedures. Samples, Records \& Archiving * Own the Reference and Retain Samples programme: define storage locations/conditions, chain of custody, retention periods and retrieval; ensure alignment with MA/HPRA expectations and BAHL SOPs. * Oversee Archiving Documentation for CMOs and contract labs to ensure complete product histories and inspection‑readiness. Training \& SOP System * Maintain and author SOPs, CMO Questionnaires, and related controlled documents; ensure version control and training assignment. * Deliver QA Training (data integrity, documentation, investigations, change control); track effectiveness. * Provide inputs to Management Review on QMS performance and training compliance. Meetings, Reviews \& Cross‑Functional Collaboration * Lead routine CMO Meetings and cross‑functional forums; capture minutes, actions and decisions. * Prepare quality inputs and actions for HA Audits and customer inspections; coordinate responses and CAPA tracking. *Please note that this job description is not exhaustive, and the role holder may be required to undertake other relevant duties commensurate with the grading of the post. Activities may be subject to amendment over time as the role develops and/or priorities and requirements evolve.* **Essential** * BSc in a science or related field. * Knowledge of pharmaceutical QA methodologies, cGMP, Quality Systems, Analytical Chemistry. * High integrity; excellent attention to detail; analytical thinker; organised; team‑oriented; self‑starter. * 2–3 years relevant experience in a regulated pharmaceutical environment (QA/QC). **Desirable** * Experience with external manufacturing/CMO oversight and contract lab management. * Familiarity with HPRA, EU GMP/GDP, and product lifecycle documentation (SMF, PQR). * Working knowledge of sampling standards (e.g., ANSI/ASQ), stability/IQ‑OQ‑PQ, and data integrity (ALCOA\+). * Strong communication skills to manage partner relationships and drive timely closure of quality actions. **About The Role** This role is 5 days on site at 21 Spruce Avenue, Stillorgan Industrial Estate, Sandyford, A94 K5C8 Ireland The hours for this role: 39 hours per week The salary for this role: €36,606\.00 per annum The Employer is: Bimeda Animal Health Ltd. **About Bimeda** Bimeda is a leading global innovator, manufacturer and marketer of veterinary pharmaceuticals and animal health products and has over half a century’s experience in providing science\-driven solutions to optimize the health, wellbeing and productivity of the world’s animals. Bimeda’s global innovation program sees six state\-of\-the art R\&D centers across four continents collaborate on an enviable product development pipeline which anticipates the ever\-evolving needs of the animal health industry. Bimeda’s nine manufacturing facilities across seven countries allow the company to manufacture a broad range of preventative, curative and nutritional products including sterile injectables, vaccinations, nutritional boluses, feed additives, tablets, water\-soluble powders, pastes and non\-sterile liquids. Globally, the company focuses on the development, manufacture and commercialization of quality Bimeda\-branded products while also being the partner of choice for contract manufacturing and R\&D services for prominent companies within the animal health industry. Your application to us; assumes you have read and agree with our privacy policy",https://www.linkedin.com/jobs/view/4401390791
QA Sr Associate,Recruitment by Aphex,"Dublin, County Dublin, Ireland",linkedin,"**Purpose:** The Senior Associate for Plant Quality Assurance (PQA) will report to the QA Manager, playing a pivotal role in the site's Quality Assurance team. As the Quality point of contact for manufacturing and inspection operations, the PQA Senior Associate will contribute to continuous improvement initiatives by undertaking additional responsibilities beyond routine QA duties. This 24/7 shift role demands a 12\-hour shift pattern (4 on, 4 off) to support manufacturing operations. **Requirement** \* Exceptional written and verbal communication skills. \* Proven experience collaborating with dynamic cross\-functional teams and strong decision\-making abilities. \* Robust organizational skills, with a commitment to seeing assignments through to completion. \* Demonstrated problem\-solving abilities, particularly in supporting non\-conformance/deviation investigations. \* Experience in inspecting vials and syringes and engaging in aseptic operations. \* Familiarity with applicable Regulatory requirements and proficiency in evaluating compliance issues. **Responsibilities:** \* Ensure adherence to safety standards and SOPs in all activities. \* Review and approve production batch records and associated documentation for Qualified Person disposition activities. \* Provide real\-time quality oversight and support for production unit operations, extending to formulation, vial and syringe Fill Finish activities, including media fills and assessment of aseptic interventions. \* Conduct inspections of vials and syringes as part of AQLs, annual reserve inspections, and support complaint investigations. \* Offer Quality Assurance support for on\-the\-floor investigations and deviations. \* Review and approve deviations for closure, ensuring compliance with appropriate documentation. \* Participate in customer complaint investigations. \* Conduct routine Quality Assurance walks on the production floor. \* Review and issue logbooks, ensuring compliance with procedures. \* Provide training and guidance to staff for effective performance. \* Review and approve cGMP records, ensuring compliance with appropriate documentation. \* Support continuous improvement and Operational Excellence initiatives. \* Undertake other tasks/projects as assigned by the manager. **Requirements** \* University degree in an Engineering or Science\-related discipline (preferred). \* Over 4 years of relevant experience in the pharmaceutical or biotechnology industry or an equivalent combination of experience and educational background",https://www.linkedin.com/jobs/view/4410531364
QC Micro Analyst,Morgan McKinley,"Blanchardstown, Fingal, Ireland",linkedin,"I am seeking a QC Microbiology Analyst with 1 \- 2 years pharmaceutical industry experience with * Utility sampling of Compressed Air/Gas * Isolator batch related monitoring * Issuance, receipt, and testing of biological indicators * Reconciliation and inspection of media fill units, and participation in media fills (APS) 12 month contract with view to extend. **Responsibilities will include (but not limited to):** * Perform cleanroom, BSC \& Isolator batch related monitoring * Utility sampling of water systems and Compressed Air/Gas. * Carrying out In\-Process testing of critical lot related samples to support * Manufacturing activities (HPLC and UV Spectrophotometry). * Issuance, receipt, and testing of biological indicators. * Reading and reporting of environmental monitoring, BIs, and aseptic qualification sample results. * Reconciliation and inspection of media fill units, and participation in media fills. * Carrying out identifications of Microorganisms isolated post testing activities. * Completing all laboratory documentation in a timely and accurate manner. * Compliance with Standard Operating Procedures and Registered Specifications. * Assisting in authoring and reviewing documentation. * Providing support to other departments to ensure qualification and production schedules are adhered to. * Reviewing paperwork, and reconciliation of analysis performed in the laboratory. * Ensuring that any alert/action limit excursions are investigated according to site procedures. * Receipt and processing of drug substance and drug product samples. * Adherence to and improvement upon lean lab and 6S practices. * Ensuring a high standard of housekeeping and safety is maintained in the laboratory. * Performing any other activities as indicated by the Microbiology Manager. **Qualification and Experience** * Level 8 degree in Microbiology or related discipline. * At least 1 \- 2 years’ experience in a pharmaceutical / healthcare GMP laboratory or related technical function. * Applicants should have relevant experience working in a cleanroom environment using aseptic techniques, and experience working with isolators is advantageous. * Experience in HPLC and UV Spectrophotometry is desirable but not essential. * Experience using MODA, Empower, CIMS, LIMS, LES and Veeva Vault is desirable but not essential. * The successful candidate must demonstrate excellent written and verbal communication skills. * The ability to work in a team based collaborative environment is essential.",https://www.linkedin.com/jobs/view/4408990922
QC Micro Analyst,"LSC, Life Science Consultants","Dublin, County Dublin, Ireland",linkedin,"**LSC have a great contract opportunity for a QC Micro Analyst to join a Dublin based Biopharmaceutical company dedicated to discovering, developing, and delivering innovative medicines that can help patients overcome serious diseases and improve their quality of life.** **If you have 2 years of experience working in the pharmaceutical or biotechnology industry and are ready for your next challenge, this could be the perfect opportunity for you!** **ABOUT THE PROJECT \- KEY RESPONSIBILITIES:** * Perform cleanroom, BSC \& Isolator batch related monitoring. * Utility sampling of water systems and Compressed Air/Gas. * Carrying out In\-Process testing of critical lot related samples to support Manufacturing activities (HPLC and UV Spectrophotometry). * Issuance, receipt, and testing of biological indicators. * Reading and reporting of environmental monitoring, BIs, and aseptic qualification sample results. * Reconciliation and inspection of media fill units, and participation in media fills. * Compliance with Standard Operating Procedures and Registered Specifications. * Assisting in authoring and reviewing documentation. **ABOUT YOU \- ARE YOUR SKILLS A MATCH?** * A level 8 degree in microbiology or related discipline. * At least 2 years' experience in a pharmaceutical / healthcare laboratory or related technical function. * Applicants should have relevant experience working in a cleanroom environment using aseptic techniques, and experience working with isolators is advantageous. * Experience in HPLC and UV Spectrophotometry is desirable but not essential. * Experience using MODA, Empower, CIMS, LIMS, LES and Veeva Vault is desirable but not essential. **Apply via this advert or contact Jenny Murphy on 021 4777329 if you have any more questions about this role!** **You will need to hold a Stamp 1G/Stamp 4 visa to apply. LSC do not provide work permit/visa sponsorship.**",https://www.linkedin.com/jobs/view/4410560136
Qualified Carpenter,HK Home Solutions Ltd,"South Dublin, D, IE",indeed,"**Qualified Carpenter – High\-End Residential (South Dublin \& City)** **HK Home Solutions Ireland** is seeking a fully qualified Carpenter to join our team working on high\-end residential projects across South Dublin and Dublin City. This role suits someone who takes pride in their work, has strong attention to detail, and is comfortable delivering high\-quality finishes in client\-facing environments. **Requirements:** * Fully qualified Carpenter (essential) * Safe Pass \& Manual Handling * Own tools (essential) * Full driving licence \& own transport * Strong experience in first and second fix carpentry * Experience with fitted furniture / bespoke joinery (essential) **Key Qualities:** * Strong work ethic and reliability * High attention to detail * Pride in workmanship * Ability to work independently and as part of a team * Professional attitude on site **Location:** South Dublin \& Dublin City **What We Offer:** * Top rates for the right candidate * Consistent, long\-term work * Opportunity to grow within a high\-end service company * Pay increase after probation period **Please Note:** Only applicants who meet all listed requirements will be considered. **Apply with:** * Brief summary of experience * Confirmation of tools and driving licence * Any photos of previous work (if available) Job Type: Permanent Pay: €26\.00\-€35\.00 per hour Expected hours: 40 per week Benefits: * Company car * Sick pay Application question(s): * Do you have hands\-on experience installing fitted furniture or bespoke joinery? Experience: * Carpentry: 5 years (preferred) Work authorisation: * Ireland (preferred) Willingness to travel: * 50% (preferred) Work Location: In person",https://ie.indeed.com/viewjob?jk=58b8da6c3bfc57d8
Quantity Surveyor,PJ Hegarty & Sons,"Dublin, County Dublin, Ireland",linkedin,"At PJ Hegarty \& Sons, we pride ourselves in a holistic approach to Quantity Surveying. Our responsibility is to manage the company’s financial interests in a manner as wide as is possible and simultaneously assist in project delivery to meet the Client’s vision for the project. These responsibilities include the management of costs and value and also the management of our contractual relationships with the Client and the supply chain. We are currently seeking experienced Quantity Surveyors in the Greater Dublin area. You will be responsible for the cost and value management of projects from mobilisation to the settlement of final accounts. **Overview** As a Quantity Surveyor in our team, you will have progressed from graduate level and will be focused upon becoming a Senior Surveyor. We have a progressive training programme focused upon your development and tailored to meet the requirements of the SCSI/RICS Assessment of Professional Competence. You will be given the tools to assist you manage a trainee or graduate quantity surveyor. You will also participate in departmental training and will be involved in receiving training from seniors and also giving training to juniors. Key Duties * Participate in procurement of specialist trades for the project and make appointment recommendations to the project director. * Assist in the drafting of subcontract Agreements. * Receive, assess, and settle subcontract interim valuations and final accounts. * Review developing design information and advise the wider project team of the cost implications in good time. * Identify and advise the wider project team of value engineering opportunities. * Complete monthly valuations for submission to the Employer’s Representative and agree said valuations. * Participate in the monthly internal cost reporting systems engaging in cost V value reconciliations, turnover reports, prelim cost reports and project outcome projections. * Be a key player in the preparation of the project final account submission to the Client. * Assist in the provision of proactive advice to the project director on matters of contract. * And most importantly Develop and maintain strong working relationships with the wider project team. **Skills/Experience Required** You will have * A level 8 degree in Quantity Surveying or above * 3\+ Years’ experience in a similar role * Good written and oral communication skills with emphasis on ability to provide and explain reports accurately. * A proven track record in dealing with Subcontractors and Clients. * Good problem\-solving skills. * A reasonable knowledge of current forms of Agreement for the industry * You will be\-Computer literate in Microsoft Office, and have some knowledge of Bluebeam, CostX, and Cubit (although training can be given in these) * Able to work well under pressure, on your own and also as part of a team. * Career driven, ambitious and enthusiastic with your eye on promotion to the role of a Senior Surveyor. Further Information At PJ Hegarty and Sons, we acknowledge that your career is a journey and dependent upon that career to date you may be stronger or indeed weaker in some areas. As indicated, we will tailor a training programme to meet any needs and actively encourage Continuous Professional Development. Diversity and Inclusion The Company is an Equal Opportunities employer and recognises its responsibility to provide equality of opportunity to employees and prospective employees. Our Aim is to ensure that no job applicant or employee receives less favourable treatment on the grounds of religious belief, political opinion, gender, marital status, civil status, sexual orientation, disability, race, age and membership of the Traveller community. The Company will not accept or tolerate any form of discrimination, direct or indirect, by any member of the Company. The Company is committed to the fair treatment of employees at all times.",https://www.linkedin.com/jobs/view/4337445971
Receptionist,J D Wetherspoon,"Dublin 2, County Dublin, Ireland",linkedin,"**Job Ref** 653864 **Job Title** Receptionist **Pub** Keavan\`s Port Hotel, Camden Street **Salary** £14\.86 **Closing Date** 12\-05\-2026 **Vacancy Description** The ideal applicant We\`re looking for fun, enthusiastic, passionate people to join our hard\-working teams. No experience is needed, just a good attitude, a willingness to learn and a calm head under pressure. As a UK Top Employer with an award\-winning training programme, we know that we can teach you the skills you\`ll need to succeed. Whether you\`re looking for a long\-term career or just some extra shifts, if you\`re reliable, friendly and love working as part of a team \- this role could be perfect for you. What\`s in it for you? * competitive rate of pay * a free meal and a drink, when working * 20% discount on all food, drinks and hotel accommodation (for you and up to three guests), when not working * £1 extra per hour, for hours worked during midnight\-5\.59am * bonus scheme \- earn up to 19% of your pay * availability of guaranteed\-hours contracts and variable\-hours contracts * paid holiday * free shares (after a qualifying period) * loyalty reward scheme The role At a glance, your role is to deliver friendly, efficient customer service and to create a warm and welcoming atmosphere for all guests. **Duties Include** * interacting politely with guests \- greeting them, saying \`thank you\` and \`goodbye\` * maintaining office administration in line with company policies and general data protection regulations (GDPR) * carrying out administrative tasks, reservations, cancellations and no\-shows, managing check\-ins, check\-outs and aftercare, providing reports as necessary (eg for housekeeping or management tasks) * checking that all bedrooms/conference rooms and all other associated areas under your responsibility are cleaned and maintained within guidelines * conducting regular security checks, including fire safety checks, throughout your shift, reporting any issues to your line manager * reporting any security issues, safety hazards, accidents, incidents and/or maintenance issues to the manager on duty * being responsible for evacuation, in the case of emergency, liaising with guests and the emergency services * completing required induction, role\-specific and ongoing refresher training and contributing to continuous improvement Progression and development Most Wetherspoon team leaders and managers started in the kitchen or behind the bar. If you\`re looking to progress, we can support your development with: * structured on\-the\-job training. * apprenticeships and management academies. * cross\-training into other areas (bar, floor, kitchen). * opportunities to progress into team\-leader and shift\-leader roles and beyond. Wetherspoon promotes an inclusive working environment where everyone is welcome. When you\`re at work, we want you to feel comfortable being yourself. Whatever your background, preferences or beliefs, we\`ll ensure that you have the skills and knowledge you need for a great career with us. This role is not suitable for under\-18s because of lone working. There may be other roles available, including front\-of\-house and kitchen roles. If a high number of applications is received, this vacancy may close early. Read more about our receptionist role **Hours Per Week** 12 **Monday Hours** Flexible Flexible **Tuesday Hours** Flexible Flexible **Wednesday Hours** Flexible Flexible **Thursday Hours** Flexible Flexible **Friday Hours** Flexible Flexible **Saturday Hours** Flexible Flexible **Sunday Hours** Flexible Flexible Apply",https://www.linkedin.com/jobs/view/4409316944
