title,company,location,site,description,job_url
A Fresh Start for Your Career in Recruitment Consulting,Access Healthcare,"Dublin, County Dublin, Ireland",linkedin,"* **Channel your drive into a role that fuels a company in rapid expansion.** * **Your effort sets the pace – fast and completely performance\-based career progression.** * **Join a business that rewards ambition and invests in your future.** What if your career moved forward exactly as fast as you’re willing to push it? What if you didn’t have to wait for someone else’s approval to take the next step? At **Access** , your results speak louder than anything else. Here, **progression isn’t about time served, it’s about performance** . If you bring energy, resilience, and hunger to succeed, there’s no ceiling on what you can achieve. Maybe you’re already in recruitment and ready for a step up. Or maybe you’re looking for a new challenge: a role where ambition, people skills, and results are truly rewarded. Either way, this is your chance to build something exciting. **What the role involves:** As a Recruitment Consultant, you’ll be backed by a leadership team dedicated to helping you grow quickly and confidently. Every day brings variety and purpose: * Building relationships with clients and candidates across the healthcare sector * Managing live vacancies from first briefing to final offer * Interviewing, qualifying, and advising candidates through each stage of the process **What’s in it for you:** * **Career Progression** \- Rise fast through a clear, merit\-based pathway into senior and leadership positions. * **Continuous Development** \- Access expert mentorship, hands\-on training, and specialist knowledge to accelerate your career. * **Recognition \& Rewards** \- Every milestone matters. Expect real recognition, added responsibility, and outstanding financial rewards. The **average total compensation for year 1 is more than €45k, and for year 2 it’s over €66k** . Of course, due to our uncapped commission structure, top performers earn much more than this from the jump. * **Leadership Academy** \- Exclusive access to our Leadership Academy for advanced training, certifications, and networking with top performers. **You’ll be a great fit if you have:** * At least 1 year of experience in a fast\-moving environment (any sector) * A proactive, ambitious mindset and the confidence to take ownership of your growth * Strong communication skills and a natural drive to succeed **Your success story could look like Rian’s:** In just **24 months** , he progressed from Recruitment Consultant **to Associate Manager** , building a high\-performing team and shaping his own leadership path. In two years, you could be his peer, and you could be telling this same story to your friends, but this time about yourself. For more information, contact César Toscano at **\+353 1 572 1161** or email your CV to **cesar.toscano@accesshealthcare.ie**",https://www.linkedin.com/jobs/view/4405823092
AI Portfolio Architect,Irish Life,"Dublin, County Dublin, Ireland",linkedin,"**Location :** Hybrid role based in our City Centre offices **Contract Type:** Full‑time, permanent **What we offer** Hybrid working (part week at home, part in office), competitive salary and bonus, robust learning and development, defined contribution pension, and comprehensive wellbeing supports. Further details: Benefits (life‑careers.com). At Irish Life, our purpose is to help people build better futures. Our values are built on integrity, doing the right thing, aiming high, putting customers at the heart of what we do, and working together in a supportive, collaborative environment. **Role overview** The AI Portfolio Architect owns the enterprise‑grade AI strategy, architecture, and infrastructure for projects across Customer Solutions, ensuring all AI solutions align with ILG’s AI Governance Framework, the EU AI Act, GDPR, Central Bank expectations, EIOPA guidance, and emerging European standards. You translate policy and regulatory requirements into practical architectural controls and technical patterns, and work closely with the AI Governance Lead, Portfolio and Solution Architects, Engineering, Risk, Data, EXO, European governance bodies, and business stakeholders to deliver safe, ethical, and scalable AI across Irish Life Group. **Key Responsibilities** **Strategic leadership \& direction** * Define and champion the long‑term AI vision within Customer Solutions and across ILG. * Develop and maintain an enterprise‑aligned roadmap for safe, scalable AI adoption. * Shape AI capabilities across platforms, lifecycle maturity, governance, and engineering. * Advise senior leaders on AI investments, platform evolution, and capital planning. * Identify strategic AI opportunities and threats, informing direction and risk posture. **Define \& evolve AI architecture** * Define and continually enhance enterprise AI architecture, reference patterns, and guardrails across analytics, ML, and generative AI. * Translate AI governance requirements (EU AI Act, GDPR, DORA, Irish regulation, ILG rules) into actionable controls and standards. * Ensure transparency, safety, explainability, auditability, and alignment with enterprise architecture. **Governance \& regulatory compliance** * Implement frameworks defined by the AI Governance Lead, embedding controls into solution designs (e.g. bias mitigation, explainability, hallucination control, HITL, monitoring, lifecycle management). * Provide technical risk assessments, architectural artefacts, and evidence for the Central AI Register, high‑risk classification, and audits. * Ensure solutions meet European governance expectations and support escalations to EU committees where required. * Identify technical risks in the CS AI domain and propose mitigation strategies to ensure stability, scalability, and performance. **Shape the AI use case portfolio** * Work with Product and Portfolio leadership to shape a prioritised AI opportunity pipeline. * Assess feasibility, architectural risk, governance implications, and regulatory classification early in the lifecycle. * Provide architectural leadership from discovery through design, delivery, and operationalisation. **Azure AI \& cloud‑native solutions** * Develop the CS AI Roadmap aligned with business strategy. * Lead the design of Azure AI and cloud‑native solutions, ensuring scalability, robustness, performance, and compliance with ILG security and risk standards. * Promote mature MLOps/LLMOps operating models and integrated AI lifecycle controls. * Engage proactively with business leaders, vendors, and architects to understand needs and communicate possibilities and constraints. **Governance forums \& collaboration** * Be a standing member of the Customer Solutions Design Authority and represent the portfolio in ILG Enterprise Architecture forums. * Represent AI portfolio interests at ILG Architecture and AI Governance Boards, working closely with Strategy \& Architecture and Risk leads. * Ensure all AI designs meet enterprise architecture principles, security requirements, and regulatory obligations. * Partner with AI Governance, Risk, Legal, Data, EXO, Engineering, and operations to ensure safe, compliant delivery of AI. * Translate complex regulatory and technical requirements into clear, business‑friendly guidance. * Support uplift of AI literacy, governance capability, and good architectural practice across CS and ILG. * Ensure commercial awareness and consideration of total cost of ownership in design decisions. **Continuous improvement \& innovation** * Stay ahead of emerging AI regulations, industry standards, model safety techniques, and architectural innovations. * Identify opportunities to improve AI governance maturity, accelerators, reusable patterns, and documentation. * Drive responsible, ethical, forward‑thinking AI adoption across Irish Life Group. **Key skills and Capabilities** * Excellent collaboration skills across IS, especially with data science, engineering, and AI governance teams. * Ability to influence and support senior IS and business leaders, ensuring AI initiatives align with strategic objectives and responsible AI principles. * Strong experience delivering complex AI and data‑driven solutions in large enterprises and leading architectural direction for analytics, ML, and enterprise AI. * Good knowledge of application engineering plus experience with MLOps, AI lifecycle management, and agile delivery. * Ability to produce high‑quality architecture and design artefacts (AI reference architectures, data flows, governance artefacts) and present to senior stakeholders. * Strong problem‑solving and decision‑making abilities, assessing AI‑related risks, trade‑offs, and ethical considerations. * Experience designing AI‑enabled solutions using ML, generative AI, analytics, and automation to drive business value. * Experience with data integration patterns, AI security best practice, model governance frameworks, and handling sensitive data securely. * Versatile experience across on‑prem, private, hybrid, and public cloud AI services. * Knowledge of modern AI patterns and technologies (e.g. vector databases, LLM orchestration, prompt engineering, model evaluation). * Experience with Microsoft AI ecosystem (Azure OpenAI, Cognitive Services, Fabric, Power Platform). * Scripting and automation experience (e.g. Python, PowerShell) including integration with APIs, AI pipelines, and DevOps/MLOps tooling. * Understanding of data and model infrastructure (feature stores, model registries, inference optimisation, scalable APIs). * Ability to align AI non‑functional requirements (fairness, interpretability, performance, latency, scalability, cost) with business strategy and risk appetite. * Strong understanding of emerging AI regulations, especially the EU AI Act, and ability to translate these into practical technical and architectural requirements. * Ability to embed regulatory compliance into architecture and delivery, ensuring logging, monitoring, robustness, documentation, and clear team responsibilities. **Essential requirements** * Minimum 7 years’ experience in technical design and delivery of strategic AI, data, or analytics solutions on enterprise‑scale platforms. * Strong understanding of modern AI integration and orchestration services (e.g. Azure Machine Learning, Azure OpenAI, Cognitive Services, Logic Apps, Azure Functions, enterprise API layers and RAG). * Advanced knowledge of AI lifecycle automation and MLOps, including model evaluation, deployment, and AI risk controls. * Experience in AI security, scalability, observability, and performance optimisation in highly regulated environments. * Strong grasp of enterprise architecture best practice and AI‑specific governance standards. * Familiarity with agile and cross‑functional delivery. * Strong stakeholder management and communication skills, able to demystify complex AI concepts and risks. * Practical experience integrating regulatory and compliance frameworks (including EU AI Act) into AI delivery and supporting audits and conformity assessments. * Sound understanding of application, infrastructure, and security frameworks. **Desirable** * Deep understanding of Microsoft Azure AI and data technologies (e.g. Azure ML, Azure OpenAI, Cognitive Search, Databricks on Azure, Fabric). * Experience with end‑to‑end AI solution architectures across IaaS, PaaS, and SaaS. * Financial services experience, ideally life assurance. * Relevant certifications (e.g. Azure Solutions Architect Expert, Azure AI Engineer Associate). * Experience contributing to AI assurance frameworks (model cards, documentation templates, transparency artefacts, audit‑ready controls). **About us** Irish Life is one of Ireland’s largest financial institutions with over 1\.5 million customers across life insurance, pensions, investments, and health insurance. We are a subsidiary of Great‑West Lifeco and part of the Power Financial Corporation group. We invest heavily in developing our people and maintaining high professional standards, which keeps us at the forefront of our industry. The company may draw up a shortlist as part of the selection process. Where agency assistance is required, the Irish Life Recruitment Team will engage directly; unsolicited CVs from agencies will not be accepted. Irish Life is proud to be an equal opportunities employer, committed to inclusion, diversity, and enabling people to bring their whole selves to work. If you require any accommodation during the recruitment process, please contact lifecareers@irishlife.ie. ILFS supports Equal Opportunity and is regulated by the Central Bank of Ireland.",https://www.linkedin.com/jobs/view/4398126196
API Test Infrastructure Engineer,ZeroRisk.io,"Dublin, County Dublin, Ireland",linkedin,"**About The Role** We are looking for an **API Test Infrastructure Engineer** to join our engineering team. This is a platform\-focused role sitting at the intersection of software engineering, quality, and DevOps. The engineer will be responsible for building and owning the foundational infrastructure that enables our engineering teams to test APIs at scale, with confidence and speed. You will not be the sole author of all tests. Instead, your primary mission is to build the platform, tooling, and patterns that make it easy for every engineer to write high\-quality API tests. You will also own a set of integrations with external tools and services, continuously validating that those integrations behave correctly through automated API\-level testing. Core Responsibilities Test Infrastructure \& Platform * Design, build, and maintain a robust, automated API testing infrastructure that can be spun up reproducible across local, CI, and production\-mirror environments. * Develop and maintain a shared library of reusable test utilities, fixtures, helpers, and patterns for use across engineering teams. * Own the containerization strategy for test environments using Docker (and related tooling), ensuring tests run consistently and reliably regardless of where they execute. * Integrate the testing infrastructure into existing CI/CD pipelines, including test reporting, alerting, and failure triage workflows. * Continuously evaluate and introduce new tools, frameworks, and practices that improve the reliability, speed, or coverage of the infrastructure. External Tool Integrations \& Continuous Validation * Build and maintain a suite of automated integration tests that validate the behavior of third\-party and external API\-based tools the organisation depends on. * Design monitoring and alerting strategies that detect regressions or unexpected changes in external API behavior as early as possible. * Collaborate with internal teams to understand integration requirements and translate them into automated, continuously\-running test scenarios. **Required Skills \& Experience** * Python scripting: strong scripting ability with experience writing clean, maintainable, production\-quality Python code used in test tooling and automation frameworks. * API standards: solid understanding of REST, GraphQL, and related API conventions including request/response life\-cycles, pagination, error handling, and versioning. * API security: practical knowledge of API\-level security concepts including authentication (OAuth 2\.0, API keys, JWT), authorization patterns, and how to validate security controls through tests. * Automated testing: experience designing, building, and maintaining automated test suites; familiarity with frameworks such as pytest, and an understanding of test architecture (unit, integration, contract, end\-to\-end). * Containerization: hands\-on experience with Docker to create reliable, reproducible test environments; experience with Docker Compose or similar tooling for orchestrating multi\-service test setups. * CI/CD integration: experience integrating automated tests into CI/CD pipelines (e.g. GitHub Actions, GitLab CI, Jenkins) including test reporting and gating strategies. What a Typical Day Looks Like * Improving or extending the core testing infrastructure; making it faster, more reliable, or easier for other engineers to use. * Reviewing the landscape of available tooling and evaluating whether something new could meaningfully improve the platform. * Building or extending an integration test for an external API\-based tool; writing the scaffolding, the assertions, and connecting it to the reporting pipeline. * Pairing with a product engineer to help them write a new API test using shared infrastructure, or reviewing a test they've written for quality and consistency. * Investigating a test failure in CI. Diagnosing whether it represents a real regression, an environment issue, or a flaky test, and resolving accordingly. * Contributing to documentation, playbooks, and internal guides that help engineers self\-serve on the testing platform. How Success is Measured * Platform adoption: engineers across teams are able to write and run API tests using the shared infrastructure with minimal friction. * Infrastructure reliability: test environments spin up fully automated and consistently; flakiness rates are low and trending downward. * Coverage of external integrations: critical third\-party API integrations are covered by continuously\-running automated tests with clear alerting on failure. * CI/CD integration quality: test results are visible, actionable, and correctly gate deployments across the pipeline. * Time to onboard new tests: the effort required to add a new test to the platform is low and well\-documented. Nice to Have * Experience with API contract testing. * Familiarity with observability tooling (e.g. Grafana, Datadog) for monitoring test pipelines and external service health. * Exposure to Kubernetes or other container orchestration platforms. * Experience contributing to or maintaining internal developer platforms or tooling. * Background in a polyglot environment. Exposure to languages beyond Python (e.g. TypeScript/JavaScript) is a plus. What we offer * A high\-impact role with clear ownership of a critical engineering platform. * Close collaboration with engineering teams across the organisation. * The opportunity to shape how quality and testing are practiced at scale. * A culture that values engineering craft, automation, and continuous improvement.",https://www.linkedin.com/jobs/view/4405669766
API Test Infrastructure Engineer,ZeroRisk,"Dublin, D, IE",indeed,"**About the Role** ------------------ We are looking for an **API Test Infrastructure Engineer** to join our engineering team. This is a platform\-focused role sitting at the intersection of software engineering, quality, and DevOps. The engineer will be responsible for building and owning the foundational infrastructure that enables our engineering teams to test APIs at scale, with confidence and speed. You will not be the sole author of all tests. Instead, your primary mission is to build the platform, tooling, and patterns that make it easy for every engineer to write high\-quality API tests. You will also own a set of integrations with external tools and services, continuously validating that those integrations behave correctly through automated API\-level testing. **Core Responsibilities** ------------------------- ### **Test Infrastructure \& Platform** * Design, build, and maintain a robust, automated API testing infrastructure that can be spun up reproducible across local, CI, and production\-mirror environments. * Develop and maintain a shared library of reusable test utilities, fixtures, helpers, and patterns for use across engineering teams. * Own the containerization strategy for test environments using Docker (and related tooling), ensuring tests run consistently and reliably regardless of where they execute. * Integrate the testing infrastructure into existing CI/CD pipelines, including test reporting, alerting, and failure triage workflows. * Continuously evaluate and introduce new tools, frameworks, and practices that improve the reliability, speed, or coverage of the infrastructure. ### **External Tool Integrations \& Continuous Validation** * Build and maintain a suite of automated integration tests that validate the behavior of third\-party and external API\-based tools the organisation depends on. * Design monitoring and alerting strategies that detect regressions or unexpected changes in external API behavior as early as possible. * Collaborate with internal teams to understand integration requirements and translate them into automated, continuously\-running test scenarios. **Required Skills \& Experience** --------------------------------- * **Python scripting**: strong scripting ability with experience writing clean, maintainable, production\-quality Python code used in test tooling and automation frameworks. * **API standards**: solid understanding of REST, GraphQL, and related API conventions including request/response life\-cycles, pagination, error handling, and versioning. * **API security**: practical knowledge of API\-level security concepts including authentication (OAuth 2\.0, API keys, JWT), authorization patterns, and how to validate security controls through tests. * **Automated testing**: experience designing, building, and maintaining automated test suites; familiarity with frameworks such as pytest, and an understanding of test architecture (unit, integration, contract, end\-to\-end). * **Containerization**: hands\-on experience with Docker to create reliable, reproducible test environments; experience with Docker Compose or similar tooling for orchestrating multi\-service test setups. * **CI/CD integration**: experience integrating automated tests into CI/CD pipelines (e.g. GitHub Actions, GitLab CI, Jenkins) including test reporting and gating strategies. **What a Typical Day Looks Like** --------------------------------- * Improving or extending the core testing infrastructure; making it faster, more reliable, or easier for other engineers to use. * Reviewing the landscape of available tooling and evaluating whether something new could meaningfully improve the platform. * Building or extending an integration test for an external API\-based tool; writing the scaffolding, the assertions, and connecting it to the reporting pipeline. * Pairing with a product engineer to help them write a new API test using shared infrastructure, or reviewing a test they've written for quality and consistency. * Investigating a test failure in CI. Diagnosing whether it represents a real regression, an environment issue, or a flaky test, and resolving accordingly. * Contributing to documentation, playbooks, and internal guides that help engineers self\-serve on the testing platform. **How Success is Measured** --------------------------- * **Platform adoption**: engineers across teams are able to write and run API tests using the shared infrastructure with minimal friction. * **Infrastructure reliability**: test environments spin up fully automated and consistently; flakiness rates are low and trending downward. * **Coverage of external integrations**: critical third\-party API integrations are covered by continuously\-running automated tests with clear alerting on failure. * **CI/CD integration quality**: test results are visible, actionable, and correctly gate deployments across the pipeline. * **Time to onboard new tests:** the effort required to add a new test to the platform is low and well\-documented. **Nice to Have** ---------------- * Experience with API contract testing. * Familiarity with observability tooling (e.g. Grafana, Datadog) for monitoring test pipelines and external service health. * Exposure to Kubernetes or other container orchestration platforms. * Experience contributing to or maintaining internal developer platforms or tooling. * Background in a polyglot environment. Exposure to languages beyond Python (e.g. TypeScript/JavaScript) is a plus. **What We Offer** ----------------- * A high\-impact role with clear ownership of a critical engineering platform. * Close collaboration with engineering teams across the organisation. * The opportunity to shape how quality and testing are practiced at scale. * A culture that values engineering craft, automation, and continuous improvement.",https://ie.indeed.com/viewjob?jk=64822d5fc40cd096
