title,company,location,site,description,job_url
Graduate Management Trainee - Kildare,Enterprise,"Kildare, County Kildare, Ireland",linkedin,"**Overview** We’re Enterprise Mobility. A family\-owned, global mobility leader with a $39 billion turnover, nearly 90,000 team members, and operations in 95 countries. Led by CEO Chrissy Taylor, the third generation of the Taylor family, we’re built on a legacy that gives us the stability to focus on the long\-term success of our people, our customers and our business. **Why join the Graduate Management Training Programme?** As a Graduate Management Trainee, you'll have the freedom and support to explore your leadership potential \- and the opportunity to become a branch manager in one of our retail operations in as little as two years. In fact, most of our senior leaders began their careers in this very role \- including our current CEO. From day one, we’ll invest in you. You’ll be in a supportive environment where you’ll take on real responsibilities and gain invaluable hands\-on experience in customer service, sales, marketing, finance, operations, and more. **We work hard and reward hard work** Your work will be recognised with performance\-based incentives and opportunities for continued promotion. Our unique promote\-from\-within culture means you can keep your career moving forward without having to change organisations. **Award\-winning training and development** Whether you’re building on existing strengths or developing new ones, your growth is our priority. Through classroom learning, on\-the\-job training, and mentorship, you’ll have the tools and support to take the next step – and the one after that. **Our doors are open** As a Graduate Management Trainee, your experience at Enterprise Mobility will be as unique as you because you shape who we are as much as we shape your skills, path and potential. We pride ourselves on opening our doors to a variety of voices, giving way to an experience that’s both inclusive and that inspires diversity of thought. **Responsibilities** From your very first day, you’ll be trusted with real responsibility and exposed to all areas of our business. You’ll develop skills in: **Customer Service:** deliver exceptional experiences by confidently handling reservations, resolving enquiries, and building rapport with a diverse range of customers. **Sales and Marketing:** connect with local business partners, grow your network and develop lasting relationships. **Financial Control and Profitability:** understand the financial mechanics of a successful business, including cost control and interpreting profit and loss statements. **Operations and Logistics:** learn how to manage a fleet, plan strategically, and drive performance. **Leadership and Development:** take the lead in mentoring, training, and developing your own team \- with the opportunity to manage and promote others as you grow. **Qualifications** * A Bachelor’s degree is preferred; however, professional experience can be substituted if applicable. * You must have a full manual Republic of Ireland, UK or EU driving licence, but we do make accommodations for applicants who don’t drive due to a disability. * No drug or alcohol related offence on driving record within the last five years is permitted. **Additional Information** * In accordance with current employment permit regulations, we are unable to support an employment permit application for this role, as it is not eligible under the current system. * Regardless of your socio\-economic background, university attended, subject studied, and degree attained, we will always look at how you perform against our competencies and will judge you on that alone. * Please let us know about any accommodations you may need to participate in our recruitment process. * Please limit your application to only one job posting based on where you live and/or plan to work. Applying to multiple locations will delay your application being processed. * This job posting is for applications within the following location(s): Kildare",https://www.linkedin.com/jobs/view/4381646141
Junior Accounts Payable Specialist - Dublin - 145169,Jones Engineering,"Dublin, County Dublin, Ireland",linkedin,"**Company Description** **Jones Engineering** are a leading engineering services company with a proven track record of high quality, customer focused project delivery for over 130 years. Our core divisions include Mechanical Engineering, Electrical Engineering, Sprinkler and Fire Protection. Some of the other services we provide include Specialist Lift, Off Site Fabrication, Technical Support Services, Maintenance, Asset Management, BIM (Building Information Modelling) and Geo\-Surveying. We offer competitive salaries, financial support for further training, performance incentives and the ability to progress your career with a world class engineering contractor. **Job Description** **Jones Engineering** are looking to hire an AP Specialist to join our team. This is a full\-time role based onsite at our headquarters in Pembroke Road, Dublin 4\. The ideal candidate will have a good understanding of the Accounts Payable process within a high\-volume, multinational environment. They will join the AP finance team and work within a team and report to the Finance Manager **In this role, You will;** * Process invoices/credit notes and expenses using SAP system * Dealing with vendor queries in a timely manner * Completion of vendor reconciliations * Process monthly employee expenses * Preparation of payment proposals for weekly payment run * Process changes to vendor account set up * Work with purchasing and commercial team to resolve invoice issues * Ensure general ledger postings are coded correctly * Ad\-hoc projects as required **For this role you will need;** * Candidates must have a minimum 2 years’ experience in Accounts Payable * Third level qualification or equivalent * Experience in a multinational environment with high invoice volumes * Excellent communication skills both verbal and written * Good team player with a strong willingness to participate and help others * Strong Excel skills and overall computer skills required **Benefits** We offer a competitive salary package commensurate with experience and qualifications. In addition, you will have the opportunity to work in a dynamic and supportive environment, collaborating with industry leaders and contributing to a sustainable future. Our company values work\-life balance and encourages professional growth through training and development programs. If you are ready to make a difference and be part of a growing industry, please submit your CV, along with a cover letter highlighting your relevant experience and why you are interested in this role. Recognising the contributions and respecting our people is core to our culture and values. We are an equal opportunities employer, and we encourage candidates from all backgrounds to apply for roles.",https://www.linkedin.com/jobs/view/4382199692
Legal Counsel – Multinational Tech Company,Methodius IT Recruitment,"Dublin, County Dublin, Ireland",linkedin,"My client is looking for an experienced Legal Counsel to join their team in Dublin. They are a major Multinational company growing their team in Ireland at scale. You’ll provide legal advice to management on strategic initiatives, business operations, regulatory matters, and compliance in Ireland. Lead corporate legal activities and ensure timely, effective legal support across the business, including drafting, reviewing, and negotiating contracts. **Key Responsibilities** * Draft, review, and negotiate a wide range of commercial contracts and legal documents. * Advise on contractual, statutory, and regulatory obligations, ensuring ongoing compliance in customer engagements. * Conduct legal due diligence and research to support business decisions. * Provide legal counsel across corporate, commercial, and risk management matters. * Identify and mitigate legal and operational risks. * Interpret statutes, regulations, and contracts, and advise on resolving legal and business issues. * Partner with internal stakeholders to deliver clear, practical legal guidance. * Manage and support legal projects and, where required, supervise junior legal staff. * Report regularly to the Head of Legal on key matters and developments. **Skills \& Experience** * Qualified lawyer (LLB/LLM/JD or equivalent) with a current practising certificate. * 5–10 years’ experience, including at least 5 years in outsourcing, IT contracts, or licensing. * Strong drafting, negotiation, and analytical skills, with solid knowledge of relevant laws. * Effective communicator with the ability to work across all levels and cultures. * Strong organisational, project management, and prioritisation skills. * Collaborative, proactive, and able to operate independently with minimal support. * Experience managing or mentoring team members is an advantage. * Willingness to travel domestically and internationally as required. Salary dependent on candidate experience. Benefits: Annual Bonus Scheme. Contributory Pension. Private Medical Insurance. Life Assurance \& Long\-Term Disability. Employee Assistance Programme. 22 days annual leave \+ 10 public holidays. Continuous Learning \& Development. Access to extensive training \& certification resources. Lunch \& Learn sessions. Additional perks including company discounts, on\-site parking, and bike\-to\-work scheme **Based in Dublin, Ireland. Hybrid.** Candidates must be eligible to work in Ireland/EU. For more information, please contact **David Coyle** at **01 635 1748** or email **david@methodius.com**",https://www.linkedin.com/jobs/view/4403548400
Plasterer,,"Dublin, D, IE",indeed,"Job Title: Plasterer (Full\-Time) Location: Meath / Dublin / Kildare (Site\-Based) Job Type: Full\-Time, Permanent Salary: Competitive – Based on Experience Job Description: We are currently seeking a reliable and hardworking plasterer to join a 2:1 gang for ongoing full\-time work. The role involves machine plastering on active construction sites across Meath, Dublin, and Kildare. Machine plastering experience is an advantage but not essential, as training can be provided for the right candidate. Key Responsibilities: * Carry out plastering work on\-site to a high standard * Work efficiently as part of a 2:1 gang * Operate or assist with plastering machines * Follow all site health and safety regulations Requirements: * Valid Safe Pass * Manual Handling Certificate * Own transport (essential due to site locations) * Strong work ethic and reliability * Previous plastering experience preferred What We Offer: * Full\-time, ongoing work * Competitive pay (depending on experience) * Opportunity to gain machine plastering experience How to Apply: Apply directly through Indeed or contact us for more information Job Type: Permanent Pay: €220\.00\-€250\.00 per day Work Location: On the road",https://ie.indeed.com/viewjob?jk=224604858556caa1
QC Analyst - Alexion,"Alexion Pharmaceuticals, Inc.","Dublin, County Dublin, Ireland",linkedin,"**QC Biochemistry Analyst** **Location:** Dublin, Ireland **Reports to:** QC Biochemistry Supervisor Competitive salary and bonus **This Is What You Will Do** The individual in this position should have a working knowledge of the cGMP QC laboratory environment and laboratory equipment associated with biopharmaceutical analysis. The position requires the ability to understand and follow written SOPs, to accurately and legibly record work in real time, and pay close attention to detail. The individual must be able to perform routine tasks with a minimum of supervision. **You Will Be Responsible For** * Perform all lab functions in compliance with cGMP * Follow written procedures for the following tests, as trained and qualified: + Gel electrophoresis (SDS\-PAGE, IEF) + ELISA and plate based assays (potency and residual assays such as HCP and ProA) * Prioritisation of samples for testing (release, stability and in\-process testing) * Reviewing of laboratory data, including logbooks and test executions. * Recognize and report aberrant test results and sample conditions. * Training of new analysts in specific assays. * Drive continuous improvement initiatives within the QC department. * Complete execution of investigations in a timely manner, ensuring they are updated in real time. * Provide lab support including reagent preparation, cleaning, and routine equipment maintenance. * Ensure training is current for all job functions performed. * Order, stock and receive laboratory supplies. * Complete all required documentation legibly and accurately. **You Will Need To Have** * BSc in Chemistry or a biological science, with 1\-4 years’ experience, or equivalent combination of education and experience. **We Would Prefer For You To Have** * A working knowledge of the cGMP QC laboratory environment, and equipment associated with testing of biopharmaceutical products * Ability to follow written procedures with close attention to detail * Ability to function with minimal supervision for routine job duties. * A working knowledge of gel electrophoresis and ELISA assays **Date Posted** 17\-Apr\-2026 **Closing Date** 22\-Apr\-2026 Our mission is to build an inclusive and equitable environment. We want people to feel they belong at AstraZeneca and Alexion, starting with our recruitment process. We welcome and consider applications from all qualified candidates, regardless of characteristics. We offer reasonable adjustments/accommodations to help all candidates to perform at their best. If you have a need for any adjustments/accommodations, please complete the section in the application form.",https://www.linkedin.com/jobs/view/4403841267
Quantity Surveyor - Transport,Mott MacDonald,"Dublin, County Dublin, Ireland",linkedin,"**Location/s:** Dublin, IE **Recruiter contact:** William Bates Mott MacDonald is a global engineering, management, and development consultancy with over 20,000 employees across more than 50 countries and 140\+ offices. We work across incredible global industries, delivering exciting work that is defining our future and making an important societal impact in the communities we serve. Our people power our performance – we succeed when they do. With countless opportunities to collaborate, learn, and grow, the possibilities for excellence are as varied as every individual. Whether you want to grow as a subject matter expert or broaden your experience with roles across our international community, you’re surrounded by global specialists who want to combine their expertise and champion you to be your best. As a proudly employee\-owned business, we benefit our clients, our communities, and each other, investing in creating the right space for everyone to feel empowered, included, and valued. Whatever your ambition, Mott MacDonald is where people come to be **brilliant.** **About The Division** The advisory and programme delivery divisiondelivers services to projects ranging in scale and complexity from a few million pounds to £20bn through the technical disciplines of land advisory, programme management, project management, project controls, scheduling, cost management, estimating, infrastructure finance, management consulting, digital consulting, education and healthcare management. Our transportation portfolio is primarily a UK based business working in four key sectors of rail, highways, maritime and aviation. We deliver programme, project and commercial management services to clients in mainland Europe, Africa, Middle East, India and Australasia while supporting other parts of the transportation business across the globe. What is our vision? Our vision, with your help, is to deliver major transportation projects as part of a global business and to establish our wide\-ranging consultancy as credible and preferred for our existing and new clients. **About The Team** Our transportation team is expanding, and we have multiple exciting opportunities for project and commercial managers. Our core team consists of professionally qualified and experienced Project/Programme Managers, Planners, Commercial Managers, and Quantity Surveyors. We lead and deliver a broad range of exciting transportation projects and programmes through our integrated, full service, Project, Programme, and Commercial Management (PPCM). We deliver a one Mott MacDonald solution by collaborating closely with our clients in the transportation sector and leveraging Mott MacDonald’s technical excellence in engineering, development, and management services. We are seeking driven professionals with the right attitude to integrate both internally and externally, grow our team, represent Mott MacDonald, and to deliver excellent service to our clients. We operate in Aviation, Highways, Rail and Maritime. Our vision is to deliver major transportation projects as part of a global business and to establish our wide\-ranging consultancy as ‘credible’ and ‘preferred’ for our existing and new clients. **Overview Of The Role** As Quantity Surveyor you will be responsible for the commercial management of multiple projects and workstreams on major highways projects. **Key Responsibilities And Duties Include** * Responsible for commercially managing a project or multiple projects, including: + Budget management including month end reporting (actuals, monthly variances, accruals and annual variances) + Risk management and reporting + Dispute resolution / avoidance + Offering commercial strategy advice + Review and recommendation of subcontractor acceptance + Assessment of compensation events + Assessment of monthly payment applications + Commercial audits * Mentoring of junior members of team **Candidate specification** **Essential** * Full Membership of the Royal Institution of Chartered Surveyors (MRICS) * Cost planning skills and experience of delivering ideally within a cost consultancy / multi\-disciplinary environment * Previous experience of contract administration, cost estimates and NEC contracts * Relevant experience working on transportation/highways projects is preferred * Ideally degree qualified * Ability to operate both autonomously and as a part of a larger team * Excellent IT Skills – Word/Excel/PowerPoint * Strong communication skills including writing reports and presenting * Ability to establish and maintain good working relationships with clients, stakeholders, colleagues and the supply chain * Ability to demonstrate a flexible approach to work * Flexibility to travel to client sites and other MM offices Please be advised that offers for this role are conditional upon obtaining the appropriate level of Security Clearance. **We Offer Some Fantastic Benefits Including** * Flexible working * Pension matched up to 7% of base salary * Competitive annual leave * An annual professional institution subscription * Life insurance * Income continuance * Enhanced Paternity leave * Annual company performance bonus scheme – Subject to company performance * Cycle to work scheme * Travel TaxSaver tickets * Commitment to Continuing Professional Development – we are accredited by Engineers Ireland * Mentoring and support for career development and progression **Employee Ownership** * Our employee ownership model means no external investors, just us, creating a culture of shared success. * Our employees have a stake and a voice in our business, giving them a direct connection to our success through our personal and group performance bonuses. * As your career grows, so does your stake, recognising your long\-term impact and contribution. * Your voice matters, with the opportunity to connect directly with senior leadership through formal channels to help shape our future. * For our senior roles you will have a direct pathway towards ownership from day one. **Equality, diversity, and inclusion** We put equality, diversity, and inclusion at the heart of our business, seeking to promote fair employment procedures and practices to ensure equal opportunities for all. We encourage individual expression in our workplace and are committed to creating an inclusive environment where **everyone** feels they can contribute. **Accessibility** We want you to perform your best at every stage in the recruitment process. If you are disabled or need any support to enable you to apply or attend an interview, please contact us at reasonable.adjustments@mottmac.com and we will talk to you about how we can support you. **Agile working** At Mott MacDonald, we believe it makes business sense for you and your manager to choose how you can work most effectively to meet your client, team, and personal commitments. We offer a hybrid working policy that embraces your well\-being, flexibility, and trust. Apply now, or for more information about our application process, click here. Location(s): Dublin, IE **Contract Type:** Permanent **Work Pattern:** Full Time Market: Transport **Discipline:** Project programme and commercial management **Job Ref:** 13048 **Recruiter Contact:** William Bates",https://www.linkedin.com/jobs/view/4371490316
RETAIL ASSOCIATE,TJX Europe,"Dublin, County Dublin, Ireland",linkedin,"TJX Europe At TJX Europe, every day brings new opportunities for growth, exploration, and achievement. You’ll be part of our vibrant team that embraces diversity, fosters collaboration, and prioritises your development. Whether you’re working in our Distribution Centers, Corporate Offices, or Retail Stores—TK Maxx \& Homesense, you’ll find abundant opportunities to learn, thrive, and make an impact. Come join our TJX team—a Fortune 100 company and the world’s leading off\-price retailer. **Job Description** PART TIME ROLES AVAILABLE, VARIOUS HOURS. PLEASE INCLUDE AVAILABILITY WITHIN APPLICATION. We’re looking for Retail Associates to join our team in a welcoming environment. Whether you’re starting your career or already have experience, we’re excited to work with you and help you grow. **Why Work With Us?** * Enjoy exclusive discounts at our stores—just for you and your eligible family members. * We value integrity, respect, and teamwork, encouraging a unique and inclusive culture. * Training and development resources that are designed to help you learn, grow, and succeed. * Support for you and your family through our Associate and Family Assistance programs, offering helpful resources and services to enhance your well\-being. **What You’ll Do** * Create a welcoming atmosphere by greeting customers with a smile, assisting with their needs, and ensuring they have a positive shopping experience. * Take on a variety of tasks, from cashier duties and fitting room assistance to backroom support and keeping the store clean and inviting. * Embrace opportunities to grow by participating in learning and development programs that build your skills and knowledge. * Be a valued part of a supportive and collaborative team, working together to achieve shared goals. **About You** * Friendly and approachable – creates a warm and inclusive environment, making everyone feel comfortable and appreciated. * A committed teammate – supports colleagues, communicates openly, and is always ready to lend a hand. * Great communicator – explains things clearly, listens actively, and addresses concerns with care. * Flexible and adaptable – stays organized, manages time well, and thrives in a busy, ever\-changing environment. * No experience? No problem! We’ll provide all the training you need. If you’re ready to bring your energy and passion, we’d love to hear from you! Join us and be part of a place where every day is a chance to make a difference. As proud as we are of our past success, it’s our future that excites us most. We strive to provide opportunities for growth, recognition and a competitive salary and benefits package. Share our determination to think bolder and bigger, and be part of our future. We consider all applicants for employment without regard to age, disability, gender, gender reassignment, marriage and civil partnerships, pregnancy and maternity, race, religion or belief and/or sexual orientation. **Address** Ilac Shopping Centre Moore Mall **Location:** EUR TK Maxx IE Store 412 \- Dublin Ilac",https://www.linkedin.com/jobs/view/4403072732
